,AID,AID Version,AID Revision,Panel Member ID,SID,CID,Bioactivity Outcome,Target GI,Target GeneID,Activity Value [uM],Activity Name,Assay Name,Bioassay Type,PubMed ID,RNAi
0,1145368,1,1,,242092392,31205,Unspecified,,,,,Antimicrobial activity against Pseudomonas aeruginosa,Other,1271398,
1,1145369,1,1,,242092392,31205,Unspecified,,,,,Antimicrobial activity against Staphylococcus aureus,Other,1271398,
2,1145370,1,1,,242092392,31205,Unspecified,,,,,Antimicrobial activity against Clostridium welchii,Other,1271398,
3,1145371,1,1,,242092392,31205,Unspecified,,,,,Toxicity in sheep RBC assessed as hemolysis,Other,1271398,
4,1149264,1,1,,242092392,31205,Unspecified,,,,,Antimicrobial activity against Staphylococcus aureus,Other,818381,
