,AID,AID Version,AID Revision,Panel Member ID,SID,CID,Bioactivity Outcome,Target GI,Target GeneID,Activity Value [uM],Activity Name,Assay Name,Bioassay Type,PubMed ID,RNAi
0,179,1,1,,114849,7547,Inactive,,,,,NCI AIDS Antiviral Assay,Confirmatory,,
1,880,2,1,,26757451,7547,Inactive,3290016.0,6002.0,,,qHTS Assay for Inhibitors of RGS12 GoLoco Motif Activity (Red Fluorophore),Confirmatory,,
2,880,2,1,,26757451,7547,Inactive,33946324.0,2770.0,,,qHTS Assay for Inhibitors of RGS12 GoLoco Motif Activity (Red Fluorophore),Confirmatory,,
3,1469,1,1,,26757451,7547,Inactive,189491771.0,7068.0,,Potency,qHTS for Inhibitors of the Interaction of Thyroid Hormone Receptor and Steroid Receptor Coregulator 2,Confirmatory,,
4,1471,2,1,,26757451,7547,Inactive,90903231.0,3064.0,,,qHTS Multiplex Assay to Identify Dual Action Probes in a Cell Model of Huntington: Cytoprotection (ATP),Confirmatory,,
5,1479,1,2,,26757451,7547,Inactive,189491771.0,7068.0,,Potency,Total Fluorescence Counterscreen for Inhibitors of the Interaction of Thyroid Hormone Receptor and Steroid Receptor Coregulator 2,Confirmatory,,
6,1487,1,1,,26757451,7547,Inconclusive,27436948.0,4000.0,11.2202,Potency,qHTS Assay for Modulators of Lamin A Splicing,Confirmatory,,
7,1490,2,1,,26757451,7547,Inactive,10954339.0,,,Potency,qHTS Assay for Inhibitors of Bacillus subtilis Sfp phosphopantetheinyl transferase (PPTase),Confirmatory,,
8,1576,1,1,,57244291,7547,Inactive,,,,,DSSTox (KIERBL) EPA Estrogen Receptor Ki Binding Study (Laws et al.) Database,Other,,
9,1688,1,1,,26757451,7547,Active,90903231.0,3064.0,11.2202,Potency,qHTS Multiplex Assay to Identify Dual Action Probes in a Cell Model of Huntington: Aggregate Formation (GFP),Confirmatory,,
10,1766,1,1,,26757451,7547,Inactive,18860839.0,4221.0,,Potency,qHTS Assay for Inhibitors Targeting the Menin-MLL Interaction in MLL Related Leukemias: Competition With Fluorescein Labeled MLL-derived Peptide,Confirmatory,,
11,1766,1,1,,26757451,7547,Inactive,56550039.0,4297.0,,Potency,qHTS Assay for Inhibitors Targeting the Menin-MLL Interaction in MLL Related Leukemias: Competition With Fluorescein Labeled MLL-derived Peptide,Confirmatory,,
12,1768,1,1,,26757451,7547,Inconclusive,18860839.0,4221.0,3.1623,Potency,qHTS Assay for Inhibitors Targeting the Menin-MLL Interaction in MLL Related Leukemias: Competition With Texas Red Labeled MLL-derived Mutant Peptide,Confirmatory,,
13,1768,1,1,,26757451,7547,Inconclusive,56550039.0,4297.0,3.1623,Potency,qHTS Assay for Inhibitors Targeting the Menin-MLL Interaction in MLL Related Leukemias: Competition With Texas Red Labeled MLL-derived Mutant Peptide,Confirmatory,,
14,1987,1,2,,85148633,7547,Inactive,37589898.0,5536.0,,,Fluorescence-based primary biochemical high throughput screening assay to identify inhibitors of Protein Phosphatase 5 (PP5).,Screening,,
15,2016,1,3,,85148633,7547,Inactive,1302091.0,,,,Multiplex HTS Screen of TOR pathway GFP-fusion proteins in Saccharomyes cerevisiae_specifically_ MEP2_MLPCN.,Screening,,
16,2023,1,3,,85148633,7547,Inactive,486173.0,,,,Multiplex HTS Screen of TOR pathway GFP-fusion proteins in Saccharomyes cerevisiae_specifically_ LAP4_MLPCN.,Screening,,
17,2025,1,3,,85148633,7547,Inactive,536029.0,,,,Multiplex HTS Screen of TOR pathway GFP-fusion proteins in Saccharomyes cerevisiae_specifically_ RPL19A_MLPCN.,Screening,,
18,2029,1,3,,85148633,7547,Inactive,171229.0,,,,Multiplex HTS Screen of TOR pathway GFP-fusion proteins in Saccharomyes cerevisiae_specifically_ CIT2_MLPCN.,Screening,,
19,2052,2,1,,85148633,7547,Inactive,124486680.0,16408.0,,,HTS for developing T Cell Immune Modulators,Screening,,
20,2057,1,2,,85148633,7547,Inactive,78070770.0,4170.0,,,Fluorescence polarization-based primary biochemical high throughput screening assay to identify inhibitors of myeloid cell leukemia sequence 1 (MCL1) interactions with BIM-BH3 peptide.,Screening,,
21,2066,1,4,,85148633,7547,Inactive,85666113.0,850333.0,,,Multiplex HTS Screen of TOR pathway GFP-fusion proteins in Saccharomyes cerevisiae_specifically_ AGP1_MLPCN.,Screening,,
22,2099,1,1,,85148633,7547,Inactive,,,,,Fluorescence Biochemical Primary HTS to Identify Inhibitors of GASC-1 Activity,Screening,,
23,2129,1,2,,85148633,7547,Inactive,510901.0,598.0,,,"Primary biochemical high throughput screening assay to identify inhibitors of BCL2-related protein, long isoform (BCLXL).",Screening,,
24,2130,1,3,,85148633,7547,Inactive,7706645.0,51400.0,,,Fluorescence polarization-based primary biochemical high throughput screening assay to identify inhibitors of Protein Phosphatase Methylesterase 1 (PME-1).,Screening,,
25,2174,1,3,,85148633,7547,Inactive,5453722.0,10434.0,,,Counterscreen for PME1 inhibitors: fluorescence polarization-based primary biochemical high throughput screening assay to identify inhibitors of lysophospholipase 1 (LYPLA1).,Screening,,
26,2177,1,3,,85148633,7547,Inactive,4581413.0,,,,Counterscreen for PME1 inhibitors: fluorescence polarization-based primary biochemical high throughput screening assay to identify inhibitors of lysophospholipase 2 (LYPLA2).,Screening,,
27,2234,1,2,,85148633,7547,Inactive,82503229.0,3783744.0,,,"Counterscreen for inhibitors of EBNA-1: fluorescence polarization-based biochemical high throughput primary assay to identify inhibitors of the Epstein-Barr virus-encoded protein, ZTA.",Screening,,
28,2235,1,2,,85148633,7547,Inactive,56790945.0,5499.0,,,Counterscreen for inhibitors of PP5: fluorescence-based biochemical high throughput primary assay to identify inhibitors of Protein Phosphatase 1 (PP1).,Screening,,
29,2280,2,3,,85148633,7547,Inactive,17507875.0,172532.0,,,Fluorescence polarization-based primary biochemical high throughput screening assay to identify inhibitors of GLD-1 protein - TGE RNA interaction.,Screening,,
30,2300,1,3,,85148633,7547,Inactive,216409728.0,10002.0,,,"TR-FRET-based primary biochemical high throughput screening assay to identify agonists of nuclear receptor subfamily 2, group E, member 3 (NR2E3).",Screening,,
31,2380,1,2,,85148633,7547,Inactive,,,,,uHTS identification of small molecules that induce b-cell replication in the MIN-6 cell line,Screening,,
32,2391,1,1,,85148633,7547,Inactive,,,,IC50,A Cell Based HTS Approach for the Discovery of New Inhibitors of Respiratory syncytial virus (RSV),Confirmatory,,
33,2435,1,2,,85148633,7547,Inactive,32307152.0,5021.0,,,Fluorescence-based primary cell-based high throughput screening assay to identify agonists of the Oxytocin Receptor (OXTR).,Screening,,
34,2445,1,2,,85148633,7547,Inactive,32307152.0,5021.0,,,Fluorescence-based primary cell-based high throughput screening assay to identify potentiators of Oxytocin Receptor (OXTR),Screening,,
35,2462,1,1,,85148633,7547,Inactive,20336315.0,10018.0,,,Luminescence Cell-Based Primary HTS to Identify Inhibitors of A1 Apoptosis.,Screening,,
36,2462,1,1,,85148633,7547,Inactive,167013344.0,,,,Luminescence Cell-Based Primary HTS to Identify Inhibitors of A1 Apoptosis.,Screening,,
37,2517,2,1,,85148633,7547,Inactive,6980812.0,,,Potency,qHTS Assay for Inhibitors of the Human Apurinic/apyrimidinic Endonuclease 1 (APE1),Confirmatory,,
38,2520,1,4,,85148633,7547,Inactive,4885057.0,187.0,,,uHTS identification of small molecule agonists of the APJ  receptor  via a luminescent beta-arrestin assay,Screening,,
39,2521,1,3,,85148633,7547,Inactive,4885057.0,187.0,,,uHTS identification of small molecule antagonists of the APJ  receptor  via a luminescent beta-arrestin assay,Screening,,
40,2524,1,2,,85148633,7547,Inactive,124376142.0,248.0,,,uHTS Luminescent assay for identification of activators of human intestinal alkaline phosphatase,Screening,,
41,2528,1,2,,26757451,7547,Inactive,4557365.0,641.0,,Potency,qHTS Assay for Inhibitors of Bloom's syndrome helicase (BLM),Confirmatory,,
42,2540,1,2,,85148633,7547,Inactive,262118306.0,123228.0,,,HTS Luminescent assay for identification of inhibitors of Sentrin-specific protease 8 (SENP8),Screening,,
43,2544,1,2,,85148633,7547,Inactive,124376142.0,248.0,,,uHTS Luminescent assay for identification of inhibitors of human intestinal alkaline phosphatase,Screening,,
44,2546,1,1,,26757451,7547,Inconclusive,188536040.0,19885.0,35.4813,Potency,VP16 counterscreen qHTS for inhibitors of ROR gamma transcriptional activity,Confirmatory,,
45,2551,1,1,,26757451,7547,Inactive,188536040.0,19885.0,,Potency,qHTS for inhibitors of ROR gamma transcriptional activity,Confirmatory,,
46,2557,1,3,,85148633,7547,Inactive,67191027.0,3676.0,,,HTS for Identification of VLA-4 Allosteric Modulators from MLPCN library,Screening,,
47,2599,1,2,,85148633,7547,Inactive,6166485.0,26054.0,,,uHTS Luminescent assay for identification of inhibitors of Sentrin-specific protease 6 (SENP6),Screening,,
48,2606,1,2,,85148633,7547,Inactive,15610807.0,885176.0,,,Fluorescence polarization-based primary biochemical high throughput screening assay to identify inhibitors of the membrane-associated serine protease Rv3671c in M.tuberculosis,Screening,,
49,2629,1,1,,85148633,7547,Inactive,139472804.0,4961527.0,,,Fluorescence Polarization Cell-Free Homogeneous Primary HTS to Identify Inhibitors of the LANA Histone H2A/H2B Interaction,Screening,,
50,2650,2,1,,85148633,7547,Inactive,49574532.0,2931.0,,,Luminescence Cell-Free  Homogenous Primary HTS to Identify Inhibitors of GSK-3 alpha,Screening,,
51,2661,1,1,,85148633,7547,Inactive,23943882.0,65975.0,,,Luminescence Cell-Free  Homogenous Primary HTS to Identify Inhibitors of Serine/Threonine  Kinase 33  Activity,Screening,,
52,2662,2,1,,26757451,7547,Inactive,56550039.0,4297.0,,Potency,qHTS Fluorescence Polarization Assay for Inhibitors of MLL CXXC domain - DNA interaction,Confirmatory,,
53,2676,1,2,,85148633,7547,Inactive,85986601.0,59350.0,,Potency,qHTS Assay for Agonists of the Relaxin Receptor RXFP1,Confirmatory,,
54,2685,1,1,,85148633,7547,Inconclusive,,,8.1995,Potency,qHTS Assay for Lipid Storage Modulators in Drosophila S3 Cells,Confirmatory,,
55,2690,1,2,,85148633,7547,Inactive,,,,,A yeast HTS for caloric restriction mimetics that inhibit age-related superoxide,Screening,,
56,2716,1,1,,85148633,7547,Inactive,,,,,Luminescence  Microorganism Primary HTS to Identify Inhibitors of the SUMOylation Pathway Using a Temperature Sensitive Growth Reversal Mutant Mot1-301,Screening,,
57,2717,1,2,,85148633,7547,Inactive,,,,,Luminescence Cell-Based Primary HTS to Identify Inhibitors of Cancer Stem Cells,Screening,,
58,2718,1,1,,85148633,7547,Inactive,13128862.0,8841.0,,,Fluorescence Cell-Free Homogeneous Primary HTS to Identify Inhibitors of Histone Deacetylase 3,Screening,,
59,2751,2,2,,85148633,7547,Inactive,153217451.0,9581.0,,,Fluorescence polarization-based primary biochemical high throughput screening assay to identify inhibitors of the prolyl oligopeptidase-like enzyme (PREPL),Screening,,
60,2796,1,4,,85148633,7547,Inactive,4502003.0,196.0,,,Luminescence-based primary cell-based high throughput screening assay to identify activators of the Aryl Hydrocarbon Receptor (AHR),Screening,,
61,2797,1,2,,85148633,7547,Inactive,4502331.0,552.0,,,Counterscreen for Oxytocin Receptor (OXTR) agonists: Fluorescence-based primary cell-based high throughput assay to identify agonists of the vasopressin 1 receptor (V1R),Screening,,
62,2805,2,2,,85148633,7547,Active,124487323.0,76768.0,,,uHTS Luminescent assay for identification of activators of mouse intestinal alkaline phosphatase,Screening,,
63,2806,2,2,,85148633,7547,Inactive,124487323.0,76768.0,,,uHTS Luminescent assay for identification of inhibitors of mouse intestinal alkaline phosphatase,Screening,,
64,2825,1,2,,85148633,7547,Active,219518789.0,114548.0,,,uHTS Luminescent assay for identification of inhibitors of NALP3 in yeast,Screening,,
65,434955,1,2,,85148633,7547,Inactive,,,,IC90,Screen to Identify Novel Compounds That Sensitize Mycobacterium Tuberculosis to Beta-lactam Antibiotics,Confirmatory,,
66,434962,1,2,,85148633,7547,Inactive,155969707.0,3416.0,,,Fluorescence polarization-based cell-based primary high throughput screening assay to identify inhibitors of insulin-degrading enzyme (IDE),Screening,,
67,434970,1,2,,85148633,7547,Active,124487323.0,76768.0,,,Single concentration confirmation of uHTS hits from a small molecule activators of mouse intestinal alkaline phosphatase via a luminescent assay,Screening,,
68,434971,1,2,,85148633,7547,Inactive,124487323.0,76768.0,,,Single concentration confirmation of uHTS hits from a small molecule inhibitors of mouse intestinal alkaline phosphatase via a luminescent assay,Screening,,
69,434973,1,3,,85148633,7547,Inactive,120538355.0,57337.0,,,uHTS Luminescent assay for identification of inhibitors of Sentrin-specific protease 7 (SENP7),Screening,,
70,434989,1,1,,85148633,7547,Active,222080095.0,3061.0,,,Fluorescence-based cell-based primary high throughput screening assay to identify antagonists of the orexin 1 receptor (OX1R; HCRTR1),Screening,,
71,435003,1,3,,85148633,7547,Inactive,,,,,uHTS luminescence assay for the identification of chemical inhibitors of T-cell specific antigen receptor-induced NF-kB activation,Screening,,
72,435005,1,1,,85148633,7547,Active,,,,,Luminescence Cell-Based Primary HTS to Identify Inhibitors of Beta Cell Apoptosis.,Screening,,
73,435006,1,2,,85148633,7547,Active,219518789.0,114548.0,,,Single concentration confirmation of uHTS for the identification of inhibitors of NALP3 in yeast using a luminescent assay,Screening,,
74,435022,2,2,,85148633,7547,Inactive,,,,,uHTS luminescence assay for the identification of chemical inhibitors of B-cell specific antigen receptor-induced NF-kB activation,Screening,,
75,435030,1,2,,85148633,7547,Inactive,15645703.0,899625.0,,,Absorbance-based primary bacterial cell-based high throughput screening assay to identify inhibitors of AddAB recombination protein complex,Screening,,
76,435030,1,2,,85148633,7547,Inactive,15646160.0,899738.0,,,Absorbance-based primary bacterial cell-based high throughput screening assay to identify inhibitors of AddAB recombination protein complex,Screening,,
77,449728,1,2,,85148633,7547,Inactive,,,,,Counterscreen for inhibitors of AddAB: absorbance-based bacterial cell-based high throughput screening assay to identify inhibitors of bacterial viability,Screening,,
78,449756,1,1,,85148633,7547,Active,,,3.6889999999999996,AC50_uM,Luminescence Cell-Based Dose Retest to Confirm Inhibitors of  Beta Cell Apoptosis,Confirmatory,,
79,449762,1,2,,85148633,7547,Inconclusive,,,,IC50,High Throughput Screening Assay used to Identify Novel Compounds that Inhibit Mycobacterium Tuberculosis in 7H9 Media,Confirmatory,,
80,449763,1,3,,85148633,7547,Inactive,,,,,uHTS identification of small molecule activators of the apoptotic arm of the Unfolded Protein response via a luminescent-based reporter assay,Screening,,
81,463079,1,2,,85148633,7547,Active,,,,,Fluorescence-based counterscreen for orexin 1 receptor (OX1R) antagonists: cell-based assay to identify antagonists of the parental CHO cell line,Screening,,
82,463082,1,1,,85148633,7547,Inactive,270133071.0,7941.0,,,Fluorescence polarization-based primary biochemical high throughput screening assay to identify inhibitors of the plasma platelet activating factor acetylhydrolase (pPAFAH),Screening,,
83,463104,1,2,,85148633,7547,Inactive,,,,,uHTS identification of small molecule activators of the adaptive arm of the Unfolded Protein response via a luminescent-based reporter assay,Screening,,
84,463141,1,2,,85148633,7547,Inactive,14790119.0,836.0,,,Absorbance-based primary biochemical high throughput screening assay to identify activators of procaspase-3,Screening,,
85,463190,1,2,,85148633,7547,Inactive,285809906.0,856395.0,,,uHTS identification of small molecule inhibitors of tim10-1 yeast via a luminescent assay,Screening,,
86,463195,1,2,,85148633,7547,Inactive,285809906.0,856395.0,,,uHTS identification of small molecule inhibitors of tim10 yeast via a luminescent assay,Screening,,
87,463206,1,1,,85148633,7547,Inactive,,,260.0,AC50_uM,Luminescence Cell-Based Counter Screen to Identify Inhibitors of Cytokine Induced Apoptosis,Confirmatory,,
88,463210,1,2,,85148633,7547,Inactive,55960760.0,,,,Counterscreen for procaspase-3 activators: absorbance-based primary biochemical high throughput screening assay to identify activators of procaspase-7,Screening,,
89,463212,1,1,,85148633,7547,Inactive,285814664.0,855751.0,,,uHTS identification of small molecule inhibitors of tim23-1 yeast via a luminescent assay,Screening,,
90,463229,1,1,,85148633,7547,Active,,,6.975,AC50_uM,ATP-based Luminescence in the Absence of Cytokines Measured in Cell-Based System Using Plate Reader - 2061-06_Inhibitor_Dose_CherryPick,Confirmatory,,
91,463254,1,1,,85148633,7547,Inactive,188528692.0,9099.0,,Potency,qHTS Assay for Inhibitors of Ubiquitin-specific Protease USP2a Using CHOP2 as the Reporter,Confirmatory,,
92,468443,4,7,,103737810,7547,Unspecified,60416391.0,2166.0,,,Inhibition of human FAAH at 1 uM,Other,19850474.0,
93,485270,1,1,,85148633,7547,Active,222080095.0,3061.0,,,FRET-based cell-based primary high throughput screening assay to identify antagonists of the orexin 1 receptor (OX1R; HCRTR1),Screening,,
94,485272,1,1,,85148633,7547,Inactive,216548487.0,23569.0,,,Fluorescence polarization-based primary biochemical high throughput screening assay to identify inhibitors of Protein Arginine Deiminase 4 (PAD4) (1536 HTS),Screening,,
95,485273,2,1,,85148633,7547,Inactive,4507793.0,7334.0,,,uHTS identification of UBC13 Polyubiquitin Inhibitors via a TR-FRET Assay,Screening,,
96,485275,1,3,,85148633,7547,Inactive,,,,,Phenotypic HTS multiplex for antifungal efflux pump inhibitors,Screening,,
97,485290,1,1,,26757451,7547,Inactive,20150581.0,,,Potency,qHTS Assay for Inhibitors of Tyrosyl-DNA Phosphodiesterase (TDP1),Confirmatory,,
98,485290,1,1,,85148633,7547,Inactive,20150581.0,,,Potency,qHTS Assay for Inhibitors of Tyrosyl-DNA Phosphodiesterase (TDP1),Confirmatory,,
99,485294,1,1,,85148633,7547,Inactive,119389684.0,,,Potency,qHTS Inhibitors of AmpC Beta-Lactamase (assay with detergent),Confirmatory,,
100,485297,1,1,,85148633,7547,Inactive,4759012.0,9367.0,,Potency,qHTS Assay for Rab9 Promoter Activators,Confirmatory,,
101,485298,1,1,,85148633,7547,Inactive,,,,Potency,qHTS Assay for Small Molecule Inhibitors of Mitochondrial Division or Activators of Mitochondrial Fusion,Confirmatory,,
102,485313,1,2,,85148633,7547,Inconclusive,255652944.0,4864.0,5.6234,Potency,qHTS Assay for NPC1 Promoter Activators,Confirmatory,,
103,485317,1,2,,85148633,7547,Inactive,54112432.0,2671.0,,,HTS-Luminescent assay for inhibitors of ALR by detection of hydrogen peroxide production Measured in Biochemical System Using Plate Reader - 2036-02_Inhibitor_SinglePoint_HTS,Screening,,
104,485341,1,1,,85148633,7547,Inactive,119389684.0,,,Potency,qHTS Inhibitors of AmpC Beta-Lactamase (assay without detergent),Confirmatory,,
105,485344,1,1,,85148633,7547,Inactive,4503385.0,1813.0,,,HTS Assay for Allosteric Antagonists of the Human D2 Dopamine Receptor: Primary Screen for Antagonists,Screening,,
106,485346,1,1,,85148633,7547,Active,88702791.0,4194.0,,,uHTS for identification of Inhibitors of Mdm2/MdmX interaction in luminescent format.,Screening,,
107,485346,1,1,,85148633,7547,Active,89993689.0,4193.0,,,uHTS for identification of Inhibitors of Mdm2/MdmX interaction in luminescent format.,Screening,,
108,485347,1,2,,85148633,7547,Inactive,4503385.0,1813.0,,,HTS Assay for Positive Allosteric Modulators of the Human D2 Dopamine Receptor: Primary Screen for Potentiators,Screening,,
109,485349,1,1,,85148633,7547,Inactive,71902540.0,472.0,,Potency,qHTS Assay for Identifying a Potential Treatment of Ataxia-Telangiectasia,Confirmatory,,
110,485353,2,1,,85148633,7547,Inactive,30124074.0,1489680.0,,,qHTS of Yeast-based Assay for SARS-CoV PLP,Confirmatory,,
111,485358,1,1,,85148633,7547,Inactive,4503385.0,1813.0,,,HTS Assay for Allosteric Agonists of the Human D2 Dopamine Receptor: Primary Screen for Agonists,Screening,,
112,485360,1,1,,85148633,7547,Inactive,117938328.0,26013.0,,Potency,qHTS Assay for the Inhibitors of L3MBTL1,Confirmatory,,
113,485364,1,1,,85148633,7547,Inactive,15149312.0,8345881.0,,Potency,qHTS Assay for the Inhibitors of Schistosoma Mansoni Peroxiredoxins,Confirmatory,,
114,485367,1,2,,85148633,7547,Inactive,72386991.0,3656265.0,,Potency,qHTS Assay to Find Inhibitors of T. brucei phosphofructokinase,Confirmatory,,
115,488784,1,2,,85148633,7547,Inactive,219518789.0,114548.0,,,Single concentration confirmation of inhibitors of NALP3 in yeast using a Caspase-1-ASC counter screen,Screening,,
116,488794,1,2,,85148633,7547,Inactive,219518789.0,114548.0,,,Single concentration confirmation of uHTS for the identification of inhibitors of NALP3 in yeast using a luminescent assay - retest,Screening,,
117,488799,1,2,,85148633,7547,Active,219518789.0,114548.0,1.49,IC50_Mean,Dose Response confirmation of uHTS for the identification of inhibitors of NALP3 in yeast using a luminescent assay,Confirmatory,,
118,488800,1,1,,85148633,7547,Active,219518789.0,114548.0,0.805,IC50_Mean,Dose Response confirmation of inhibitors of NALP3 in yeast using a Caspase-1-ASC counter screen,Confirmatory,,
119,488837,1,1,,85148633,7547,Inactive,26667227.0,2139.0,,Potency,qHTS Assay for Inhibitors of the Phosphatase Activity of Eya2,Confirmatory,,
120,488847,1,3,,85148633,7547,Inactive,148539876.0,156.0,,,RNA aptamer-based HTS for inhibitors of GRK2,Screening,,
121,488890,1,2,,85148633,7547,Inconclusive,,,,IC50,"Elucidation of physiology of non-replicating, drug-tolerant Mycobacterium tuberculosis",Confirmatory,,
122,489028,1,2,,85148633,7547,Active,88702791.0,4194.0,,,Single concentration confirmation of uHTS for Inhibitors of Mdm2/MdmX interaction in luminescent format.,Screening,,
123,489028,1,2,,85148633,7547,Active,89993689.0,4193.0,,,Single concentration confirmation of uHTS for Inhibitors of Mdm2/MdmX interaction in luminescent format.,Screening,,
124,489030,2,1,,85148633,7547,Inactive,187952397.0,317.0,,,uHTS Fluorescent assay for identification of inhibitors of Apaf-1,Screening,,
125,489031,2,1,,85148633,7547,Inactive,187952397.0,317.0,,,uHTS Fluorescent assay for identification of activators of Apaf-1,Screening,,
126,492947,1,1,,85148633,7547,Inactive,4501969.0,154.0,,Potency,qHTS assay of beta-arrestin-biased ligands of beta2-adrenergic receptor,Confirmatory,,
127,492961,1,1,,26757451,7547,Inactive,72386991.0,3656265.0,,Potency,qHTS Assay to Find Inhibitors of T. brucei phosphofructokinase: hit validation,Confirmatory,,
128,493005,1,1,,85148633,7547,Inactive,5454140.0,7251.0,,Potency,qHTS Assay for Iinhibitors of HIV-1 Budding by Blocking the Interaction of PTAP/TSG101,Confirmatory,,
129,493011,1,1,,85148633,7547,Inactive,21955158.0,200315.0,,,uHTS identification of APOBEC3A DNA Deaminase Inhibitors via a fluorescence-based single-stranded DNA deaminase assay,Screening,,
130,493012,1,1,,85148633,7547,Inactive,13399304.0,60489.0,,,uHTS identification of APOBEC3G DNA Deaminase Inhibitors via a fluorescence-based single-stranded DNA deaminase assay,Screening,,
131,493014,1,1,,85148633,7547,Inconclusive,,,29.0929,Potency,qHTS Assay to Find Inhibitors of Chronic Active B-Cell Receptor Signaling,Confirmatory,,
132,493036,1,2,,85148633,7547,Inactive,110611243.0,4923.0,,,Image-Based HTS for Selective Agonists for NTR1,Screening,,
133,493056,1,1,,85148633,7547,Inactive,4507681.0,7201.0,,,qHTS for Small Molecule Agonists and Allosteric Enhancers of Human TRH Receptor: Primary Screen for Enhancers,Screening,,
134,493084,1,1,,85148633,7547,Inactive,4507681.0,7201.0,,,qHTS for Small Molecule Agonists and Allosteric Enhancers of Human TRH Receptor: Primary Screen for Agonists.,Screening,,
135,493091,1,1,,85148633,7547,Inactive,10864009.0,58190.0,,,uHTS Colorimetric assay for identification of inhibitors of Scp-1,Screening,,
136,493098,1,1,,85148633,7547,Inactive,37187860.0,1235.0,,,uHTS identification of small molecule antagonists of the CCR6 receptor via a luminescent beta-arrestin assay,Screening,,
137,493160,1,1,,85148633,7547,Inactive,156151420.0,80201.0,,,uHTS Fluorescent assay for identification of inhibitors of hexokinase domain containing  I (HKDC1),Screening,,
138,493187,1,2,,85148633,7547,Inactive,156151420.0,80201.0,,,uHTS Fluorescent assay for identification of activators of hexokinase domain containing  I (HKDC1),Screening,,
139,504327,1,1,,26757451,7547,Inactive,153791535.0,2648.0,,Potency,qHTS Assay for Inhibitors of GCN5L2,Confirmatory,,
140,504327,1,1,,85148633,7547,Inactive,153791535.0,2648.0,,Potency,qHTS Assay for Inhibitors of GCN5L2,Confirmatory,,
141,504332,1,1,,26757451,7547,Inactive,168985070.0,,,Potency,qHTS Assay for Inhibitors of Histone Lysine Methyltransferase G9a,Confirmatory,,
142,504332,1,1,,85148633,7547,Inactive,168985070.0,,,Potency,qHTS Assay for Inhibitors of Histone Lysine Methyltransferase G9a,Confirmatory,,
143,504333,1,1,,85148633,7547,Inactive,6683500.0,29994.0,,Potency,qHTS Assay for Inhibitors of BAZ2B,Confirmatory,,
144,504339,1,1,,85148633,7547,Inactive,162330054.0,,,Potency,qHTS Assay for Inhibitors of JMJD2A-Tudor Domain,Confirmatory,,
145,504406,1,1,,85148633,7547,Inactive,15610945.0,886142.0,,,Inhibitors of Mycobacterium tuberculosis UDP-galactopyranose mutase (UGM) enzyme - High throughput screening using Fluorescent polarization assay Measured in Biochemical System Using Plate Reader - 2105-01_Inhibitor_SinglePoint_HTS_Activity_Set6,Screening,,
146,504444,1,1,,85148633,7547,Inconclusive,224028257.0,4780.0,29.0929,Potency,Nrf2 qHTS screen for inhibitors,Confirmatory,,
147,504462,1,1,,85148633,7547,Inactive,47132611.0,23192.0,,,uHTS fluorescent assay for identification of inhibitors of ATG4B,Screening,,
148,504466,1,1,,85148633,7547,Inactive,116283940.0,79915.0,,Potency,qHTS screen for small molecules that induce genotoxicity in human embryonic kidney (HEK293T) cells expressing luciferase-tagged ELG1,Confirmatory,,
