,AID,AID Version,AID Revision,Panel Member ID,SID,CID,Bioactivity Outcome,Target GI,Target GeneID,Activity Value [uM],Activity Name,Assay Name,Bioassay Type,PubMed ID,RNAi
0,155,1,1,,69894,7047,Inactive,,,,,NCI Yeast Anticancer Drug Screen. Data for the rad50 strain,Other,,
1,157,1,1,,69894,7047,Inactive,,,,,NCI Yeast Anticancer Drug Screen. Data for the mec2-1 strain,Other,,
2,161,1,1,,69894,7047,Inactive,,,,,NCI Yeast Anticancer Drug Screen. Data for the sgs1 mgt1 strain,Other,,
3,165,1,1,,69894,7047,Inactive,,,,,NCI Yeast Anticancer Drug Screen. Data for the cln2 rad14 strain,Other,,
4,167,1,1,,69894,7047,Inactive,,,,,NCI Yeast Anticancer Drug Screen. Data for the bub3 strain,Other,,
5,175,1,1,,69894,7047,Inactive,,,,,NCI Yeast Anticancer Drug Screen. Data for the mlh1 rad18 strain,Other,,
6,270,1,1,,69894,7047,Inactive,,,,,NCI In Vivo Anticancer Drug Screen. Data for tumor model  Lewis Lung Carcinoma (subcutaneous) in B6D2F1 (BDF1) mice,Other,,
7,316,1,1,,69894,7047,Inactive,,,,,NCI In Vivo Anticancer Drug Screen. Data for tumor model  P1534 Leukemia (intraperitoneal) in CD2F1 (CDF1) mice,Other,,
8,421,1,3,,17389631,7047,Inactive,,,,,Cell Viability - BJ,Confirmatory,,
9,426,1,2,,17389631,7047,Inactive,,,,,Cell Viability - Jurkat,Confirmatory,,
10,427,1,1,,17389631,7047,Inactive,,,,,Cell Viability - Hek293,Confirmatory,,
11,433,1,1,,17389631,7047,Inactive,,,,,Cell Viability - HepG2,Confirmatory,,
12,434,1,2,,17389631,7047,Inactive,,,,,Cell Viability - MRC5,Confirmatory,,
13,435,1,2,,17389631,7047,Inactive,,,,,Cell Viability - SK-N-SH,Confirmatory,,
14,445,3,1,,17389631,7047,Inactive,10092619.0,4792.0,,,IkB Signaling,Confirmatory,,
15,530,1,1,,17389631,7047,Inactive,2499604.0,26414.0,,,JNK3 AlphaScreen Assay,Confirmatory,,
16,540,1,1,,17389631,7047,Inactive,,,,,Cell Viability - N2a,Confirmatory,,
17,541,1,1,,17389631,7047,Inactive,,,,,Cell Viability - NIH 3T3,Confirmatory,,
18,542,1,1,,17389631,7047,Inactive,,,,,Cell Viability - HUV-EC-C,Confirmatory,,
19,543,1,1,,17389631,7047,Inactive,,,,,Cell Viability - H-4-II-E,Confirmatory,,
20,544,2,1,,17389631,7047,Inactive,,,,,Cell Viability - SH-SY5Y,Confirmatory,,
21,545,1,1,,17389631,7047,Inactive,,,,,Cell Viability - Renal Proximal Tubule,Confirmatory,,
22,546,1,1,,17389631,7047,Inactive,,,,,Cell Viability - Mesenchymal,Confirmatory,,
23,584,1,3,,17389631,7047,Inactive,119389684.0,,,,Promiscuous and Specific Inhibitors of AmpC Beta-Lactamase (assay with detergent),Confirmatory,,
24,585,1,4,,17389631,7047,Inactive,119389684.0,,,,Promiscuous and Specific Inhibitors of AmpC Beta-Lactamase (assay without detergent),Confirmatory,,
25,595,1,3,,17389631,7047,Inactive,,,,,qHTS Assay for Disrupters of an Hsp90 Co-Chaperone Interaction,Confirmatory,,
26,596,1,2,,17389631,7047,Inactive,92096784.0,4137.0,,,qHTS Assay for Tau Filament Binding,Confirmatory,,
27,603,1,2,,17389631,7047,Inactive,,,,,qHTS Assay for Inhibitors of DNA Polymerase III Holoenzyme System,Confirmatory,,
28,605,1,2,,17389631,7047,Inactive,84028058.0,,,,qHTS Assay for Inhibitors of YjeE,Confirmatory,,
29,654,1,1,,17389631,7047,Inactive,,,,,Cellular Toxicity (caspase-3) HepG2,Confirmatory,,
30,655,1,1,,17389631,7047,Inactive,,,,,Cellular Toxicity (caspase-3) Jurkat,Confirmatory,,
31,656,1,1,,17389631,7047,Inactive,,,,,Cellular Toxicity (caspase-3) HUV-EC-C,Confirmatory,,
32,657,1,1,,17389631,7047,Inactive,,,,,Cellular Toxicity (caspase-3) SHSY5Y,Confirmatory,,
33,658,1,1,,17389631,7047,Inactive,,,,,Cellular Toxicity (caspase-3) BJ,Confirmatory,,
34,659,1,1,,17389631,7047,Inactive,,,,,Cellular Toxicity (caspase-3) MRC-5,Confirmatory,,
35,660,1,1,,17389631,7047,Inactive,,,,,Cellular Toxicity (caspase-3) Mesangial,Confirmatory,,
36,661,1,1,,17389631,7047,Inactive,,,,,Cellular Toxicity (caspase-3) SK-N-SH,Confirmatory,,
37,662,1,1,,17389631,7047,Inactive,,,,,Cell signaling CRE-BLA (Fsk stim),Confirmatory,,
38,663,1,1,,17389631,7047,Inactive,,,,,Cellular Toxicity (caspase-3) H-4-II-E,Confirmatory,,
39,664,1,1,,17389631,7047,Inactive,,,,,Cellular Toxicity (caspase-3) Hek293,Confirmatory,,
40,665,1,1,,17389631,7047,Inactive,,,,,Cellular Toxicity (caspase-3) N2a,Confirmatory,,
41,666,1,1,,17389631,7047,Inactive,,,,,Cellular Toxicity (caspase-3) NIH 3T3,Confirmatory,,
42,667,1,1,,17389631,7047,Inactive,,,,,Cellular Toxicity (caspase-3) Renal Proximal Tubule,Confirmatory,,
43,875,1,2,,17389631,7047,Inactive,159162802.0,,,Potency,qHTS Assay for Inhibitors of BRCT-Phosphoprotein Interaction (Green Fluorophore),Confirmatory,,
44,880,2,1,,17389631,7047,Inactive,3290016.0,6002.0,,,qHTS Assay for Inhibitors of RGS12 GoLoco Motif Activity (Red Fluorophore),Confirmatory,,
45,880,2,1,,17389631,7047,Inactive,33946324.0,2770.0,,,qHTS Assay for Inhibitors of RGS12 GoLoco Motif Activity (Red Fluorophore),Confirmatory,,
46,881,2,2,,17389631,7047,Inactive,317373425.0,247.0,,Potency,qHTS Assay for Inhibitors of 15-hLO-2 (15-human lipoxygenase 2),Confirmatory,,
47,884,1,2,,17389631,7047,Inactive,13435386.0,1576.0,,Potency,qHTS Assay for Inhibitors and Substrates of Cytochrome P450 3A4,Confirmatory,,
48,885,1,2,,17389631,7047,Inactive,13435386.0,1576.0,,Potency,qHTS Assay for Activators of Cytochrome P450 3A4,Confirmatory,,
49,886,1,2,,17389631,7047,Inactive,122921310.0,,,Potency,"qHTS Assay for Inhibitors of HADH2 (Hydroxyacyl-Coenzyme A Dehydrogenase, Type II)",Confirmatory,,
50,886,1,2,,17389631,7047,Inactive,122921311.0,,,Potency,"qHTS Assay for Inhibitors of HADH2 (Hydroxyacyl-Coenzyme A Dehydrogenase, Type II)",Confirmatory,,
51,887,1,2,,17389631,7047,Inactive,1832253.0,246.0,,Potency,qHTS Assay for Inhibitors of 15-hLO (15-human lipoxygenase),Confirmatory,,
52,889,1,3,,17389631,7047,Inactive,1730092.0,840.0,,Potency,qHTS Assay for Allosteric/Competitive Inhibitors of Caspase-7,Confirmatory,,
53,892,1,2,,17389631,7047,Inactive,159162802.0,,,Potency,qHTS Assay for Inhibitors of BRCT-Phosphoprotein Interaction (Red Fluorophore),Confirmatory,,
54,893,1,2,,17389631,7047,Inactive,122921310.0,,,Potency,"qHTS Assay for Inhibitors of HSD17B4, hydroxysteroid (17-beta) dehydrogenase 4",Confirmatory,,
55,893,1,2,,17389631,7047,Inactive,122921311.0,,,Potency,"qHTS Assay for Inhibitors of HSD17B4, hydroxysteroid (17-beta) dehydrogenase 4",Confirmatory,,
56,894,2,1,,17389631,7047,Inactive,31542939.0,3248.0,,Potency,qHTS Assay for Inhibitors of HPGD (15-Hydroxyprostaglandin Dehydrogenase),Confirmatory,,
57,900,1,3,,17389631,7047,Inactive,15431328.0,834.0,,Potency,qHTS Assay for Allosteric/Competitive Inhibitors of Caspase-1,Confirmatory,,
58,902,1,2,,17389631,7047,Inactive,120407068.0,7157.0,,Potency,qHTS Screen for Compounds that Selectively Target Cancer Cells with p53 Mutations: Cytotoxicity of p53ts Cells at the Nonpermissive Temperature,Confirmatory,,
59,912,1,2,,17389631,7047,Inactive,21392848.0,,,Potency,qHTS Assay for Anthrax Lethal Toxin Internalization,Confirmatory,,
60,921,1,2,,17389631,7047,Inactive,,,,Potency,Cell Viability - LYMP2-001,Confirmatory,,
61,923,1,2,,17389631,7047,Inactive,,,,Potency,qHTS Assay for Allosteric/Competitive Inhibitors of Caspase-1: Spectroscopic Profiling in AFC Spectral Region,Confirmatory,,
62,924,1,2,,17389631,7047,Inactive,120407068.0,7157.0,,Potency,qHTS Screen for Compounds that Selectively Target Cancer Cells with p53 Mutations: Cytotoxicity of p53ts Cells at the Permissive Temperature,Confirmatory,,
63,925,1,2,,17389631,7047,Inactive,4504349.0,3043.0,,Potency,qHTS Assay for Modulators of Hemoglobin Beta Chain Splicing,Confirmatory,,
64,926,1,2,,17389631,7047,Inactive,38016895.0,7253.0,,Potency,qHTS Assay for Agonists of the Thyroid Stimulating Hormone Receptor,Confirmatory,,
65,938,1,2,,17389631,7047,Inactive,38016895.0,7253.0,,Potency,qHTS Assay for Agonists of the Thyroid Stimulating Hormone Receptor: Activators of Intracellular cAMP Concentrations in Parental HEK 293,Confirmatory,,
66,946,1,2,,17389631,7047,Inactive,,,,Potency,MultiTox-Fluor Cytotoxicity Assay - LYMP1-001 - Dead Cells,Confirmatory,,
67,947,1,2,,17389631,7047,Inactive,,,,Potency,MultiTox-Fluor Cytotoxicity Assay - LYMP1-001 - Live Cells,Confirmatory,,
68,948,1,2,,17389631,7047,Inactive,,,,Potency,Cell Viability - LYMP1-002 - Assay at 16 hr,Confirmatory,,
69,955,1,2,,17389631,7047,Inactive,,,,Potency,MultiTox-Fluor Cytotoxicity Assay - LYMP1-002 - Live Cells,Confirmatory,,
70,960,1,2,,17389631,7047,Inactive,,,,Potency,MultiTox-Fluor Cytotoxicity Assay - LYMP1-002 - Dead Cells,Confirmatory,,
71,961,1,2,,17389631,7047,Inactive,,,,Potency,MultiTox-Fluor Cytotoxicity Assay - LYMP1-003 - Dead Cells,Confirmatory,,
72,962,1,2,,17389631,7047,Inactive,,,,Potency,MultiTox-Fluor Cytotoxicity Assay - LYMP1-003 - Live Cells,Confirmatory,,
73,963,1,2,,17389631,7047,Inactive,,,,Potency,Cell Viability - LYMP1-003 - Assay at 24 hr,Confirmatory,,
74,964,1,2,,17389631,7047,Inactive,,,,Potency,Cell Viability - LYMP1-003 - Assay at 40 hr,Confirmatory,,
75,965,1,2,,17389631,7047,Inactive,,,,Potency,Cell Viability - LYMP2-003,Confirmatory,,
76,966,1,2,,17389631,7047,Inactive,,,,Potency,Cell Viability - LYMP2-004,Confirmatory,,
77,967,1,2,,17389631,7047,Inactive,,,,Potency,Cell Viability - LYMP2-005,Confirmatory,,
78,968,1,2,,17389631,7047,Inactive,,,,Potency,Cell Viability - LYMP2-009,Confirmatory,,
79,969,1,2,,17389631,7047,Inactive,,,,Potency,Cell Viability - LYMP2-011,Confirmatory,,
80,970,1,2,,17389631,7047,Inactive,,,,Potency,Cell Viability - LYMP2-013,Confirmatory,,
81,971,1,2,,17389631,7047,Inactive,,,,Potency,Cell Viability - LYMP2-015,Confirmatory,,
82,972,1,2,,17389631,7047,Inactive,,,,Potency,Cell Viability - LYMP2-017,Confirmatory,,
83,973,1,2,,17389631,7047,Inactive,,,,Potency,Cell Viability - LYMP2-019,Confirmatory,,
84,974,1,2,,17389631,7047,Inactive,,,,Potency,Cell Viability - LYMP2-021,Confirmatory,,
85,975,1,2,,17389631,7047,Inactive,,,,Potency,Cell Viability - LYMP2-023,Confirmatory,,
86,976,1,2,,17389631,7047,Inactive,,,,Potency,Cell Viability - LYMP2-025,Confirmatory,,
87,977,1,2,,17389631,7047,Inactive,,,,Potency,Cell Viability - LYMP2-002,Confirmatory,,
88,978,1,2,,17389631,7047,Inactive,,,,Potency,Cell Viability - LYMP2-006,Confirmatory,,
89,979,1,2,,17389631,7047,Inactive,,,,Potency,Cell Viability - LYMP2-007,Confirmatory,,
90,980,1,2,,17389631,7047,Inactive,,,,Potency,Cell Viability - LYMP2-008,Confirmatory,,
91,981,1,2,,17389631,7047,Inactive,,,,Potency,Cell Viability - LYMP2-010,Confirmatory,,
92,982,1,2,,17389631,7047,Inactive,,,,Potency,Cell Viability - LYMP2-012,Confirmatory,,
93,983,1,2,,17389631,7047,Inactive,,,,Potency,Cell Viability - LYMP2-014,Confirmatory,,
94,984,1,2,,17389631,7047,Inactive,,,,Potency,Cell Viability - LYMP2-016,Confirmatory,,
95,985,1,2,,17389631,7047,Inactive,,,,Potency,Cell Viability - LYMP2-018,Confirmatory,,
96,986,1,2,,17389631,7047,Inactive,,,,Potency,Cell Viability - LYMP2-020,Confirmatory,,
97,987,1,2,,17389631,7047,Inactive,,,,Potency,Cell Viability - LYMP2-022,Confirmatory,,
98,988,1,2,,17389631,7047,Inactive,,,,Potency,Cell Viability - LYMP2-024,Confirmatory,,
99,989,1,2,,17389631,7047,Inactive,,,,Potency,Cell Viability - LYMP2-026,Confirmatory,,
100,993,1,2,,17389631,7047,Inactive,,,,Potency,Cell Viability - LYMP1-002 - Assay at 24 hr,Confirmatory,,
101,994,1,2,,17389631,7047,Inactive,,,,Potency,Cell Viability - LYMP1-002 - Assay at 40 hr,Confirmatory,,
102,995,1,2,,17389631,7047,Inactive,66932916.0,5594.0,,Potency,qHTS Assay for Inhibitors of the ERK Signaling Pathway using a Homogeneous Screening Assay,Confirmatory,,
103,1030,2,1,,17389631,7047,Inconclusive,30582681.0,216.0,37.6505,Potency,qHTS Assay for Inhibitors of Aldehyde Dehydrogenase 1 (ALDH1A1),Confirmatory,,
104,1188,1,2,,48414990,7047,Active,,,,,DSSTox (EPAFHM) EPA Fathead Minnow Acute Toxicity,Other,,
105,1452,1,1,,17389631,7047,Inactive,154426292.0,239.0,,Potency,qHTS Assay for Inhibitors of 12-hLO (12-human lipoxygenase),Confirmatory,,
106,1457,1,1,,17389631,7047,Inactive,44888968.0,83523.0,,Potency,qHTS Assay for Identifying the Cell-Membrane Permeable IMPase Inhibitors: Potentiation with Lithium,Confirmatory,,
107,1458,1,1,,17389631,7047,Inactive,10937869.0,6607.0,,Potency,qHTS Assay for Enhancers of SMN2 Splice Variant Expression,Confirmatory,,
108,1469,1,1,,17389631,7047,Inactive,189491771.0,7068.0,,Potency,qHTS for Inhibitors of the Interaction of Thyroid Hormone Receptor and Steroid Receptor Coregulator 2,Confirmatory,,
109,1471,2,1,,17389631,7047,Inactive,90903231.0,3064.0,,,qHTS Multiplex Assay to Identify Dual Action Probes in a Cell Model of Huntington: Cytoprotection (ATP),Confirmatory,,
110,1476,2,1,,17389631,7047,Inactive,281307097.0,,,Potency,qHTS Assay for Promiscuous and Specific Inhibitors of Cruzain (without detergent),Confirmatory,,
111,1477,1,1,,17389631,7047,Inactive,,,,Potency,qHTS Assay for Compounds Blocking the Interaction Between CBF-beta and RUNX1 for the Treatment of Acute Myeloid Leukemia,Confirmatory,,
112,1478,2,1,,17389631,7047,Inactive,281307097.0,,,Potency,qHTS Assay for Promiscuous and Specific Inhibitors of Cruzain (with detergent),Confirmatory,,
113,1479,1,2,,17389631,7047,Inactive,189491771.0,7068.0,,Potency,Total Fluorescence Counterscreen for Inhibitors of the Interaction of Thyroid Hormone Receptor and Steroid Receptor Coregulator 2,Confirmatory,,
114,1948,1,1,,17389631,7047,Inactive,,,,Potency,qHTS Assay for Compounds that Induce Erasure of Genomic Imprints,Confirmatory,,
115,1996,2,2,,85148604,7047,Active,,,,,Aqueous Solubility from MLSMR Stock Solutions,Other,,
116,2016,1,3,,85148604,7047,Inactive,1302091.0,,,,Multiplex HTS Screen of TOR pathway GFP-fusion proteins in Saccharomyes cerevisiae_specifically_ MEP2_MLPCN.,Screening,,
117,2023,1,3,,85148604,7047,Inactive,486173.0,,,,Multiplex HTS Screen of TOR pathway GFP-fusion proteins in Saccharomyes cerevisiae_specifically_ LAP4_MLPCN.,Screening,,
118,2025,1,3,,85148604,7047,Inactive,536029.0,,,,Multiplex HTS Screen of TOR pathway GFP-fusion proteins in Saccharomyes cerevisiae_specifically_ RPL19A_MLPCN.,Screening,,
119,2029,1,3,,85148604,7047,Inactive,171229.0,,,,Multiplex HTS Screen of TOR pathway GFP-fusion proteins in Saccharomyes cerevisiae_specifically_ CIT2_MLPCN.,Screening,,
120,2052,2,1,,85148604,7047,Inactive,124486680.0,16408.0,,,HTS for developing T Cell Immune Modulators,Screening,,
121,2066,1,4,,85148604,7047,Inactive,85666113.0,850333.0,,,Multiplex HTS Screen of TOR pathway GFP-fusion proteins in Saccharomyes cerevisiae_specifically_ AGP1_MLPCN.,Screening,,
122,2101,1,1,,17389631,7047,Inactive,496369.0,2629.0,,Potency,qHTS Assay for Inhibitors and Activators of N370S glucocerebrosidase as a Potential Chaperone Treatment of Gaucher Disease,Confirmatory,,
123,2107,1,1,,17389631,7047,Inactive,757912.0,2717.0,,Potency,qHTS Assay for Inhibitors and Activators of Human alpha-Galactosidase From Spleen Homogenate,Confirmatory,,
124,2112,1,1,,17389631,7047,Inactive,119393891.0,2548.0,,Potency,qHTS Assay for Inhibitors and Activators of Human alpha-Glucosidase From Spleen Homogenate,Confirmatory,,
125,2120,1,1,,17389631,7047,Inactive,32879895.0,3091.0,,Potency,qHTS Assay for Identification of Small Molecule Inducers of Hypoxia Response,Confirmatory,,
126,2280,2,3,,85148604,7047,Inactive,17507875.0,172532.0,,,Fluorescence polarization-based primary biochemical high throughput screening assay to identify inhibitors of GLD-1 protein - TGE RNA interaction.,Screening,,
127,2380,1,2,,85148604,7047,Inactive,,,,,uHTS identification of small molecules that induce b-cell replication in the MIN-6 cell line,Screening,,
128,2435,1,2,,85148604,7047,Inactive,32307152.0,5021.0,,,Fluorescence-based primary cell-based high throughput screening assay to identify agonists of the Oxytocin Receptor (OXTR).,Screening,,
129,2445,1,2,,85148604,7047,Inactive,32307152.0,5021.0,,,Fluorescence-based primary cell-based high throughput screening assay to identify potentiators of Oxytocin Receptor (OXTR),Screening,,
130,2517,2,1,,17389631,7047,Inactive,6980812.0,,,Potency,qHTS Assay for Inhibitors of the Human Apurinic/apyrimidinic Endonuclease 1 (APE1),Confirmatory,,
131,2517,2,1,,85148604,7047,Inactive,6980812.0,,,Potency,qHTS Assay for Inhibitors of the Human Apurinic/apyrimidinic Endonuclease 1 (APE1),Confirmatory,,
132,2520,1,4,,85148604,7047,Inactive,4885057.0,187.0,,,uHTS identification of small molecule agonists of the APJ  receptor  via a luminescent beta-arrestin assay,Screening,,
133,2521,1,3,,85148604,7047,Inactive,4885057.0,187.0,,,uHTS identification of small molecule antagonists of the APJ  receptor  via a luminescent beta-arrestin assay,Screening,,
134,2524,1,2,,85148604,7047,Inactive,124376142.0,248.0,,,uHTS Luminescent assay for identification of activators of human intestinal alkaline phosphatase,Screening,,
135,2540,1,2,,85148604,7047,Inactive,262118306.0,123228.0,,,HTS Luminescent assay for identification of inhibitors of Sentrin-specific protease 8 (SENP8),Screening,,
136,2544,1,2,,85148604,7047,Inactive,124376142.0,248.0,,,uHTS Luminescent assay for identification of inhibitors of human intestinal alkaline phosphatase,Screening,,
137,2546,1,1,,17389631,7047,Inactive,188536040.0,19885.0,,Potency,VP16 counterscreen qHTS for inhibitors of ROR gamma transcriptional activity,Confirmatory,,
138,2549,1,1,,17389631,7047,Inactive,282403581.0,,,Potency,qHTS Assay for Inhibitors of RecQ-Like Dna Helicase 1 (RECQ1),Confirmatory,,
139,2551,1,1,,17389631,7047,Inactive,188536040.0,19885.0,,Potency,qHTS for inhibitors of ROR gamma transcriptional activity,Confirmatory,,
140,2557,1,3,,85148604,7047,Inactive,67191027.0,3676.0,,,HTS for Identification of VLA-4 Allosteric Modulators from MLPCN library,Screening,,
141,2599,1,2,,85148604,7047,Inactive,6166485.0,26054.0,,,uHTS Luminescent assay for identification of inhibitors of Sentrin-specific protease 6 (SENP6),Screening,,
142,2606,1,2,,85148604,7047,Inactive,15610807.0,885176.0,,,Fluorescence polarization-based primary biochemical high throughput screening assay to identify inhibitors of the membrane-associated serine protease Rv3671c in M.tuberculosis,Screening,,
143,2690,1,2,,85148604,7047,Inactive,,,,,A yeast HTS for caloric restriction mimetics that inhibit age-related superoxide,Screening,,
144,2751,2,2,,85148604,7047,Inactive,153217451.0,9581.0,,,Fluorescence polarization-based primary biochemical high throughput screening assay to identify inhibitors of the prolyl oligopeptidase-like enzyme (PREPL),Screening,,
145,2796,1,4,,85148604,7047,Inactive,4502003.0,196.0,,,Luminescence-based primary cell-based high throughput screening assay to identify activators of the Aryl Hydrocarbon Receptor (AHR),Screening,,
146,2797,1,2,,85148604,7047,Inactive,4502331.0,552.0,,,Counterscreen for Oxytocin Receptor (OXTR) agonists: Fluorescence-based primary cell-based high throughput assay to identify agonists of the vasopressin 1 receptor (V1R),Screening,,
147,2805,2,2,,85148604,7047,Inactive,124487323.0,76768.0,,,uHTS Luminescent assay for identification of activators of mouse intestinal alkaline phosphatase,Screening,,
148,2806,2,2,,85148604,7047,Inactive,124487323.0,76768.0,,,uHTS Luminescent assay for identification of inhibitors of mouse intestinal alkaline phosphatase,Screening,,
149,2825,1,2,,85148604,7047,Inactive,219518789.0,114548.0,,,uHTS Luminescent assay for identification of inhibitors of NALP3 in yeast,Screening,,
150,19225,3,4,,103177899,7047,Unspecified,,,,,Partition coefficient (logP),Other,,
151,19262,5,1,,103177899,7047,Unspecified,,,,,Aqueous solubility,Other,10866370.0,
152,19424,3,4,,103177899,7047,Unspecified,,,,,Partition coefficient (logD7.4),Other,11448232.0,
153,19427,3,3,,103177899,7047,Unspecified,,,,,HPLC capacity factor (k),Other,10956200.0,
154,25335,3,4,,103177899,7047,Unspecified,,,,,Association constant (pKa) was determined,Other,,
155,25367,3,3,,103177899,7047,Unspecified,,,,,Compound was evaluated for the pKa value in water at 20 degrees Centigrade,Other,8544179.0,
156,27580,3,3,,103177899,7047,Unspecified,,,,,Partition coefficient (logP),Other,10956200.0,
157,29176,3,3,,103177899,7047,Unspecified,,,,,Dissociation constent of compound at 20 degree C,Other,2502633.0,
158,29421,3,3,,103177899,7047,Unspecified,,,,,Partition coefficient (logP) (HPLC),Other,10956200.0,
159,61001,3,9,,103177899,7047,Unspecified,128613.0,24898.0,,,The maximal DA release induced by perfusion with 10 mM MPP+ (15 min) 1 day after perfusion with the test compound with basal striatal DA (%of basal x10E-3),Other,2374149.0,
160,61002,3,9,,103177899,7047,Unspecified,128613.0,24898.0,,,The maximum dopamine release induced by perfusion with the test compound with basal striatal DA (%of basal x10E-3),Other,2374149.0,
161,74835,3,6,,103177899,7047,Unspecified,,,,,Inhibitory activity against vesicular glutamate transport (GVT) in synaptic vesicles isolated from rat forebrain,Other,10498218.0,
162,125789,6,6,,103177899,7047,Unspecified,84028191.0,1565.0,1000.0,Ki,Inhibitory effect on Bufuralol 1'-hydroxylation by human liver microsomes (Ki = apparent inhibition constant),Confirmatory,8487254.0,
163,158544,4,3,,103177899,7047,Unspecified,,,10.0,IC50,In vitro antiplasmodial activity against Plasmodium falciparum D10,Confirmatory,10649984.0,
164,168703,3,4,,103177899,7047,Unspecified,,,,,Inhibition of Rana pipiens muscle activity.,Other,2033592.0,
165,219087,3,4,,103177899,7047,Unspecified,,,,,Association constant with ferriprotoporphyrin IX.,Other,10649984.0,
166,226297,5,1,,103177899,7047,Inactive,,,,,Inhibition of Beta-hematin (hemozoin) formation; No inhibition.,Other,10649984.0,
167,237685,4,3,,103177899,7047,Unspecified,,,,,Lipophilicity determined as logarithm of the partition coefficient in the alkane/water system,Other,15857133.0,
168,238164,7,7,,103177899,7047,Inactive,81878010.0,,,,Displacement of PRP-1 peptide from mouse Tec kinase SH3 domain by fluorescence polarization; No binding,Other,15481978.0,
169,342464,3,3,,103177899,7047,Unspecified,,,,,"Dissociation constant, pKa of the compound",Other,18570365.0,
170,343398,3,4,,103177899,7047,Unspecified,,,,,"Octanol-water distribution coefficient, log D at pH 7.4 by shake-flask technique",Other,18558667.0,
171,343680,3,4,,103177899,7047,Unspecified,,,,,"Hexadecane-water distribution coefficient, log D at pH 7.4 by shake-flask technique",Other,18558667.0,
172,346025,3,3,,103177899,7047,Unspecified,,,,,Binding affinity to beta cyclodextrin,Other,19056282.0,
173,434955,1,2,,85148604,7047,Inactive,,,,IC90,Screen to Identify Novel Compounds That Sensitize Mycobacterium Tuberculosis to Beta-lactam Antibiotics,Confirmatory,,
174,434962,1,2,,85148604,7047,Inactive,155969707.0,3416.0,,,Fluorescence polarization-based cell-based primary high throughput screening assay to identify inhibitors of insulin-degrading enzyme (IDE),Screening,,
175,434973,1,3,,85148604,7047,Inactive,120538355.0,57337.0,,,uHTS Luminescent assay for identification of inhibitors of Sentrin-specific protease 7 (SENP7),Screening,,
176,434989,1,1,,85148604,7047,Inactive,222080095.0,3061.0,,,Fluorescence-based cell-based primary high throughput screening assay to identify antagonists of the orexin 1 receptor (OX1R; HCRTR1),Screening,,
177,435003,1,3,,85148604,7047,Inactive,,,,,uHTS luminescence assay for the identification of chemical inhibitors of T-cell specific antigen receptor-induced NF-kB activation,Screening,,
178,435022,2,2,,85148604,7047,Inactive,,,,,uHTS luminescence assay for the identification of chemical inhibitors of B-cell specific antigen receptor-induced NF-kB activation,Screening,,
179,435030,1,2,,85148604,7047,Inactive,15645703.0,899625.0,,,Absorbance-based primary bacterial cell-based high throughput screening assay to identify inhibitors of AddAB recombination protein complex,Screening,,
180,435030,1,2,,85148604,7047,Inactive,15646160.0,899738.0,,,Absorbance-based primary bacterial cell-based high throughput screening assay to identify inhibitors of AddAB recombination protein complex,Screening,,
181,449728,1,2,,85148604,7047,Inactive,,,,,Counterscreen for inhibitors of AddAB: absorbance-based bacterial cell-based high throughput screening assay to identify inhibitors of bacterial viability,Screening,,
182,449762,1,2,,85148604,7047,Inactive,,,,IC50,High Throughput Screening Assay used to Identify Novel Compounds that Inhibit Mycobacterium Tuberculosis in 7H9 Media,Confirmatory,,
183,449763,1,3,,85148604,7047,Inactive,,,,,uHTS identification of small molecule activators of the apoptotic arm of the Unfolded Protein response via a luminescent-based reporter assay,Screening,,
184,463079,1,2,,85148604,7047,Inactive,,,,,Fluorescence-based counterscreen for orexin 1 receptor (OX1R) antagonists: cell-based assay to identify antagonists of the parental CHO cell line,Screening,,
185,463082,1,1,,85148604,7047,Inactive,270133071.0,7941.0,,,Fluorescence polarization-based primary biochemical high throughput screening assay to identify inhibitors of the plasma platelet activating factor acetylhydrolase (pPAFAH),Screening,,
186,463104,1,2,,85148604,7047,Inactive,,,,,uHTS identification of small molecule activators of the adaptive arm of the Unfolded Protein response via a luminescent-based reporter assay,Screening,,
187,463141,1,2,,85148604,7047,Inactive,14790119.0,836.0,,,Absorbance-based primary biochemical high throughput screening assay to identify activators of procaspase-3,Screening,,
188,463190,1,2,,85148604,7047,Inactive,285809906.0,856395.0,,,uHTS identification of small molecule inhibitors of tim10-1 yeast via a luminescent assay,Screening,,
189,463195,1,2,,85148604,7047,Inactive,285809906.0,856395.0,,,uHTS identification of small molecule inhibitors of tim10 yeast via a luminescent assay,Screening,,
190,463210,1,2,,85148604,7047,Inactive,55960760.0,,,,Counterscreen for procaspase-3 activators: absorbance-based primary biochemical high throughput screening assay to identify activators of procaspase-7,Screening,,
