,AID,AID Version,AID Revision,Panel Member ID,SID,CID,Bioactivity Outcome,Target GI,Target GeneID,Activity Value [uM],Activity Name,Assay Name,Bioassay Type,PubMed ID,RNAi
0,248,1,1,,425148,20120,Inactive,,,,,NCI In Vivo Anticancer Drug Screen. Data for tumor model  L1210 Leukemia (intraperitoneal) in B6D2F1 (BDF1) mice,Other,,
1,1189,1,5,,48413668,20120,Active,,,,,DSSTox (CPDBAS) Carcinogenic Potency Database Summary SingleCellCall Results,Other,,
2,1205,1,4,,48413668,20120,Active,,,,,DSSTox (CPDBAS) Carcinogenic Potency Database Summary MultiCellCall Results,Other,,
3,1208,1,3,,48413668,20120,Active,,,,,DSSTox (CPDBAS) Carcinogenic Potency Database Summary Rat Bioassay Results,Other,,
4,318681,7,1,,103567739,20120,Unspecified,,,,,Anticarcinogenic activity in rat assessed as induction of tumors per day,Other,18295489.0,
5,1259407,1,1,,363901449,20120,Inactive,,,,,CCRIS mutagenicity studies,Other,,
6,1259411,1,1,,363901449,20120,Active,,,,,CCRIS carcinogenicity studies,Other,,
