,AID,AID Version,AID Revision,Panel Member ID,SID,CID,Bioactivity Outcome,Target GI,Target GeneID,Activity Value [uM],Activity Name,Assay Name,Bioassay Type,PubMed ID,RNAi
0,248,1,1,,83696,228398,Inactive,,,,,NCI In Vivo Anticancer Drug Screen. Data for tumor model  L1210 Leukemia (intraperitoneal) in B6D2F1 (BDF1) mice,Other,,
1,875,1,2,,26749717,228398,Inactive,159162802.0,,,Potency,qHTS Assay for Inhibitors of BRCT-Phosphoprotein Interaction (Green Fluorophore),Confirmatory,,
2,880,2,1,,26749717,228398,Inactive,3290016.0,6002.0,,,qHTS Assay for Inhibitors of RGS12 GoLoco Motif Activity (Red Fluorophore),Confirmatory,,
3,880,2,1,,26749717,228398,Inactive,33946324.0,2770.0,,,qHTS Assay for Inhibitors of RGS12 GoLoco Motif Activity (Red Fluorophore),Confirmatory,,
4,881,2,2,,26749717,228398,Inactive,317373425.0,247.0,,Potency,qHTS Assay for Inhibitors of 15-hLO-2 (15-human lipoxygenase 2),Confirmatory,,
5,884,1,2,,26749717,228398,Inactive,13435386.0,1576.0,,Potency,qHTS Assay for Inhibitors and Substrates of Cytochrome P450 3A4,Confirmatory,,
6,885,1,2,,26749717,228398,Inactive,13435386.0,1576.0,,Potency,qHTS Assay for Activators of Cytochrome P450 3A4,Confirmatory,,
7,887,1,2,,26749717,228398,Inactive,1832253.0,246.0,,Potency,qHTS Assay for Inhibitors of 15-hLO (15-human lipoxygenase),Confirmatory,,
8,889,1,3,,26749717,228398,Inactive,1730092.0,840.0,,Potency,qHTS Assay for Allosteric/Competitive Inhibitors of Caspase-7,Confirmatory,,
9,892,1,2,,26749717,228398,Inactive,159162802.0,,,Potency,qHTS Assay for Inhibitors of BRCT-Phosphoprotein Interaction (Red Fluorophore),Confirmatory,,
10,893,1,2,,26749717,228398,Inactive,122921310.0,,,Potency,"qHTS Assay for Inhibitors of HSD17B4, hydroxysteroid (17-beta) dehydrogenase 4",Confirmatory,,
11,893,1,2,,26749717,228398,Inactive,122921311.0,,,Potency,"qHTS Assay for Inhibitors of HSD17B4, hydroxysteroid (17-beta) dehydrogenase 4",Confirmatory,,
12,894,2,1,,26749717,228398,Inactive,31542939.0,3248.0,,Potency,qHTS Assay for Inhibitors of HPGD (15-Hydroxyprostaglandin Dehydrogenase),Confirmatory,,
13,900,1,3,,26749717,228398,Inactive,15431328.0,834.0,,Potency,qHTS Assay for Allosteric/Competitive Inhibitors of Caspase-1,Confirmatory,,
14,902,1,2,,26749717,228398,Inactive,120407068.0,7157.0,,Potency,qHTS Screen for Compounds that Selectively Target Cancer Cells with p53 Mutations: Cytotoxicity of p53ts Cells at the Nonpermissive Temperature,Confirmatory,,
15,910,1,2,,26749717,228398,Inactive,4504349.0,3043.0,,Potency,Confirmation and Secondary Assay for Modulators of Hemoglobin Beta Chain Splicing at IVS2 654 locus,Confirmatory,,
16,923,1,2,,26749717,228398,Inactive,,,,Potency,qHTS Assay for Allosteric/Competitive Inhibitors of Caspase-1: Spectroscopic Profiling in AFC Spectral Region,Confirmatory,,
17,924,1,2,,26749717,228398,Inactive,120407068.0,7157.0,,Potency,qHTS Screen for Compounds that Selectively Target Cancer Cells with p53 Mutations: Cytotoxicity of p53ts Cells at the Permissive Temperature,Confirmatory,,
18,927,1,3,,26749717,228398,Inactive,188528692.0,9099.0,,Potency,qHTS Assay for Inhibitors of Ubiquitin-specific Protease USP2a,Confirmatory,,
19,930,1,2,,26749717,228398,Inactive,4504349.0,3043.0,,Potency,Confirmation and Secondary Assay for Modulators of Hemoglobin Beta Chain Splicing at IVS2 705 locus,Confirmatory,,
20,995,1,2,,26749717,228398,Inactive,66932916.0,5594.0,,Potency,qHTS Assay for Inhibitors of the ERK Signaling Pathway using a Homogeneous Screening Assay,Confirmatory,,
21,1030,2,1,,26749717,228398,Inactive,30582681.0,216.0,,Potency,qHTS Assay for Inhibitors of Aldehyde Dehydrogenase 1 (ALDH1A1),Confirmatory,,
22,1379,1,2,,26749717,228398,Inactive,1669525.0,,,Potency,Counterscreen for Luciferase (Kinase-Glo TM) Inhibition,Confirmatory,,
23,1452,1,1,,26749717,228398,Inactive,154426292.0,239.0,,Potency,qHTS Assay for Inhibitors of 12-hLO (12-human lipoxygenase),Confirmatory,,
24,1454,1,1,,26749717,228398,Inactive,66932916.0,5594.0,,Potency,qHTS Assay for Inhibitors of the ERK Signaling Pathway using a Homogeneous Screening Assay; Stimulation with EGF,Confirmatory,,
25,1457,1,1,,26749717,228398,Inactive,44888968.0,83523.0,,Potency,qHTS Assay for Identifying the Cell-Membrane Permeable IMPase Inhibitors: Potentiation with Lithium,Confirmatory,,
26,1458,1,1,,26749717,228398,Inactive,10937869.0,6607.0,,Potency,qHTS Assay for Enhancers of SMN2 Splice Variant Expression,Confirmatory,,
27,1460,1,3,,26749717,228398,Inactive,92096784.0,4137.0,,Potency,"qHTS for Inhibitors of Tau Fibril Formation, Thioflavin T Binding",Confirmatory,,
28,1463,1,1,,26749717,228398,Inactive,,,,Potency,"Counterscreen qHTS for Inhibitors of Tau Fibril Formation, Fluorescence Polarization",Confirmatory,,
29,1467,1,3,,26749717,228398,Inactive,757912.0,2717.0,,Potency,qHTS Assay for Inhibitors of Human alpha-Galactosidase at pH 4.5.,Confirmatory,,
30,1468,1,1,,26749717,228398,Inactive,92096784.0,4137.0,,Potency,"qHTS for Inhibitors of Tau Fibril Formation, Fluorescence Polarization",Confirmatory,,
31,1469,1,1,,26749717,228398,Inactive,189491771.0,7068.0,,Potency,qHTS for Inhibitors of the Interaction of Thyroid Hormone Receptor and Steroid Receptor Coregulator 2,Confirmatory,,
32,1476,2,1,,26749717,228398,Inactive,281307097.0,,,Potency,qHTS Assay for Promiscuous and Specific Inhibitors of Cruzain (without detergent),Confirmatory,,
33,1478,2,1,,26749717,228398,Inactive,281307097.0,,,Potency,qHTS Assay for Promiscuous and Specific Inhibitors of Cruzain (with detergent),Confirmatory,,
34,1479,1,2,,26749717,228398,Inactive,189491771.0,7068.0,,Potency,Total Fluorescence Counterscreen for Inhibitors of the Interaction of Thyroid Hormone Receptor and Steroid Receptor Coregulator 2,Confirmatory,,
35,1487,1,1,,26749717,228398,Inactive,27436948.0,4000.0,,Potency,qHTS Assay for Modulators of Lamin A Splicing,Confirmatory,,
36,1490,2,1,,26749717,228398,Inactive,10954339.0,,,Potency,qHTS Assay for Inhibitors of Bacillus subtilis Sfp phosphopantetheinyl transferase (PPTase),Confirmatory,,
37,1519,1,3,,26749717,228398,Inactive,,,,Potency,qHTS Assay for Lipid Storage Modulators,Confirmatory,,
38,1766,1,1,,26749717,228398,Inactive,18860839.0,4221.0,,Potency,qHTS Assay for Inhibitors Targeting the Menin-MLL Interaction in MLL Related Leukemias: Competition With Fluorescein Labeled MLL-derived Peptide,Confirmatory,,
39,1766,1,1,,26749717,228398,Inactive,56550039.0,4297.0,,Potency,qHTS Assay for Inhibitors Targeting the Menin-MLL Interaction in MLL Related Leukemias: Competition With Fluorescein Labeled MLL-derived Peptide,Confirmatory,,
40,1768,1,1,,26749717,228398,Inactive,18860839.0,4221.0,,Potency,qHTS Assay for Inhibitors Targeting the Menin-MLL Interaction in MLL Related Leukemias: Competition With Texas Red Labeled MLL-derived Mutant Peptide,Confirmatory,,
41,1768,1,1,,26749717,228398,Inactive,56550039.0,4297.0,,Potency,qHTS Assay for Inhibitors Targeting the Menin-MLL Interaction in MLL Related Leukemias: Competition With Texas Red Labeled MLL-derived Mutant Peptide,Confirmatory,,
42,1865,1,1,,26749717,228398,Inactive,,,,Potency,Quantitative High-Throughput Screen for Regulators of Epigenetic Control,Confirmatory,,
43,1948,1,1,,26749717,228398,Inactive,,,,Potency,qHTS Assay for Compounds that Induce Erasure of Genomic Imprints,Confirmatory,,
44,2101,1,1,,26749717,228398,Inactive,496369.0,2629.0,,Potency,qHTS Assay for Inhibitors and Activators of N370S glucocerebrosidase as a Potential Chaperone Treatment of Gaucher Disease,Confirmatory,,
45,2107,1,1,,26749717,228398,Inactive,757912.0,2717.0,,Potency,qHTS Assay for Inhibitors and Activators of Human alpha-Galactosidase From Spleen Homogenate,Confirmatory,,
46,2112,1,1,,26749717,228398,Inactive,119393891.0,2548.0,,Potency,qHTS Assay for Inhibitors and Activators of Human alpha-Glucosidase From Spleen Homogenate,Confirmatory,,
47,2147,1,1,,26749717,228398,Inactive,221046486.0,,,Potency,qHTS Assay for Inhibitors of  Human Jumonji Domain Containing 2E (JMJD2E),Confirmatory,,
48,2451,1,2,,26749717,228398,Inactive,122920737.0,,,Potency,"qHTS Assay for Inhibitors of Fructose-1,6-bisphosphate Aldolase from Giardia Lamblia",Confirmatory,,
49,2472,1,2,,26749717,228398,Inactive,7669492.0,2597.0,,,"qHTS Assay for Inhibitors of Fructose-1,6-bisphosphate Aldolase from Giardia Lamblia: Coupling assay counterscreen",Screening,,
50,2517,2,1,,26749717,228398,Inactive,6980812.0,,,Potency,qHTS Assay for Inhibitors of the Human Apurinic/apyrimidinic Endonuclease 1 (APE1),Confirmatory,,
51,2528,1,2,,26749717,228398,Inactive,4557365.0,641.0,,Potency,qHTS Assay for Inhibitors of Bloom's syndrome helicase (BLM),Confirmatory,,
52,2546,1,1,,26749717,228398,Inactive,188536040.0,19885.0,,Potency,VP16 counterscreen qHTS for inhibitors of ROR gamma transcriptional activity,Confirmatory,,
53,2549,1,1,,26749717,228398,Inactive,282403581.0,,,Potency,qHTS Assay for Inhibitors of RecQ-Like Dna Helicase 1 (RECQ1),Confirmatory,,
54,2551,1,1,,26749717,228398,Inactive,188536040.0,19885.0,,Potency,qHTS for inhibitors of ROR gamma transcriptional activity,Confirmatory,,
55,485281,1,1,,26749717,228398,Inactive,254220970.0,,,Potency,qHTS Assay for Identification of Novel General Anesthetics,Confirmatory,,
56,485290,1,1,,26749717,228398,Inactive,20150581.0,,,Potency,qHTS Assay for Inhibitors of Tyrosyl-DNA Phosphodiesterase (TDP1),Confirmatory,,
57,504327,1,1,,26749717,228398,Inactive,153791535.0,2648.0,,Potency,qHTS Assay for Inhibitors of GCN5L2,Confirmatory,,
58,504847,1,1,,26749717,228398,Inactive,63054845.0,7421.0,,Potency,Inhibitors of the vitamin D receptor (VDR): qHTS,Confirmatory,,
59,504865,1,1,,26749717,228398,Inactive,118600387.0,7398.0,,Potency,Inhibitors of USP1/UAF1: Pilot qHTS,Confirmatory,,
60,588579,1,1,,26749717,228398,Inactive,7705344.0,51426.0,,Potency,qHTS for Inhibitors of Polymerase Kappa,Confirmatory,,
61,602332,1,1,,26749717,228398,Inactive,168984549.0,,,Potency,qHTS for Inducers of the Endoplasmic Reticulum Stress Response (ERSR) in Human Glioma: qHTS,Confirmatory,,
62,624263,1,1,,26749717,228398,Inactive,3063388.0,5071.0,,Potency,A Quantitative High throughput Screen to Identify Chemical Modulators of PINK1 Expression,Confirmatory,,
63,624263,1,1,,26749717,228398,Inactive,37183032.0,,,Potency,A Quantitative High throughput Screen to Identify Chemical Modulators of PINK1 Expression,Confirmatory,,
64,686978,1,1,,26749717,228398,Inactive,79154014.0,55775.0,,Potency,qHTS for Inhibitors of human tyrosyl-DNA phosphodiesterase 1 (TDP1): qHTS in cells in absence of CPT,Confirmatory,,
65,686979,1,1,,26749717,228398,Inactive,79154014.0,55775.0,,Potency,qHTS for Inhibitors of human tyrosyl-DNA phosphodiesterase 1 (TDP1): qHTS in cells in presence of CPT,Confirmatory,,
66,720532,1,1,,26749717,228398,Inactive,420597.0,,,Potency,qHTS for Inhibitors of binding or entry into cells for Marburg Virus,Confirmatory,,
67,720533,1,1,,26749717,228398,Inactive,,,,Potency,qHTS for Inhibitors of binding or entry into cells for Lassa Virus,Confirmatory,,
68,720579,2,1,,26749717,228398,Inactive,222762.0,3707576.0,,Potency,qHTS for Stage-Specific Inhibitors of Vaccinia Orthopoxvirus: mCherry Reporter Primary qHTS,Confirmatory,,
69,720580,1,1,,26749717,228398,Inactive,222762.0,3707576.0,,Potency,qHTS for Stage-Specific Inhibitors of Vaccinia Orthopoxvirus: Venus Reporter Primary qHTS,Confirmatory,,
70,1159524,1,1,,26749717,228398,Inactive,,,,Potency,High Throughput Screening for Foot and Mouth Disease Virus Antivirals,Confirmatory,,
71,1259416,1,2,,340081901,228398,Inactive,56786138.0,3458.0,,,Toxoplasma gondii inhibition HTS in the presence of IFN-y,Screening,,
72,1259421,1,1,,340081901,228398,Inactive,56786138.0,3458.0,,,Toxoplasma gondii HTS in the absence of IFN-y,Screening,,
