,AID,AID Version,AID Revision,Panel Member ID,SID,CID,Bioactivity Outcome,Target GI,Target GeneID,Activity Value [uM],Activity Name,Assay Name,Bioassay Type,PubMed ID,RNAi
0,875,1,2,,26749100,5475,Inactive,159162802.0,,,Potency,qHTS Assay for Inhibitors of BRCT-Phosphoprotein Interaction (Green Fluorophore),Confirmatory,,
1,880,2,1,,26749100,5475,Inactive,3290016.0,6002.0,,,qHTS Assay for Inhibitors of RGS12 GoLoco Motif Activity (Red Fluorophore),Confirmatory,,
2,880,2,1,,26749100,5475,Inactive,33946324.0,2770.0,,,qHTS Assay for Inhibitors of RGS12 GoLoco Motif Activity (Red Fluorophore),Confirmatory,,
3,881,2,2,,26749100,5475,Inactive,317373425.0,247.0,,Potency,qHTS Assay for Inhibitors of 15-hLO-2 (15-human lipoxygenase 2),Confirmatory,,
4,884,1,2,,26749100,5475,Inactive,13435386.0,1576.0,,Potency,qHTS Assay for Inhibitors and Substrates of Cytochrome P450 3A4,Confirmatory,,
5,885,1,2,,26749100,5475,Inactive,13435386.0,1576.0,,Potency,qHTS Assay for Activators of Cytochrome P450 3A4,Confirmatory,,
6,887,1,2,,26749100,5475,Inactive,1832253.0,246.0,,Potency,qHTS Assay for Inhibitors of 15-hLO (15-human lipoxygenase),Confirmatory,,
7,889,1,3,,26749100,5475,Inactive,1730092.0,840.0,,Potency,qHTS Assay for Allosteric/Competitive Inhibitors of Caspase-7,Confirmatory,,
8,892,1,2,,26749100,5475,Inactive,159162802.0,,,Potency,qHTS Assay for Inhibitors of BRCT-Phosphoprotein Interaction (Red Fluorophore),Confirmatory,,
9,893,1,2,,26749100,5475,Inactive,122921310.0,,,Potency,"qHTS Assay for Inhibitors of HSD17B4, hydroxysteroid (17-beta) dehydrogenase 4",Confirmatory,,
10,893,1,2,,26749100,5475,Inactive,122921311.0,,,Potency,"qHTS Assay for Inhibitors of HSD17B4, hydroxysteroid (17-beta) dehydrogenase 4",Confirmatory,,
11,894,2,1,,26749100,5475,Inactive,31542939.0,3248.0,,Potency,qHTS Assay for Inhibitors of HPGD (15-Hydroxyprostaglandin Dehydrogenase),Confirmatory,,
12,900,1,3,,26749100,5475,Inactive,15431328.0,834.0,,Potency,qHTS Assay for Allosteric/Competitive Inhibitors of Caspase-1,Confirmatory,,
13,902,1,2,,26749100,5475,Inactive,120407068.0,7157.0,,Potency,qHTS Screen for Compounds that Selectively Target Cancer Cells with p53 Mutations: Cytotoxicity of p53ts Cells at the Nonpermissive Temperature,Confirmatory,,
14,910,1,2,,26749100,5475,Inactive,4504349.0,3043.0,,Potency,Confirmation and Secondary Assay for Modulators of Hemoglobin Beta Chain Splicing at IVS2 654 locus,Confirmatory,,
15,923,1,2,,26749100,5475,Inactive,,,,Potency,qHTS Assay for Allosteric/Competitive Inhibitors of Caspase-1: Spectroscopic Profiling in AFC Spectral Region,Confirmatory,,
16,924,1,2,,26749100,5475,Inactive,120407068.0,7157.0,,Potency,qHTS Screen for Compounds that Selectively Target Cancer Cells with p53 Mutations: Cytotoxicity of p53ts Cells at the Permissive Temperature,Confirmatory,,
17,927,1,3,,26749100,5475,Inactive,188528692.0,9099.0,,Potency,qHTS Assay for Inhibitors of Ubiquitin-specific Protease USP2a,Confirmatory,,
18,930,1,2,,26749100,5475,Inactive,4504349.0,3043.0,,Potency,Confirmation and Secondary Assay for Modulators of Hemoglobin Beta Chain Splicing at IVS2 705 locus,Confirmatory,,
19,940,1,2,,26613158,5475,Inactive,31881630.0,5732.0,,,Modulators of the EP2 prostaglandin E2 receptor - Primary Screening,Screening,,
20,995,1,2,,26749100,5475,Inactive,66932916.0,5594.0,,Potency,qHTS Assay for Inhibitors of the ERK Signaling Pathway using a Homogeneous Screening Assay,Confirmatory,,
21,1030,2,1,,26749100,5475,Inactive,30582681.0,216.0,,Potency,qHTS Assay for Inhibitors of Aldehyde Dehydrogenase 1 (ALDH1A1),Confirmatory,,
22,1379,1,2,,26749100,5475,Inactive,1669525.0,,,Potency,Counterscreen for Luciferase (Kinase-Glo TM) Inhibition,Confirmatory,,
23,1422,1,1,,26613158,5475,Inactive,31881630.0,5732.0,,,Inhibitors of the EP2 Prostaglandin E2 Receptor - Primary Screen,Screening,,
24,1452,1,1,,26749100,5475,Inactive,154426292.0,239.0,,Potency,qHTS Assay for Inhibitors of 12-hLO (12-human lipoxygenase),Confirmatory,,
25,1454,1,1,,26749100,5475,Inactive,66932916.0,5594.0,,Potency,qHTS Assay for Inhibitors of the ERK Signaling Pathway using a Homogeneous Screening Assay; Stimulation with EGF,Confirmatory,,
26,1457,1,1,,26749100,5475,Inactive,44888968.0,83523.0,,Potency,qHTS Assay for Identifying the Cell-Membrane Permeable IMPase Inhibitors: Potentiation with Lithium,Confirmatory,,
27,1458,1,1,,26749100,5475,Inactive,10937869.0,6607.0,,Potency,qHTS Assay for Enhancers of SMN2 Splice Variant Expression,Confirmatory,,
28,1460,1,3,,26749100,5475,Inconclusive,92096784.0,4137.0,19.9526,Potency,"qHTS for Inhibitors of Tau Fibril Formation, Thioflavin T Binding",Confirmatory,,
29,1463,1,1,,26749100,5475,Inactive,,,,Potency,"Counterscreen qHTS for Inhibitors of Tau Fibril Formation, Fluorescence Polarization",Confirmatory,,
30,1467,1,3,,26749100,5475,Inactive,757912.0,2717.0,,Potency,qHTS Assay for Inhibitors of Human alpha-Galactosidase at pH 4.5.,Confirmatory,,
31,1468,1,1,,26749100,5475,Inactive,92096784.0,4137.0,,Potency,"qHTS for Inhibitors of Tau Fibril Formation, Fluorescence Polarization",Confirmatory,,
32,1469,1,1,,26749100,5475,Inactive,189491771.0,7068.0,,Potency,qHTS for Inhibitors of the Interaction of Thyroid Hormone Receptor and Steroid Receptor Coregulator 2,Confirmatory,,
33,1471,2,1,,26749100,5475,Inactive,90903231.0,3064.0,,,qHTS Multiplex Assay to Identify Dual Action Probes in a Cell Model of Huntington: Cytoprotection (ATP),Confirmatory,,
34,1476,2,1,,26749100,5475,Inactive,281307097.0,,,Potency,qHTS Assay for Promiscuous and Specific Inhibitors of Cruzain (without detergent),Confirmatory,,
35,1477,1,1,,26749100,5475,Inactive,,,,Potency,qHTS Assay for Compounds Blocking the Interaction Between CBF-beta and RUNX1 for the Treatment of Acute Myeloid Leukemia,Confirmatory,,
36,1478,2,1,,26749100,5475,Inactive,281307097.0,,,Potency,qHTS Assay for Promiscuous and Specific Inhibitors of Cruzain (with detergent),Confirmatory,,
37,1479,1,2,,26749100,5475,Inactive,189491771.0,7068.0,,Potency,Total Fluorescence Counterscreen for Inhibitors of the Interaction of Thyroid Hormone Receptor and Steroid Receptor Coregulator 2,Confirmatory,,
38,1490,2,1,,26749100,5475,Inactive,10954339.0,,,Potency,qHTS Assay for Inhibitors of Bacillus subtilis Sfp phosphopantetheinyl transferase (PPTase),Confirmatory,,
39,1519,1,3,,26749100,5475,Inactive,,,,Potency,qHTS Assay for Lipid Storage Modulators,Confirmatory,,
40,1580,1,1,,8150145,5475,Inconclusive,,,,,Screen for compounds that inhibit mitochondrial permeability transition (MitoPT),Other,,
41,1581,1,1,,8150145,5475,Inconclusive,,,,,Screen of Compounds to Block PAR4 - aPKC Interaction for Treatment of Neurodegeneration (Par4_PKC),Other,,
42,1582,1,1,,8150145,5475,Inconclusive,,,,,Yeast cell-based screen for Novel HDAC inhibitors using a PHO84-LacZ reporter gene (PHO84),Other,,
43,1583,1,1,,8150145,5475,Unspecified,,,,,Assay to identify inhibitors of polyglutamine-induced caspase-3 activation (CASP3),Other,,
44,1584,1,1,,8150145,5475,Inconclusive,,,,,Screen for compounds that inhibit in vitro mutant huntingtin aggregation (QA1),Other,,
45,1585,1,1,,8150145,5475,Inconclusive,,,,,"Screen for compounds that inhibit the ability of solid phase synthetic polyglutamine aggregates to elongate by incorporating solution-phase biotin-tagged, monomeric polyglutamine (QA3)",Other,,
46,1586,1,1,,8150145,5475,Inconclusive,,,,,A 2-Hybrid Test for Interactions Between Polyglutamine-Containing Proteins in the Yeast Nucleus  (Qn2Hy),Other,,
47,1587,1,1,,8150145,5475,Inconclusive,,,,,Screen for compounds that increase the expression of EAAT-2 in rat spinal cord organotypic slice cultures (X4_EAAT2),Other,,
48,1588,1,1,,8150145,5475,Inconclusive,,,,,Screen for compounds that reduce polyglutamine aggregation as measured by turbidity (QTHIO),Other,,
49,1589,1,1,,8150145,5475,Inconclusive,,,,,Screen for compounds that reduce polyglutamine (polyQ) inclusions in nerve growth factor (NGF)-treated PC12 cells (SDS),Other,,
50,1590,1,1,,8150145,5475,Inconclusive,,,,,Cellular toxicity caused by inducible expressing of N-terminal huntingtin with expanded ployglutamine repeat (Htt-N63-148Q) in PC12 cells (ROSShtt),Other,,
51,1593,1,1,,8150145,5475,Unspecified,,,,,Yeast cell-based screen for compounds that suppress polyglutamine aggregation in vivo (75Q-TubU),Other,,
52,1594,1,1,,8150145,5475,Inconclusive,,,,,Screen for compounds that decrease glutamate induced motor neuron death measured by TUNEL staining for DNA degradation (MNGlu),Other,,
53,1595,1,1,,8150145,5475,Inconclusive,,,,,Suppression of Polyglutamine Toxicity in Whole Organism Drosophila Model of SCA1 (SCA1FLYe),Other,,
54,1596,1,1,,8150145,5475,Inconclusive,,,,,Protection from expanded polyglutamine huntingtin toxicity in PC12 cells (LDH100),Other,,
55,1597,1,1,,8150145,5475,Inconclusive,,,,,Suppression of Polyglutamine Toxicity in Whole Organism Drosophila Model of SCA1 (SCA1FLYp),Other,,
56,1598,1,1,,8150145,5475,Inconclusive,,,,,Screen for compounds that selectively increase SMN2 splicing relative to SMN1 splicing (SMNLUC),Other,,
57,1599,1,1,,8150145,5475,Unspecified,,,,,"Screen for compounds that correct neuronal dysfunction without cell death as induced by the expression of polyglutamine-expanded, N-terminal huntingtin in C. elegans mechanosensory neurons (HDELENEU)",Other,,
58,1600,1,1,,8150145,5475,Inconclusive,,,,,Yeast Assay for Parkinson&apos;s Disease (YAPD),Other,,
59,1601,1,1,,8150145,5475,Inconclusive,,,,,Screen for compounds that suppress mutant SOD1-mediated cell death (mSODtox),Other,,
60,1602,1,1,,8150145,5475,Inconclusive,,,,,Screen for compounds that attenuate mutant SOD1 toxicity (mSOD1),Other,,
61,1603,1,1,,8150145,5475,Unspecified,,,,,Screen for compounds that selectively inhibit cytochrome c release from purified mitochondria (CytoCRel),Other,,
62,1604,1,1,,8150145,5475,Unspecified,,,,,Screen for compounds that inhibit polyglutamine induced protein aggregation (AGREG),Other,,
63,1605,1,1,,8150145,5475,Unspecified,,,,,Screening of compounds showing protective effect against cell death induced by familial amyotrophic lateral sclerosis (FALS)-linked mutantsuperoxide dismutase 1 (SOD1) (ALSOD1),Other,,
64,1606,1,1,,8150145,5475,Inconclusive,,,,,Protection from expanded polyglutamine huntingtin toxicity in PC12 cells (LDH20),Other,,
65,1607,1,1,,8150145,5475,Inconclusive,,,,,Screen for compounds that promote the turnover of an expanded polyglutamine androgen receptor (AR112GFP),Other,,
66,1608,1,1,,8150145,5475,Inconclusive,,,,,Protection from expanded polyglutamine huntingtin toxicity in PC12 cells (LDH016),Other,,
67,1609,1,1,,8150145,5475,Inconclusive,,,,,Protection from expanded polyglutamine huntingtin toxicity in PC12 cells (LDH08),Other,,
68,1610,1,1,,8150145,5475,Inconclusive,,,,,Protection from expanded polyglutamine huntingtin toxicity in PC12 cells,Other,,
69,1611,1,1,,8150145,5475,Unspecified,,,,,Screen for compounds that induce the human heat shock transcriptional response (HSEluc),Other,,
70,1612,1,1,,8150145,5475,Unspecified,,,,,Screen for compounds that increase glutamate transport activity in MN-1 cell line (GluUPTAKE),Other,,
71,1613,1,1,,8150145,5475,Unspecified,,,,,Screen for compounds that inhibit protein aggregation formed by mutant SOD1 (GFPSOD1),Other,,
72,1614,1,1,,8150145,5475,Unspecified,,,,,Screen for compounds that reduce polyglutamine (polyQ) inclusions in nerve growth factor (NGF)-treated PC12 cells (GFPQ80),Other,,
73,1616,1,1,,8150145,5475,Unspecified,,,,,Yeast cell-based screen for compounds that suppress polyglutamine aggregation in vivo (75Q-TubH),Other,,
74,1688,1,1,,26749100,5475,Inactive,90903231.0,3064.0,,Potency,qHTS Multiplex Assay to Identify Dual Action Probes in a Cell Model of Huntington: Aggregate Formation (GFP),Confirmatory,,
75,1766,1,1,,26749100,5475,Inactive,18860839.0,4221.0,,Potency,qHTS Assay for Inhibitors Targeting the Menin-MLL Interaction in MLL Related Leukemias: Competition With Fluorescein Labeled MLL-derived Peptide,Confirmatory,,
76,1766,1,1,,26749100,5475,Inactive,56550039.0,4297.0,,Potency,qHTS Assay for Inhibitors Targeting the Menin-MLL Interaction in MLL Related Leukemias: Competition With Fluorescein Labeled MLL-derived Peptide,Confirmatory,,
77,1768,1,1,,26749100,5475,Inactive,18860839.0,4221.0,,Potency,qHTS Assay for Inhibitors Targeting the Menin-MLL Interaction in MLL Related Leukemias: Competition With Texas Red Labeled MLL-derived Mutant Peptide,Confirmatory,,
78,1768,1,1,,26749100,5475,Inactive,56550039.0,4297.0,,Potency,qHTS Assay for Inhibitors Targeting the Menin-MLL Interaction in MLL Related Leukemias: Competition With Texas Red Labeled MLL-derived Mutant Peptide,Confirmatory,,
79,1865,1,1,,26749100,5475,Inactive,,,,Potency,Quantitative High-Throughput Screen for Regulators of Epigenetic Control,Confirmatory,,
80,1948,1,1,,26749100,5475,Inactive,,,,Potency,qHTS Assay for Compounds that Induce Erasure of Genomic Imprints,Confirmatory,,
81,2101,1,1,,26749100,5475,Inactive,496369.0,2629.0,,Potency,qHTS Assay for Inhibitors and Activators of N370S glucocerebrosidase as a Potential Chaperone Treatment of Gaucher Disease,Confirmatory,,
82,2107,1,1,,26749100,5475,Inactive,757912.0,2717.0,,Potency,qHTS Assay for Inhibitors and Activators of Human alpha-Galactosidase From Spleen Homogenate,Confirmatory,,
83,2112,1,1,,26749100,5475,Inactive,119393891.0,2548.0,,Potency,qHTS Assay for Inhibitors and Activators of Human alpha-Glucosidase From Spleen Homogenate,Confirmatory,,
84,2147,1,1,,26749100,5475,Inactive,221046486.0,,,Potency,qHTS Assay for Inhibitors of  Human Jumonji Domain Containing 2E (JMJD2E),Confirmatory,,
85,2451,1,2,,26749100,5475,Inactive,122920737.0,,,Potency,"qHTS Assay for Inhibitors of Fructose-1,6-bisphosphate Aldolase from Giardia Lamblia",Confirmatory,,
86,2472,1,2,,26749100,5475,Inactive,7669492.0,2597.0,,,"qHTS Assay for Inhibitors of Fructose-1,6-bisphosphate Aldolase from Giardia Lamblia: Coupling assay counterscreen",Screening,,
87,2517,2,1,,144205037,5475,Inactive,6980812.0,,,Potency,qHTS Assay for Inhibitors of the Human Apurinic/apyrimidinic Endonuclease 1 (APE1),Confirmatory,,
88,2528,1,2,,26749100,5475,Inactive,4557365.0,641.0,,Potency,qHTS Assay for Inhibitors of Bloom's syndrome helicase (BLM),Confirmatory,,
89,2546,1,1,,26749100,5475,Inactive,188536040.0,19885.0,,Potency,VP16 counterscreen qHTS for inhibitors of ROR gamma transcriptional activity,Confirmatory,,
90,2549,1,1,,26749100,5475,Inactive,282403581.0,,,Potency,qHTS Assay for Inhibitors of RecQ-Like Dna Helicase 1 (RECQ1),Confirmatory,,
91,2551,1,1,,26749100,5475,Inactive,188536040.0,19885.0,,Potency,qHTS for inhibitors of ROR gamma transcriptional activity,Confirmatory,,
92,2662,2,1,,26749100,5475,Inconclusive,56550039.0,4297.0,39.8107,Potency,qHTS Fluorescence Polarization Assay for Inhibitors of MLL CXXC domain - DNA interaction,Confirmatory,,
93,23954,3,3,,103228169,5475,Unspecified,,,,,logD (measured by HPLC) (as log k'),Other,6167716.0,
94,23955,3,3,,103228169,5475,Unspecified,,,,,logD (measured by HPLC) (as log k'),Other,6167716.0,
95,23956,3,3,,103228169,5475,Unspecified,,,,,logD (measured by HPLC) (as log k'),Other,6167716.0,
96,23957,3,3,,103228169,5475,Unspecified,,,,,logD (measured by HPLC) (as log k'),Other,6167716.0,
97,23960,3,3,,103228169,5475,Unspecified,,,,,logD (measured by HPLC) (as log k'),Other,6167716.0,
98,23968,4,3,,103228169,5475,Unspecified,,,,,logD (measured by HPLC) (as log k'),Other,6167716.0,
99,23970,4,3,,103228169,5475,Unspecified,,,,,logD (measured by HPLC) (as log k'),Other,6167716.0,
100,23973,4,3,,103228169,5475,Unspecified,,,,,"Partition coefficient (logD, measured by HPLC, log k')",Other,6167716.0,
101,23975,4,3,,103228169,5475,Unspecified,,,,,logD (measured by HPLC) (as log k'),Other,6167716.0,
102,23976,4,3,,103228169,5475,Unspecified,,,,,logD (measured by HPLC) (as log k'),Other,6167716.0,
103,26294,4,4,,103228169,5475,Unspecified,,,,,Partition coefficient (logD) (HPLC),Other,6167716.0,
104,26295,4,4,,103228169,5475,Unspecified,,,,,Partition coefficient (logD) (HPLC),Other,6167716.0,
105,26296,4,4,,103228169,5475,Unspecified,,,,,Partition coefficient (logD7.4),Other,6167716.0,
106,26310,4,4,,103228169,5475,Unspecified,,,,,Partition coefficient (logD7.4),Other,6167716.0,
107,26515,3,4,,103228169,5475,Unspecified,,,,,Partition coefficient (logD7.4),Other,6167716.0,
108,26756,3,4,,103228169,5475,Unspecified,,,,,DNA binding dissociation constant as KD,Other,6708048.0,
109,120996,3,4,,103228169,5475,Unspecified,,,,,"Efficacy against a lethal virus challenge with an interferon sensitive virus, columbia SK was evaluated 14 days postinfection (oral dosing) as number of mice survived out of 20 tested",Other,6644739.0,
110,222354,3,5,,103228169,5475,Unspecified,,,,,"Percent suppression of plaque forming cells in spleen cell suspension at a dose of 125 mg/kg, po. in AKR mice",Other,1732553.0,
111,224066,3,3,,103228169,5475,Unspecified,,,,,Antiinflammatory activity dosed orally against D-adjuvant arthiritis in injected rat paw at 50 mgKg,Other,1732553.0,
112,224068,3,3,,103228169,5475,Unspecified,,,,,"Antiinflammatory activity against carrageenan induced rat paw edema (CPE), dosed orally",Other,1732553.0,
113,224665,3,3,,103228169,5475,Unspecified,,,,,Antiinflammatory activity in D-adjuvant induced arthiritis in rat measured by the change in body weight,Other,1732553.0,
114,225625,3,3,,103228169,5475,Unspecified,,,,,Antiinflammatory activity dosed orally against D-adjuvant arthiritis in injected rat paw at 100 mg/Kg,Other,1732553.0,
115,225626,3,3,,103228169,5475,Unspecified,,,,,Antiinflammatory activity dosed orally against D-adjuvant arthiritis in uninjected rat paw at 100 mg/Kg,Other,1732553.0,
116,429219,3,3,,103228169,5475,Unspecified,,,,,Displacement of ethidium bromide from calf thymus DNA,Other,19349097.0,
117,485281,1,1,,26749100,5475,Inactive,254220970.0,,,Potency,qHTS Assay for Identification of Novel General Anesthetics,Confirmatory,,
118,485290,1,1,,26749100,5475,Inactive,20150581.0,,,Potency,qHTS Assay for Inhibitors of Tyrosyl-DNA Phosphodiesterase (TDP1),Confirmatory,,
119,485350,1,2,,92124766,5475,Inactive,126642418.0,,,,A screen for compounds that inhibit the bacterial siderophore biosynthetic enzyme BasE,Screening,,
120,492961,1,1,,26749100,5475,Inactive,72386991.0,3656265.0,,Potency,qHTS Assay to Find Inhibitors of T. brucei phosphofructokinase: hit validation,Confirmatory,,
121,492967,1,2,,92211584,5475,Inactive,47566732.0,,,,A screen for compounds that inhibit the CapD enzyme of Bacillus anthracis,Other,,
122,492967,1,2,,99301106,5475,Inactive,47566732.0,,,,A screen for compounds that inhibit the CapD enzyme of Bacillus anthracis,Other,,
123,493033,1,2,,92124766,5475,Inactive,614089026.0,,,,A screen for compounds that inhibit the bacterial siderophore biosynthetic enzyme MbtI,Other,,
124,493162,1,2,,99301106,5475,Active,335756.0,,,,A screen for compounds that inhibit processive DNA synthesis of vaccinia virus,Other,,
125,504327,1,1,,26749100,5475,Inactive,153791535.0,2648.0,,Potency,qHTS Assay for Inhibitors of GCN5L2,Confirmatory,,
126,504332,1,1,,26749100,5475,Inactive,168985070.0,,,Potency,qHTS Assay for Inhibitors of Histone Lysine Methyltransferase G9a,Confirmatory,,
127,504749,1,3,,26749100,5475,Unspecified,,,,,qHTS profiling for inhibitors of Plasmodium falciparum proliferation,Other,21817045.0,
128,504749,1,3,1.0,26749100,5475,Inconclusive,,,,,qHTS profiling for inhibitors of Plasmodium falciparum proliferation,Other,21817045.0,
129,504749,1,3,2.0,26749100,5475,Inconclusive,,,,,qHTS profiling for inhibitors of Plasmodium falciparum proliferation,Other,21817045.0,
130,504749,1,3,3.0,26749100,5475,Active,,,,,qHTS profiling for inhibitors of Plasmodium falciparum proliferation,Other,21817045.0,
131,504749,1,3,4.0,26749100,5475,Inconclusive,,,,,qHTS profiling for inhibitors of Plasmodium falciparum proliferation,Other,21817045.0,
132,504749,1,3,5.0,26749100,5475,Inconclusive,,,,,qHTS profiling for inhibitors of Plasmodium falciparum proliferation,Other,21817045.0,
133,504749,1,3,6.0,26749100,5475,Active,,,,,qHTS profiling for inhibitors of Plasmodium falciparum proliferation,Other,21817045.0,
134,504749,1,3,7.0,26749100,5475,Active,,,,,qHTS profiling for inhibitors of Plasmodium falciparum proliferation,Other,21817045.0,
135,504749,1,3,8.0,26749100,5475,Inconclusive,,,,,qHTS profiling for inhibitors of Plasmodium falciparum proliferation,Other,21817045.0,
136,504749,1,3,9.0,26749100,5475,Inconclusive,,,,,qHTS profiling for inhibitors of Plasmodium falciparum proliferation,Other,21817045.0,
137,504749,1,3,10.0,26749100,5475,Inconclusive,,,,,qHTS profiling for inhibitors of Plasmodium falciparum proliferation,Other,21817045.0,
138,504749,1,3,11.0,26749100,5475,Inconclusive,,,,,qHTS profiling for inhibitors of Plasmodium falciparum proliferation,Other,21817045.0,
139,504749,1,3,12.0,26749100,5475,Inconclusive,,,,,qHTS profiling for inhibitors of Plasmodium falciparum proliferation,Other,21817045.0,
140,504749,1,3,13.0,26749100,5475,Inconclusive,,,,,qHTS profiling for inhibitors of Plasmodium falciparum proliferation,Other,21817045.0,
141,504749,1,3,14.0,26749100,5475,Inconclusive,,,,,qHTS profiling for inhibitors of Plasmodium falciparum proliferation,Other,21817045.0,
142,504749,1,3,15.0,26749100,5475,Active,,,,,qHTS profiling for inhibitors of Plasmodium falciparum proliferation,Other,21817045.0,
143,504749,1,3,16.0,26749100,5475,Active,,,,,qHTS profiling for inhibitors of Plasmodium falciparum proliferation,Other,21817045.0,
144,504749,1,3,17.0,26749100,5475,Active,,,,,qHTS profiling for inhibitors of Plasmodium falciparum proliferation,Other,21817045.0,
145,504749,1,3,18.0,26749100,5475,Inconclusive,,,,,qHTS profiling for inhibitors of Plasmodium falciparum proliferation,Other,21817045.0,
146,504749,1,3,19.0,26749100,5475,Active,,,,,qHTS profiling for inhibitors of Plasmodium falciparum proliferation,Other,21817045.0,
147,504749,1,3,20.0,26749100,5475,Inconclusive,,,,,qHTS profiling for inhibitors of Plasmodium falciparum proliferation,Other,21817045.0,
148,504749,1,3,21.0,26749100,5475,Active,,,,,qHTS profiling for inhibitors of Plasmodium falciparum proliferation,Other,21817045.0,
149,504749,1,3,22.0,26749100,5475,Inconclusive,,,,,qHTS profiling for inhibitors of Plasmodium falciparum proliferation,Other,21817045.0,
150,504749,1,3,23.0,26749100,5475,Active,,,,,qHTS profiling for inhibitors of Plasmodium falciparum proliferation,Other,21817045.0,
151,504749,1,3,24.0,26749100,5475,Active,,,,,qHTS profiling for inhibitors of Plasmodium falciparum proliferation,Other,21817045.0,
152,504749,1,3,25.0,26749100,5475,Inconclusive,,,,,qHTS profiling for inhibitors of Plasmodium falciparum proliferation,Other,21817045.0,
153,504749,1,3,26.0,26749100,5475,Active,,,,,qHTS profiling for inhibitors of Plasmodium falciparum proliferation,Other,21817045.0,
154,504749,1,3,27.0,26749100,5475,Inconclusive,,,,,qHTS profiling for inhibitors of Plasmodium falciparum proliferation,Other,21817045.0,
155,504749,1,3,28.0,26749100,5475,Inconclusive,,,,,qHTS profiling for inhibitors of Plasmodium falciparum proliferation,Other,21817045.0,
156,504749,1,3,29.0,26749100,5475,Inconclusive,,,,,qHTS profiling for inhibitors of Plasmodium falciparum proliferation,Other,21817045.0,
157,504749,1,3,30.0,26749100,5475,Inconclusive,,,,,qHTS profiling for inhibitors of Plasmodium falciparum proliferation,Other,21817045.0,
158,504749,1,3,31.0,26749100,5475,Inactive,,,,,qHTS profiling for inhibitors of Plasmodium falciparum proliferation,Other,21817045.0,
159,504749,1,3,32.0,26749100,5475,Active,,,,,qHTS profiling for inhibitors of Plasmodium falciparum proliferation,Other,21817045.0,
160,504749,1,3,33.0,26749100,5475,Active,,,,,qHTS profiling for inhibitors of Plasmodium falciparum proliferation,Other,21817045.0,
161,504749,1,3,34.0,26749100,5475,Inconclusive,,,,,qHTS profiling for inhibitors of Plasmodium falciparum proliferation,Other,21817045.0,
162,504749,1,3,35.0,26749100,5475,Inconclusive,,,,,qHTS profiling for inhibitors of Plasmodium falciparum proliferation,Other,21817045.0,
163,504749,1,3,36.0,26749100,5475,Inconclusive,,,,,qHTS profiling for inhibitors of Plasmodium falciparum proliferation,Other,21817045.0,
164,504749,1,3,37.0,26749100,5475,Inconclusive,,,,,qHTS profiling for inhibitors of Plasmodium falciparum proliferation,Other,21817045.0,
165,504749,1,3,38.0,26749100,5475,Inconclusive,,,,,qHTS profiling for inhibitors of Plasmodium falciparum proliferation,Other,21817045.0,
166,504749,1,3,39.0,26749100,5475,Active,,,,,qHTS profiling for inhibitors of Plasmodium falciparum proliferation,Other,21817045.0,
167,504749,1,3,40.0,26749100,5475,Active,,,,,qHTS profiling for inhibitors of Plasmodium falciparum proliferation,Other,21817045.0,
168,504749,1,3,41.0,26749100,5475,Inconclusive,,,,,qHTS profiling for inhibitors of Plasmodium falciparum proliferation,Other,21817045.0,
169,504749,1,3,42.0,26749100,5475,Inconclusive,,,,,qHTS profiling for inhibitors of Plasmodium falciparum proliferation,Other,21817045.0,
170,504749,1,3,43.0,26749100,5475,Active,,,,,qHTS profiling for inhibitors of Plasmodium falciparum proliferation,Other,21817045.0,
171,504749,1,3,44.0,26749100,5475,Inconclusive,,,,,qHTS profiling for inhibitors of Plasmodium falciparum proliferation,Other,21817045.0,
172,504749,1,3,45.0,26749100,5475,Inconclusive,,,,,qHTS profiling for inhibitors of Plasmodium falciparum proliferation,Other,21817045.0,
173,504749,1,3,46.0,26749100,5475,Inconclusive,,,,,qHTS profiling for inhibitors of Plasmodium falciparum proliferation,Other,21817045.0,
174,504749,1,3,47.0,26749100,5475,Inconclusive,,,,,qHTS profiling for inhibitors of Plasmodium falciparum proliferation,Other,21817045.0,
175,504749,1,3,48.0,26749100,5475,Inconclusive,,,,,qHTS profiling for inhibitors of Plasmodium falciparum proliferation,Other,21817045.0,
