,AID,AID Version,AID Revision,Panel Member ID,SID,CID,Bioactivity Outcome,Target GI,Target GeneID,Activity Value [uM],Activity Name,Assay Name,Bioassay Type,PubMed ID,RNAi
454,1259403,1,1,,170466150,5475,Inconclusive,325495545.0,2101.0,19.5704,Antagonist Potency (uM),qHTS assay to identify small molecule antagonists of the estrogen related receptor (ERR) signaling pathway from Tox21 library: Summary,Summary,,
455,1259404,1,1,,170466150,5475,Inconclusive,325495545.0,2101.0,,,qHTS assay to identify small molecule agonists of the estrogen related receptor (ERR) signaling pathway from Tox21 library: Summary,Summary,,
456,1259408,1,1,,363897148,5475,Active,,,,,GENE-TOX mutagenicity studies,Other,,
457,1259416,1,2,,375174752,5475,Inactive,56786138.0,3458.0,,,Toxoplasma gondii inhibition HTS in the presence of IFN-y,Screening,,
458,1259421,1,1,,340080666,5475,Inactive,56786138.0,3458.0,,,Toxoplasma gondii HTS in the absence of IFN-y,Screening,,
459,1259421,1,1,,375174752,5475,Inactive,56786138.0,3458.0,,,Toxoplasma gondii HTS in the absence of IFN-y,Screening,,
460,1259423,1,2,,354914077,5475,Inactive,,,,,Primary cell-based high-throughput screening assay for identification of small molecule agonists of Aedes aegypti NPYLR7 [Small Molecule Inhibitors of Mosquito Biting Behavior],Screening,,
