,AID,AID Version,AID Revision,Panel Member ID,SID,CID,Bioactivity Outcome,Target GI,Target GeneID,Activity Value [uM],Activity Name,Assay Name,Bioassay Type,PubMed ID,RNAi
156,2094,1,2,,26725226,5896580,Inactive,67463988.0,,,,Plate Read Microorganism-Based Primary HTS to Identify Modulators of the AI-2 Quorum Sensing System,Screening,,
157,2094,1,2,,26725226,5896580,Inactive,67463989.0,,,,Plate Read Microorganism-Based Primary HTS to Identify Modulators of the AI-2 Quorum Sensing System,Screening,,
158,2094,1,2,,26725226,5896580,Inactive,166202459.0,,,,Plate Read Microorganism-Based Primary HTS to Identify Modulators of the AI-2 Quorum Sensing System,Screening,,
159,2097,1,2,,26725226,5896580,Inactive,21361340.0,2932.0,,,Cell-Free Homogeneous Primary HTS to Identify Inhibitors of GSK3beta Activity,Screening,,
160,2098,1,1,,26725226,5896580,Inactive,62740231.0,15499.0,,,Luminescence Cell-Based Primary HTS to Identify Inhibitors of Heat Shock Factor 1 (HSF1).,Screening,,
161,2099,1,1,,26725226,5896580,Inactive,,,,,Fluorescence Biochemical Primary HTS to Identify Inhibitors of GASC-1 Activity,Screening,,
162,2100,1,1,,26725226,5896580,Inactive,119393891.0,2548.0,,Potency,qHTS Assay for Inhibitors and Activators of Human alpha-Glucosidase Cleavage of Glycogen,Confirmatory,,
163,2101,1,1,,26725226,5896580,Inactive,496369.0,2629.0,,Potency,qHTS Assay for Inhibitors and Activators of N370S glucocerebrosidase as a Potential Chaperone Treatment of Gaucher Disease,Confirmatory,,
164,2107,1,1,,26725226,5896580,Inactive,757912.0,2717.0,,Potency,qHTS Assay for Inhibitors and Activators of Human alpha-Galactosidase From Spleen Homogenate,Confirmatory,,
165,2112,1,1,,26725226,5896580,Inactive,119393891.0,2548.0,,Potency,qHTS Assay for Inhibitors and Activators of Human alpha-Glucosidase From Spleen Homogenate,Confirmatory,,
166,2129,1,2,,26725226,5896580,Inactive,510901.0,598.0,,,"Primary biochemical high throughput screening assay to identify inhibitors of BCL2-related protein, long isoform (BCLXL).",Screening,,
167,2130,1,3,,26725226,5896580,Inactive,7706645.0,51400.0,,,Fluorescence polarization-based primary biochemical high throughput screening assay to identify inhibitors of Protein Phosphatase Methylesterase 1 (PME-1).,Screening,,
168,2147,1,1,,26725226,5896580,Inactive,221046486.0,,,Potency,qHTS Assay for Inhibitors of  Human Jumonji Domain Containing 2E (JMJD2E),Confirmatory,,
169,2156,2,2,,26725226,5896580,Inactive,18959272.0,170848.0,,,Primary cell-based high-throughput screening assay for identification of compounds that inhibit KCNQ2 potassium channels,Screening,,
170,2174,1,3,,26725226,5896580,Inactive,5453722.0,10434.0,,,Counterscreen for PME1 inhibitors: fluorescence polarization-based primary biochemical high throughput screening assay to identify inhibitors of lysophospholipase 1 (LYPLA1).,Screening,,
171,2177,1,3,,26725226,5896580,Inactive,4581413.0,,,,Counterscreen for PME1 inhibitors: fluorescence polarization-based primary biochemical high throughput screening assay to identify inhibitors of lysophospholipase 2 (LYPLA2).,Screening,,
172,2216,1,3,,26725226,5896580,Inactive,,,,,Fluorescence Cell-Free Homogeneous Primary HTS to Identify Inhibitors of the RanGTP-Importin-beta complex,Screening,,
173,2221,1,2,,26725226,5896580,Inactive,15609874.0,888371.0,,,Fluorescence Cell-Free Homogenous Primary HTS to Identify Inhibitors of RecA Intein Splicing Activity,Screening,,
174,2227,1,2,,26725226,5896580,Inactive,2935630.0,22066.0,,,Primary cell-based high-throughput screening assay for identification of compounds that allosterically potentiate transient receptor potential cation channel C4 (TRPC4),Screening,,
175,2234,1,2,,26725226,5896580,Inactive,82503229.0,3783744.0,,,"Counterscreen for inhibitors of EBNA-1: fluorescence polarization-based biochemical high throughput primary assay to identify inhibitors of the Epstein-Barr virus-encoded protein, ZTA.",Screening,,
176,2235,1,2,,26725226,5896580,Inactive,56790945.0,5499.0,,,Counterscreen for inhibitors of PP5: fluorescence-based biochemical high throughput primary assay to identify inhibitors of Protein Phosphatase 1 (PP1).,Screening,,
177,2237,1,2,,26725226,5896580,Inactive,2935630.0,22066.0,,,Primary cell-based screen for identification of compounds that activate transient receptor potential cation channel C4 (TRPC4).,Screening,,
178,2239,1,2,,26725226,5896580,Inactive,18959272.0,170848.0,,,Primary cell-based high-throughput screening assay for identification of compounds that potentiate KCNQ2 potassium channels,Screening,,
179,2247,1,2,,26725226,5896580,Inactive,2935630.0,22066.0,,,Primary cell-based screen for identification of compounds that inhibit transient receptor potential cation channel C4 (TRPC4).,Screening,,
180,2280,2,3,,26725226,5896580,Inactive,17507875.0,172532.0,,,Fluorescence polarization-based primary biochemical high throughput screening assay to identify inhibitors of GLD-1 protein - TGE RNA interaction.,Screening,,
181,2288,1,1,,26725226,5896580,Inactive,,,1.4689,Potency,qHTS Assay for Modulators of miRNAs and/orActivators of miR-21,Confirmatory,,
182,2289,1,1,,26725226,5896580,Inconclusive,,,1.4689,Potency,qHTS Assay for Modulators of miRNAs and/or Inhibitors of miR-21,Confirmatory,,
183,2300,1,3,,26725226,5896580,Inactive,216409728.0,10002.0,,,"TR-FRET-based primary biochemical high throughput screening assay to identify agonists of nuclear receptor subfamily 2, group E, member 3 (NR2E3).",Screening,,
184,2314,1,2,,26725226,5896580,Active,32400299.0,,,,Cycloheximide Counterscreen for Small Molecule Inhibitors of Shiga Toxin,Screening,,
185,2314,1,2,,26725226,5896580,Active,32400300.0,,,,Cycloheximide Counterscreen for Small Molecule Inhibitors of Shiga Toxin,Screening,,
186,2315,1,2,,26725226,5896580,Active,32400299.0,,,,A qHTS for Small Molecule Inhibitors of Shiga Toxin,Screening,,
187,2315,1,2,,26725226,5896580,Active,32400300.0,,,,A qHTS for Small Molecule Inhibitors of Shiga Toxin,Screening,,
188,2326,1,1,,26725226,5896580,Inactive,194352380.0,,,Potency,qHTS Assay for Inhibitors of Influenza NS1 Protein Function,Confirmatory,,
189,2380,1,2,,26725226,5896580,Inactive,,,,,uHTS identification of small molecules that induce b-cell replication in the MIN-6 cell line,Screening,,
190,2391,1,1,,26725226,5896580,Inactive,,,,IC50,A Cell Based HTS Approach for the Discovery of New Inhibitors of Respiratory syncytial virus (RSV),Confirmatory,,
191,2435,1,2,,26725226,5896580,Inactive,32307152.0,5021.0,,,Fluorescence-based primary cell-based high throughput screening assay to identify agonists of the Oxytocin Receptor (OXTR).,Screening,,
192,2445,1,2,,26725226,5896580,Inactive,32307152.0,5021.0,,,Fluorescence-based primary cell-based high throughput screening assay to identify potentiators of Oxytocin Receptor (OXTR),Screening,,
193,2451,1,2,,26725226,5896580,Inactive,122920737.0,,,Potency,"qHTS Assay for Inhibitors of Fructose-1,6-bisphosphate Aldolase from Giardia Lamblia",Confirmatory,,
194,2462,1,1,,26725226,5896580,Inactive,20336315.0,10018.0,,,Luminescence Cell-Based Primary HTS to Identify Inhibitors of A1 Apoptosis.,Screening,,
195,2462,1,1,,26725226,5896580,Inactive,167013344.0,,,,Luminescence Cell-Based Primary HTS to Identify Inhibitors of A1 Apoptosis.,Screening,,
196,2472,1,2,,26725226,5896580,Inactive,7669492.0,2597.0,,,"qHTS Assay for Inhibitors of Fructose-1,6-bisphosphate Aldolase from Giardia Lamblia: Coupling assay counterscreen",Screening,,
197,2517,2,1,,26725226,5896580,Inactive,6980812.0,,0.0282,Potency,qHTS Assay for Inhibitors of the Human Apurinic/apyrimidinic Endonuclease 1 (APE1),Confirmatory,,
198,2520,1,4,,26725226,5896580,Inactive,4885057.0,187.0,,,uHTS identification of small molecule agonists of the APJ  receptor  via a luminescent beta-arrestin assay,Screening,,
199,2521,1,3,,26725226,5896580,Inactive,4885057.0,187.0,,,uHTS identification of small molecule antagonists of the APJ  receptor  via a luminescent beta-arrestin assay,Screening,,
200,2524,1,2,,26725226,5896580,Inactive,124376142.0,248.0,,,uHTS Luminescent assay for identification of activators of human intestinal alkaline phosphatase,Screening,,
201,2528,1,2,,26725226,5896580,Inactive,4557365.0,641.0,,Potency,qHTS Assay for Inhibitors of Bloom's syndrome helicase (BLM),Confirmatory,,
202,2540,1,2,,26725226,5896580,Inactive,262118306.0,123228.0,,,HTS Luminescent assay for identification of inhibitors of Sentrin-specific protease 8 (SENP8),Screening,,
203,2544,1,2,,26725226,5896580,Inactive,124376142.0,248.0,,,uHTS Luminescent assay for identification of inhibitors of human intestinal alkaline phosphatase,Screening,,
204,2546,1,1,,26725226,5896580,Inconclusive,188536040.0,19885.0,35.4813,Potency,VP16 counterscreen qHTS for inhibitors of ROR gamma transcriptional activity,Confirmatory,,
205,2549,1,1,,26725226,5896580,Inactive,282403581.0,,,Potency,qHTS Assay for Inhibitors of RecQ-Like Dna Helicase 1 (RECQ1),Confirmatory,,
206,2550,1,3,,26725226,5896580,Inactive,160333370.0,22068.0,,,High throughput screening of activators of transient receptor potential cation channel C6 (TRPC6),Screening,,
207,2551,1,1,,26725226,5896580,Inconclusive,188536040.0,19885.0,35.4813,Potency,qHTS for inhibitors of ROR gamma transcriptional activity,Confirmatory,,
208,2553,1,2,,26725226,5896580,Inactive,160333370.0,22068.0,,,High throughput screening of inhibitors of transient receptor potential cation channel C6 (TRPC6),Screening,,
209,2557,1,3,,26725226,5896580,Inactive,67191027.0,3676.0,,,HTS for Identification of VLA-4 Allosteric Modulators from MLPCN library,Screening,,
210,2563,1,1,,26725226,5896580,Inactive,6323930.0,855317.0,,,Fluorescence Cell-Free Homogenous Primary HTS  to Identify Inhibitors of the Ras-converting Enzyme,Screening,,
211,2599,1,2,,26725226,5896580,Inactive,6166485.0,26054.0,,,uHTS Luminescent assay for identification of inhibitors of Sentrin-specific protease 6 (SENP6),Screening,,
212,2606,1,2,,26725226,5896580,Inactive,15610807.0,885176.0,,,Fluorescence polarization-based primary biochemical high throughput screening assay to identify inhibitors of the membrane-associated serine protease Rv3671c in M.tuberculosis,Screening,,
213,2629,1,1,,26725226,5896580,Inactive,139472804.0,4961527.0,,,Fluorescence Polarization Cell-Free Homogeneous Primary HTS to Identify Inhibitors of the LANA Histone H2A/H2B Interaction,Screening,,
214,2642,1,2,,26725226,5896580,Inactive,32479527.0,3784.0,,,Primary cell-based high-throughput screening assay for identification of compounds that inhibit KCNQ1 potassium channels,Screening,,
215,2648,1,2,,26725226,5896580,Inactive,32479527.0,3784.0,,,Primary cell-based high-throughput screening assay for identification of compounds that potentiate/activate KCNQ1 potassium channels,Screening,,
216,2650,2,1,,26725226,5896580,Inactive,49574532.0,2931.0,,,Luminescence Cell-Free  Homogenous Primary HTS to Identify Inhibitors of GSK-3 alpha,Screening,,
217,2661,1,1,,26725226,5896580,Inactive,23943882.0,65975.0,,,Luminescence Cell-Free  Homogenous Primary HTS to Identify Inhibitors of Serine/Threonine  Kinase 33  Activity,Screening,,
218,2662,2,1,,26725226,5896580,Inactive,56550039.0,4297.0,,Potency,qHTS Fluorescence Polarization Assay for Inhibitors of MLL CXXC domain - DNA interaction,Confirmatory,,
219,2675,1,1,,26725226,5896580,Inactive,41281591.0,4154.0,,Potency,qHTS Assay for Inhibitors of MBNL1-poly(CUG) RNA binding,Confirmatory,,
220,2676,1,2,,26725226,5896580,Inactive,85986601.0,59350.0,,Potency,qHTS Assay for Agonists of the Relaxin Receptor RXFP1,Confirmatory,,
221,2685,1,1,,26725226,5896580,Inconclusive,,,0.92,Potency,qHTS Assay for Lipid Storage Modulators in Drosophila S3 Cells,Confirmatory,,
222,2690,1,2,,26725226,5896580,Inactive,,,,,A yeast HTS for caloric restriction mimetics that inhibit age-related superoxide,Screening,,
223,2716,1,1,,26725226,5896580,Inactive,,,,,Luminescence  Microorganism Primary HTS to Identify Inhibitors of the SUMOylation Pathway Using a Temperature Sensitive Growth Reversal Mutant Mot1-301,Screening,,
224,2717,1,2,,26725226,5896580,Inactive,,,,,Luminescence Cell-Based Primary HTS to Identify Inhibitors of Cancer Stem Cells,Screening,,
225,2718,1,1,,26725226,5896580,Inactive,13128862.0,8841.0,,,Fluorescence Cell-Free Homogeneous Primary HTS to Identify Inhibitors of Histone Deacetylase 3,Screening,,
226,2732,1,1,,26725226,5896580,Inactive,160707929.0,13198.0,,,HTS for small molecule inhibitors of CHOP to regulate the unfolded protein response to ER stress,Screening,,
227,2751,2,2,,26725226,5896580,Inactive,153217451.0,9581.0,,,Fluorescence polarization-based primary biochemical high throughput screening assay to identify inhibitors of the prolyl oligopeptidase-like enzyme (PREPL),Screening,,
228,2796,1,4,,26725226,5896580,Inactive,4502003.0,196.0,,,Luminescence-based primary cell-based high throughput screening assay to identify activators of the Aryl Hydrocarbon Receptor (AHR),Screening,,
229,2797,1,2,,26725226,5896580,Inactive,4502331.0,552.0,,,Counterscreen for Oxytocin Receptor (OXTR) agonists: Fluorescence-based primary cell-based high throughput assay to identify agonists of the vasopressin 1 receptor (V1R),Screening,,
230,2805,2,2,,26725226,5896580,Inactive,124487323.0,76768.0,,,uHTS Luminescent assay for identification of activators of mouse intestinal alkaline phosphatase,Screening,,
231,2806,2,2,,26725226,5896580,Inactive,124487323.0,76768.0,,,uHTS Luminescent assay for identification of inhibitors of mouse intestinal alkaline phosphatase,Screening,,
232,2825,1,2,,26725226,5896580,Inactive,219518789.0,114548.0,,,uHTS Luminescent assay for identification of inhibitors of NALP3 in yeast,Screening,,
233,283847,7,2,,103516048,5896580,Unspecified,,,,,Antifungal activity against Candida albicans Berhaut 62I after 24 hrs,Other,17007965.0,
234,283848,4,3,,103516048,5896580,Unspecified,,,,,Growth inhibition of Candida albicans Berhaut 62I by agar cup method,Other,17007965.0,
235,283849,7,2,,103516048,5896580,Unspecified,,,,,Antifungal activity against Candida albicans Berhaut 62I in meat-pepton broth,Other,17007965.0,
236,295380,3,4,,103516048,5896580,Unspecified,,,,,Cytotoxicity against human TK10 cells in aerobic condition assessed as survival at 100 uM by sulforhodamine assay,Other,17383189.0,
237,295381,3,4,,103516048,5896580,Unspecified,,,,,Cytotoxicity against human MCF7 cells ATCC HTB38 in aerobic condition assessed as survival at 100 uM by sulforhodamine assay,Other,17383189.0,
238,295382,4,4,,103516048,5896580,Unspecified,,,,,Cytotoxicity against human HT29 cells ATCC HTB38 in aerobic condition assessed as survival at 100 uM by sulforhodamine assay,Other,17383189.0,
239,372906,3,3,,103516048,5896580,Inactive,,,,,Antibacterial activity against Escherichia coli WF+,Other,18584918.0,
240,372907,3,4,,103516048,5896580,Unspecified,,,,,Antibacterial activity against Staphylococcus aureus Rosenbach 209 after 48 hrs by agar well diffusion method,Other,18584918.0,
241,372908,6,2,,103516048,5896580,Unspecified,,,,,Antibacterial activity against Staphylococcus aureus Rosenbach 209 after 24 hrs by serial dilution method,Other,18584918.0,
242,434955,1,2,,26725226,5896580,Inactive,,,,IC90,Screen to Identify Novel Compounds That Sensitize Mycobacterium Tuberculosis to Beta-lactam Antibiotics,Confirmatory,,
243,434962,1,2,,26725226,5896580,Inactive,155969707.0,3416.0,,,Fluorescence polarization-based cell-based primary high throughput screening assay to identify inhibitors of insulin-degrading enzyme (IDE),Screening,,
244,434973,1,3,,26725226,5896580,Inactive,120538355.0,57337.0,,,uHTS Luminescent assay for identification of inhibitors of Sentrin-specific protease 7 (SENP7),Screening,,
245,434989,1,1,,26725226,5896580,Inactive,222080095.0,3061.0,,,Fluorescence-based cell-based primary high throughput screening assay to identify antagonists of the orexin 1 receptor (OX1R; HCRTR1),Screening,,
246,435003,1,3,,26725226,5896580,Inactive,,,,,uHTS luminescence assay for the identification of chemical inhibitors of T-cell specific antigen receptor-induced NF-kB activation,Screening,,
247,435005,1,1,,26725226,5896580,Inactive,,,,,Luminescence Cell-Based Primary HTS to Identify Inhibitors of Beta Cell Apoptosis.,Screening,,
248,435022,2,2,,26725226,5896580,Inactive,,,,,uHTS luminescence assay for the identification of chemical inhibitors of B-cell specific antigen receptor-induced NF-kB activation,Screening,,
249,435030,1,2,,26725226,5896580,Inactive,15645703.0,899625.0,,,Absorbance-based primary bacterial cell-based high throughput screening assay to identify inhibitors of AddAB recombination protein complex,Screening,,
250,435030,1,2,,26725226,5896580,Inactive,15646160.0,899738.0,,,Absorbance-based primary bacterial cell-based high throughput screening assay to identify inhibitors of AddAB recombination protein complex,Screening,,
251,449728,1,2,,26725226,5896580,Inactive,,,,,Counterscreen for inhibitors of AddAB: absorbance-based bacterial cell-based high throughput screening assay to identify inhibitors of bacterial viability,Screening,,
252,449762,1,2,,26725226,5896580,Inactive,,,,IC50,High Throughput Screening Assay used to Identify Novel Compounds that Inhibit Mycobacterium Tuberculosis in 7H9 Media,Confirmatory,,
253,449763,1,3,,26725226,5896580,Inactive,,,,,uHTS identification of small molecule activators of the apoptotic arm of the Unfolded Protein response via a luminescent-based reporter assay,Screening,,
254,463075,1,1,,26725226,5896580,Inactive,,,,,HTS to identify inhibitors of TNF-alpha Induced Cell Death in Jurkat FADD-/- Cells.,Screening,,
255,463079,1,2,,26725226,5896580,Inactive,,,,,Fluorescence-based counterscreen for orexin 1 receptor (OX1R) antagonists: cell-based assay to identify antagonists of the parental CHO cell line,Screening,,
256,463082,1,1,,26725226,5896580,Inactive,270133071.0,7941.0,,,Fluorescence polarization-based primary biochemical high throughput screening assay to identify inhibitors of the plasma platelet activating factor acetylhydrolase (pPAFAH),Screening,,
257,463104,1,2,,26725226,5896580,Inactive,,,,,uHTS identification of small molecule activators of the adaptive arm of the Unfolded Protein response via a luminescent-based reporter assay,Screening,,
258,463111,1,1,,26725226,5896580,Inactive,5032039.0,5999.0,,,Primary cell-based high-throughput screening assay for identification of compounds that potentiate/activate regulator of G-protein signaling 4 (RGS4),Screening,,
259,463115,1,1,,26725226,5896580,Inactive,119622516.0,5045.0,,,High throughput fluorescence intensity-based biochemical assay to screen for small molecule inhibitors of Furin conducted by the Pittsburgh Molecular Library Screening Center.,Screening,,
260,463141,1,2,,26725226,5896580,Inactive,14790119.0,836.0,,,Absorbance-based primary biochemical high throughput screening assay to identify activators of procaspase-3,Screening,,
261,463165,1,1,,26725226,5896580,Inactive,5032039.0,5999.0,,,Primary cell-based high-throughput screening assay for identification of compounds that inhibit regulator of   G-protein signaling 4 (RGS4),Screening,,
262,463187,1,1,,26725226,5896580,Inactive,,,,,384-well Z-Lyte format Hck-Nef inhibitor HTS run at the PMLSC,Screening,,
263,463190,1,2,,26725226,5896580,Active,285809906.0,856395.0,,,uHTS identification of small molecule inhibitors of tim10-1 yeast via a luminescent assay,Screening,,
264,463195,1,2,,26725226,5896580,Inactive,285809906.0,856395.0,,,uHTS identification of small molecule inhibitors of tim10 yeast via a luminescent assay,Screening,,
265,463210,1,2,,26725226,5896580,Inactive,55960760.0,,,,Counterscreen for procaspase-3 activators: absorbance-based primary biochemical high throughput screening assay to identify activators of procaspase-7,Screening,,
266,463212,1,1,,26725226,5896580,Inactive,285814664.0,855751.0,,,uHTS identification of small molecule inhibitors of tim23-1 yeast via a luminescent assay,Screening,,
267,463213,1,3,,26725226,5896580,Active,285809906.0,856395.0,,,Single concentration confirmation of small molecule inhibitors of tim10-1 yeast via a luminescent assay,Screening,,
268,463254,1,1,,26725226,5896580,Inactive,188528692.0,9099.0,,Potency,qHTS Assay for Inhibitors of Ubiquitin-specific Protease USP2a Using CHOP2 as the Reporter,Confirmatory,,
269,485270,1,1,,26725226,5896580,Inactive,222080095.0,3061.0,,,FRET-based cell-based primary high throughput screening assay to identify antagonists of the orexin 1 receptor (OX1R; HCRTR1),Screening,,
270,485272,1,1,,26725226,5896580,Inactive,216548487.0,23569.0,,,Fluorescence polarization-based primary biochemical high throughput screening assay to identify inhibitors of Protein Arginine Deiminase 4 (PAD4) (1536 HTS),Screening,,
271,485273,2,1,,26725226,5896580,Inactive,4507793.0,7334.0,,,uHTS identification of UBC13 Polyubiquitin Inhibitors via a TR-FRET Assay,Screening,,
272,485275,1,3,,26725226,5896580,Inactive,,,,,Phenotypic HTS multiplex for antifungal efflux pump inhibitors,Screening,,
273,485281,1,1,,26725226,5896580,Inactive,254220970.0,,35.4813,Potency,qHTS Assay for Identification of Novel General Anesthetics,Confirmatory,,
274,485290,1,1,,26725226,5896580,Inactive,20150581.0,,,Potency,qHTS Assay for Inhibitors of Tyrosyl-DNA Phosphodiesterase (TDP1),Confirmatory,,
275,485294,1,1,,26725226,5896580,Inactive,119389684.0,,,Potency,qHTS Inhibitors of AmpC Beta-Lactamase (assay with detergent),Confirmatory,,
276,485297,1,1,,26725226,5896580,Active,4759012.0,9367.0,3.9811,Potency,qHTS Assay for Rab9 Promoter Activators,Confirmatory,,
277,485298,1,1,,26725226,5896580,Inactive,,,,Potency,qHTS Assay for Small Molecule Inhibitors of Mitochondrial Division or Activators of Mitochondrial Fusion,Confirmatory,,
278,485313,1,2,,26725226,5896580,Active,255652944.0,4864.0,2.5119,Potency,qHTS Assay for NPC1 Promoter Activators,Confirmatory,,
279,485314,1,1,,26725226,5896580,Inactive,4505931.0,5423.0,,Potency,qHTS Assay for Inhibitors of DNA Polymerase Beta,Confirmatory,,
280,485317,1,2,,26725226,5896580,Inactive,54112432.0,2671.0,,,HTS-Luminescent assay for inhibitors of ALR by detection of hydrogen peroxide production Measured in Biochemical System Using Plate Reader - 2036-02_Inhibitor_SinglePoint_HTS,Screening,,
281,485341,1,1,,26725226,5896580,Inactive,119389684.0,,,Potency,qHTS Inhibitors of AmpC Beta-Lactamase (assay without detergent),Confirmatory,,
282,485344,1,1,,26725226,5896580,Inactive,4503385.0,1813.0,,,HTS Assay for Allosteric Antagonists of the Human D2 Dopamine Receptor: Primary Screen for Antagonists,Screening,,
283,485346,1,1,,26725226,5896580,Inactive,88702791.0,4194.0,,,uHTS for identification of Inhibitors of Mdm2/MdmX interaction in luminescent format.,Screening,,
284,485346,1,1,,26725226,5896580,Inactive,89993689.0,4193.0,,,uHTS for identification of Inhibitors of Mdm2/MdmX interaction in luminescent format.,Screening,,
285,485347,1,2,,26725226,5896580,Inactive,4503385.0,1813.0,,,HTS Assay for Positive Allosteric Modulators of the Human D2 Dopamine Receptor: Primary Screen for Potentiators,Screening,,
286,485349,1,1,,26725226,5896580,Inactive,71902540.0,472.0,,Potency,qHTS Assay for Identifying a Potential Treatment of Ataxia-Telangiectasia,Confirmatory,,
287,485353,2,1,,26725226,5896580,Inactive,30124074.0,1489680.0,,,qHTS of Yeast-based Assay for SARS-CoV PLP,Confirmatory,,
288,485358,1,1,,26725226,5896580,Inactive,4503385.0,1813.0,,,HTS Assay for Allosteric Agonists of the Human D2 Dopamine Receptor: Primary Screen for Agonists,Screening,,
289,485360,1,1,,26725226,5896580,Inactive,117938328.0,26013.0,,Potency,qHTS Assay for the Inhibitors of L3MBTL1,Confirmatory,,
290,485364,1,1,,26725226,5896580,Inconclusive,15149312.0,8345881.0,50.1187,Potency,qHTS Assay for the Inhibitors of Schistosoma Mansoni Peroxiredoxins,Confirmatory,,
291,485367,1,2,,26725226,5896580,Inactive,72386991.0,3656265.0,,Potency,qHTS Assay to Find Inhibitors of T. brucei phosphofructokinase,Confirmatory,,
292,488837,1,1,,26725226,5896580,Inactive,26667227.0,2139.0,,Potency,qHTS Assay for Inhibitors of the Phosphatase Activity of Eya2,Confirmatory,,
293,488847,1,3,,26725226,5896580,Inactive,148539876.0,156.0,,,RNA aptamer-based HTS for inhibitors of GRK2,Screening,,
294,488890,1,2,,26725226,5896580,Inactive,,,,IC50,"Elucidation of physiology of non-replicating, drug-tolerant Mycobacterium tuberculosis",Confirmatory,,
295,488922,1,2,,26725226,5896580,Inactive,7706135.0,,,,Primary cell-based screen for identification of compounds that inhibit the two-pore domain potassium channel KCNK9,Screening,,
296,488975,1,2,,26725226,5896580,Inactive,11141885.0,60482.0,,,Primary cell-based screen for identification of compounds that inhibit the Choline Transporter (CHT),Screening,,
297,488977,1,2,,26725226,5896580,Inactive,11141885.0,60482.0,,,Primary cell-based screen for identification of compounds that allosterically activate the Choline Transporter (CHT),Screening,,
298,489030,2,1,,26725226,5896580,Inactive,187952397.0,317.0,,,uHTS Fluorescent assay for identification of inhibitors of Apaf-1,Screening,,
299,489031,2,1,,26725226,5896580,Inactive,187952397.0,317.0,,,uHTS Fluorescent assay for identification of activators of Apaf-1,Screening,,
300,492947,1,1,,26725226,5896580,Inactive,4501969.0,154.0,,Potency,qHTS assay of beta-arrestin-biased ligands of beta2-adrenergic receptor,Confirmatory,,
301,493011,1,1,,26725226,5896580,Inactive,21955158.0,200315.0,,,uHTS identification of APOBEC3A DNA Deaminase Inhibitors via a fluorescence-based single-stranded DNA deaminase assay,Screening,,
302,493012,1,1,,26725226,5896580,Inactive,13399304.0,60489.0,,,uHTS identification of APOBEC3G DNA Deaminase Inhibitors via a fluorescence-based single-stranded DNA deaminase assay,Screening,,
303,493014,1,1,,26725226,5896580,Inconclusive,,,17.7828,Potency,qHTS Assay to Find Inhibitors of Chronic Active B-Cell Receptor Signaling,Confirmatory,,
