,AID,AID Version,AID Revision,Panel Member ID,SID,CID,Bioactivity Outcome,Target GI,Target GeneID,Activity Value [uM],Activity Name,Assay Name,Bioassay Type,PubMed ID,RNAi
304,493036,1,2,,26725226,5896580,Inactive,110611243.0,4923.0,,,Image-Based HTS for Selective Agonists for NTR1,Screening,,
305,493056,1,1,,26725226,5896580,Inactive,4507681.0,7201.0,,,qHTS for Small Molecule Agonists and Allosteric Enhancers of Human TRH Receptor: Primary Screen for Enhancers,Screening,,
306,493084,1,1,,26725226,5896580,Inactive,4507681.0,7201.0,,,qHTS for Small Molecule Agonists and Allosteric Enhancers of Human TRH Receptor: Primary Screen for Agonists.,Screening,,
307,504327,1,1,,26725226,5896580,Inactive,153791535.0,2648.0,,Potency,qHTS Assay for Inhibitors of GCN5L2,Confirmatory,,
308,504332,1,1,,26725226,5896580,Inactive,168985070.0,,,Potency,qHTS Assay for Inhibitors of Histone Lysine Methyltransferase G9a,Confirmatory,,
309,504333,1,1,,26725226,5896580,Inactive,6683500.0,29994.0,,Potency,qHTS Assay for Inhibitors of BAZ2B,Confirmatory,,
310,504406,1,1,,26725226,5896580,Inactive,15610945.0,886142.0,,,Inhibitors of Mycobacterium tuberculosis UDP-galactopyranose mutase (UGM) enzyme - High throughput screening using Fluorescent polarization assay Measured in Biochemical System Using Plate Reader - 2105-01_Inhibitor_SinglePoint_HTS_Activity_Set6,Screening,,
311,504408,2,1,,26725226,5896580,Inactive,,,,,Heat Shock Factor-1 (HSF-1) Measured in Cell-Based System Using Plate Reader - 2038-01_Activator_SinglePoint_HTS_Activity,Screening,,
312,504466,1,1,,26725226,5896580,Active,116283940.0,79915.0,16.3535,Potency,qHTS screen for small molecules that induce genotoxicity in human embryonic kidney (HEK293T) cells expressing luciferase-tagged ELG1,Confirmatory,,
313,504467,1,1,,26725226,5896580,Inconclusive,116283940.0,79915.0,20.5878,Potency,qHTS screen for small molecules that inhibit ELG1-dependent DNA repair in human embryonic kidney (HEK293T) cells expressing luciferase-tagged ELG1,Confirmatory,,
314,504651,1,1,,26725226,5896580,Inactive,4503383.0,1812.0,,,Potentiators of Human D1 Dopamine Receptor: qHTS,Screening,,
315,504652,1,1,,26725226,5896580,Inactive,4503383.0,1812.0,,,Antagonist of Human D 1 Dopamine Receptor: qHTS,Screening,,
316,504660,1,1,,26725226,5896580,Inactive,4503383.0,1812.0,,,Allosteric Agonists of the Human D1 Dopamine Receptor: qHTS,Screening,,
317,504706,1,1,,26725226,5896580,Active,23491729.0,7157.0,15.8489,Potency,qHTS assay for re-activators of p53 using a Luc reporter,Confirmatory,,
318,504810,1,2,,26725226,5896580,Inactive,118341367.0,7253.0,,,Antagonists of the Thyroid Stimulating Hormone Receptor: HTS campaign,Screening,20427476.0,
319,504812,1,2,,26725226,5896580,Inactive,118341367.0,7253.0,,,Inverse Agonists of the Thyroid Stimulating Hormone Receptor: HTS campaign,Screening,20427476.0,
320,504832,1,1,,26725226,5896580,Inactive,,,1.1689,Potency,"Primary qHTS for delayed death inhibitors of the malarial parasite plastid, 48 hour incubation",Confirmatory,,
321,504834,1,1,,26725226,5896580,Inactive,,,10.4179,Potency,"Primary qHTS for delayed death inhibitors of the malarial parasite plastid, 96 hour incubation",Confirmatory,,
322,504842,1,1,,26725226,5896580,Inactive,4090929.0,10576.0,,Potency,Inhibitors of TCP-1 ring complex (TRiC) of Methanococcus maripaludis (MmCpn): qHTS,Confirmatory,,
323,540275,1,1,,26725226,5896580,Inactive,74315350.0,7442.0,,,HTS Assay for Compounds that Act as Agonists of the Vanilloid Receptor 1,Screening,,
324,540277,1,1,,26725226,5896580,Inactive,74315350.0,7442.0,,,HTS Assay for Compounds that Act as Potentiators of the Vanilloid Receptor 1,Screening,,
325,588342,1,1,,26725226,5896580,Active,160794.0,,1.3459,Potency,qHTS profiling assay for firefly luciferase inhibitor/activator using purifed enzyme and Km concentrations of substrates (counterscreen for miR-21 project),Confirmatory,,
326,588478,1,2,,125177406,5896580,Inactive,4877999.0,51377.0,,,"A screen for small molecule inhibitors of the human deubiquitinating enzyme, UCH37",Other,,
327,588511,1,2,,26725226,5896580,Inactive,334278898.0,101772.0,,,Primary cell-based high-throughput screening for identification of compounds that inhibit/block calcium-activated chloride channels (TMEM16A),Screening,,
328,588627,1,1,,26725226,5896580,Inactive,195969650.0,259249.0,,,Primary cell-based high-throughput screening for identification of compounds that activate MrgX1 receptor signaling,Screening,,
329,588675,1,1,,26725226,5896580,Inactive,195969650.0,259249.0,,,Primary cell-based high-throughput screening for identification of compounds that allosterically activate MrgX1 receptor signaling,Screening,,
330,588676,1,1,,26725226,5896580,Inactive,195969650.0,259249.0,,,Primary cell-based high-throughput screening for identification of compounds that antagonize MrgX1 receptor signaling,Screening,,
331,743445,1,1,,26725226,5896580,Inactive,109633019.0,7468.0,,,"Development of Small Molecule Probes of the Histone Methyltransferase, NSD2 Measured in Biochemical System Using Plate Reader - 7053-01_Inhibitor_SinglePoint_HTS_Activity_Set2",Screening,,
332,1053175,2,1,,125177406,5896580,Inactive,,,,,A screen for compounds that inhibit growth of Escherichia coli,Other,,
333,1117319,1,2,,26725226,5896580,Inactive,9629361.0,155459.0,,Average IC50,High Throughput Screen to Identify Inhibitors Targeting HIV-1 Vif-dependent Degradation of Human APOBEC3G:#A time-resolved fluorescence resonance energy transfer (TR-FRET) assay for HIV-1 Vif-APOBEC3G interaction,Confirmatory,,
334,1117319,1,2,,26725226,5896580,Inactive,13399304.0,60489.0,,Average IC50,High Throughput Screen to Identify Inhibitors Targeting HIV-1 Vif-dependent Degradation of Human APOBEC3G:#A time-resolved fluorescence resonance energy transfer (TR-FRET) assay for HIV-1 Vif-APOBEC3G interaction,Confirmatory,,
335,1159583,2,1,,125177406,5896580,Inactive,,,,,High throughput screen for small molecule inhibitors of a hypoxia-regulated fluorescent biosensor in Mycobacterium tuberculosis,Other,,
336,1259309,1,1,,125177406,5896580,Inactive,,,,,A screen for compounds that are lethal to S. aureus RN4220 with the processive glycosyltransferase UgtP deleted,Other,,
337,1259311,1,1,,125177406,5896580,Inactive,,,,,A screen for compounds that are lethal to S. aureus RN4220,Other,,
338,1259407,1,1,,363900165,5896580,Active,,,,,CCRIS mutagenicity studies,Other,,
