,AID,AID Version,AID Revision,Panel Member ID,SID,CID,Bioactivity Outcome,Target GI,Target GeneID,Activity Value [uM],Activity Name,Assay Name,Bioassay Type,PubMed ID,RNAi
330,493244,1,1,,56314828,1988,Inactive,1927.0,100037999.0,,,Fluorescence-based biochemical primary high throughput screening assay to identify inhibitors of the calcium sensitivity of cardiac Regulated Thin Filaments (RTF),Screening,,
331,493244,1,1,,56314828,1988,Inactive,4507615.0,7134.0,,,Fluorescence-based biochemical primary high throughput screening assay to identify inhibitors of the calcium sensitivity of cardiac Regulated Thin Filaments (RTF),Screening,,
332,493244,1,1,,56314828,1988,Inactive,48255881.0,7139.0,,,Fluorescence-based biochemical primary high throughput screening assay to identify inhibitors of the calcium sensitivity of cardiac Regulated Thin Filaments (RTF),Screening,,
333,493244,1,1,,56314828,1988,Inactive,151101270.0,7137.0,,,Fluorescence-based biochemical primary high throughput screening assay to identify inhibitors of the calcium sensitivity of cardiac Regulated Thin Filaments (RTF),Screening,,
334,504326,1,2,,56314828,1988,Inactive,63477962.0,4985.0,,,Luminescence-based cell-based primary high throughput screening assay to identify agonists of heterodimerization of the mu 1 (OPRM1) and delta 1 (OPRD1) opioid receptors,Screening,,
335,504326,1,2,,56314828,1988,Inactive,117940060.0,4988.0,,,Luminescence-based cell-based primary high throughput screening assay to identify agonists of heterodimerization of the mu 1 (OPRM1) and delta 1 (OPRD1) opioid receptors,Screening,,
336,504327,1,1,,26747242,1988,Inactive,153791535.0,2648.0,,Potency,qHTS Assay for Inhibitors of GCN5L2,Confirmatory,,
337,504327,1,1,,56314828,1988,Inactive,153791535.0,2648.0,,Potency,qHTS Assay for Inhibitors of GCN5L2,Confirmatory,,
338,504329,1,1,,56314828,1988,Inactive,227977143.0,23308111.0,,IC50,Discovery of Small Molecule Probes for H1N1 Influenza NS1A,Confirmatory,,
339,504332,1,1,,56314828,1988,Inactive,168985070.0,,,Potency,qHTS Assay for Inhibitors of Histone Lysine Methyltransferase G9a,Confirmatory,,
340,504333,1,1,,56314828,1988,Inactive,6683500.0,29994.0,,Potency,qHTS Assay for Inhibitors of BAZ2B,Confirmatory,,
341,504339,1,1,,56314828,1988,Inactive,162330054.0,,,Potency,qHTS Assay for Inhibitors of JMJD2A-Tudor Domain,Confirmatory,,
342,504357,1,1,,56314828,1988,Inactive,63477962.0,4985.0,,,Luminescence-based cell-based primary high throughput screening assay to identify inverse agonists of heterodimerization of the mu 1 (OPRM1) and delta 1 (OPRD1) opioid receptors,Screening,,
343,504357,1,1,,56314828,1988,Inactive,117940060.0,4988.0,,,Luminescence-based cell-based primary high throughput screening assay to identify inverse agonists of heterodimerization of the mu 1 (OPRM1) and delta 1 (OPRD1) opioid receptors,Screening,,
344,504408,2,1,,56314828,1988,Inactive,,,,,Heat Shock Factor-1 (HSF-1) Measured in Cell-Based System Using Plate Reader - 2038-01_Activator_SinglePoint_HTS_Activity,Screening,,
345,504411,1,1,,56314828,1988,Inactive,218931251.0,221955.0,,,"Fluorescence-based primary biochemical high throughput screening assay to identify inhibitors of human diacylglycerol lipase, beta (DAGLB)",Screening,,
346,504414,1,1,,56314828,1988,Inactive,9966877.0,57120.0,,,Fluorescence Polarization with Cer CAL-PDZ Measured in Biochemical System Using Plate Reader - 2109-01_Inhibitor_SinglePoint_HTS_Activity,Screening,,
347,504414,1,1,,56314828,1988,Inactive,90421313.0,1080.0,,,Fluorescence Polarization with Cer CAL-PDZ Measured in Biochemical System Using Plate Reader - 2109-01_Inhibitor_SinglePoint_HTS_Activity,Screening,,
348,504423,1,1,,56314828,1988,Inactive,312275222.0,,,,C-LANA FP assay Measured in Biochemical System Using Plate Reader - 2117-01_Inhibitor_SinglePoint_HTS_Activity,Screening,,
349,504441,1,1,,56314828,1988,Inactive,6978787.0,25255.0,,,Dyrk1 A HTS Measured in Biochemical System Using Plate Reader - 2124-01_Inhibitor_SinglePoint_HTS_Activity,Screening,,
350,504444,1,1,,56314828,1988,Inconclusive,224028257.0,4780.0,0.057999999999999996,Potency,Nrf2 qHTS screen for inhibitors,Confirmatory,,
351,504454,1,3,,56314828,1988,Inactive,4501969.0,154.0,,,HTS for Beta-2AR agonists via FAP method,Screening,,
352,504462,1,1,,56314828,1988,Inactive,47132611.0,23192.0,,,uHTS fluorescent assay for identification of inhibitors of ATG4B,Screening,,
353,504466,1,1,,56314828,1988,Inactive,116283940.0,79915.0,23.0999,Potency,qHTS screen for small molecules that induce genotoxicity in human embryonic kidney (HEK293T) cells expressing luciferase-tagged ELG1,Confirmatory,,
354,504467,1,1,,56314828,1988,Inconclusive,116283940.0,79915.0,20.5878,Potency,qHTS screen for small molecules that inhibit ELG1-dependent DNA repair in human embryonic kidney (HEK293T) cells expressing luciferase-tagged ELG1,Confirmatory,,
355,504490,1,2,,56314828,1988,Inactive,13177715.0,408.0,,,Assay for Inhibitors of the beta-Arrestin-Adaptor Protein 2 Interaction That Mediate GPCR Degradation and Recycling,Screening,,
356,504523,1,1,,56314828,1988,Inactive,45269145.0,9817.0,,,Fluorescence polarization to screen for inhibitors that disrupt the protein-protein interaction between Keap1 and Nrf2   Measured in Biochemical System Using Plate Reader - 2119-01_Inhibitor_SinglePoint_HTS_Activity,Screening,,
357,504523,1,1,,56314828,1988,Inactive,224028257.0,4780.0,,,Fluorescence polarization to screen for inhibitors that disrupt the protein-protein interaction between Keap1 and Nrf2   Measured in Biochemical System Using Plate Reader - 2119-01_Inhibitor_SinglePoint_HTS_Activity,Screening,,
358,504558,1,1,,56314828,1988,Inactive,23893668.0,3783750.0,,,Inhibitors of Epstein-Barr LMP1 inducible NF-kappaB luciferase reporter Measured in Cell-Based System Using Plate Reader - 2122-01_Inhibitor_SinglePoint_HTS_Activity,Screening,,
359,504577,2,2,,56314828,1988,Inactive,6325022.0,855842.0,,,HTS of Small Molecules that Regulate V-ATPase Proton Transport in Yeast using pHLuorin,Screening,,
360,504582,2,1,,56314828,1988,Inactive,124809271.0,811941.0,,,In vivo-based yeast HTS to detect compounds rescuing yeast growth/survival of Plasmodium Falciparum HSP40-mediated toxicity Measured in Whole Organism System Using Plate Reader - 2120-01_Inhibitor_SinglePoint_HTS_Activity,Screening,,
361,504634,1,1,,56314828,1988,Inactive,13236497.0,3361.0,,,Counterscreen for inverse agonists of OPRM1-OPRD1 heterodimerization: luminescence-based cell-based full-deck high throughput screening assay to identify inverse agonists of 5-hydroxytryptamine (serotonin) 5A receptor (HTR5A),Screening,,
362,504648,1,1,,56314828,1988,Inactive,,,,Potency,Nrf2 qHTS screen for inhibitors: counterscreen for cytotoxicity,Confirmatory,,
363,504651,1,1,,56314828,1988,Inactive,4503383.0,1812.0,,,Potentiators of Human D1 Dopamine Receptor: qHTS,Screening,,
364,504652,1,1,,56314828,1988,Inactive,4503383.0,1812.0,,,Antagonist of Human D 1 Dopamine Receptor: qHTS,Screening,,
365,504660,1,1,,56314828,1988,Inactive,4503383.0,1812.0,,,Allosteric Agonists of the Human D1 Dopamine Receptor: qHTS,Screening,,
366,504690,1,3,,56314828,1988,Inactive,12381848.0,,,,uHTS identification of small molecule inhibitors of Plasmodium falciparum Glucose-6-phosphate dehydrogenase via a fluorescence intensity assay,Screening,,
367,504692,2,2,,56314828,1988,Inactive,13236497.0,3361.0,,,Counterscreen for agonists of OPRM1-OPRD1 heterodimerization: luminescence-based cell-based full-deck high throughput screening assay to identify agonists of 5-hydroxytryptamine (serotonin) 5A receptor (HTR5A),Screening,,
368,504700,1,1,,56314828,1988,Inactive,46909587.0,5567.0,,,Fluorescence polarization-based biochemical primary high throughput screening assay to identify activators of the Protein Kinase A-R2B (PKA-R2B) complex,Screening,,
369,504700,1,1,,56314828,1988,Inactive,47132585.0,5577.0,,,Fluorescence polarization-based biochemical primary high throughput screening assay to identify activators of the Protein Kinase A-R2B (PKA-R2B) complex,Screening,,
370,504706,1,1,,56314828,1988,Inactive,23491729.0,7157.0,,Potency,qHTS assay for re-activators of p53 using a Luc reporter,Confirmatory,,
371,504707,1,1,,56314828,1988,Inactive,6755076.0,18749.0,,,Fluorescence polarization-based biochemical primary high throughput screening assay to identify activators of the Protein Kinase A-R1A (PKA-R1A) complex,Screening,,
372,504707,1,1,,56314828,1988,Inactive,115496662.0,615074.0,,,Fluorescence polarization-based biochemical primary high throughput screening assay to identify activators of the Protein Kinase A-R1A (PKA-R1A) complex,Screening,,
373,504720,1,1,,56314828,1988,Inactive,16130689.0,947252.0,,,uHTS identification of MazEF TA System activators  via a fluorescence-based single-stranded RNase assay,Screening,,
374,504734,1,1,,56314828,1988,Inactive,194068499.0,54106.0,,,Fluorescence-based cell-based primary high throughput screening assay to identify inhibitors of TLR9-MyD88 binding.,Screening,,
375,504766,2,1,,56314828,1988,Inactive,5016090.0,190.0,,,"Luminescence-based primary cell-based high throughput screening assay to identify inhibitors of the orphan nuclear receptor subfamily 0, group B, member 1 (DAX1; NR0B1)",Screening,,
376,504775,1,1,,56314828,1988,Inactive,14389423.0,20778.0,,,HTS using DiI-HDL to assay lipid transfer in ldlA[SR-BI] cells Measured in Cell-Based System Using Plate Reader - 2085-01_Activator_SinglePoint_HTS_Activity,Screening,,
377,504803,1,1,,56314828,1988,Inactive,121945198.0,,,,Fluorescence polarization-based primary biochemical high throughput screening assay to identify inhibitors of the HTRA serine peptidase 1 (HTRA1),Screening,,
378,504810,1,2,,56314828,1988,Inactive,118341367.0,7253.0,,,Antagonists of the Thyroid Stimulating Hormone Receptor: HTS campaign,Screening,20427476.0,
379,504812,1,2,,56314828,1988,Inactive,118341367.0,7253.0,,,Inverse Agonists of the Thyroid Stimulating Hormone Receptor: HTS campaign,Screening,20427476.0,
380,504832,1,1,,56314828,1988,Active,,,13.1154,Potency,"Primary qHTS for delayed death inhibitors of the malarial parasite plastid, 48 hour incubation",Confirmatory,,
381,504834,1,1,,56314828,1988,Inconclusive,,,10.4179,Potency,"Primary qHTS for delayed death inhibitors of the malarial parasite plastid, 96 hour incubation",Confirmatory,,
382,504842,1,1,,56314828,1988,Inactive,4090929.0,10576.0,,Potency,Inhibitors of TCP-1 ring complex (TRiC) of Methanococcus maripaludis (MmCpn): qHTS,Confirmatory,,
383,504845,1,1,,56314828,1988,Inactive,86301163.0,5999.0,,Potency,Inhibitors of Regulator of G Protein Signaling (RGS) 4: qHTS,Confirmatory,,
384,504847,1,1,,26747242,1988,Inactive,63054845.0,7421.0,,Potency,Inhibitors of the vitamin D receptor (VDR): qHTS,Confirmatory,,
385,504847,1,1,,56314828,1988,Inactive,63054845.0,7421.0,,Potency,Inhibitors of the vitamin D receptor (VDR): qHTS,Confirmatory,,
386,504865,1,1,,26747242,1988,Inactive,118600387.0,7398.0,,Potency,Inhibitors of USP1/UAF1: Pilot qHTS,Confirmatory,,
387,504884,1,2,,56314828,1988,Inactive,115347926.0,1175052.0,,,Inhibitors of Y. pestis Topo-I using cleavage product accumulation Measured in Biochemical System Using Plate Reader - 2123-01_Inhibitor_SinglePoint_HTS_Activity,Screening,,
388,504891,1,1,,56314828,1988,Inactive,5453898.0,5300.0,,Potency,qHTS Assay to Find Inhibitors of Pin1,Confirmatory,,
389,504894,1,1,,56314828,1988,Inactive,553160.0,,,Potency,Activators of T cell receptors: qHTS campaign,Confirmatory,,
390,504937,1,2,,56314828,1988,Inactive,179095.0,6609.0,,Potency,Inhibitors of Secretory Acid Sphingomyelinase (S-ASM): qHTS,Confirmatory,,
391,540253,1,1,,56314828,1988,Inactive,5031833.0,10073.0,,Potency,qHTS Assay for Inhibitors of RanGTP induced Rango (Ran-regulated importin-beta cargo) - Importin beta complex dissociation,Confirmatory,,
392,540253,1,1,,56314828,1988,Inactive,5453555.0,5901.0,,Potency,qHTS Assay for Inhibitors of RanGTP induced Rango (Ran-regulated importin-beta cargo) - Importin beta complex dissociation,Confirmatory,,
393,540253,1,1,,56314828,1988,Inactive,19923142.0,3837.0,,Potency,qHTS Assay for Inhibitors of RanGTP induced Rango (Ran-regulated importin-beta cargo) - Importin beta complex dissociation,Confirmatory,,
394,540256,1,2,,56314828,1988,Inactive,,,,Potency,qHTS for Inhibitors of binding or entry into cells for Lassa Virus,Confirmatory,,
395,540263,1,1,,56314828,1988,Inactive,5031833.0,10073.0,,Potency,qHTS Assay for Inhibitors of Rango (Ran-regulated importin-beta cargo) - Importin beta complex formation,Confirmatory,,
396,540263,1,1,,56314828,1988,Inactive,19923142.0,3837.0,,Potency,qHTS Assay for Inhibitors of Rango (Ran-regulated importin-beta cargo) - Importin beta complex formation,Confirmatory,,
397,540267,1,1,,56314828,1988,Inactive,,,,,Small Molecules that selectively kill Giardia lamblia: qHTS,Screening,,
398,540275,1,1,,56314828,1988,Inactive,74315350.0,7442.0,,,HTS Assay for Compounds that Act as Agonists of the Vanilloid Receptor 1,Screening,,
399,540276,1,2,,17389205,1988,Inconclusive,420597.0,,4.4668,Potency,qHTS for inhibitors of binding or entry into cells for Marburg Virus,Confirmatory,,
400,540276,1,2,,26747242,1988,Inconclusive,420597.0,,4.4668,Potency,qHTS for inhibitors of binding or entry into cells for Marburg Virus,Confirmatory,,
401,540276,1,2,,26752784,1988,Inconclusive,420597.0,,4.4668,Potency,qHTS for inhibitors of binding or entry into cells for Marburg Virus,Confirmatory,,
402,540276,1,2,,50105432,1988,Inconclusive,420597.0,,4.4668,Potency,qHTS for inhibitors of binding or entry into cells for Marburg Virus,Confirmatory,,
403,540276,1,2,,50105433,1988,Inconclusive,420597.0,,4.4668,Potency,qHTS for inhibitors of binding or entry into cells for Marburg Virus,Confirmatory,,
404,540276,1,2,,56314828,1988,Inconclusive,420597.0,,4.4668,Potency,qHTS for inhibitors of binding or entry into cells for Marburg Virus,Confirmatory,,
405,540277,1,1,,56314828,1988,Inactive,74315350.0,7442.0,,,HTS Assay for Compounds that Act as Potentiators of the Vanilloid Receptor 1,Screening,,
406,540295,1,1,,56314828,1988,Inactive,119508433.0,4160.0,,,TRFRET-based cell-based primary high throughput screening assay to identify biased ligands of the melanocortin 4 receptor (MC4R): antagonists of MC4R,Screening,,
407,540303,1,1,,56314828,1988,Inactive,6679377.0,18792.0,,Potency,qHTS for Inhibitors of Cell Surface uPA Generation,Confirmatory,,
408,540303,1,1,,56314828,1988,Inactive,7242179.0,18793.0,,Potency,qHTS for Inhibitors of Cell Surface uPA Generation,Confirmatory,,
409,540303,1,1,,56314828,1988,Inactive,257471003.0,18815.0,,Potency,qHTS for Inhibitors of Cell Surface uPA Generation,Confirmatory,,
410,540308,1,1,,56314828,1988,Inactive,119508433.0,4160.0,,,Luminescence-based cell-based primary high throughput screening assay to identify biased ligands of the melanocortin 4 receptor (MC4R): agonists of MC4R,Screening,,
411,540317,1,1,,56314828,1988,Inactive,187960037.0,10951.0,,Potency,HTS for Inhibitors of HP1-beta Chromodomain Interactions with Methylated Histone Tails,Confirmatory,,
412,540336,1,1,,56314828,1988,Inactive,68474550.0,3639678.0,,,Rtt109/Vps75 Measured in Biochemical System Using Plate Reader - 2106-01_Inhibitor_SinglePoint_HTS_Activity,Screening,,
413,540336,1,1,,56314828,1988,Inactive,68488893.0,3646682.0,,,Rtt109/Vps75 Measured in Biochemical System Using Plate Reader - 2106-01_Inhibitor_SinglePoint_HTS_Activity,Screening,,
414,540364,1,2,,56314828,1988,Inactive,,2395.0,,,Luminescence-based cell-based primary high throughput screening assay to identify activators of the GAA850 frataxin (FXN) promoter,Screening,,
415,588334,1,1,,56314828,1988,Inactive,,,,,MITF Measured in Cell-Based System Using Plate Reader - 2084-01_Activator_SinglePoint_HTS_Activity,Screening,,
416,588335,1,1,,56314828,1988,Inactive,,,,,Counterscreen for inhibitors of the fructose-bisphosphate aldolase (FBA) of M. tuberculosis: Absorbance-based biochemical high throughput Glycerophosphate Dehydrogenase-Triosephosphate Isomerase (GDH-TPI) full deck assay to identify assay artifacts,Screening,,
417,588342,1,1,,56314828,1988,Inactive,160794.0,,,Potency,qHTS profiling assay for firefly luciferase inhibitor/activator using purifed enzyme and Km concentrations of substrates (counterscreen for miR-21 project),Confirmatory,,
418,588352,1,2,,56314828,1988,Inactive,32307126.0,8202.0,,,Luminescence-based cell-based primary high throughput screening assay to identify inhibitors of the Steroid Receptor Coactivator 3 (SRC3; NCOA3),Screening,,
419,588354,1,1,,56314828,1988,Inactive,22538455.0,8648.0,,,Luminescence-based cell-based primary high throughput screening assay to identify inhibitors of the Steroid Receptor Coactivator 1 (SRC1; NCOA1),Screening,,
420,588358,1,2,,56314828,1988,Inactive,,,,,HTS to Find Inhibitors of Pathogenic Pemphigus Antibodies,Screening,,
421,588391,1,1,,56314828,1988,Inactive,14790033.0,5034.0,,,Turbidometric Biochemical  Primary HTS  to identify inhibitors of Protein Disulfide Isomerase Measured in Biochemical System Using Plate Reader - 2137-01_Inhibitor_SinglePoint_HTS_Activity,Screening,,
422,588405,1,1,,56314828,1988,Inactive,78486550.0,171071.0,,,HTS Assay for Peg3 Promoter Inhibitors,Screening,,
423,588413,1,2,,56314828,1988,Inactive,6009644.0,14632.0,,,uHTS identification of Gli-Sufu Antagonists in a luminescence reporter assay,Screening,,
424,588436,1,1,,56314828,1988,Inactive,,,,,"Cholera Quorum: HTS for inducers of light production in the absence ofautoinducers using BH1578 (luxS deficient, cqsA deficient) Measured in Microorganism System Using Plate Reader - 2132-01_Agonist_SinglePoint_HTS_Activity",Screening,,
425,588453,1,1,,56314828,1988,Inconclusive,8659577.0,58819.0,31.6228,Potency,qHTS Assay for Inhibitors of Mammalian Selenoprotein Thioredoxin Reductase 1 (TrxR1): qHTS,Confirmatory,,
426,588456,1,1,,56314828,1988,Inactive,8659577.0,58819.0,,Potency,qHTS Assay for Substrates of Mammalian Selenoprotein Thioredoxin Reductase 1 (TrxR1): qHTS,Confirmatory,,
427,588458,1,1,,56314828,1988,Inactive,4503351.0,1786.0,,,uHTS identification of DNMT1 inhibitors in a Fluorescent Molecular Beacon assay,Screening,,
428,588473,1,1,,56314828,1988,Inactive,30219.0,1393.0,,,uHTS identification of agonists of the CRF-binding protein and CRF-R2 receptor complex,Screening,,
429,588473,1,1,,56314828,1988,Inactive,38349113.0,1395.0,,,uHTS identification of agonists of the CRF-binding protein and CRF-R2 receptor complex,Screening,,
430,588475,1,2,,56314828,1988,Inactive,30219.0,1393.0,,,uHTS identification of antagonists of the CRF-binding protein and CRF-R2 receptor complex,Screening,,
431,588475,1,2,,56314828,1988,Inactive,38349113.0,1395.0,,,uHTS identification of antagonists of the CRF-binding protein and CRF-R2 receptor complex,Screening,,
432,588478,1,2,,125227663,1988,Inactive,4877999.0,51377.0,,,"A screen for small molecule inhibitors of the human deubiquitinating enzyme, UCH37",Other,,
433,588489,1,1,,56314828,1988,Inactive,46367787.0,26986.0,,,uHTS identification of microRNA-mediated mRNA deadenylation inhibitors by fluoresence polarization assay,Screening,,
434,588492,1,1,,56314828,1988,Inactive,,,,,uHTS identification of small molecule modulators of myocardial damage,Screening,,
435,588493,1,2,,56314828,1988,Inactive,16306916.0,10213.0,,,uHTS identification of inhibitors of Rpn11 in a Fluorescent Polarization assay,Screening,,
436,588497,1,2,,56314828,1988,Inactive,168184763.0,,,,"High-throughput multiplex microsphere screening for inhibitors of toxin protease, specifically Botulinum neurotoxin light chain F protease, MLPCN compound set",Screening,16604538.0,
437,588497,1,2,,56314828,1988,Inactive,168184763.0,,,,"High-throughput multiplex microsphere screening for inhibitors of toxin protease, specifically Botulinum neurotoxin light chain F protease, MLPCN compound set",Screening,20035615.0,
438,588497,1,2,,56314828,1988,Inactive,168184763.0,,,,"High-throughput multiplex microsphere screening for inhibitors of toxin protease, specifically Botulinum neurotoxin light chain F protease, MLPCN compound set",Screening,20938917.0,
439,588499,1,3,,56314828,1988,Inactive,148378801.0,5185061.0,,,"High-throughput multiplex microsphere screening for inhibitors of toxin protease, specifically Botulinum neurotoxin light chain A protease, MLPCN compound set",Screening,16604538.0,
440,588499,1,3,,56314828,1988,Inactive,148378801.0,5185061.0,,,"High-throughput multiplex microsphere screening for inhibitors of toxin protease, specifically Botulinum neurotoxin light chain A protease, MLPCN compound set",Screening,20035615.0,
441,588499,1,3,,56314828,1988,Inactive,148378801.0,5185061.0,,,"High-throughput multiplex microsphere screening for inhibitors of toxin protease, specifically Botulinum neurotoxin light chain A protease, MLPCN compound set",Screening,20938917.0,
442,588501,1,2,,56314828,1988,Inactive,21392848.0,,,,"High-throughput multiplex microsphere screening for inhibitors of toxin protease, specifically Lethal Factor Protease, MLPCN compound set",Screening,16604538.0,
443,588501,1,2,,56314828,1988,Inactive,21392848.0,,,,"High-throughput multiplex microsphere screening for inhibitors of toxin protease, specifically Lethal Factor Protease, MLPCN compound set",Screening,20035615.0,
444,588501,1,2,,56314828,1988,Inactive,21392848.0,,,,"High-throughput multiplex microsphere screening for inhibitors of toxin protease, specifically Lethal Factor Protease, MLPCN compound set",Screening,20938917.0,
445,588511,1,2,,56314828,1988,Inactive,334278898.0,101772.0,,,Primary cell-based high-throughput screening for identification of compounds that inhibit/block calcium-activated chloride channels (TMEM16A),Screening,,
446,588513,1,1,,17389205,1988,Inconclusive,348019627.0,2099.0,14.1254,Potency,qHTS assay for small molecule antagonists of estrogen receptor alpha signaling,Confirmatory,,
447,588513,1,1,,26752784,1988,Inconclusive,348019627.0,2099.0,,Potency,qHTS assay for small molecule antagonists of estrogen receptor alpha signaling,Confirmatory,,
448,588514,1,1,,17389205,1988,Active,348019627.0,2099.0,0.7079,Potency,qHTS assay for small molecule agonists of estrogen receptor alpha signaling,Confirmatory,,
449,588514,1,1,,26752784,1988,Inactive,348019627.0,2099.0,,Potency,qHTS assay for small molecule agonists of estrogen receptor alpha signaling,Confirmatory,,
450,588515,1,1,,17389205,1988,Inactive,124375976.0,367.0,,Potency,qHTS assay for small molecule agonists of androgen receptor signaling,Confirmatory,,
451,588515,1,1,,26752784,1988,Inactive,124375976.0,367.0,,Potency,qHTS assay for small molecule agonists of androgen receptor signaling,Confirmatory,,
452,588516,1,1,,17389205,1988,Active,124375976.0,367.0,39.8107,Potency,qHTS assay for small molecule antagonists of androgen receptor signaling,Confirmatory,,
453,588516,1,1,,26752784,1988,Active,124375976.0,367.0,35.4813,Potency,qHTS assay for small molecule antagonists of androgen receptor signaling,Confirmatory,,
454,588526,1,1,,17389205,1988,Inconclusive,325495553.0,9971.0,,Potency,qHTS assay for small molecule antagonists of farnesoid X receptor signaling,Confirmatory,,
455,588526,1,1,,26752784,1988,Inconclusive,325495553.0,9971.0,,Potency,qHTS assay for small molecule antagonists of farnesoid X receptor signaling,Confirmatory,,
456,588527,1,1,,17389205,1988,Inconclusive,325495553.0,9971.0,35.4813,Potency,qHTS assay for small molecule agonists of farnesoid X receptor signaling,Confirmatory,,
457,588527,1,1,,26752784,1988,Inactive,325495553.0,9971.0,,Potency,qHTS assay for small molecule agonists of farnesoid X receptor signaling,Confirmatory,,
458,588532,1,1,,17389205,1988,Inactive,311348376.0,2908.0,,Potency,qHTS assay for small molecule agonists of glucocorticoid receptor signaling,Confirmatory,,
459,588532,1,1,,26752784,1988,Inactive,311348376.0,2908.0,,Potency,qHTS assay for small molecule agonists of glucocorticoid receptor signaling,Confirmatory,,
460,588533,1,1,,17389205,1988,Inconclusive,311348376.0,2908.0,50.1187,Potency,qHTS assay for small molecule antagonists of glucocorticoid receptor signaling,Confirmatory,,
461,588533,1,1,,26752784,1988,Inconclusive,311348376.0,2908.0,,Potency,qHTS assay for small molecule antagonists of glucocorticoid receptor signaling,Confirmatory,,
462,588534,1,1,,17389205,1988,Inconclusive,216409690.0,5467.0,44.6684,Potency,qHTS assay for small molecule agonists of peroxisome proliferator-activated receptor delta signaling,Confirmatory,,
463,588534,1,1,,26752784,1988,Inconclusive,216409690.0,5467.0,35.4813,Potency,qHTS assay for small molecule agonists of peroxisome proliferator-activated receptor delta signaling,Confirmatory,,
464,588535,1,1,,17389205,1988,Inconclusive,216409690.0,5467.0,,Potency,qHTS assay for small molecule antagonists of peroxisome proliferator-activated receptor delta signaling,Confirmatory,,
465,588535,1,1,,26752784,1988,Inconclusive,216409690.0,5467.0,39.8107,Potency,qHTS assay for small molecule antagonists of peroxisome proliferator-activated receptor delta signaling,Confirmatory,,
466,588536,1,1,,17389205,1988,Inconclusive,216409692.0,5468.0,,Potency,qHTS assay for small molecule agonists of peroxisome proliferator-activated receptor gamma signaling,Confirmatory,,
467,588536,1,1,,26752784,1988,Inconclusive,216409692.0,5468.0,35.4813,Potency,qHTS assay for small molecule agonists of peroxisome proliferator-activated receptor gamma signaling,Confirmatory,,
468,588537,1,1,,17389205,1988,Inconclusive,216409692.0,5468.0,39.8107,Potency,qHTS assay for small molecule antagonists of peroxisome proliferator-activated receptor gamma signaling,Confirmatory,,
469,588537,1,1,,26752784,1988,Inconclusive,216409692.0,5468.0,15.8489,Potency,qHTS assay for small molecule antagonists of peroxisome proliferator-activated receptor gamma signaling,Confirmatory,,
