,AID,AID Version,AID Revision,Panel Member ID,SID,CID,Bioactivity Outcome,Target GI,Target GeneID,Activity Value [uM],Activity Name,Assay Name,Bioassay Type,PubMed ID,RNAi
0,421,1,3,,17389205,1988,Active,,,,,Cell Viability - BJ,Confirmatory,,
1,426,1,2,,17389205,1988,Active,,,,,Cell Viability - Jurkat,Confirmatory,,
2,427,1,1,,17389205,1988,Inconclusive,,,,,Cell Viability - Hek293,Confirmatory,,
3,433,1,1,,17389205,1988,Inconclusive,,,,,Cell Viability - HepG2,Confirmatory,,
4,434,1,2,,17389205,1988,Inconclusive,,,,,Cell Viability - MRC5,Confirmatory,,
5,435,1,2,,17389205,1988,Inconclusive,,,,,Cell Viability - SK-N-SH,Confirmatory,,
6,445,3,1,,17389205,1988,Inactive,10092619.0,4792.0,,,IkB Signaling,Confirmatory,,
7,530,1,1,,17389205,1988,Inactive,2499604.0,26414.0,,,JNK3 AlphaScreen Assay,Confirmatory,,
8,540,1,1,,17389205,1988,Inactive,,,,,Cell Viability - N2a,Confirmatory,,
9,541,1,1,,17389205,1988,Active,,,,,Cell Viability - NIH 3T3,Confirmatory,,
10,542,1,1,,17389205,1988,Active,,,,,Cell Viability - HUV-EC-C,Confirmatory,,
11,543,1,1,,17389205,1988,Inconclusive,,,,,Cell Viability - H-4-II-E,Confirmatory,,
12,544,2,1,,17389205,1988,Inconclusive,,,,,Cell Viability - SH-SY5Y,Confirmatory,,
13,545,1,1,,17389205,1988,Active,,,,,Cell Viability - Renal Proximal Tubule,Confirmatory,,
14,546,1,1,,17389205,1988,Inactive,,,,,Cell Viability - Mesenchymal,Confirmatory,,
15,584,1,3,,17389205,1988,Inactive,119389684.0,,,,Promiscuous and Specific Inhibitors of AmpC Beta-Lactamase (assay with detergent),Confirmatory,,
16,585,1,4,,17389205,1988,Inactive,119389684.0,,,,Promiscuous and Specific Inhibitors of AmpC Beta-Lactamase (assay without detergent),Confirmatory,,
17,595,1,3,,17389205,1988,Inactive,,,,,qHTS Assay for Disrupters of an Hsp90 Co-Chaperone Interaction,Confirmatory,,
18,596,1,2,,17389205,1988,Inactive,92096784.0,4137.0,,,qHTS Assay for Tau Filament Binding,Confirmatory,,
19,603,1,2,,17389205,1988,Inactive,,,,,qHTS Assay for Inhibitors of DNA Polymerase III Holoenzyme System,Confirmatory,,
20,605,1,2,,17389205,1988,Inactive,84028058.0,,,,qHTS Assay for Inhibitors of YjeE,Confirmatory,,
21,654,1,1,,17389205,1988,Inactive,,,,,Cellular Toxicity (caspase-3) HepG2,Confirmatory,,
22,655,1,1,,17389205,1988,Inconclusive,,,,,Cellular Toxicity (caspase-3) Jurkat,Confirmatory,,
23,656,1,1,,17389205,1988,Inactive,,,,,Cellular Toxicity (caspase-3) HUV-EC-C,Confirmatory,,
24,657,1,1,,17389205,1988,Inactive,,,,,Cellular Toxicity (caspase-3) SHSY5Y,Confirmatory,,
25,658,1,1,,17389205,1988,Inactive,,,,,Cellular Toxicity (caspase-3) BJ,Confirmatory,,
26,659,1,1,,17389205,1988,Inactive,,,,,Cellular Toxicity (caspase-3) MRC-5,Confirmatory,,
27,660,1,1,,17389205,1988,Inactive,,,,,Cellular Toxicity (caspase-3) Mesangial,Confirmatory,,
28,661,1,1,,17389205,1988,Inactive,,,,,Cellular Toxicity (caspase-3) SK-N-SH,Confirmatory,,
29,662,1,1,,17389205,1988,Inconclusive,,,,,Cell signaling CRE-BLA (Fsk stim),Confirmatory,,
30,663,1,1,,17389205,1988,Inactive,,,,,Cellular Toxicity (caspase-3) H-4-II-E,Confirmatory,,
31,664,1,1,,17389205,1988,Inactive,,,,,Cellular Toxicity (caspase-3) Hek293,Confirmatory,,
32,665,1,1,,17389205,1988,Inactive,,,,,Cellular Toxicity (caspase-3) N2a,Confirmatory,,
33,666,1,1,,17389205,1988,Inactive,,,,,Cellular Toxicity (caspase-3) NIH 3T3,Confirmatory,,
34,667,1,1,,17389205,1988,Inactive,,,,,Cellular Toxicity (caspase-3) Renal Proximal Tubule,Confirmatory,,
35,875,1,2,,17389205,1988,Inactive,159162802.0,,,Potency,qHTS Assay for Inhibitors of BRCT-Phosphoprotein Interaction (Green Fluorophore),Confirmatory,,
36,880,2,1,,17389205,1988,Inactive,3290016.0,6002.0,,,qHTS Assay for Inhibitors of RGS12 GoLoco Motif Activity (Red Fluorophore),Confirmatory,,
37,880,2,1,,17389205,1988,Inactive,33946324.0,2770.0,,,qHTS Assay for Inhibitors of RGS12 GoLoco Motif Activity (Red Fluorophore),Confirmatory,,
38,880,2,1,,26747242,1988,Inactive,3290016.0,6002.0,,,qHTS Assay for Inhibitors of RGS12 GoLoco Motif Activity (Red Fluorophore),Confirmatory,,
39,880,2,1,,26747242,1988,Inactive,33946324.0,2770.0,,,qHTS Assay for Inhibitors of RGS12 GoLoco Motif Activity (Red Fluorophore),Confirmatory,,
40,881,2,2,,17389205,1988,Inactive,317373425.0,247.0,,Potency,qHTS Assay for Inhibitors of 15-hLO-2 (15-human lipoxygenase 2),Confirmatory,,
41,884,1,2,,17389205,1988,Inactive,13435386.0,1576.0,15.8489,Potency,qHTS Assay for Inhibitors and Substrates of Cytochrome P450 3A4,Confirmatory,,
42,885,1,2,,17389205,1988,Active,13435386.0,1576.0,15.8489,Potency,qHTS Assay for Activators of Cytochrome P450 3A4,Confirmatory,,
43,886,1,2,,17389205,1988,Inactive,122921310.0,,,Potency,"qHTS Assay for Inhibitors of HADH2 (Hydroxyacyl-Coenzyme A Dehydrogenase, Type II)",Confirmatory,,
44,886,1,2,,17389205,1988,Inactive,122921311.0,,,Potency,"qHTS Assay for Inhibitors of HADH2 (Hydroxyacyl-Coenzyme A Dehydrogenase, Type II)",Confirmatory,,
45,887,1,2,,17389205,1988,Inactive,1832253.0,246.0,,Potency,qHTS Assay for Inhibitors of 15-hLO (15-human lipoxygenase),Confirmatory,,
46,889,1,3,,17389205,1988,Inactive,1730092.0,840.0,,Potency,qHTS Assay for Allosteric/Competitive Inhibitors of Caspase-7,Confirmatory,,
47,892,1,2,,17389205,1988,Inactive,159162802.0,,,Potency,qHTS Assay for Inhibitors of BRCT-Phosphoprotein Interaction (Red Fluorophore),Confirmatory,,
48,893,1,2,,17389205,1988,Inactive,122921310.0,,,Potency,"qHTS Assay for Inhibitors of HSD17B4, hydroxysteroid (17-beta) dehydrogenase 4",Confirmatory,,
49,893,1,2,,17389205,1988,Inactive,122921311.0,,,Potency,"qHTS Assay for Inhibitors of HSD17B4, hydroxysteroid (17-beta) dehydrogenase 4",Confirmatory,,
50,894,2,1,,17389205,1988,Inactive,31542939.0,3248.0,,Potency,qHTS Assay for Inhibitors of HPGD (15-Hydroxyprostaglandin Dehydrogenase),Confirmatory,,
51,894,2,1,,26747242,1988,Inactive,31542939.0,3248.0,,Potency,qHTS Assay for Inhibitors of HPGD (15-Hydroxyprostaglandin Dehydrogenase),Confirmatory,,
52,900,1,3,,17389205,1988,Inactive,15431328.0,834.0,,Potency,qHTS Assay for Allosteric/Competitive Inhibitors of Caspase-1,Confirmatory,,
53,902,1,2,,17389205,1988,Inconclusive,120407068.0,7157.0,31.6228,Potency,qHTS Screen for Compounds that Selectively Target Cancer Cells with p53 Mutations: Cytotoxicity of p53ts Cells at the Nonpermissive Temperature,Confirmatory,,
54,910,1,2,,17389205,1988,Inactive,4504349.0,3043.0,,Potency,Confirmation and Secondary Assay for Modulators of Hemoglobin Beta Chain Splicing at IVS2 654 locus,Confirmatory,,
55,912,1,2,,17389205,1988,Inactive,21392848.0,,,Potency,qHTS Assay for Anthrax Lethal Toxin Internalization,Confirmatory,,
56,921,1,2,,17389205,1988,Inconclusive,,,50.1187,Potency,Cell Viability - LYMP2-001,Confirmatory,,
57,923,1,2,,17389205,1988,Inactive,,,,Potency,qHTS Assay for Allosteric/Competitive Inhibitors of Caspase-1: Spectroscopic Profiling in AFC Spectral Region,Confirmatory,,
58,924,1,2,,17389205,1988,Inactive,120407068.0,7157.0,,Potency,qHTS Screen for Compounds that Selectively Target Cancer Cells with p53 Mutations: Cytotoxicity of p53ts Cells at the Permissive Temperature,Confirmatory,,
59,925,1,2,,17389205,1988,Inactive,4504349.0,3043.0,,Potency,qHTS Assay for Modulators of Hemoglobin Beta Chain Splicing,Confirmatory,,
60,926,1,2,,17389205,1988,Inactive,38016895.0,7253.0,,Potency,qHTS Assay for Agonists of the Thyroid Stimulating Hormone Receptor,Confirmatory,,
61,927,1,3,,17389205,1988,Inactive,188528692.0,9099.0,,Potency,qHTS Assay for Inhibitors of Ubiquitin-specific Protease USP2a,Confirmatory,,
62,930,1,2,,17389205,1988,Inactive,4504349.0,3043.0,,Potency,Confirmation and Secondary Assay for Modulators of Hemoglobin Beta Chain Splicing at IVS2 705 locus,Confirmatory,,
63,938,1,2,,17389205,1988,Inactive,38016895.0,7253.0,,Potency,qHTS Assay for Agonists of the Thyroid Stimulating Hormone Receptor: Activators of Intracellular cAMP Concentrations in Parental HEK 293,Confirmatory,,
64,940,1,2,,26613416,1988,Inactive,31881630.0,5732.0,,,Modulators of the EP2 prostaglandin E2 receptor - Primary Screening,Screening,,
65,946,1,2,,17389205,1988,Inconclusive,,,50.1187,Potency,MultiTox-Fluor Cytotoxicity Assay - LYMP1-001 - Dead Cells,Confirmatory,,
66,947,1,2,,17389205,1988,Inactive,,,,Potency,MultiTox-Fluor Cytotoxicity Assay - LYMP1-001 - Live Cells,Confirmatory,,
67,948,1,2,,17389205,1988,Inactive,,,,Potency,Cell Viability - LYMP1-002 - Assay at 16 hr,Confirmatory,,
68,955,1,2,,17389205,1988,Inactive,,,,Potency,MultiTox-Fluor Cytotoxicity Assay - LYMP1-002 - Live Cells,Confirmatory,,
69,960,1,2,,17389205,1988,Inconclusive,,,31.6228,Potency,MultiTox-Fluor Cytotoxicity Assay - LYMP1-002 - Dead Cells,Confirmatory,,
70,961,1,2,,17389205,1988,Inconclusive,,,79.4328,Potency,MultiTox-Fluor Cytotoxicity Assay - LYMP1-003 - Dead Cells,Confirmatory,,
71,962,1,2,,17389205,1988,Inactive,,,,Potency,MultiTox-Fluor Cytotoxicity Assay - LYMP1-003 - Live Cells,Confirmatory,,
72,963,1,2,,17389205,1988,Inactive,,,,Potency,Cell Viability - LYMP1-003 - Assay at 24 hr,Confirmatory,,
73,964,1,2,,17389205,1988,Active,,,50.1187,Potency,Cell Viability - LYMP1-003 - Assay at 40 hr,Confirmatory,,
74,965,1,2,,17389205,1988,Active,,,50.1187,Potency,Cell Viability - LYMP2-003,Confirmatory,,
75,966,1,2,,17389205,1988,Inconclusive,,,39.8107,Potency,Cell Viability - LYMP2-004,Confirmatory,,
76,967,1,2,,17389205,1988,Inconclusive,,,39.8107,Potency,Cell Viability - LYMP2-005,Confirmatory,,
77,968,1,2,,17389205,1988,Inconclusive,,,50.1187,Potency,Cell Viability - LYMP2-009,Confirmatory,,
78,969,1,2,,17389205,1988,Active,,,50.1187,Potency,Cell Viability - LYMP2-011,Confirmatory,,
79,970,1,2,,17389205,1988,Inconclusive,,,79.4328,Potency,Cell Viability - LYMP2-013,Confirmatory,,
80,971,1,2,,17389205,1988,Inconclusive,,,50.1187,Potency,Cell Viability - LYMP2-015,Confirmatory,,
81,972,1,2,,17389205,1988,Active,,,50.1187,Potency,Cell Viability - LYMP2-017,Confirmatory,,
82,973,1,2,,17389205,1988,Inconclusive,,,50.1187,Potency,Cell Viability - LYMP2-019,Confirmatory,,
83,974,1,2,,17389205,1988,Active,,,50.1187,Potency,Cell Viability - LYMP2-021,Confirmatory,,
84,975,1,2,,17389205,1988,Inconclusive,,,79.4328,Potency,Cell Viability - LYMP2-023,Confirmatory,,
85,976,1,2,,17389205,1988,Inconclusive,,,100.0,Potency,Cell Viability - LYMP2-025,Confirmatory,,
86,977,1,2,,17389205,1988,Inactive,,,,Potency,Cell Viability - LYMP2-002,Confirmatory,,
87,978,1,2,,17389205,1988,Active,,,50.1187,Potency,Cell Viability - LYMP2-006,Confirmatory,,
88,979,1,2,,17389205,1988,Active,,,50.1187,Potency,Cell Viability - LYMP2-007,Confirmatory,,
89,980,1,2,,17389205,1988,Inconclusive,,,50.1187,Potency,Cell Viability - LYMP2-008,Confirmatory,,
90,981,1,2,,17389205,1988,Active,,,50.1187,Potency,Cell Viability - LYMP2-010,Confirmatory,,
91,982,1,2,,17389205,1988,Inconclusive,,,50.1187,Potency,Cell Viability - LYMP2-012,Confirmatory,,
92,983,1,2,,17389205,1988,Inconclusive,,,79.4328,Potency,Cell Viability - LYMP2-014,Confirmatory,,
93,984,1,2,,17389205,1988,Inconclusive,,,79.4328,Potency,Cell Viability - LYMP2-016,Confirmatory,,
94,985,1,2,,17389205,1988,Inconclusive,,,50.1187,Potency,Cell Viability - LYMP2-018,Confirmatory,,
95,986,1,2,,17389205,1988,Inconclusive,,,63.0957,Potency,Cell Viability - LYMP2-020,Confirmatory,,
96,987,1,2,,17389205,1988,Inconclusive,,,50.1187,Potency,Cell Viability - LYMP2-022,Confirmatory,,
97,988,1,2,,17389205,1988,Inconclusive,,,79.4328,Potency,Cell Viability - LYMP2-024,Confirmatory,,
98,989,1,2,,17389205,1988,Inconclusive,,,79.4328,Potency,Cell Viability - LYMP2-026,Confirmatory,,
99,993,1,2,,17389205,1988,Inconclusive,,,50.1187,Potency,Cell Viability - LYMP1-002 - Assay at 24 hr,Confirmatory,,
100,994,1,2,,17389205,1988,Inconclusive,,,50.1187,Potency,Cell Viability - LYMP1-002 - Assay at 40 hr,Confirmatory,,
101,995,1,2,,17389205,1988,Inactive,66932916.0,5594.0,,Potency,qHTS Assay for Inhibitors of the ERK Signaling Pathway using a Homogeneous Screening Assay,Confirmatory,,
102,1030,2,1,,17389205,1988,Active,30582681.0,216.0,31.6228,Potency,qHTS Assay for Inhibitors of Aldehyde Dehydrogenase 1 (ALDH1A1),Confirmatory,,
103,1030,2,1,,26747242,1988,Inactive,30582681.0,216.0,,Potency,qHTS Assay for Inhibitors of Aldehyde Dehydrogenase 1 (ALDH1A1),Confirmatory,,
104,1379,1,2,,26747242,1988,Inactive,1669525.0,,,Potency,Counterscreen for Luciferase (Kinase-Glo TM) Inhibition,Confirmatory,,
105,1422,1,1,,26613416,1988,Inactive,31881630.0,5732.0,,,Inhibitors of the EP2 Prostaglandin E2 Receptor - Primary Screen,Screening,,
106,1452,1,1,,17389205,1988,Inactive,154426292.0,239.0,,Potency,qHTS Assay for Inhibitors of 12-hLO (12-human lipoxygenase),Confirmatory,,
107,1454,1,1,,26747242,1988,Inactive,66932916.0,5594.0,,Potency,qHTS Assay for Inhibitors of the ERK Signaling Pathway using a Homogeneous Screening Assay; Stimulation with EGF,Confirmatory,,
108,1457,1,1,,17389205,1988,Inactive,44888968.0,83523.0,,Potency,qHTS Assay for Identifying the Cell-Membrane Permeable IMPase Inhibitors: Potentiation with Lithium,Confirmatory,,
109,1457,1,1,,26747242,1988,Inactive,44888968.0,83523.0,,Potency,qHTS Assay for Identifying the Cell-Membrane Permeable IMPase Inhibitors: Potentiation with Lithium,Confirmatory,,
110,1458,1,1,,17389205,1988,Inactive,10937869.0,6607.0,,Potency,qHTS Assay for Enhancers of SMN2 Splice Variant Expression,Confirmatory,,
111,1458,1,1,,26747242,1988,Inactive,10937869.0,6607.0,,Potency,qHTS Assay for Enhancers of SMN2 Splice Variant Expression,Confirmatory,,
112,1460,1,3,,26747242,1988,Inactive,92096784.0,4137.0,,Potency,"qHTS for Inhibitors of Tau Fibril Formation, Thioflavin T Binding",Confirmatory,,
113,1463,1,1,,26747242,1988,Inactive,,,,Potency,"Counterscreen qHTS for Inhibitors of Tau Fibril Formation, Fluorescence Polarization",Confirmatory,,
114,1467,1,3,,26747242,1988,Inactive,757912.0,2717.0,,Potency,qHTS Assay for Inhibitors of Human alpha-Galactosidase at pH 4.5.,Confirmatory,,
115,1468,1,1,,26747242,1988,Inactive,92096784.0,4137.0,,Potency,"qHTS for Inhibitors of Tau Fibril Formation, Fluorescence Polarization",Confirmatory,,
116,1469,1,1,,17389205,1988,Inactive,189491771.0,7068.0,,Potency,qHTS for Inhibitors of the Interaction of Thyroid Hormone Receptor and Steroid Receptor Coregulator 2,Confirmatory,,
117,1469,1,1,,26747242,1988,Inactive,189491771.0,7068.0,,Potency,qHTS for Inhibitors of the Interaction of Thyroid Hormone Receptor and Steroid Receptor Coregulator 2,Confirmatory,,
118,1469,1,1,,26752784,1988,Inactive,189491771.0,7068.0,,Potency,qHTS for Inhibitors of the Interaction of Thyroid Hormone Receptor and Steroid Receptor Coregulator 2,Confirmatory,,
119,1471,2,1,,17389205,1988,Inactive,90903231.0,3064.0,,,qHTS Multiplex Assay to Identify Dual Action Probes in a Cell Model of Huntington: Cytoprotection (ATP),Confirmatory,,
120,1476,2,1,,17389205,1988,Inactive,281307097.0,,,Potency,qHTS Assay for Promiscuous and Specific Inhibitors of Cruzain (without detergent),Confirmatory,,
121,1476,2,1,,26747242,1988,Inactive,281307097.0,,,Potency,qHTS Assay for Promiscuous and Specific Inhibitors of Cruzain (without detergent),Confirmatory,,
122,1477,1,1,,17389205,1988,Inactive,,,,Potency,qHTS Assay for Compounds Blocking the Interaction Between CBF-beta and RUNX1 for the Treatment of Acute Myeloid Leukemia,Confirmatory,,
123,1478,2,1,,17389205,1988,Inactive,281307097.0,,,Potency,qHTS Assay for Promiscuous and Specific Inhibitors of Cruzain (with detergent),Confirmatory,,
124,1478,2,1,,26747242,1988,Inactive,281307097.0,,,Potency,qHTS Assay for Promiscuous and Specific Inhibitors of Cruzain (with detergent),Confirmatory,,
125,1479,1,2,,17389205,1988,Inactive,189491771.0,7068.0,,Potency,Total Fluorescence Counterscreen for Inhibitors of the Interaction of Thyroid Hormone Receptor and Steroid Receptor Coregulator 2,Confirmatory,,
126,1479,1,2,,26747242,1988,Inactive,189491771.0,7068.0,,Potency,Total Fluorescence Counterscreen for Inhibitors of the Interaction of Thyroid Hormone Receptor and Steroid Receptor Coregulator 2,Confirmatory,,
127,1479,1,2,,26752784,1988,Inactive,189491771.0,7068.0,,Potency,Total Fluorescence Counterscreen for Inhibitors of the Interaction of Thyroid Hormone Receptor and Steroid Receptor Coregulator 2,Confirmatory,,
128,1487,1,1,,26747242,1988,Inactive,27436948.0,4000.0,,Potency,qHTS Assay for Modulators of Lamin A Splicing,Confirmatory,,
129,1490,2,1,,26747242,1988,Inactive,10954339.0,,,Potency,qHTS Assay for Inhibitors of Bacillus subtilis Sfp phosphopantetheinyl transferase (PPTase),Confirmatory,,
130,1511,1,3,,56314828,1988,Inactive,487738.0,3757.0,,,Primary cell-based high-throughput screening assay for identification of compounds that protect hERG from block by proarrhythmic agents,Screening,,
131,1519,1,3,,26747242,1988,Inactive,,,,Potency,qHTS Assay for Lipid Storage Modulators,Confirmatory,,
132,1554,1,1,,56314828,1988,Inactive,,,,,MLPCN Ras selective lethality-BJeLR viability,Screening,,
133,1662,1,2,,56314828,1988,Inactive,15675770.0,901648.0,,,MLPCN Streptokinase Expression Inhibition,Screening,,
134,1663,1,2,,56314828,1988,Inactive,,,,,MLPCN Platelet Activation -Dense Granule Release,Screening,,
135,1672,1,3,,56314828,1988,Inactive,6680530.0,16518.0,,,Primary cell-based high-throughput screening assay for identification of compounds that inhibit/block inward-rectifying potassium ion channel Kir2.1,Screening,,
136,1766,1,1,,26747242,1988,Inactive,18860839.0,4221.0,,Potency,qHTS Assay for Inhibitors Targeting the Menin-MLL Interaction in MLL Related Leukemias: Competition With Fluorescein Labeled MLL-derived Peptide,Confirmatory,,
137,1766,1,1,,26747242,1988,Inactive,56550039.0,4297.0,,Potency,qHTS Assay for Inhibitors Targeting the Menin-MLL Interaction in MLL Related Leukemias: Competition With Fluorescein Labeled MLL-derived Peptide,Confirmatory,,
138,1768,1,1,,26747242,1988,Inactive,18860839.0,4221.0,,Potency,qHTS Assay for Inhibitors Targeting the Menin-MLL Interaction in MLL Related Leukemias: Competition With Texas Red Labeled MLL-derived Mutant Peptide,Confirmatory,,
139,1768,1,1,,26747242,1988,Inactive,56550039.0,4297.0,,Potency,qHTS Assay for Inhibitors Targeting the Menin-MLL Interaction in MLL Related Leukemias: Competition With Texas Red Labeled MLL-derived Mutant Peptide,Confirmatory,,
140,1813,1,2,,56314828,1988,Inactive,,,,,MLPCN Alpha-Synuclein 5'UTR - 5'-UTR binding - inhibitors,Screening,,
141,1814,1,2,,56314828,1988,Inactive,,,,,MLPCN Alpha-Synuclein 5'UTR - 5'-UTR binding - activators,Screening,,
142,1832,2,1,,56314828,1988,Inactive,55976631.0,178296.0,,,MLPCN maternal gene expression-MEX-5 TCR-2 binding assay-Primary Screen,Screening,,
143,1850,2,1,,56314828,1988,Inactive,,,,IC50,A small molecule screen for inhibitors of the PhoP regulon in Salmonella typhi,Confirmatory,,
144,1863,2,1,,56314828,1988,Inactive,,,,IC50,A small molecule screen for inhibitors of the PhoP regulon in Salmonella Typhimurium,Confirmatory,,
145,1865,1,1,,26747242,1988,Inactive,,,,Potency,Quantitative High-Throughput Screen for Regulators of Epigenetic Control,Confirmatory,,
146,1875,2,1,,56314828,1988,Inactive,,,,,Luminescence Cell-Based Primary HTS to Identify Inhibitors of Polyadenylation,Screening,,
147,1885,2,1,,56314828,1988,Inactive,,,,,Luminescence Cell-Based/Microorganism Primary HTS to Identify Inhibitors of T.Cruzi Replication,Screening,,
148,1899,1,3,,56314828,1988,Inactive,83779224.0,,,,TR-FRET-based primary biochemical high-throughput screening assay to identify inhibitors of Hepatitis C Virus (HCV) core protein dimerization,Screening,,
149,1903,2,3,,56314828,1988,Inactive,297591903.0,29031019.0,,IC50,Identification of SV40 T antigen inhibitors: A route to novel anti-viral reagents,Confirmatory,,
150,1906,1,3,,56314828,1988,Inactive,55958172.0,,,,QFRET-based counterscreen for PFM18AAP inhibitors: biochemical high throughput screening assay to identify inhibitors of the Cathepsin L proteinase (CTSL1).,Screening,,
151,1910,1,2,,56314828,1988,Inactive,,,,,Luminescence Cell-Based Primary HTS to Identify Transcriptional Activators of Hypoxia-Inducible Factor Pathway,Screening,,
152,1947,1,2,,56314828,1988,Inactive,21595511.0,226016.0,,,Fluorescence polarization-based counterscreen for RBBP9 inhibitors: primary biochemical high throughput screening assay to identify inhibitors of the serine hydrolase family member Fam108B.,Screening,,
153,1948,1,1,,17389205,1988,Inactive,,,,Potency,qHTS Assay for Compounds that Induce Erasure of Genomic Imprints,Confirmatory,,
154,1948,1,1,,26747242,1988,Inactive,,,,Potency,qHTS Assay for Compounds that Induce Erasure of Genomic Imprints,Confirmatory,,
155,1950,1,3,,56314828,1988,Inactive,23893623.0,3783709.0,,,Fluorescence polarization-based primary biochemical high throughput screening assay to identify inhibitors of the Epstein-Barr virus nuclear antigen 1 (EBNA-1).,Screening,,
156,1962,1,2,,56314828,1988,Inactive,68476498.0,,,,Fluorescence polarization-based primary biochemical high throughput screening assay to identify inhibitors of tRNA 2'-phosphotransferase (TPT1).,Screening,,
157,1974,1,2,,56314828,1988,Active,4758484.0,9446.0,,,Fluorescence polarization-based counterscreen for RBBP9 inhibitors: primary biochemical high throughput screening assay to identify inhibitors of the oxidoreductase glutathione S-transferase omega 1(GSTO1).,Screening,,
158,1979,1,1,,56314828,1988,Inactive,994798.0,,,,Fluorescence Cell-Based Primary HTS of C.albicans growth in the presence of Fluconazole and compound,Screening,,
159,1987,1,2,,56314828,1988,Inactive,37589898.0,5536.0,,,Fluorescence-based primary biochemical high throughput screening assay to identify inhibitors of Protein Phosphatase 5 (PP5).,Screening,,
160,2016,1,3,,56314828,1988,Inactive,1302091.0,,,,Multiplex HTS Screen of TOR pathway GFP-fusion proteins in Saccharomyes cerevisiae_specifically_ MEP2_MLPCN.,Screening,,
161,2023,1,3,,56314828,1988,Inactive,486173.0,,,,Multiplex HTS Screen of TOR pathway GFP-fusion proteins in Saccharomyes cerevisiae_specifically_ LAP4_MLPCN.,Screening,,
162,2025,1,3,,56314828,1988,Inactive,536029.0,,,,Multiplex HTS Screen of TOR pathway GFP-fusion proteins in Saccharomyes cerevisiae_specifically_ RPL19A_MLPCN.,Screening,,
163,2029,1,3,,56314828,1988,Inactive,171229.0,,,,Multiplex HTS Screen of TOR pathway GFP-fusion proteins in Saccharomyes cerevisiae_specifically_ CIT2_MLPCN.,Screening,,
164,2052,2,1,,56314828,1988,Inactive,124486680.0,16408.0,,,HTS for developing T Cell Immune Modulators,Screening,,
165,2057,1,2,,56314828,1988,Inactive,78070770.0,4170.0,,,Fluorescence polarization-based primary biochemical high throughput screening assay to identify inhibitors of myeloid cell leukemia sequence 1 (MCL1) interactions with BIM-BH3 peptide.,Screening,,
166,2066,1,4,,56314828,1988,Inactive,85666113.0,850333.0,,,Multiplex HTS Screen of TOR pathway GFP-fusion proteins in Saccharomyes cerevisiae_specifically_ AGP1_MLPCN.,Screening,,
167,2094,1,2,,56314828,1988,Inactive,67463988.0,,,,Plate Read Microorganism-Based Primary HTS to Identify Modulators of the AI-2 Quorum Sensing System,Screening,,
168,2094,1,2,,56314828,1988,Inactive,67463989.0,,,,Plate Read Microorganism-Based Primary HTS to Identify Modulators of the AI-2 Quorum Sensing System,Screening,,
169,2094,1,2,,56314828,1988,Inactive,166202459.0,,,,Plate Read Microorganism-Based Primary HTS to Identify Modulators of the AI-2 Quorum Sensing System,Screening,,
170,2097,1,2,,56314828,1988,Inactive,21361340.0,2932.0,,,Cell-Free Homogeneous Primary HTS to Identify Inhibitors of GSK3beta Activity,Screening,,
171,2098,1,1,,56314828,1988,Inactive,62740231.0,15499.0,,,Luminescence Cell-Based Primary HTS to Identify Inhibitors of Heat Shock Factor 1 (HSF1).,Screening,,
172,2099,1,1,,56314828,1988,Inactive,,,,,Fluorescence Biochemical Primary HTS to Identify Inhibitors of GASC-1 Activity,Screening,,
173,2101,1,1,,17389205,1988,Inactive,496369.0,2629.0,,Potency,qHTS Assay for Inhibitors and Activators of N370S glucocerebrosidase as a Potential Chaperone Treatment of Gaucher Disease,Confirmatory,,
174,2101,1,1,,26747242,1988,Inactive,496369.0,2629.0,,Potency,qHTS Assay for Inhibitors and Activators of N370S glucocerebrosidase as a Potential Chaperone Treatment of Gaucher Disease,Confirmatory,,
175,2101,1,1,,56314828,1988,Inactive,496369.0,2629.0,,Potency,qHTS Assay for Inhibitors and Activators of N370S glucocerebrosidase as a Potential Chaperone Treatment of Gaucher Disease,Confirmatory,,
176,2107,1,1,,17389205,1988,Inactive,757912.0,2717.0,,Potency,qHTS Assay for Inhibitors and Activators of Human alpha-Galactosidase From Spleen Homogenate,Confirmatory,,
177,2107,1,1,,26747242,1988,Inactive,757912.0,2717.0,,Potency,qHTS Assay for Inhibitors and Activators of Human alpha-Galactosidase From Spleen Homogenate,Confirmatory,,
178,2112,1,1,,17389205,1988,Inactive,119393891.0,2548.0,,Potency,qHTS Assay for Inhibitors and Activators of Human alpha-Glucosidase From Spleen Homogenate,Confirmatory,,
179,2112,1,1,,26747242,1988,Inactive,119393891.0,2548.0,,Potency,qHTS Assay for Inhibitors and Activators of Human alpha-Glucosidase From Spleen Homogenate,Confirmatory,,
180,2120,1,1,,17389205,1988,Inactive,32879895.0,3091.0,,Potency,qHTS Assay for Identification of Small Molecule Inducers of Hypoxia Response,Confirmatory,,
181,2129,1,2,,56314828,1988,Inactive,510901.0,598.0,,,"Primary biochemical high throughput screening assay to identify inhibitors of BCL2-related protein, long isoform (BCLXL).",Screening,,
182,2130,1,3,,56314828,1988,Inactive,7706645.0,51400.0,,,Fluorescence polarization-based primary biochemical high throughput screening assay to identify inhibitors of Protein Phosphatase Methylesterase 1 (PME-1).,Screening,,
183,2147,1,1,,26747242,1988,Inactive,221046486.0,,,Potency,qHTS Assay for Inhibitors of  Human Jumonji Domain Containing 2E (JMJD2E),Confirmatory,,
184,2156,2,2,,56314828,1988,Inactive,18959272.0,170848.0,,,Primary cell-based high-throughput screening assay for identification of compounds that inhibit KCNQ2 potassium channels,Screening,,
