,AID,AID Version,AID Revision,Panel Member ID,SID,CID,Bioactivity Outcome,Target GI,Target GeneID,Activity Value [uM],Activity Name,Assay Name,Bioassay Type,PubMed ID,RNAi
671,602141,1,1,,56314828,1988,Inactive,,,,,uHTS determination of small molecule cytotoxicity in a fluorescence assay to identify cystic fibrosis induced NFkb Inhibitors,Screening,,
672,602162,1,1,,56314828,1988,Inactive,9955963.0,10058.0,,,Flow Cytometric HTS Screen for inhibitors of the ABC transporter ABCB6 for MLPCN Compound Set,Screening,,
673,602163,1,1,,56314828,1988,Inactive,73586699.0,281312.0,,,Absorbance-based biochemical primary high throughput screening assay to identify activators of Methionine sulfoxide reductase A (MsrA),Screening,,
674,602179,1,2,,56314828,1988,Inactive,89573979.0,3417.0,,Potency,qHTS for Inhibitors of mutant isocitrate dehydrogenase 1 (IDH1): qHTS,Confirmatory,,
675,602229,1,1,,56314828,1988,Inactive,216409728.0,10002.0,,,"Luminescence-based cell-based high throughput primary screening assay to identify agonists of nuclear receptor subfamily 2, group E, member 3 (NR2E3)",Screening,,
676,602233,1,1,,56314828,1988,Inactive,115503961.0,4357161.0,,Potency,qHTS Assay to Find Inhibitors of Phosphoglycerate Kinase,Confirmatory,,
677,602244,1,2,,56314828,1988,Inactive,5730106.0,10663.0,,,uHTS identification of CXCR6 Inhibitors in a B-arrestin luminescence assay,Screening,,
678,602247,1,2,,56314828,1988,Inactive,,,,,Full deck counterscreen for positive allosteric modulators (PAMs) of the human M1 muscarinic receptor (CHRM1): Fluorescence-based cell-based high throughput screening assay to identify nonselective activators and assay artifacts using the parental CHOK1 cell line,Screening,,
679,602248,1,2,,56314828,1988,Inactive,,,,,Full deck counterscreen for agonists of the human M1 muscarinic receptor (CHRM1): Fluorescence-based cell-based high throughput screening assay to identify nonselective activators and assay artifacts using the parental CHOK1 cell line,Screening,,
680,602250,1,2,,56314828,1988,Inactive,,,,,Full deck counterscreen for antagonists of the human M1 muscarinic receptor (CHRM1): Fluorescence-based cell-based high throughput screening assay to identify nonselective inhibitors and assay artifacts using the parental CHOK1 cell line,Screening,,
681,602252,1,1,,56314828,1988,Inactive,62868213.0,57120.0,,,Fluorescence Polarization with CAL-PDZ Measured in Biochemical System Using Plate Reader - 2109-02_Inhibitor_SinglePoint_HTS_Activity,Screening,,
682,602252,1,1,,56314828,1988,Inactive,90421313.0,1080.0,,,Fluorescence Polarization with CAL-PDZ Measured in Biochemical System Using Plate Reader - 2109-02_Inhibitor_SinglePoint_HTS_Activity,Screening,,
683,602261,1,1,,56314828,1988,Inactive,41872631.0,2194.0,,,uHTS identification of small molecule inhibitors of  the thioesterase domain of fatty acid synthase via a fluorescence intensity assay,Screening,,
684,602274,1,2,,56314828,1988,Inactive,,,,,uHTS luminescent assay for identification of compounds that enhance the survival of human induced pluripotent stem cells when cultured as single cells,Screening,,
685,602281,1,1,,56314828,1988,Inactive,31542303.0,51099.0,,,"Luminescence-based biochemical primary high throughput screening assay to identify inhibitors of the interaction of the lipase co-activator protein, abhydrolase domain containing 5 (ABHD5) with perilipin-5 (MLDP; PLIN5)",Screening,,
686,602281,1,1,,56314828,1988,Inactive,116292172.0,440503.0,,,"Luminescence-based biochemical primary high throughput screening assay to identify inhibitors of the interaction of the lipase co-activator protein, abhydrolase domain containing 5 (ABHD5) with perilipin-5 (MLDP; PLIN5)",Screening,,
687,602310,1,2,,56314828,1988,Inactive,13399304.0,60489.0,,Potency,qHTS for Inhibitors of Vif-A3G Interactions: qHTS,Confirmatory,,
688,602313,1,1,,56314828,1988,Inactive,22907044.0,200316.0,,Potency,qHTS for Inhibitors of Vif-A3F Interactions: qHTS,Confirmatory,,
689,602329,1,1,,56314828,1988,Inactive,216548193.0,8438.0,,,Identification of inhibitors of RAD54 Measured in Biochemical System Using Plate Reader - 2159-01_Inhibitor_SinglePoint_HTS_Activity,Screening,,
690,602332,1,1,,26747242,1988,Inactive,168984549.0,,,Potency,qHTS for Inducers of the Endoplasmic Reticulum Stress Response (ERSR) in Human Glioma: qHTS,Confirmatory,,
691,602332,1,1,,56314828,1988,Inactive,168984549.0,,,Potency,qHTS for Inducers of the Endoplasmic Reticulum Stress Response (ERSR) in Human Glioma: qHTS,Confirmatory,,
692,602340,1,2,,56314828,1988,Inactive,,,,,HTS for suppressors of simvastatin-induced mytoxicity in differentiated C2C12 cells Measured in Cell-Based System Using Plate Reader - 2112-01_Suppressor_SinglePoint_HTS_Activity,Screening,,
693,602342,2,1,,56314828,1988,Inactive,,,,,Small molecule inhibitors of miR122  Measured in Cell-Based System Using Plate Reader - 2144-01_Inhibitor_SinglePoint_HTS_Activity,Screening,,
694,602346,1,1,,56314828,1988,Inactive,9629361.0,155459.0,,,Identification of VIF Inhibitors Measured in Cell-Based System Using Imaging - 2108-01_Inhibitor_SinglePoint_HTS_Activity,Screening,,
695,602363,1,1,,56314828,1988,Inactive,,,,,Whole cell Yeast HTS to identify compounds modulating the fidelity of the start codon recognition in eukaryotes. Measured in Whole Organism System Using Plate Reader - 2155-01_Other_SinglePoint_HTS_Activity,Screening,,
696,602393,1,1,,56314828,1988,Inactive,291463269.0,20586.0,,,Screen for inhibitors of the SWI/SNF chromatin remodeling complex (esBAF) in mouse embryonic stem cells with Luciferase reporter assay Measured in Cell-Based System Using Plate Reader - 2141-01_Inhibitor_SinglePoint_HTS_Activity,Screening,,
697,602396,1,2,,56314828,1988,Inactive,4504343.0,2494.0,,,Luminescence-based cell-based primary high throughput screening assay to identify inverse agonists of the liver receptor homolog-1 (LRH-1; NR5A2),Screening,,
698,602399,1,2,,56314828,1988,Inactive,15927174.0,,,,uHTS identification of inhibitors of NadD in a Colorimetric assay,Screening,,
699,602405,1,1,,56314828,1988,Inactive,75495260.0,,,,PgID: DNTB colorimetric HTS to detect inhibitor of PgID Measured in Biochemical System Using Plate Reader - 2164-01_Inhibitor_SinglePoint_HTS_Activity,Screening,,
700,602410,1,1,,56314828,1988,Inactive,11093520.0,3777.0,,,Primary cell-based screen for identification of compounds that inhibit the two-pore domain potassium channel KCNK3,Screening,,
701,602429,1,1,,56314828,1988,Inactive,1762973.0,7341.0,,,uHTS identification of SUMO1-mediated protein-protein interactions,Screening,,
702,602438,1,1,,56314828,1988,Inactive,160877737.0,,,,uHTS identification of modulators of interaction between CendR and NRP-1 using Fluorescence Polarization assay,Screening,,
703,602440,1,1,,56314828,1988,Inactive,262118306.0,123228.0,,,uHTS Fluorescent Assay Using Nedd8 Protein Substrate for Identification of Inhibitors of Sentrin-Specific Protease 8 (SENP8),Screening,,
704,602449,1,2,,56314828,1988,Inactive,,,,,uHTS identification of small molecule inhibitors of the mitochondrial permeability transition pore via an absorbance assay,Screening,,
705,602481,1,1,,56314828,1988,Inactive,378544807.0,,,,Mycobacterium tuberculosis BioA enzyme inhibitor Measured in Biochemical System Using Plate Reader - 2163-01_Inhibitor_SinglePoint_HTS_Activity,Screening,,
706,623870,1,1,,56314828,1988,Inactive,2702319.0,405.0,,,ARNT-TAC3: AlphaScreen HTS to detect disruption of ARNT/TAC3 interactions Measured in Biochemical System Using Plate Reader - 2158-01_Inhibitor_SinglePoint_HTS_Activity,Screening,,
707,623870,1,1,,56314828,1988,Inactive,5454102.0,10460.0,,,ARNT-TAC3: AlphaScreen HTS to detect disruption of ARNT/TAC3 interactions Measured in Biochemical System Using Plate Reader - 2158-01_Inhibitor_SinglePoint_HTS_Activity,Screening,,
708,623877,1,1,,56314828,1988,Inactive,334278898.0,101772.0,,,Primary cell-based high-throughput screening for identification of compounds that activate/potentiate calcium-activated chloride channels (TMEM16A),Screening,,
709,623901,1,1,,56314828,1988,Inactive,,,,,Small molecule inhibitors of miR122  Measured in Cell-Based System Using Plate Reader - 2144-01_Activator_SinglePoint_HTS_Activity,Screening,,
710,624037,1,3,,56314828,1988,Inactive,7108336.0,1133.0,,,"Fluorescence-based cell-based primary high throughput screening assay to identify agonists of the human cholinergic receptor, muscarinic 5 (CHRM5)",Screening,,
711,624038,1,3,,56314828,1988,Inactive,7108336.0,1133.0,,,"Fluorescence-based cell-based primary high throughput screening assay to identify positive allosteric modulators (PAMs) of the human cholinergic receptor, muscarinic 5 (CHRM5)",Screening,,
712,624040,1,3,,56314828,1988,Inactive,7108336.0,1133.0,,,"Fluorescence-based cell-based primary high throughput screening assay to identify antagonists of the human cholinergic receptor, muscarinic 5 (CHRM5)",Screening,,
713,624125,1,4,,56314828,1988,Inactive,52426748.0,1132.0,,,"Fluorescence-based cell-based primary high throughput screening assay to identify antagonists of the human cholinergic receptor, muscarinic 4 (CHRM4)",Screening,,
714,624126,1,3,,56314828,1988,Inactive,52426748.0,1132.0,,,"Fluorescence-based cell-based primary high throughput screening assay to identify positive allosteric modulators (PAMs) of the human cholinergic receptor, muscarinic 4 (CHRM4)",Screening,,
715,624127,1,2,,56314828,1988,Inactive,52426748.0,1132.0,,,"Fluorescence-based cell-based primary high throughput screening assay to identify agonists of the human cholinergic receptor, muscarinic 4 (CHRM4)",Screening,,
716,624156,1,1,,85789637,1988,Inactive,,,,,Fluorescence Cell-Based Primary  HTS to Identify Reactive Oxygen Species Inducers in Cancer Cells Measured in Cell-Based System Using Plate Reader and Imaging Combination - 2044-01_Activator_SinglePoint_HTS_Activity,Screening,,
717,624168,1,1,,56314828,1988,Inactive,47678551.0,9215.0,,,uHTS identification of small molecule activators of alpha dystroglycan glycosylation,Screening,,
718,624169,1,1,,56314828,1988,Inactive,27753985.0,15558.0,,,Luminescence-based cell-based primary high throughput screening assay to identify agonists of the mouse 5-hydroxytryptamine (serotonin) receptor 2A (HTR2A),Screening,,
719,624170,1,1,,56314828,1988,Inactive,71051501.0,2744.0,,Potency,qHTS for Inhibitors of Glutaminase (GLS),Confirmatory,,
720,624171,1,1,,56314828,1988,Inconclusive,693842.0,4780.0,25.1189,Potency,qHTS of Nrf2 Activators,Confirmatory,,
721,624172,1,1,,56314828,1988,Inactive,1724069.0,2740.0,,Potency,qHTS of GLP-1 Receptor Agonists,Confirmatory,,
722,624173,1,3,,56314828,1988,Inactive,62359610.0,,,Potency,qHTS of Trypanosoma Brucei Inhibitors,Confirmatory,,
723,624178,1,1,,56314828,1988,Unspecified,179095.0,6609.0,,Potency,qHTS for Inhibitors of Human Acid Sphingomyelinase Assay: Native Substrate,Confirmatory,,
724,624202,1,1,,56314828,1988,Inactive,1698399.0,672.0,,Potency,qHTS Assay to Identify Small Molecule Activators of BRCA1 Expression,Confirmatory,,
725,624204,1,2,,56314828,1988,Inactive,7657550.0,,,,"uHTS identification of small molecule inhibitors of the catalytic domain of the SUMO protease, SENP1 in a FRET assay",Screening,,
726,624246,1,1,,56314828,1988,Inactive,343478176.0,2078.0,,Potency,qHTS for Small Molecule Inhibitors of the ERG Ets/DNA interaction,Confirmatory,,
727,624256,1,2,,56314828,1988,Inactive,,3205.0,,,HTS to identify compounds that promote myeloid differentiation with MLPCN compound set,Screening,,
728,624263,1,1,,26747242,1988,Inactive,3063388.0,5071.0,,Potency,A Quantitative High throughput Screen to Identify Chemical Modulators of PINK1 Expression,Confirmatory,,
729,624263,1,1,,26747242,1988,Inactive,37183032.0,,,Potency,A Quantitative High throughput Screen to Identify Chemical Modulators of PINK1 Expression,Confirmatory,,
730,624263,1,1,,56314828,1988,Inactive,3063388.0,5071.0,,Potency,A Quantitative High throughput Screen to Identify Chemical Modulators of PINK1 Expression,Confirmatory,,
731,624263,1,1,,56314828,1988,Inactive,37183032.0,,,Potency,A Quantitative High throughput Screen to Identify Chemical Modulators of PINK1 Expression,Confirmatory,,
732,624267,1,2,,56314828,1988,Inactive,4506537.0,8767.0,,,Fluorescence-based cell-based primary high throughput screening assay to identify inhibitors of the interaction of nucleotide-binding oligomerization domain containing 2 (NOD2) and the receptor-interacting serine-threonine kinase 2 (RIPK2),Screening,,
733,624267,1,2,,56314828,1988,Inactive,119603173.0,64127.0,,,Fluorescence-based cell-based primary high throughput screening assay to identify inhibitors of the interaction of nucleotide-binding oligomerization domain containing 2 (NOD2) and the receptor-interacting serine-threonine kinase 2 (RIPK2),Screening,,
734,624268,1,3,,56314828,1988,Inactive,71746704.0,3662741.0,,,Luminescence-based biochemical primary high throughput screening assay to identify inhibitors of Trypanosoma brucei methionyl tRNA synthetase (MetRS),Screening,,
735,624287,1,1,,56314828,1988,Inactive,52000961.0,2778.0,,Potency,"qHTS for Agonist of gsp, the Etiologic Mutation Responsible for Fibrous Dysplasia/McCune-Albright Syndrome: qHTS",Confirmatory,,
736,624288,1,1,,56314828,1988,Inactive,52000961.0,2778.0,,Potency,"qHTS for Antagonists of gsp, the Etiologic Mutation Responsible for Fibrous Dysplasia/McCune-Albright Syndrome: qHTS",Confirmatory,,
737,624291,1,1,,56314828,1988,Inactive,121312.0,1081.0,,Potency,qHTS for Activators of Integrin-Mediated Alleviation for Muscular Dystrophy,Confirmatory,,
738,624296,1,1,,56314828,1988,Inactive,7705682.0,51053.0,6.5131,Potency,A quantitative high throughput screen for small molecules that induce DNA re-replication in MCF 10a normal breast cells.,Confirmatory,,
739,624297,1,1,,56314828,1988,Inconclusive,7705682.0,51053.0,11.5821,Potency,A quantitative high throughput screen for small molecules that induce DNA re-replication in SW480 colon adenocarcinoma cells.,Confirmatory,,
740,624304,1,2,,56314828,1988,Inactive,25148072.0,177343.0,,,uHTS identification of SKN-1 Inhibitors in a fluoresence assay,Screening,,
741,624330,1,2,,56314828,1988,Inactive,21361397.0,29127.0,,IC50,Discovery of small molecule inhibitors of the oncogenic and cytokinetic protein MgcRacGAP -  Primary and Confirmatory Screens,Confirmatory,,
742,624352,1,1,,56314828,1988,Inactive,40254439.0,2034.0,,,uHTS identification of HIF-2a Inhibitors in a luminesence assay,Screening,,
743,624354,1,1,,56314828,1988,Inactive,224494019.0,8795.0,,,uHTS identification of Caspase-8 TRAIL sensitizers in a luminesence assay,Screening,,
744,624377,1,1,,89854494,1988,Inactive,351542238.0,50807.0,,,"Fluorescence polarization-based biochemical primary high throughput screening assay to identify inhibitors of ArfGAP with SH3 domain, ankyrin repeat and PH domain 1 (ASAP1)",Screening,,
745,624414,1,1,,56314828,1988,Inactive,10092597.0,57192.0,,,qHTS for Agonists of the Human Mucolipin Transient Receptor Potential 1 (TRPML1),Screening,,
746,624415,1,2,,56314828,1988,Inactive,10092597.0,57192.0,,,qHTS for Inhibitors of the Human Mucolipin Transient Receptor Potential 1 (TRPML1),Screening,,
747,624416,1,1,,89854494,1988,Inactive,9629363.0,155971.0,,,"TRFRET-based biochemical primary high throughput screening assay to identify small molecules that bind to the HIV-1-gp120 binding antibody, PG9",Screening,,
748,624417,1,1,,56314828,1988,Inactive,1724069.0,2740.0,,Potency,qHTS of GLP-1 Receptor Inverse Agonists (Inhibition Mode),Confirmatory,,
749,624418,1,1,,56314828,1988,Inactive,,,,Potency,qHTS of GLP-1 Receptor Inverse Agonists: Cytotox Screen,Confirmatory,,
750,624463,1,1,,56314828,1988,Inactive,4503385.0,1813.0,,,Beta-Arrestin HTS for Positive Allosteric Modulators of the Human D2 Dopamine Receptor: Antagonists,Other,,
751,624464,1,1,,56314828,1988,Inactive,4503385.0,1813.0,,,Beta-Arrestin HTS for Positive Allosteric Modulators of the Human D2 Dopamine Receptor: Potentiators,Other,,
752,624465,1,1,,56314828,1988,Inactive,4503385.0,1813.0,,,Beta-Arrestin HTS for Positive Allosteric Modulators of the Human D2 Dopamine Receptor: Agonists,Other,,
753,624466,1,3,,89854494,1988,Inactive,21264324.0,134864.0,,,Fluorescence-based cell-based primary high throughput screening assay to identify antagonists of the human trace amine associated receptor 1 (TAAR1),Screening,,
754,624467,1,1,,89854494,1988,Inactive,21264324.0,134864.0,,,Fluorescence-based cell-based primary high throughput screening assay to identify agonists of the human trace amine associated receptor 1 (TAAR1),Screening,,
755,624483,1,1,,56314828,1988,Inactive,,,,,Counterscreen of compound fluorescence effects on High-throughput multiplex microsphere screening for inhibitors of toxin protease,Screening,,
756,651550,1,1,,56314828,1988,Inactive,60391226.0,207.0,,,HTS Assay for Inhibitors of Akt Phophorylation: Primary Screen,Screening,,
757,651560,1,1,,56314828,1988,Inactive,1709543.0,52.0,,,"uHTS identification of small molecule inhibitors of Low Molecular Weight Protein Tyrosine Phosphatase, LMPTP, via a fluorescence intensity assay",Screening,,
758,651572,1,2,,89854494,1988,Inactive,21489979.0,246310.0,,,Fluorescence polarization-based biochemical primary high throughput screening assay to identify inhibitors of ADP-ribosylation factor GTPase activating protein 1 (ARFGAP1),Screening,,
759,651582,1,1,,56314828,1988,Inactive,,,,,uHTS identification of small molecule Triacylglycerol inhbitors in a fluoresence assay,Screening,,
760,651602,1,1,,89854494,1988,Inactive,16130723.0,947287.0,,,Absorbance-based primary bacterial cell-based high throughput screening assay to identify inhibitors of RecBCD (with phage),Screening,,
761,651602,1,1,,89854494,1988,Inactive,16130724.0,947286.0,,,Absorbance-based primary bacterial cell-based high throughput screening assay to identify inhibitors of RecBCD (with phage),Screening,,
762,651602,1,1,,89854494,1988,Inactive,16130726.0,947294.0,,,Absorbance-based primary bacterial cell-based high throughput screening assay to identify inhibitors of RecBCD (with phage),Screening,,
763,651610,2,1,,89854494,1988,Inactive,,,,,HIV entry: Env-mediated Cell Fusion Measured in Cell-Based System Using Plate Reader - 7013-01_Inhibitor_SinglePoint_HTS_Activity,Screening,,
764,651631,4,1,,144209643,1988,Inconclusive,269849759.0,7157.0,72.6747,Potency-Replicate_1,qHTS assay for small molecule agonists of the p53 signaling pathway,Confirmatory,,
765,651631,4,1,,144211206,1988,Inconclusive,269849759.0,7157.0,,Potency-Replicate_1,qHTS assay for small molecule agonists of the p53 signaling pathway,Confirmatory,,
766,651632,4,1,,144209643,1988,Inactive,296439460.0,79915.0,28.9323,Potency-Replicate_1,qHTS assay for small molecules that induce genotoxicity in human embryonic kidney cells expressing luciferase-tagged ATAD5,Confirmatory,,
767,651632,4,1,,144211206,1988,Inactive,296439460.0,79915.0,,Potency-Replicate_1,qHTS assay for small molecules that induce genotoxicity in human embryonic kidney cells expressing luciferase-tagged ATAD5,Confirmatory,,
768,651633,4,1,,144209643,1988,Inactive,,,,Potency-Replicate_1,qHTS assay for small molecule agonists of the p53 signaling pathway - cell viability,Confirmatory,,
769,651633,4,1,,144211206,1988,Inactive,,,,Potency-Replicate_1,qHTS assay for small molecule agonists of the p53 signaling pathway - cell viability,Confirmatory,,
770,651634,4,1,,144209643,1988,Inactive,,,,Potency-Replicate_1,qHTS assay for small molecules that induce genotoxicity in human embryonic kidney cells expressing luciferase-tagged ATAD5 - cell viability,Confirmatory,,
771,651634,4,1,,144211206,1988,Inactive,,,6.859,Potency-Replicate_1,qHTS assay for small molecules that induce genotoxicity in human embryonic kidney cells expressing luciferase-tagged ATAD5 - cell viability,Confirmatory,,
772,651635,1,3,,56314828,1988,Inactive,171543895.0,6311.0,,Potency,qHTS for Inhibitors of ATXN expression,Confirmatory,,
773,651636,1,1,,56314828,1988,Inactive,4826706.0,1880.0,,,uHTS identification of small molecule antagonists of the EBI2 receptor via a luminescent beta-arrestin assay,Screening,,
774,651640,1,1,,89854494,1988,Inactive,,,,,DENV2 CPE-Based HTS Measured in Cell-Based and Microorganism Combination System Using Plate Reader - 2149-01_Other_SinglePoint_HTS_Activity,Screening,,
775,651644,1,1,,56314828,1988,Inactive,28872817.0,155807.0,,Potency,qHTS Assay for Inhibitors of the HIV-1 protein Vpr,Confirmatory,,
776,651647,1,1,,56314828,1988,Inactive,4826834.0,4323.0,,,uHTS identification of inhibitors of MT1-MMP activation in a fluoresence assay,Screening,,
777,651654,1,1,,56314828,1988,Inactive,,,,,HTS for the detection of C. neoformans cell lysis via adenylate kinase (AK) release Measured in Microorganism System Using Plate Reader - 2162-01_Inhibitor_SinglePoint_HTS_Activity,Screening,,
778,651658,1,1,,89854494,1988,Inactive,10190672.0,27006.0,,,Small Molecule Inhibitors of FGF22-Mediated Excitatory Synaptogenesis & Epilepsy Measured in Biochemical System Using RT-PCR - 7012-01_Inhibitor_SinglePoint_HTS_Activity,Screening,,
779,651661,2,1,,89854494,1988,Inactive,,,,,Luminescence Cell-Based Primary HTS to identify inhibitors of the oncoprotein EWS/Fli transcriptional activity Measured in Cell-Based System Using Plate Reader - 7014-01_Inhibitor_SinglePoint_HTS_Activity,Screening,,
780,651687,1,1,,56314828,1988,Inactive,,,,,MLPCN PGC1a Modulators Measured in Cell-Based System Using Plate Reader - 2139-01_Inhibitor_SinglePoint_HTS_Activity,Screening,,
781,651699,1,1,,56314828,1988,Inactive,4502169.0,8883.0,,,uHTS identification of inhibitors of cullin neddylation in a TR-FRET assay,Screening,,
782,651699,1,1,,56314828,1988,Inactive,4507791.0,9040.0,,,uHTS identification of inhibitors of cullin neddylation in a TR-FRET assay,Screening,,
783,651702,1,2,,56314828,1988,Inactive,,,,,Flow Cytometric HTS Screening for Inhibitors of Lytic Granule Exocytosis with MLPCN Compound Library,Screening,,
784,651704,2,1,,89854494,1988,Inactive,156104889.0,4300.0,,,Inhibition of the MLL-AF4-AF9 Interaction in Pediatric Leukemia Measured in Biochemical System Using Plate Reader - 2160-01_Inhibitor_SinglePoint_HTS_Activity,Screening,,
785,651710,1,1,,89854494,1988,Inactive,109637798.0,5893.0,,,FRET-based HTS for detection of RAD52 Inhibitors Measured in Biochemical System Using Plate Reader - 7018-01_Inhibitor_SinglePoint_HTS_Activity_Set2,Screening,,
786,651711,2,1,,89854494,1988,Inactive,2501205.0,10130.0,,,Turbidometric Biochemical  Primary HTS  to identify inhibitors of ERp5 Measured in Biochemical System Using Plate Reader - 7002-01_Inhibitor_SinglePoint_HTS_Activity,Screening,,
787,651718,1,2,,89854494,1988,Inactive,73586699.0,281312.0,,,Absorbance-based biochemical primary high throughput screening assay to identify inhibitors of Methionine sulfoxide reductase A (MsrA),Screening,,
788,651719,1,2,,89854494,1988,Inactive,4503907.0,8484.0,,,Fluorescence-based cell-based primary high throughput screening assay to identify antagonists of the Galanin Receptor 3 (GalR3),Screening,,
789,651723,1,1,,56314828,1988,Inactive,,,,,MLPCN PGC1a Modulators Measured in Cell-Based System Using Plate Reader - 2139-01_Activator_SinglePoint_HTS_Activity,Screening,,
790,651724,1,1,,56314828,1988,Inactive,1730321.0,5932.0,,,qHTS Assay for Inhibitors of the CtBP/E1A Interaction,Screening,,
791,651725,1,1,,56314828,1988,Inactive,1246761.0,6495.0,,,qHTS Assay for Inhibitors of the Six1/Eya2 Interaction,Screening,,
792,651741,1,1,,17389205,1988,Active,20149576.0,4780.0,7.4978,Potency,qHTS assay for small molecule agonists of the antioxidant response element (ARE) signaling pathway,Confirmatory,,
793,651741,1,1,,26752784,1988,Active,20149576.0,4780.0,7.6959,Potency,qHTS assay for small molecule agonists of the antioxidant response element (ARE) signaling pathway,Confirmatory,,
794,651743,1,1,,17389205,1988,Inactive,269849759.0,7157.0,,Potency,qHTS assay for small molecule activators of the p53 signaling pathway,Confirmatory,,
795,651743,1,1,,26752784,1988,Inactive,269849759.0,7157.0,,Potency,qHTS assay for small molecule activators of the p53 signaling pathway,Confirmatory,,
796,651749,1,1,,17389205,1988,Inactive,34577122.0,4790.0,,Potency,qHTS assay for small molecule activators of the nuclear factor-kappa B (NF-kB) signaling pathway,Confirmatory,,
797,651749,1,1,,26752784,1988,Inactive,34577122.0,4790.0,,Potency,qHTS assay for small molecule activators of the nuclear factor-kappa B (NF-kB) signaling pathway,Confirmatory,,
798,651751,1,1,,17389205,1988,Inactive,5702233.0,84385.0,,Potency,qHTS assay for small molecule activators of the rat pregnane X receptor (rPXR) signaling pathway,Confirmatory,,
799,651751,1,1,,26752784,1988,Inactive,5702233.0,84385.0,,Potency,qHTS assay for small molecule activators of the rat pregnane X receptor (rPXR) signaling pathway,Confirmatory,,
800,651754,1,1,,17389205,1988,Inactive,,,,Potency,qHTS assay for small molecule disruptors of the mitochondrial membrane potential - 1 hr assay,Confirmatory,,
801,651755,1,1,,17389205,1988,Inactive,,,,Potency,qHTS assay for small molecule disruptors of the mitochondrial membrane potential - 5 hr assay,Confirmatory,,
802,651757,1,1,,17389205,1988,Inactive,25952111.0,7124.0,,Potency,qHTS assay to identify small molecules that stimulate Tumor Necrosis Factor-alpha (TNF-alpha) secretion,Confirmatory,,
803,651758,1,1,,17389205,1988,Inactive,186368.0,3576.0,,Potency,qHTS assay to identify small molecules that stimulate interleukin-8 (IL-8) secretion,Confirmatory,,
804,651768,1,2,,56314828,1988,Inactive,3719421.0,7486.0,,Potency,qHTS for Inhibitors of WRN Helicase,Confirmatory,,
805,651777,1,1,,17389205,1988,Inactive,51095037.0,196.0,,Potency,qHTS assay for environmental chemicals that activate the Aryl hydrocarbon Receptor (AhR) signaling pathway,Confirmatory,,
