,AID,AID Version,AID Revision,Panel Member ID,SID,CID,Bioactivity Outcome,Target GI,Target GeneID,Activity Value [uM],Activity Name,Assay Name,Bioassay Type,PubMed ID,RNAi
0,155,1,1,,399678,6654,Inactive,,,,,NCI Yeast Anticancer Drug Screen. Data for the rad50 strain,Other,,
1,155,1,1,,399679,6654,Inactive,,,,,NCI Yeast Anticancer Drug Screen. Data for the rad50 strain,Other,,
2,157,1,1,,399678,6654,Inactive,,,,,NCI Yeast Anticancer Drug Screen. Data for the mec2-1 strain,Other,,
3,157,1,1,,399679,6654,Inactive,,,,,NCI Yeast Anticancer Drug Screen. Data for the mec2-1 strain,Other,,
4,161,1,1,,399678,6654,Inactive,,,,,NCI Yeast Anticancer Drug Screen. Data for the sgs1 mgt1 strain,Other,,
5,161,1,1,,399679,6654,Inactive,,,,,NCI Yeast Anticancer Drug Screen. Data for the sgs1 mgt1 strain,Other,,
6,165,1,1,,399678,6654,Inactive,,,,,NCI Yeast Anticancer Drug Screen. Data for the cln2 rad14 strain,Other,,
7,165,1,1,,399679,6654,Inactive,,,,,NCI Yeast Anticancer Drug Screen. Data for the cln2 rad14 strain,Other,,
8,167,1,1,,399678,6654,Inactive,,,,,NCI Yeast Anticancer Drug Screen. Data for the bub3 strain,Other,,
9,167,1,1,,399679,6654,Inactive,,,,,NCI Yeast Anticancer Drug Screen. Data for the bub3 strain,Other,,
10,175,1,1,,399678,6654,Inactive,,,,,NCI Yeast Anticancer Drug Screen. Data for the mlh1 rad18 strain,Other,,
11,175,1,1,,399679,6654,Inactive,,,,,NCI Yeast Anticancer Drug Screen. Data for the mlh1 rad18 strain,Other,,
12,421,1,3,,17389183,6654,Inactive,,,,,Cell Viability - BJ,Confirmatory,,
13,426,1,2,,17389183,6654,Inactive,,,,,Cell Viability - Jurkat,Confirmatory,,
14,427,1,1,,17389183,6654,Inactive,,,,,Cell Viability - Hek293,Confirmatory,,
15,433,1,1,,17389183,6654,Inactive,,,,,Cell Viability - HepG2,Confirmatory,,
16,434,1,2,,17389183,6654,Inactive,,,,,Cell Viability - MRC5,Confirmatory,,
17,435,1,2,,17389183,6654,Inactive,,,,,Cell Viability - SK-N-SH,Confirmatory,,
18,445,3,1,,17389183,6654,Inactive,10092619.0,4792.0,,,IkB Signaling,Confirmatory,,
19,530,1,1,,17389183,6654,Inactive,2499604.0,26414.0,,,JNK3 AlphaScreen Assay,Confirmatory,,
20,540,1,1,,17389183,6654,Inactive,,,,,Cell Viability - N2a,Confirmatory,,
21,541,1,1,,17389183,6654,Inactive,,,,,Cell Viability - NIH 3T3,Confirmatory,,
22,542,1,1,,17389183,6654,Inactive,,,,,Cell Viability - HUV-EC-C,Confirmatory,,
23,543,1,1,,17389183,6654,Inactive,,,,,Cell Viability - H-4-II-E,Confirmatory,,
24,544,2,1,,17389183,6654,Inactive,,,,,Cell Viability - SH-SY5Y,Confirmatory,,
25,545,1,1,,17389183,6654,Inactive,,,,,Cell Viability - Renal Proximal Tubule,Confirmatory,,
26,546,1,1,,17389183,6654,Inactive,,,,,Cell Viability - Mesenchymal,Confirmatory,,
27,584,1,3,,17389183,6654,Inactive,119389684.0,,,,Promiscuous and Specific Inhibitors of AmpC Beta-Lactamase (assay with detergent),Confirmatory,,
28,585,1,4,,17389183,6654,Inactive,119389684.0,,,,Promiscuous and Specific Inhibitors of AmpC Beta-Lactamase (assay without detergent),Confirmatory,,
29,595,1,3,,17389183,6654,Inactive,,,,,qHTS Assay for Disrupters of an Hsp90 Co-Chaperone Interaction,Confirmatory,,
30,596,1,2,,17389183,6654,Inactive,92096784.0,4137.0,,,qHTS Assay for Tau Filament Binding,Confirmatory,,
31,603,1,2,,17389183,6654,Inactive,,,,,qHTS Assay for Inhibitors of DNA Polymerase III Holoenzyme System,Confirmatory,,
32,605,1,2,,17389183,6654,Inactive,84028058.0,,,,qHTS Assay for Inhibitors of YjeE,Confirmatory,,
33,654,1,1,,17389183,6654,Inactive,,,,,Cellular Toxicity (caspase-3) HepG2,Confirmatory,,
34,655,1,1,,17389183,6654,Inactive,,,,,Cellular Toxicity (caspase-3) Jurkat,Confirmatory,,
35,656,1,1,,17389183,6654,Inactive,,,,,Cellular Toxicity (caspase-3) HUV-EC-C,Confirmatory,,
36,657,1,1,,17389183,6654,Inactive,,,,,Cellular Toxicity (caspase-3) SHSY5Y,Confirmatory,,
37,658,1,1,,17389183,6654,Inactive,,,,,Cellular Toxicity (caspase-3) BJ,Confirmatory,,
38,659,1,1,,17389183,6654,Inactive,,,,,Cellular Toxicity (caspase-3) MRC-5,Confirmatory,,
39,660,1,1,,17389183,6654,Inactive,,,,,Cellular Toxicity (caspase-3) Mesangial,Confirmatory,,
40,661,1,1,,17389183,6654,Inactive,,,,,Cellular Toxicity (caspase-3) SK-N-SH,Confirmatory,,
41,662,1,1,,17389183,6654,Inactive,,,,,Cell signaling CRE-BLA (Fsk stim),Confirmatory,,
42,663,1,1,,17389183,6654,Inconclusive,,,,,Cellular Toxicity (caspase-3) H-4-II-E,Confirmatory,,
43,664,1,1,,17389183,6654,Inactive,,,,,Cellular Toxicity (caspase-3) Hek293,Confirmatory,,
44,665,1,1,,17389183,6654,Inactive,,,,,Cellular Toxicity (caspase-3) N2a,Confirmatory,,
45,666,1,1,,17389183,6654,Inactive,,,,,Cellular Toxicity (caspase-3) NIH 3T3,Confirmatory,,
46,667,1,1,,17389183,6654,Inactive,,,,,Cellular Toxicity (caspase-3) Renal Proximal Tubule,Confirmatory,,
47,875,1,2,,17389183,6654,Inactive,159162802.0,,,Potency,qHTS Assay for Inhibitors of BRCT-Phosphoprotein Interaction (Green Fluorophore),Confirmatory,,
48,880,2,1,,17389183,6654,Inactive,3290016.0,6002.0,,,qHTS Assay for Inhibitors of RGS12 GoLoco Motif Activity (Red Fluorophore),Confirmatory,,
49,880,2,1,,17389183,6654,Inactive,33946324.0,2770.0,,,qHTS Assay for Inhibitors of RGS12 GoLoco Motif Activity (Red Fluorophore),Confirmatory,,
50,881,2,2,,17389183,6654,Inactive,317373425.0,247.0,,Potency,qHTS Assay for Inhibitors of 15-hLO-2 (15-human lipoxygenase 2),Confirmatory,,
51,884,1,2,,17389183,6654,Inactive,13435386.0,1576.0,,Potency,qHTS Assay for Inhibitors and Substrates of Cytochrome P450 3A4,Confirmatory,,
52,885,1,2,,17389183,6654,Inactive,13435386.0,1576.0,,Potency,qHTS Assay for Activators of Cytochrome P450 3A4,Confirmatory,,
53,886,1,2,,17389183,6654,Inactive,122921310.0,,,Potency,"qHTS Assay for Inhibitors of HADH2 (Hydroxyacyl-Coenzyme A Dehydrogenase, Type II)",Confirmatory,,
54,886,1,2,,17389183,6654,Inactive,122921311.0,,,Potency,"qHTS Assay for Inhibitors of HADH2 (Hydroxyacyl-Coenzyme A Dehydrogenase, Type II)",Confirmatory,,
55,887,1,2,,17389183,6654,Inactive,1832253.0,246.0,,Potency,qHTS Assay for Inhibitors of 15-hLO (15-human lipoxygenase),Confirmatory,,
56,889,1,3,,17389183,6654,Inactive,1730092.0,840.0,,Potency,qHTS Assay for Allosteric/Competitive Inhibitors of Caspase-7,Confirmatory,,
57,892,1,2,,17389183,6654,Inactive,159162802.0,,,Potency,qHTS Assay for Inhibitors of BRCT-Phosphoprotein Interaction (Red Fluorophore),Confirmatory,,
58,893,1,2,,17389183,6654,Inactive,122921310.0,,,Potency,"qHTS Assay for Inhibitors of HSD17B4, hydroxysteroid (17-beta) dehydrogenase 4",Confirmatory,,
59,893,1,2,,17389183,6654,Inactive,122921311.0,,,Potency,"qHTS Assay for Inhibitors of HSD17B4, hydroxysteroid (17-beta) dehydrogenase 4",Confirmatory,,
60,894,2,1,,17389183,6654,Inactive,31542939.0,3248.0,,Potency,qHTS Assay for Inhibitors of HPGD (15-Hydroxyprostaglandin Dehydrogenase),Confirmatory,,
61,900,1,3,,17389183,6654,Inactive,15431328.0,834.0,,Potency,qHTS Assay for Allosteric/Competitive Inhibitors of Caspase-1,Confirmatory,,
62,902,1,2,,17389183,6654,Inactive,120407068.0,7157.0,,Potency,qHTS Screen for Compounds that Selectively Target Cancer Cells with p53 Mutations: Cytotoxicity of p53ts Cells at the Nonpermissive Temperature,Confirmatory,,
63,912,1,2,,17389183,6654,Inactive,21392848.0,,,Potency,qHTS Assay for Anthrax Lethal Toxin Internalization,Confirmatory,,
64,921,1,2,,17389183,6654,Inactive,,,,Potency,Cell Viability - LYMP2-001,Confirmatory,,
65,923,1,2,,17389183,6654,Inactive,,,,Potency,qHTS Assay for Allosteric/Competitive Inhibitors of Caspase-1: Spectroscopic Profiling in AFC Spectral Region,Confirmatory,,
66,924,1,2,,17389183,6654,Inactive,120407068.0,7157.0,,Potency,qHTS Screen for Compounds that Selectively Target Cancer Cells with p53 Mutations: Cytotoxicity of p53ts Cells at the Permissive Temperature,Confirmatory,,
67,925,1,2,,17389183,6654,Inactive,4504349.0,3043.0,,Potency,qHTS Assay for Modulators of Hemoglobin Beta Chain Splicing,Confirmatory,,
68,926,1,2,,17389183,6654,Inconclusive,38016895.0,7253.0,6.3096,Potency,qHTS Assay for Agonists of the Thyroid Stimulating Hormone Receptor,Confirmatory,,
69,938,1,2,,17389183,6654,Inactive,38016895.0,7253.0,6.3096,Potency,qHTS Assay for Agonists of the Thyroid Stimulating Hormone Receptor: Activators of Intracellular cAMP Concentrations in Parental HEK 293,Confirmatory,,
70,946,1,2,,17389183,6654,Inactive,,,,Potency,MultiTox-Fluor Cytotoxicity Assay - LYMP1-001 - Dead Cells,Confirmatory,,
71,947,1,2,,17389183,6654,Inactive,,,,Potency,MultiTox-Fluor Cytotoxicity Assay - LYMP1-001 - Live Cells,Confirmatory,,
72,948,1,2,,17389183,6654,Inactive,,,,Potency,Cell Viability - LYMP1-002 - Assay at 16 hr,Confirmatory,,
73,955,1,2,,17389183,6654,Inactive,,,,Potency,MultiTox-Fluor Cytotoxicity Assay - LYMP1-002 - Live Cells,Confirmatory,,
74,960,1,2,,17389183,6654,Inactive,,,,Potency,MultiTox-Fluor Cytotoxicity Assay - LYMP1-002 - Dead Cells,Confirmatory,,
75,961,1,2,,17389183,6654,Inactive,,,,Potency,MultiTox-Fluor Cytotoxicity Assay - LYMP1-003 - Dead Cells,Confirmatory,,
76,962,1,2,,17389183,6654,Inactive,,,,Potency,MultiTox-Fluor Cytotoxicity Assay - LYMP1-003 - Live Cells,Confirmatory,,
77,963,1,2,,17389183,6654,Inactive,,,,Potency,Cell Viability - LYMP1-003 - Assay at 24 hr,Confirmatory,,
78,964,1,2,,17389183,6654,Inactive,,,,Potency,Cell Viability - LYMP1-003 - Assay at 40 hr,Confirmatory,,
79,965,1,2,,17389183,6654,Inactive,,,,Potency,Cell Viability - LYMP2-003,Confirmatory,,
80,966,1,2,,17389183,6654,Inactive,,,,Potency,Cell Viability - LYMP2-004,Confirmatory,,
81,967,1,2,,17389183,6654,Inactive,,,,Potency,Cell Viability - LYMP2-005,Confirmatory,,
82,968,1,2,,17389183,6654,Inactive,,,,Potency,Cell Viability - LYMP2-009,Confirmatory,,
83,969,1,2,,17389183,6654,Inactive,,,,Potency,Cell Viability - LYMP2-011,Confirmatory,,
84,970,1,2,,17389183,6654,Inactive,,,,Potency,Cell Viability - LYMP2-013,Confirmatory,,
85,971,1,2,,17389183,6654,Inactive,,,,Potency,Cell Viability - LYMP2-015,Confirmatory,,
86,972,1,2,,17389183,6654,Inactive,,,,Potency,Cell Viability - LYMP2-017,Confirmatory,,
87,973,1,2,,17389183,6654,Inactive,,,,Potency,Cell Viability - LYMP2-019,Confirmatory,,
88,974,1,2,,17389183,6654,Inactive,,,,Potency,Cell Viability - LYMP2-021,Confirmatory,,
89,975,1,2,,17389183,6654,Inactive,,,,Potency,Cell Viability - LYMP2-023,Confirmatory,,
90,976,1,2,,17389183,6654,Inactive,,,,Potency,Cell Viability - LYMP2-025,Confirmatory,,
91,977,1,2,,17389183,6654,Inactive,,,,Potency,Cell Viability - LYMP2-002,Confirmatory,,
92,978,1,2,,17389183,6654,Inactive,,,,Potency,Cell Viability - LYMP2-006,Confirmatory,,
93,979,1,2,,17389183,6654,Inactive,,,,Potency,Cell Viability - LYMP2-007,Confirmatory,,
94,980,1,2,,17389183,6654,Inactive,,,,Potency,Cell Viability - LYMP2-008,Confirmatory,,
95,981,1,2,,17389183,6654,Inactive,,,,Potency,Cell Viability - LYMP2-010,Confirmatory,,
96,982,1,2,,17389183,6654,Inactive,,,,Potency,Cell Viability - LYMP2-012,Confirmatory,,
97,983,1,2,,17389183,6654,Inactive,,,,Potency,Cell Viability - LYMP2-014,Confirmatory,,
98,984,1,2,,17389183,6654,Inactive,,,,Potency,Cell Viability - LYMP2-016,Confirmatory,,
99,985,1,2,,17389183,6654,Inactive,,,,Potency,Cell Viability - LYMP2-018,Confirmatory,,
100,986,1,2,,17389183,6654,Inactive,,,,Potency,Cell Viability - LYMP2-020,Confirmatory,,
101,987,1,2,,17389183,6654,Inactive,,,,Potency,Cell Viability - LYMP2-022,Confirmatory,,
102,988,1,2,,17389183,6654,Inactive,,,,Potency,Cell Viability - LYMP2-024,Confirmatory,,
103,989,1,2,,17389183,6654,Inactive,,,,Potency,Cell Viability - LYMP2-026,Confirmatory,,
104,993,1,2,,17389183,6654,Inactive,,,,Potency,Cell Viability - LYMP1-002 - Assay at 24 hr,Confirmatory,,
105,994,1,2,,17389183,6654,Inactive,,,,Potency,Cell Viability - LYMP1-002 - Assay at 40 hr,Confirmatory,,
106,995,1,2,,17389183,6654,Inconclusive,66932916.0,5594.0,39.8107,Potency,qHTS Assay for Inhibitors of the ERK Signaling Pathway using a Homogeneous Screening Assay,Confirmatory,,
107,1030,2,1,,17389183,6654,Inactive,30582681.0,216.0,,Potency,qHTS Assay for Inhibitors of Aldehyde Dehydrogenase 1 (ALDH1A1),Confirmatory,,
108,1452,1,1,,17389183,6654,Inactive,154426292.0,239.0,,Potency,qHTS Assay for Inhibitors of 12-hLO (12-human lipoxygenase),Confirmatory,,
109,1457,1,1,,17389183,6654,Inactive,44888968.0,83523.0,,Potency,qHTS Assay for Identifying the Cell-Membrane Permeable IMPase Inhibitors: Potentiation with Lithium,Confirmatory,,
110,1458,1,1,,17389183,6654,Inactive,10937869.0,6607.0,,Potency,qHTS Assay for Enhancers of SMN2 Splice Variant Expression,Confirmatory,,
111,1469,1,1,,17389183,6654,Inactive,189491771.0,7068.0,,Potency,qHTS for Inhibitors of the Interaction of Thyroid Hormone Receptor and Steroid Receptor Coregulator 2,Confirmatory,,
112,1471,2,1,,17389183,6654,Inactive,90903231.0,3064.0,,,qHTS Multiplex Assay to Identify Dual Action Probes in a Cell Model of Huntington: Cytoprotection (ATP),Confirmatory,,
113,1476,2,1,,17389183,6654,Inactive,281307097.0,,,Potency,qHTS Assay for Promiscuous and Specific Inhibitors of Cruzain (without detergent),Confirmatory,,
114,1477,1,1,,17389183,6654,Inactive,,,,Potency,qHTS Assay for Compounds Blocking the Interaction Between CBF-beta and RUNX1 for the Treatment of Acute Myeloid Leukemia,Confirmatory,,
115,1478,2,1,,17389183,6654,Inactive,281307097.0,,,Potency,qHTS Assay for Promiscuous and Specific Inhibitors of Cruzain (with detergent),Confirmatory,,
116,1479,1,2,,17389183,6654,Inactive,189491771.0,7068.0,,Potency,Total Fluorescence Counterscreen for Inhibitors of the Interaction of Thyroid Hormone Receptor and Steroid Receptor Coregulator 2,Confirmatory,,
117,1487,1,1,,17389183,6654,Inactive,27436948.0,4000.0,,Potency,qHTS Assay for Modulators of Lamin A Splicing,Confirmatory,,
118,1490,2,1,,17389183,6654,Inactive,10954339.0,,,Potency,qHTS Assay for Inhibitors of Bacillus subtilis Sfp phosphopantetheinyl transferase (PPTase),Confirmatory,,
119,1688,1,1,,17389183,6654,Inactive,90903231.0,3064.0,,Potency,qHTS Multiplex Assay to Identify Dual Action Probes in a Cell Model of Huntington: Aggregate Formation (GFP),Confirmatory,,
120,1766,1,1,,17389183,6654,Inactive,18860839.0,4221.0,,Potency,qHTS Assay for Inhibitors Targeting the Menin-MLL Interaction in MLL Related Leukemias: Competition With Fluorescein Labeled MLL-derived Peptide,Confirmatory,,
121,1766,1,1,,17389183,6654,Inactive,56550039.0,4297.0,,Potency,qHTS Assay for Inhibitors Targeting the Menin-MLL Interaction in MLL Related Leukemias: Competition With Fluorescein Labeled MLL-derived Peptide,Confirmatory,,
122,1768,1,1,,17389183,6654,Inactive,18860839.0,4221.0,,Potency,qHTS Assay for Inhibitors Targeting the Menin-MLL Interaction in MLL Related Leukemias: Competition With Texas Red Labeled MLL-derived Mutant Peptide,Confirmatory,,
123,1768,1,1,,17389183,6654,Inactive,56550039.0,4297.0,,Potency,qHTS Assay for Inhibitors Targeting the Menin-MLL Interaction in MLL Related Leukemias: Competition With Texas Red Labeled MLL-derived Mutant Peptide,Confirmatory,,
124,1948,1,1,,17389183,6654,Inactive,,,,Potency,qHTS Assay for Compounds that Induce Erasure of Genomic Imprints,Confirmatory,,
125,2101,1,1,,17389183,6654,Inactive,496369.0,2629.0,,Potency,qHTS Assay for Inhibitors and Activators of N370S glucocerebrosidase as a Potential Chaperone Treatment of Gaucher Disease,Confirmatory,,
126,2107,1,1,,17389183,6654,Inactive,757912.0,2717.0,,Potency,qHTS Assay for Inhibitors and Activators of Human alpha-Galactosidase From Spleen Homogenate,Confirmatory,,
127,2112,1,1,,17389183,6654,Inactive,119393891.0,2548.0,,Potency,qHTS Assay for Inhibitors and Activators of Human alpha-Glucosidase From Spleen Homogenate,Confirmatory,,
128,2120,1,1,,17389183,6654,Inactive,32879895.0,3091.0,,Potency,qHTS Assay for Identification of Small Molecule Inducers of Hypoxia Response,Confirmatory,,
129,2517,2,1,,17389183,6654,Inactive,6980812.0,,,Potency,qHTS Assay for Inhibitors of the Human Apurinic/apyrimidinic Endonuclease 1 (APE1),Confirmatory,,
130,2528,1,2,,17389183,6654,Inactive,4557365.0,641.0,,Potency,qHTS Assay for Inhibitors of Bloom's syndrome helicase (BLM),Confirmatory,,
131,2546,1,1,,17389183,6654,Inactive,188536040.0,19885.0,,Potency,VP16 counterscreen qHTS for inhibitors of ROR gamma transcriptional activity,Confirmatory,,
132,2549,1,1,,17389183,6654,Inactive,282403581.0,,,Potency,qHTS Assay for Inhibitors of RecQ-Like Dna Helicase 1 (RECQ1),Confirmatory,,
133,2551,1,1,,17389183,6654,Inactive,188536040.0,19885.0,,Potency,qHTS for inhibitors of ROR gamma transcriptional activity,Confirmatory,,
134,2662,2,1,,17389183,6654,Inactive,56550039.0,4297.0,,Potency,qHTS Fluorescence Polarization Assay for Inhibitors of MLL CXXC domain - DNA interaction,Confirmatory,,
135,332912,9,1,,103581574,6654,Unspecified,,,,,Antimicrobial activity Propionibacterium acnes ATCC 11827 after 2 days by broth dilution method,Other,8158169.0,
136,334958,3,4,,103581574,6654,Unspecified,,,,,"Antiinflammatory activity against carrageenan-induced plantar edema in Wistar rat hind paw at 80 mg/kg, ip administered 1 hr before carrageenan challenge measured after 1 hrs",Other,2746256.0,
137,334959,3,4,,103581574,6654,Unspecified,,,,,"Antiinflammatory activity against carrageenan-induced plantar edema in Wistar rat hind paw at 80 mg/kg, ip administered 1 hr before carrageenan challenge measured after 3 hrs",Other,2746256.0,
138,334960,3,4,,103581574,6654,Unspecified,,,,,"Antiinflammatory activity against carrageenan-induced plantar edema in Wistar rat hind paw at 80 mg/kg, ip administered 1 hr before carrageenan challenge measured after 5 hrs",Other,2746256.0,
139,334961,3,4,,103581574,6654,Unspecified,,,,,"Antiinflammatory activity against carrageenan-induced plantar edema in Wistar rat hind paw at 40 mg/kg, ip administered 1 hr before carrageenan challenge measured after 1 hrs",Other,2746256.0,
140,334962,3,4,,103581574,6654,Unspecified,,,,,"Antiinflammatory activity against carrageenan-induced plantar edema in Wistar rat hind paw at 40 mg/kg, ip administered 1 hr before carrageenan challenge measured after 3 hrs",Other,2746256.0,
141,334963,3,4,,103581574,6654,Unspecified,,,,,"Antiinflammatory activity against carrageenan-induced plantar edema in Wistar rat hind paw at 40 mg/kg, ip administered 1 hr before carrageenan challenge measured after 5 hrs",Other,2746256.0,
142,334964,3,4,,103581574,6654,Unspecified,,,,,"Antiinflammatory activity against carrageenan-induced plantar edema in Wistar rat hind paw at 20 mg/kg, ip administered 1 hr before carrageenan challenge measured after 1 hrs",Other,2746256.0,
143,334965,3,4,,103581574,6654,Unspecified,,,,,"Antiinflammatory activity against carrageenan-induced plantar edema in Wistar rat hind paw at 20 mg/kg, ip administered 1 hr before carrageenan challenge measured after 3 hrs",Other,2746256.0,
144,334966,3,4,,103581574,6654,Unspecified,,,,,"Antiinflammatory activity against carrageenan-induced plantar edema in Wistar rat hind paw at 20 mg/kg, ip administered 1 hr before carrageenan challenge measured after 5 hrs",Other,2746256.0,
145,360503,12,1,,103581574,6654,Unspecified,,,,,Antioxidant activity assessed as DPPH radical scavenging activity,Other,8594153.0,
146,485290,1,1,,17389183,6654,Inactive,20150581.0,,,Potency,qHTS Assay for Inhibitors of Tyrosyl-DNA Phosphodiesterase (TDP1),Confirmatory,,
147,492961,1,1,,17389183,6654,Inactive,72386991.0,3656265.0,,Potency,qHTS Assay to Find Inhibitors of T. brucei phosphofructokinase: hit validation,Confirmatory,,
148,504327,1,1,,17389183,6654,Inactive,153791535.0,2648.0,,Potency,qHTS Assay for Inhibitors of GCN5L2,Confirmatory,,
149,504332,1,1,,17389183,6654,Inactive,168985070.0,,,Potency,qHTS Assay for Inhibitors of Histone Lysine Methyltransferase G9a,Confirmatory,,
150,504749,1,3,,17389183,6654,Unspecified,,,,,qHTS profiling for inhibitors of Plasmodium falciparum proliferation,Other,21817045.0,
151,504749,1,3,1.0,17389183,6654,Inactive,,,,,qHTS profiling for inhibitors of Plasmodium falciparum proliferation,Other,21817045.0,
152,504749,1,3,2.0,17389183,6654,Inactive,,,,,qHTS profiling for inhibitors of Plasmodium falciparum proliferation,Other,21817045.0,
153,504749,1,3,3.0,17389183,6654,Inactive,,,,,qHTS profiling for inhibitors of Plasmodium falciparum proliferation,Other,21817045.0,
154,504749,1,3,4.0,17389183,6654,Inactive,,,,,qHTS profiling for inhibitors of Plasmodium falciparum proliferation,Other,21817045.0,
155,504749,1,3,5.0,17389183,6654,Inactive,,,,,qHTS profiling for inhibitors of Plasmodium falciparum proliferation,Other,21817045.0,
156,504749,1,3,6.0,17389183,6654,Inactive,,,,,qHTS profiling for inhibitors of Plasmodium falciparum proliferation,Other,21817045.0,
157,504749,1,3,7.0,17389183,6654,Inactive,,,,,qHTS profiling for inhibitors of Plasmodium falciparum proliferation,Other,21817045.0,
158,504749,1,3,8.0,17389183,6654,Inactive,,,,,qHTS profiling for inhibitors of Plasmodium falciparum proliferation,Other,21817045.0,
159,504749,1,3,9.0,17389183,6654,Inactive,,,,,qHTS profiling for inhibitors of Plasmodium falciparum proliferation,Other,21817045.0,
160,504749,1,3,10.0,17389183,6654,Inactive,,,,,qHTS profiling for inhibitors of Plasmodium falciparum proliferation,Other,21817045.0,
161,504749,1,3,11.0,17389183,6654,Inactive,,,,,qHTS profiling for inhibitors of Plasmodium falciparum proliferation,Other,21817045.0,
162,504749,1,3,12.0,17389183,6654,Inactive,,,,,qHTS profiling for inhibitors of Plasmodium falciparum proliferation,Other,21817045.0,
163,504749,1,3,13.0,17389183,6654,Inactive,,,,,qHTS profiling for inhibitors of Plasmodium falciparum proliferation,Other,21817045.0,
164,504749,1,3,14.0,17389183,6654,Inactive,,,,,qHTS profiling for inhibitors of Plasmodium falciparum proliferation,Other,21817045.0,
165,504749,1,3,15.0,17389183,6654,Inactive,,,,,qHTS profiling for inhibitors of Plasmodium falciparum proliferation,Other,21817045.0,
166,504749,1,3,16.0,17389183,6654,Inactive,,,,,qHTS profiling for inhibitors of Plasmodium falciparum proliferation,Other,21817045.0,
167,504749,1,3,17.0,17389183,6654,Inactive,,,,,qHTS profiling for inhibitors of Plasmodium falciparum proliferation,Other,21817045.0,
168,504749,1,3,18.0,17389183,6654,Inactive,,,,,qHTS profiling for inhibitors of Plasmodium falciparum proliferation,Other,21817045.0,
169,504749,1,3,19.0,17389183,6654,Inactive,,,,,qHTS profiling for inhibitors of Plasmodium falciparum proliferation,Other,21817045.0,
170,504749,1,3,20.0,17389183,6654,Inactive,,,,,qHTS profiling for inhibitors of Plasmodium falciparum proliferation,Other,21817045.0,
171,504749,1,3,21.0,17389183,6654,Inactive,,,,,qHTS profiling for inhibitors of Plasmodium falciparum proliferation,Other,21817045.0,
172,504749,1,3,22.0,17389183,6654,Inactive,,,,,qHTS profiling for inhibitors of Plasmodium falciparum proliferation,Other,21817045.0,
173,504749,1,3,23.0,17389183,6654,Inactive,,,,,qHTS profiling for inhibitors of Plasmodium falciparum proliferation,Other,21817045.0,
174,504749,1,3,24.0,17389183,6654,Inactive,,,,,qHTS profiling for inhibitors of Plasmodium falciparum proliferation,Other,21817045.0,
175,504749,1,3,25.0,17389183,6654,Inactive,,,,,qHTS profiling for inhibitors of Plasmodium falciparum proliferation,Other,21817045.0,
176,504749,1,3,26.0,17389183,6654,Inactive,,,,,qHTS profiling for inhibitors of Plasmodium falciparum proliferation,Other,21817045.0,
177,504749,1,3,27.0,17389183,6654,Inactive,,,,,qHTS profiling for inhibitors of Plasmodium falciparum proliferation,Other,21817045.0,
178,504749,1,3,28.0,17389183,6654,Inactive,,,,,qHTS profiling for inhibitors of Plasmodium falciparum proliferation,Other,21817045.0,
179,504749,1,3,29.0,17389183,6654,Inactive,,,,,qHTS profiling for inhibitors of Plasmodium falciparum proliferation,Other,21817045.0,
180,504749,1,3,30.0,17389183,6654,Inactive,,,,,qHTS profiling for inhibitors of Plasmodium falciparum proliferation,Other,21817045.0,
181,504749,1,3,31.0,17389183,6654,Inactive,,,,,qHTS profiling for inhibitors of Plasmodium falciparum proliferation,Other,21817045.0,
182,504749,1,3,32.0,17389183,6654,Inactive,,,,,qHTS profiling for inhibitors of Plasmodium falciparum proliferation,Other,21817045.0,
183,504749,1,3,33.0,17389183,6654,Inactive,,,,,qHTS profiling for inhibitors of Plasmodium falciparum proliferation,Other,21817045.0,
184,504749,1,3,34.0,17389183,6654,Inactive,,,,,qHTS profiling for inhibitors of Plasmodium falciparum proliferation,Other,21817045.0,
185,504749,1,3,35.0,17389183,6654,Inactive,,,,,qHTS profiling for inhibitors of Plasmodium falciparum proliferation,Other,21817045.0,
186,504749,1,3,36.0,17389183,6654,Inactive,,,,,qHTS profiling for inhibitors of Plasmodium falciparum proliferation,Other,21817045.0,
187,504749,1,3,37.0,17389183,6654,Inactive,,,,,qHTS profiling for inhibitors of Plasmodium falciparum proliferation,Other,21817045.0,
188,504749,1,3,38.0,17389183,6654,Inactive,,,,,qHTS profiling for inhibitors of Plasmodium falciparum proliferation,Other,21817045.0,
189,504749,1,3,39.0,17389183,6654,Inactive,,,,,qHTS profiling for inhibitors of Plasmodium falciparum proliferation,Other,21817045.0,
190,504749,1,3,40.0,17389183,6654,Inactive,,,,,qHTS profiling for inhibitors of Plasmodium falciparum proliferation,Other,21817045.0,
191,504749,1,3,41.0,17389183,6654,Inactive,,,,,qHTS profiling for inhibitors of Plasmodium falciparum proliferation,Other,21817045.0,
192,504749,1,3,42.0,17389183,6654,Inactive,,,,,qHTS profiling for inhibitors of Plasmodium falciparum proliferation,Other,21817045.0,
193,504749,1,3,43.0,17389183,6654,Inactive,,,,,qHTS profiling for inhibitors of Plasmodium falciparum proliferation,Other,21817045.0,
194,504749,1,3,44.0,17389183,6654,Inactive,,,,,qHTS profiling for inhibitors of Plasmodium falciparum proliferation,Other,21817045.0,
195,504749,1,3,45.0,17389183,6654,Inactive,,,,,qHTS profiling for inhibitors of Plasmodium falciparum proliferation,Other,21817045.0,
196,504749,1,3,46.0,17389183,6654,Inactive,,,,,qHTS profiling for inhibitors of Plasmodium falciparum proliferation,Other,21817045.0,
