,AID,AID Version,AID Revision,Panel Member ID,SID,CID,Bioactivity Outcome,Target GI,Target GeneID,Activity Value [uM],Activity Name,Assay Name,Bioassay Type,PubMed ID,RNAi
309,602396,1,2,,85147165,31070,Inactive,4504343.0,2494.0,,,Luminescence-based cell-based primary high throughput screening assay to identify inverse agonists of the liver receptor homolog-1 (LRH-1; NR5A2),Screening,,
310,602399,1,2,,85147165,31070,Inactive,15927174.0,,,,uHTS identification of inhibitors of NadD in a Colorimetric assay,Screening,,
311,602405,1,1,,85147165,31070,Inactive,75495260.0,,,,PgID: DNTB colorimetric HTS to detect inhibitor of PgID Measured in Biochemical System Using Plate Reader - 2164-01_Inhibitor_SinglePoint_HTS_Activity,Screening,,
312,602410,1,1,,85147165,31070,Inactive,11093520.0,3777.0,,,Primary cell-based screen for identification of compounds that inhibit the two-pore domain potassium channel KCNK3,Screening,,
313,602429,1,1,,85147165,31070,Inactive,1762973.0,7341.0,,,uHTS identification of SUMO1-mediated protein-protein interactions,Screening,,
314,602438,1,1,,85147165,31070,Inactive,160877737.0,,,,uHTS identification of modulators of interaction between CendR and NRP-1 using Fluorescence Polarization assay,Screening,,
315,602440,1,1,,85147165,31070,Inactive,262118306.0,123228.0,,,uHTS Fluorescent Assay Using Nedd8 Protein Substrate for Identification of Inhibitors of Sentrin-Specific Protease 8 (SENP8),Screening,,
316,602449,1,2,,85147165,31070,Inactive,,,,,uHTS identification of small molecule inhibitors of the mitochondrial permeability transition pore via an absorbance assay,Screening,,
317,602481,1,1,,85147165,31070,Inactive,378544807.0,,,,Mycobacterium tuberculosis BioA enzyme inhibitor Measured in Biochemical System Using Plate Reader - 2163-01_Inhibitor_SinglePoint_HTS_Activity,Screening,,
318,623870,1,1,,85147165,31070,Inactive,2702319.0,405.0,,,ARNT-TAC3: AlphaScreen HTS to detect disruption of ARNT/TAC3 interactions Measured in Biochemical System Using Plate Reader - 2158-01_Inhibitor_SinglePoint_HTS_Activity,Screening,,
319,623870,1,1,,85147165,31070,Inactive,5454102.0,10460.0,,,ARNT-TAC3: AlphaScreen HTS to detect disruption of ARNT/TAC3 interactions Measured in Biochemical System Using Plate Reader - 2158-01_Inhibitor_SinglePoint_HTS_Activity,Screening,,
320,623877,1,1,,85147165,31070,Inactive,334278898.0,101772.0,,,Primary cell-based high-throughput screening for identification of compounds that activate/potentiate calcium-activated chloride channels (TMEM16A),Screening,,
321,624030,1,2,,124891424,31070,Inactive,160794.0,,,Potency,Biochemical firefly luciferase enzyme assay for NPC,Confirmatory,,
322,624037,1,3,,85147165,31070,Inactive,7108336.0,1133.0,,,"Fluorescence-based cell-based primary high throughput screening assay to identify agonists of the human cholinergic receptor, muscarinic 5 (CHRM5)",Screening,,
323,624038,1,3,,85147165,31070,Inactive,7108336.0,1133.0,,,"Fluorescence-based cell-based primary high throughput screening assay to identify positive allosteric modulators (PAMs) of the human cholinergic receptor, muscarinic 5 (CHRM5)",Screening,,
324,624040,1,3,,85147165,31070,Inactive,7108336.0,1133.0,,,"Fluorescence-based cell-based primary high throughput screening assay to identify antagonists of the human cholinergic receptor, muscarinic 5 (CHRM5)",Screening,,
325,624125,1,4,,85147165,31070,Inactive,52426748.0,1132.0,,,"Fluorescence-based cell-based primary high throughput screening assay to identify antagonists of the human cholinergic receptor, muscarinic 4 (CHRM4)",Screening,,
326,624126,1,3,,85147165,31070,Inactive,52426748.0,1132.0,,,"Fluorescence-based cell-based primary high throughput screening assay to identify positive allosteric modulators (PAMs) of the human cholinergic receptor, muscarinic 4 (CHRM4)",Screening,,
327,624127,1,2,,85147165,31070,Inactive,52426748.0,1132.0,,,"Fluorescence-based cell-based primary high throughput screening assay to identify agonists of the human cholinergic receptor, muscarinic 4 (CHRM4)",Screening,,
328,624168,1,1,,85147165,31070,Inactive,47678551.0,9215.0,,,uHTS identification of small molecule activators of alpha dystroglycan glycosylation,Screening,,
329,624169,1,1,,85147165,31070,Inactive,27753985.0,15558.0,,,Luminescence-based cell-based primary high throughput screening assay to identify agonists of the mouse 5-hydroxytryptamine (serotonin) receptor 2A (HTR2A),Screening,,
330,624170,1,1,,85147165,31070,Inactive,71051501.0,2744.0,,Potency,qHTS for Inhibitors of Glutaminase (GLS),Confirmatory,,
331,624170,1,1,,124891424,31070,Inactive,71051501.0,2744.0,,Potency,qHTS for Inhibitors of Glutaminase (GLS),Confirmatory,,
332,624171,1,1,,85147165,31070,Inactive,693842.0,4780.0,,Potency,qHTS of Nrf2 Activators,Confirmatory,,
333,624172,1,1,,85147165,31070,Inactive,1724069.0,2740.0,,Potency,qHTS of GLP-1 Receptor Agonists,Confirmatory,,
334,624172,1,1,,124891424,31070,Inactive,1724069.0,2740.0,,Potency,qHTS of GLP-1 Receptor Agonists,Confirmatory,,
335,624173,1,3,,85147165,31070,Inactive,62359610.0,,,Potency,qHTS of Trypanosoma Brucei Inhibitors,Confirmatory,,
336,624173,1,3,,124891424,31070,Inactive,62359610.0,,,Potency,qHTS of Trypanosoma Brucei Inhibitors,Confirmatory,,
337,624178,1,1,,85147165,31070,Unspecified,179095.0,6609.0,,Potency,qHTS for Inhibitors of Human Acid Sphingomyelinase Assay: Native Substrate,Confirmatory,,
338,624202,1,1,,85147165,31070,Inactive,1698399.0,672.0,,Potency,qHTS Assay to Identify Small Molecule Activators of BRCA1 Expression,Confirmatory,,
339,624204,1,2,,85147165,31070,Inactive,7657550.0,,,,"uHTS identification of small molecule inhibitors of the catalytic domain of the SUMO protease, SENP1 in a FRET assay",Screening,,
340,624246,1,1,,85147165,31070,Inactive,343478176.0,2078.0,,Potency,qHTS for Small Molecule Inhibitors of the ERG Ets/DNA interaction,Confirmatory,,
341,624256,1,2,,85147165,31070,Inactive,,3205.0,,,HTS to identify compounds that promote myeloid differentiation with MLPCN compound set,Screening,,
342,624263,1,1,,85147165,31070,Inactive,3063388.0,5071.0,,Potency,A Quantitative High throughput Screen to Identify Chemical Modulators of PINK1 Expression,Confirmatory,,
343,624263,1,1,,85147165,31070,Inactive,37183032.0,,,Potency,A Quantitative High throughput Screen to Identify Chemical Modulators of PINK1 Expression,Confirmatory,,
344,624267,1,2,,85147165,31070,Inactive,4506537.0,8767.0,,,Fluorescence-based cell-based primary high throughput screening assay to identify inhibitors of the interaction of nucleotide-binding oligomerization domain containing 2 (NOD2) and the receptor-interacting serine-threonine kinase 2 (RIPK2),Screening,,
345,624267,1,2,,85147165,31070,Inactive,119603173.0,64127.0,,,Fluorescence-based cell-based primary high throughput screening assay to identify inhibitors of the interaction of nucleotide-binding oligomerization domain containing 2 (NOD2) and the receptor-interacting serine-threonine kinase 2 (RIPK2),Screening,,
346,624268,1,3,,85147165,31070,Inactive,71746704.0,3662741.0,,,Luminescence-based biochemical primary high throughput screening assay to identify inhibitors of Trypanosoma brucei methionyl tRNA synthetase (MetRS),Screening,,
347,624287,1,1,,85147165,31070,Inconclusive,52000961.0,2778.0,3.5481,Potency,"qHTS for Agonist of gsp, the Etiologic Mutation Responsible for Fibrous Dysplasia/McCune-Albright Syndrome: qHTS",Confirmatory,,
348,624288,1,1,,85147165,31070,Inactive,52000961.0,2778.0,,Potency,"qHTS for Antagonists of gsp, the Etiologic Mutation Responsible for Fibrous Dysplasia/McCune-Albright Syndrome: qHTS",Confirmatory,,
349,624291,1,1,,85147165,31070,Inactive,121312.0,1081.0,,Potency,qHTS for Activators of Integrin-Mediated Alleviation for Muscular Dystrophy,Confirmatory,,
350,624296,1,1,,85147165,31070,Inactive,7705682.0,51053.0,,Potency,A quantitative high throughput screen for small molecules that induce DNA re-replication in MCF 10a normal breast cells.,Confirmatory,,
351,624297,1,1,,85147165,31070,Inactive,7705682.0,51053.0,,Potency,A quantitative high throughput screen for small molecules that induce DNA re-replication in SW480 colon adenocarcinoma cells.,Confirmatory,,
352,624304,1,2,,85147165,31070,Inactive,25148072.0,177343.0,,,uHTS identification of SKN-1 Inhibitors in a fluoresence assay,Screening,,
353,624330,1,2,,85147165,31070,Inactive,21361397.0,29127.0,,IC50,Discovery of small molecule inhibitors of the oncogenic and cytokinetic protein MgcRacGAP -  Primary and Confirmatory Screens,Confirmatory,,
354,624352,1,1,,85147165,31070,Inactive,40254439.0,2034.0,,,uHTS identification of HIF-2a Inhibitors in a luminesence assay,Screening,,
355,624354,1,1,,85147165,31070,Inactive,224494019.0,8795.0,,,uHTS identification of Caspase-8 TRAIL sensitizers in a luminesence assay,Screening,,
356,624377,1,1,,85147165,31070,Inactive,351542238.0,50807.0,,,"Fluorescence polarization-based biochemical primary high throughput screening assay to identify inhibitors of ArfGAP with SH3 domain, ankyrin repeat and PH domain 1 (ASAP1)",Screening,,
357,624414,1,1,,85147165,31070,Inactive,10092597.0,57192.0,,,qHTS for Agonists of the Human Mucolipin Transient Receptor Potential 1 (TRPML1),Screening,,
358,624415,1,2,,85147165,31070,Inactive,10092597.0,57192.0,,,qHTS for Inhibitors of the Human Mucolipin Transient Receptor Potential 1 (TRPML1),Screening,,
359,624416,1,1,,85147165,31070,Inactive,9629363.0,155971.0,,,"TRFRET-based biochemical primary high throughput screening assay to identify small molecules that bind to the HIV-1-gp120 binding antibody, PG9",Screening,,
360,624417,1,1,,85147165,31070,Inactive,1724069.0,2740.0,,Potency,qHTS of GLP-1 Receptor Inverse Agonists (Inhibition Mode),Confirmatory,,
361,624418,1,1,,85147165,31070,Inactive,,,,Potency,qHTS of GLP-1 Receptor Inverse Agonists: Cytotox Screen,Confirmatory,,
362,624463,1,1,,85147165,31070,Inactive,4503385.0,1813.0,,,Beta-Arrestin HTS for Positive Allosteric Modulators of the Human D2 Dopamine Receptor: Antagonists,Other,,
363,624464,1,1,,85147165,31070,Inactive,4503385.0,1813.0,,,Beta-Arrestin HTS for Positive Allosteric Modulators of the Human D2 Dopamine Receptor: Potentiators,Other,,
364,624465,1,1,,85147165,31070,Inactive,4503385.0,1813.0,,,Beta-Arrestin HTS for Positive Allosteric Modulators of the Human D2 Dopamine Receptor: Agonists,Other,,
365,624466,1,3,,85147165,31070,Inactive,21264324.0,134864.0,,,Fluorescence-based cell-based primary high throughput screening assay to identify antagonists of the human trace amine associated receptor 1 (TAAR1),Screening,,
366,624467,1,1,,85147165,31070,Inactive,21264324.0,134864.0,,,Fluorescence-based cell-based primary high throughput screening assay to identify agonists of the human trace amine associated receptor 1 (TAAR1),Screening,,
367,624483,1,1,,85147165,31070,Inactive,,,,,Counterscreen of compound fluorescence effects on High-throughput multiplex microsphere screening for inhibitors of toxin protease,Screening,,
368,651550,1,1,,85147165,31070,Inactive,60391226.0,207.0,,,HTS Assay for Inhibitors of Akt Phophorylation: Primary Screen,Screening,,
369,651560,1,1,,85147165,31070,Inactive,1709543.0,52.0,,,"uHTS identification of small molecule inhibitors of Low Molecular Weight Protein Tyrosine Phosphatase, LMPTP, via a fluorescence intensity assay",Screening,,
370,651572,1,2,,85147165,31070,Inactive,21489979.0,246310.0,,,Fluorescence polarization-based biochemical primary high throughput screening assay to identify inhibitors of ADP-ribosylation factor GTPase activating protein 1 (ARFGAP1),Screening,,
371,651582,1,1,,85147165,31070,Inactive,,,,,uHTS identification of small molecule Triacylglycerol inhbitors in a fluoresence assay,Screening,,
372,651602,1,1,,85147165,31070,Inactive,16130723.0,947287.0,,,Absorbance-based primary bacterial cell-based high throughput screening assay to identify inhibitors of RecBCD (with phage),Screening,,
373,651602,1,1,,85147165,31070,Inactive,16130724.0,947286.0,,,Absorbance-based primary bacterial cell-based high throughput screening assay to identify inhibitors of RecBCD (with phage),Screening,,
374,651602,1,1,,85147165,31070,Inactive,16130726.0,947294.0,,,Absorbance-based primary bacterial cell-based high throughput screening assay to identify inhibitors of RecBCD (with phage),Screening,,
375,651631,4,1,,144214042,31070,Inconclusive,269849759.0,7157.0,68.5896,Potency-Replicate_1,qHTS assay for small molecule agonists of the p53 signaling pathway,Confirmatory,,
376,651632,4,1,,144214042,31070,Inactive,296439460.0,79915.0,,Potency-Replicate_1,qHTS assay for small molecules that induce genotoxicity in human embryonic kidney cells expressing luciferase-tagged ATAD5,Confirmatory,,
377,651633,4,1,,144214042,31070,Inconclusive,,,48.5577,Potency-Replicate_1,qHTS assay for small molecule agonists of the p53 signaling pathway - cell viability,Confirmatory,,
378,651634,4,1,,144214042,31070,Inconclusive,,,68.5896,Potency-Replicate_1,qHTS assay for small molecules that induce genotoxicity in human embryonic kidney cells expressing luciferase-tagged ATAD5 - cell viability,Confirmatory,,
379,651635,1,3,,85147165,31070,Inactive,171543895.0,6311.0,,Potency,qHTS for Inhibitors of ATXN expression,Confirmatory,,
380,651636,1,1,,85147165,31070,Inactive,4826706.0,1880.0,,,uHTS identification of small molecule antagonists of the EBI2 receptor via a luminescent beta-arrestin assay,Screening,,
381,651640,1,1,,85147165,31070,Inactive,,,,,DENV2 CPE-Based HTS Measured in Cell-Based and Microorganism Combination System Using Plate Reader - 2149-01_Other_SinglePoint_HTS_Activity,Screening,,
382,651644,1,1,,85147165,31070,Inactive,28872817.0,155807.0,,Potency,qHTS Assay for Inhibitors of the HIV-1 protein Vpr,Confirmatory,,
383,651647,1,1,,85147165,31070,Inactive,4826834.0,4323.0,,,uHTS identification of inhibitors of MT1-MMP activation in a fluoresence assay,Screening,,
384,651654,1,1,,85147165,31070,Inactive,,,,,HTS for the detection of C. neoformans cell lysis via adenylate kinase (AK) release Measured in Microorganism System Using Plate Reader - 2162-01_Inhibitor_SinglePoint_HTS_Activity,Screening,,
385,651658,1,1,,85147165,31070,Inactive,10190672.0,27006.0,,,Small Molecule Inhibitors of FGF22-Mediated Excitatory Synaptogenesis & Epilepsy Measured in Biochemical System Using RT-PCR - 7012-01_Inhibitor_SinglePoint_HTS_Activity,Screening,,
386,651661,2,1,,85147165,31070,Inactive,,,,,Luminescence Cell-Based Primary HTS to identify inhibitors of the oncoprotein EWS/Fli transcriptional activity Measured in Cell-Based System Using Plate Reader - 7014-01_Inhibitor_SinglePoint_HTS_Activity,Screening,,
387,651699,1,1,,85147165,31070,Inactive,4502169.0,8883.0,,,uHTS identification of inhibitors of cullin neddylation in a TR-FRET assay,Screening,,
388,651699,1,1,,85147165,31070,Inactive,4507791.0,9040.0,,,uHTS identification of inhibitors of cullin neddylation in a TR-FRET assay,Screening,,
389,651702,1,2,,85147165,31070,Inactive,,,,,Flow Cytometric HTS Screening for Inhibitors of Lytic Granule Exocytosis with MLPCN Compound Library,Screening,,
390,651704,2,1,,85147165,31070,Inactive,156104889.0,4300.0,,,Inhibition of the MLL-AF4-AF9 Interaction in Pediatric Leukemia Measured in Biochemical System Using Plate Reader - 2160-01_Inhibitor_SinglePoint_HTS_Activity,Screening,,
391,651710,1,1,,85147165,31070,Inactive,109637798.0,5893.0,,,FRET-based HTS for detection of RAD52 Inhibitors Measured in Biochemical System Using Plate Reader - 7018-01_Inhibitor_SinglePoint_HTS_Activity_Set2,Screening,,
392,651711,2,1,,85147165,31070,Inactive,2501205.0,10130.0,,,Turbidometric Biochemical  Primary HTS  to identify inhibitors of ERp5 Measured in Biochemical System Using Plate Reader - 7002-01_Inhibitor_SinglePoint_HTS_Activity,Screening,,
393,651718,1,2,,85147165,31070,Inactive,73586699.0,281312.0,,,Absorbance-based biochemical primary high throughput screening assay to identify inhibitors of Methionine sulfoxide reductase A (MsrA),Screening,,
394,651719,1,2,,85147165,31070,Inactive,4503907.0,8484.0,,,Fluorescence-based cell-based primary high throughput screening assay to identify antagonists of the Galanin Receptor 3 (GalR3),Screening,,
395,651724,1,1,,85147165,31070,Inactive,1730321.0,5932.0,,,qHTS Assay for Inhibitors of the CtBP/E1A Interaction,Screening,,
396,651725,1,1,,85147165,31070,Inactive,1246761.0,6495.0,,,qHTS Assay for Inhibitors of the Six1/Eya2 Interaction,Screening,,
397,651741,1,1,,17388788,31070,Inconclusive,20149576.0,4780.0,47.3079,Potency,qHTS assay for small molecule agonists of the antioxidant response element (ARE) signaling pathway,Confirmatory,,
398,651741,1,1,,26753116,31070,Inconclusive,20149576.0,4780.0,61.1306,Potency,qHTS assay for small molecule agonists of the antioxidant response element (ARE) signaling pathway,Confirmatory,,
399,651743,1,1,,17388788,31070,Inactive,269849759.0,7157.0,,Potency,qHTS assay for small molecule activators of the p53 signaling pathway,Confirmatory,,
400,651743,1,1,,26753116,31070,Inactive,269849759.0,7157.0,,Potency,qHTS assay for small molecule activators of the p53 signaling pathway,Confirmatory,,
401,651749,1,1,,17388788,31070,Inactive,34577122.0,4790.0,,Potency,qHTS assay for small molecule activators of the nuclear factor-kappa B (NF-kB) signaling pathway,Confirmatory,,
402,651749,1,1,,26753116,31070,Inactive,34577122.0,4790.0,,Potency,qHTS assay for small molecule activators of the nuclear factor-kappa B (NF-kB) signaling pathway,Confirmatory,,
403,651751,1,1,,17388788,31070,Inactive,5702233.0,84385.0,,Potency,qHTS assay for small molecule activators of the rat pregnane X receptor (rPXR) signaling pathway,Confirmatory,,
404,651751,1,1,,26753116,31070,Inactive,5702233.0,84385.0,,Potency,qHTS assay for small molecule activators of the rat pregnane X receptor (rPXR) signaling pathway,Confirmatory,,
405,651754,1,1,,17388788,31070,Inactive,,,,Potency,qHTS assay for small molecule disruptors of the mitochondrial membrane potential - 1 hr assay,Confirmatory,,
406,651755,1,1,,17388788,31070,Inactive,,,,Potency,qHTS assay for small molecule disruptors of the mitochondrial membrane potential - 5 hr assay,Confirmatory,,
407,651757,1,1,,17388788,31070,Inactive,25952111.0,7124.0,,Potency,qHTS assay to identify small molecules that stimulate Tumor Necrosis Factor-alpha (TNF-alpha) secretion,Confirmatory,,
408,651758,1,1,,17388788,31070,Inactive,186368.0,3576.0,,Potency,qHTS assay to identify small molecules that stimulate interleukin-8 (IL-8) secretion,Confirmatory,,
409,651768,1,2,,85147165,31070,Inactive,3719421.0,7486.0,,Potency,qHTS for Inhibitors of WRN Helicase,Confirmatory,,
410,651777,1,1,,17388788,31070,Inactive,51095037.0,196.0,,Potency,qHTS assay for environmental chemicals that activate the Aryl hydrocarbon Receptor (AhR) signaling pathway,Confirmatory,,
411,651777,1,1,,26753116,31070,Inactive,51095037.0,196.0,,Potency,qHTS assay for environmental chemicals that activate the Aryl hydrocarbon Receptor (AhR) signaling pathway,Confirmatory,,
412,651778,1,1,,17388788,31070,Inactive,3041727.0,5465.0,,Potency,qHTS assay for small molecule agonists of the peroxisome proliferator-activated receptor alpha (PPARalpha) signaling pathway,Confirmatory,,
413,651778,1,1,,26753116,31070,Inactive,3041727.0,5465.0,,Potency,qHTS assay for small molecule agonists of the peroxisome proliferator-activated receptor alpha (PPARalpha) signaling pathway,Confirmatory,,
414,651800,1,1,,85147165,31070,Inactive,2358024.0,6955.0,,,Fluorescence-based biochemical primary high throughput assay to identify inhibitors of T-cell receptor (TCR)-CD3 interaction using a TAMRA-labeled TCR probe,Screening,,
415,651802,1,1,,17388788,31070,Inactive,49066040.0,6097.0,,Potency,qHTS assay for small molecule antagonists of the retinoid-related orphan receptor gamma (ROR-gamma) signaling pathway,Confirmatory,,
416,651819,1,1,,85147165,31070,Inactive,83758679.0,153562.0,,,High-Throughput Screening for Modulators of Cytosolic Chaperonin Activity,Screening,,
417,651820,1,1,,85147165,31070,Inactive,,,,Potency,qHTS Assay for Inhibitors of Hepatitis C Virus (HCV),Confirmatory,,
418,651821,2,4,,85147165,31070,Inactive,,,,,Fluorescence-based biochemical primary high throughput screening assay to identify molecules that bind r(CAG) RNA repeats,Screening,,
419,651838,1,1,,17388788,31070,Unspecified,,,,,qHTS assay for identifying genotoxic compounds that show differential cytotoxicity against a panel of isogenic chicken DT40 cell lines with known DNA damage response pathways,Other,,
420,651838,1,1,,26753116,31070,Unspecified,,,,,qHTS assay for identifying genotoxic compounds that show differential cytotoxicity against a panel of isogenic chicken DT40 cell lines with known DNA damage response pathways,Other,,
421,651838,1,1,1.0,17388788,31070,Inconclusive,,,,,qHTS assay for identifying genotoxic compounds that show differential cytotoxicity against a panel of isogenic chicken DT40 cell lines with known DNA damage response pathways,Other,,
422,651838,1,1,1.0,26753116,31070,Inactive,,,,,qHTS assay for identifying genotoxic compounds that show differential cytotoxicity against a panel of isogenic chicken DT40 cell lines with known DNA damage response pathways,Other,,
423,651838,1,1,2.0,17388788,31070,Inconclusive,,,,,qHTS assay for identifying genotoxic compounds that show differential cytotoxicity against a panel of isogenic chicken DT40 cell lines with known DNA damage response pathways,Other,,
424,651838,1,1,2.0,26753116,31070,Inconclusive,,,,,qHTS assay for identifying genotoxic compounds that show differential cytotoxicity against a panel of isogenic chicken DT40 cell lines with known DNA damage response pathways,Other,,
425,651838,1,1,3.0,17388788,31070,Inconclusive,,,,,qHTS assay for identifying genotoxic compounds that show differential cytotoxicity against a panel of isogenic chicken DT40 cell lines with known DNA damage response pathways,Other,,
426,651838,1,1,3.0,26753116,31070,Inconclusive,,,,,qHTS assay for identifying genotoxic compounds that show differential cytotoxicity against a panel of isogenic chicken DT40 cell lines with known DNA damage response pathways,Other,,
427,651838,1,1,4.0,17388788,31070,Active,,,,,qHTS assay for identifying genotoxic compounds that show differential cytotoxicity against a panel of isogenic chicken DT40 cell lines with known DNA damage response pathways,Other,,
428,651838,1,1,4.0,26753116,31070,Inconclusive,,,,,qHTS assay for identifying genotoxic compounds that show differential cytotoxicity against a panel of isogenic chicken DT40 cell lines with known DNA damage response pathways,Other,,
429,651838,1,1,5.0,17388788,31070,Inactive,,,,,qHTS assay for identifying genotoxic compounds that show differential cytotoxicity against a panel of isogenic chicken DT40 cell lines with known DNA damage response pathways,Other,,
430,651838,1,1,5.0,26753116,31070,Inactive,,,,,qHTS assay for identifying genotoxic compounds that show differential cytotoxicity against a panel of isogenic chicken DT40 cell lines with known DNA damage response pathways,Other,,
431,651838,1,1,6.0,17388788,31070,Active,,,,,qHTS assay for identifying genotoxic compounds that show differential cytotoxicity against a panel of isogenic chicken DT40 cell lines with known DNA damage response pathways,Other,,
432,651838,1,1,6.0,26753116,31070,Inconclusive,,,,,qHTS assay for identifying genotoxic compounds that show differential cytotoxicity against a panel of isogenic chicken DT40 cell lines with known DNA damage response pathways,Other,,
433,651838,1,1,7.0,17388788,31070,Active,,,,,qHTS assay for identifying genotoxic compounds that show differential cytotoxicity against a panel of isogenic chicken DT40 cell lines with known DNA damage response pathways,Other,,
434,651838,1,1,7.0,26753116,31070,Inactive,,,,,qHTS assay for identifying genotoxic compounds that show differential cytotoxicity against a panel of isogenic chicken DT40 cell lines with known DNA damage response pathways,Other,,
435,651838,1,1,8.0,17388788,31070,Inactive,,,,,qHTS assay for identifying genotoxic compounds that show differential cytotoxicity against a panel of isogenic chicken DT40 cell lines with known DNA damage response pathways,Other,,
436,651838,1,1,8.0,26753116,31070,Inactive,,,,,qHTS assay for identifying genotoxic compounds that show differential cytotoxicity against a panel of isogenic chicken DT40 cell lines with known DNA damage response pathways,Other,,
437,651957,1,1,,85147165,31070,Inactive,5729858.0,10499.0,,,Luminescence-based cell-based primary high throughput screening assay to identify inhibitors of the Steroid Receptor Coactivator 2 (SRC2; NCOA2),Screening,,
438,651958,1,1,,85147165,31070,Inactive,76364066.0,2943075.0,,,Fluorescence-based biochemical high throughput screening primary assay to identify inhibitors of Crimean-Congo Hemorrhagic Fever (CCHF) viral ovarian tumor domain protease (vOTU): Pep-AMC substrate,Screening,,
439,651965,1,1,,85147165,31070,Inactive,2668494.0,,,Potency,qHTS Assay for Activators of ClpP,Confirmatory,,
440,651999,1,1,,85147165,31070,Inactive,38027923.0,10987.0,,,"uHTS identification of small molecule inhibitors of Csn-mediated Deneddylation of Cullin-Ring Ligases, vis a fluorescence polarization assay",Screening,,
441,652010,1,1,,85147165,31070,Inactive,5016090.0,190.0,,,"Luminescence-based cell-based primary high throughput screening assay for inhibitors of the orphan nuclear receptor subfamily 0, group B, member 1 (DAX1; NR0B1): repression of SF-1 (NR5A1) activated StAR promoter by full-length DAX-1",Screening,,
442,652017,1,1,,85147165,31070,Inactive,119579215.0,6595.0,,,"Luminescence-based cell-based primary high throughput screening assay to identify activators of the function of SWI/SNF related, matrix associated, actin dependent regulator of chromatin, subfamily a, member 2 (SMARCA2, BRM)",Screening,,
443,652025,1,1,,85147165,31070,Inactive,7110653.0,16183.0,,Potency,qHTS of IL-2 Activators,Confirmatory,,
