,AID,AID Version,AID Revision,Panel Member ID,SID,CID,Bioactivity Outcome,Target GI,Target GeneID,Activity Value [uM],Activity Name,Assay Name,Bioassay Type,PubMed ID,RNAi
0,421,1,3,,17388788,31070,Inactive,,,,,Cell Viability - BJ,Confirmatory,,
1,426,1,2,,17388788,31070,Inactive,,,,,Cell Viability - Jurkat,Confirmatory,,
2,427,1,1,,17388788,31070,Inactive,,,,,Cell Viability - Hek293,Confirmatory,,
3,433,1,1,,17388788,31070,Inactive,,,,,Cell Viability - HepG2,Confirmatory,,
4,434,1,2,,17388788,31070,Inactive,,,,,Cell Viability - MRC5,Confirmatory,,
5,435,1,2,,17388788,31070,Inactive,,,,,Cell Viability - SK-N-SH,Confirmatory,,
6,445,3,1,,17388788,31070,Inactive,10092619.0,4792.0,,,IkB Signaling,Confirmatory,,
7,530,1,1,,17388788,31070,Inactive,2499604.0,26414.0,,,JNK3 AlphaScreen Assay,Confirmatory,,
8,540,1,1,,17388788,31070,Inactive,,,,,Cell Viability - N2a,Confirmatory,,
9,541,1,1,,17388788,31070,Inconclusive,,,,,Cell Viability - NIH 3T3,Confirmatory,,
10,542,1,1,,17388788,31070,Inactive,,,,,Cell Viability - HUV-EC-C,Confirmatory,,
11,543,1,1,,17388788,31070,Inactive,,,,,Cell Viability - H-4-II-E,Confirmatory,,
12,544,2,1,,17388788,31070,Active,,,,,Cell Viability - SH-SY5Y,Confirmatory,,
13,545,1,1,,17388788,31070,Inactive,,,,,Cell Viability - Renal Proximal Tubule,Confirmatory,,
14,546,1,1,,17388788,31070,Inactive,,,,,Cell Viability - Mesenchymal,Confirmatory,,
15,584,1,3,,17388788,31070,Inactive,119389684.0,,,,Promiscuous and Specific Inhibitors of AmpC Beta-Lactamase (assay with detergent),Confirmatory,,
16,585,1,4,,17388788,31070,Inactive,119389684.0,,,,Promiscuous and Specific Inhibitors of AmpC Beta-Lactamase (assay without detergent),Confirmatory,,
17,595,1,3,,17388788,31070,Inactive,,,,,qHTS Assay for Disrupters of an Hsp90 Co-Chaperone Interaction,Confirmatory,,
18,596,1,2,,17388788,31070,Inactive,92096784.0,4137.0,,,qHTS Assay for Tau Filament Binding,Confirmatory,,
19,603,1,2,,17388788,31070,Inactive,,,,,qHTS Assay for Inhibitors of DNA Polymerase III Holoenzyme System,Confirmatory,,
20,605,1,2,,17388788,31070,Inactive,84028058.0,,,,qHTS Assay for Inhibitors of YjeE,Confirmatory,,
21,654,1,1,,17388788,31070,Inactive,,,,,Cellular Toxicity (caspase-3) HepG2,Confirmatory,,
22,655,1,1,,17388788,31070,Inactive,,,,,Cellular Toxicity (caspase-3) Jurkat,Confirmatory,,
23,656,1,1,,17388788,31070,Inactive,,,,,Cellular Toxicity (caspase-3) HUV-EC-C,Confirmatory,,
24,657,1,1,,17388788,31070,Inactive,,,,,Cellular Toxicity (caspase-3) SHSY5Y,Confirmatory,,
25,658,1,1,,17388788,31070,Inactive,,,,,Cellular Toxicity (caspase-3) BJ,Confirmatory,,
26,659,1,1,,17388788,31070,Inactive,,,,,Cellular Toxicity (caspase-3) MRC-5,Confirmatory,,
27,660,1,1,,17388788,31070,Inactive,,,,,Cellular Toxicity (caspase-3) Mesangial,Confirmatory,,
28,661,1,1,,17388788,31070,Inactive,,,,,Cellular Toxicity (caspase-3) SK-N-SH,Confirmatory,,
29,662,1,1,,17388788,31070,Inactive,,,,,Cell signaling CRE-BLA (Fsk stim),Confirmatory,,
30,663,1,1,,17388788,31070,Inactive,,,,,Cellular Toxicity (caspase-3) H-4-II-E,Confirmatory,,
31,664,1,1,,17388788,31070,Inactive,,,,,Cellular Toxicity (caspase-3) Hek293,Confirmatory,,
32,665,1,1,,17388788,31070,Inactive,,,,,Cellular Toxicity (caspase-3) N2a,Confirmatory,,
33,666,1,1,,17388788,31070,Inactive,,,,,Cellular Toxicity (caspase-3) NIH 3T3,Confirmatory,,
34,667,1,1,,17388788,31070,Inactive,,,,,Cellular Toxicity (caspase-3) Renal Proximal Tubule,Confirmatory,,
35,875,1,2,,17388788,31070,Inactive,159162802.0,,,Potency,qHTS Assay for Inhibitors of BRCT-Phosphoprotein Interaction (Green Fluorophore),Confirmatory,,
36,880,2,1,,17388788,31070,Inactive,3290016.0,6002.0,,,qHTS Assay for Inhibitors of RGS12 GoLoco Motif Activity (Red Fluorophore),Confirmatory,,
37,880,2,1,,17388788,31070,Inactive,33946324.0,2770.0,,,qHTS Assay for Inhibitors of RGS12 GoLoco Motif Activity (Red Fluorophore),Confirmatory,,
38,881,2,2,,17388788,31070,Inactive,317373425.0,247.0,,Potency,qHTS Assay for Inhibitors of 15-hLO-2 (15-human lipoxygenase 2),Confirmatory,,
39,884,1,2,,17388788,31070,Inconclusive,13435386.0,1576.0,10.0,Potency,qHTS Assay for Inhibitors and Substrates of Cytochrome P450 3A4,Confirmatory,,
40,885,1,2,,17388788,31070,Inactive,13435386.0,1576.0,10.0,Potency,qHTS Assay for Activators of Cytochrome P450 3A4,Confirmatory,,
41,886,1,2,,17388788,31070,Inactive,122921310.0,,,Potency,"qHTS Assay for Inhibitors of HADH2 (Hydroxyacyl-Coenzyme A Dehydrogenase, Type II)",Confirmatory,,
42,886,1,2,,17388788,31070,Inactive,122921311.0,,,Potency,"qHTS Assay for Inhibitors of HADH2 (Hydroxyacyl-Coenzyme A Dehydrogenase, Type II)",Confirmatory,,
43,887,1,2,,17388788,31070,Inactive,1832253.0,246.0,,Potency,qHTS Assay for Inhibitors of 15-hLO (15-human lipoxygenase),Confirmatory,,
44,889,1,3,,17388788,31070,Inactive,1730092.0,840.0,,Potency,qHTS Assay for Allosteric/Competitive Inhibitors of Caspase-7,Confirmatory,,
45,892,1,2,,17388788,31070,Inactive,159162802.0,,,Potency,qHTS Assay for Inhibitors of BRCT-Phosphoprotein Interaction (Red Fluorophore),Confirmatory,,
46,893,1,2,,17388788,31070,Inactive,122921310.0,,,Potency,"qHTS Assay for Inhibitors of HSD17B4, hydroxysteroid (17-beta) dehydrogenase 4",Confirmatory,,
47,893,1,2,,17388788,31070,Inactive,122921311.0,,,Potency,"qHTS Assay for Inhibitors of HSD17B4, hydroxysteroid (17-beta) dehydrogenase 4",Confirmatory,,
48,894,2,1,,17388788,31070,Active,31542939.0,3248.0,5.6234,Potency,qHTS Assay for Inhibitors of HPGD (15-Hydroxyprostaglandin Dehydrogenase),Confirmatory,,
49,900,1,3,,17388788,31070,Inactive,15431328.0,834.0,,Potency,qHTS Assay for Allosteric/Competitive Inhibitors of Caspase-1,Confirmatory,,
50,902,1,2,,17388788,31070,Inactive,120407068.0,7157.0,,Potency,qHTS Screen for Compounds that Selectively Target Cancer Cells with p53 Mutations: Cytotoxicity of p53ts Cells at the Nonpermissive Temperature,Confirmatory,,
51,912,1,2,,17388788,31070,Inactive,21392848.0,,,Potency,qHTS Assay for Anthrax Lethal Toxin Internalization,Confirmatory,,
52,921,1,2,,17388788,31070,Inactive,,,,Potency,Cell Viability - LYMP2-001,Confirmatory,,
53,923,1,2,,17388788,31070,Inactive,,,,Potency,qHTS Assay for Allosteric/Competitive Inhibitors of Caspase-1: Spectroscopic Profiling in AFC Spectral Region,Confirmatory,,
54,924,1,2,,17388788,31070,Inactive,120407068.0,7157.0,,Potency,qHTS Screen for Compounds that Selectively Target Cancer Cells with p53 Mutations: Cytotoxicity of p53ts Cells at the Permissive Temperature,Confirmatory,,
55,925,1,2,,17388788,31070,Inactive,4504349.0,3043.0,,Potency,qHTS Assay for Modulators of Hemoglobin Beta Chain Splicing,Confirmatory,,
56,926,1,2,,17388788,31070,Inconclusive,38016895.0,7253.0,31.6228,Potency,qHTS Assay for Agonists of the Thyroid Stimulating Hormone Receptor,Confirmatory,,
57,938,1,2,,17388788,31070,Inconclusive,38016895.0,7253.0,31.6228,Potency,qHTS Assay for Agonists of the Thyroid Stimulating Hormone Receptor: Activators of Intracellular cAMP Concentrations in Parental HEK 293,Confirmatory,,
58,946,1,2,,17388788,31070,Inactive,,,,Potency,MultiTox-Fluor Cytotoxicity Assay - LYMP1-001 - Dead Cells,Confirmatory,,
59,947,1,2,,17388788,31070,Inconclusive,,,0.1,Potency,MultiTox-Fluor Cytotoxicity Assay - LYMP1-001 - Live Cells,Confirmatory,,
60,948,1,2,,17388788,31070,Inactive,,,,Potency,Cell Viability - LYMP1-002 - Assay at 16 hr,Confirmatory,,
61,955,1,2,,17388788,31070,Inactive,,,,Potency,MultiTox-Fluor Cytotoxicity Assay - LYMP1-002 - Live Cells,Confirmatory,,
62,960,1,2,,17388788,31070,Inactive,,,,Potency,MultiTox-Fluor Cytotoxicity Assay - LYMP1-002 - Dead Cells,Confirmatory,,
63,961,1,2,,17388788,31070,Inactive,,,,Potency,MultiTox-Fluor Cytotoxicity Assay - LYMP1-003 - Dead Cells,Confirmatory,,
64,962,1,2,,17388788,31070,Inactive,,,,Potency,MultiTox-Fluor Cytotoxicity Assay - LYMP1-003 - Live Cells,Confirmatory,,
65,963,1,2,,17388788,31070,Inactive,,,,Potency,Cell Viability - LYMP1-003 - Assay at 24 hr,Confirmatory,,
66,964,1,2,,17388788,31070,Inactive,,,,Potency,Cell Viability - LYMP1-003 - Assay at 40 hr,Confirmatory,,
67,965,1,2,,17388788,31070,Inactive,,,,Potency,Cell Viability - LYMP2-003,Confirmatory,,
68,966,1,2,,17388788,31070,Inactive,,,,Potency,Cell Viability - LYMP2-004,Confirmatory,,
69,967,1,2,,17388788,31070,Inactive,,,,Potency,Cell Viability - LYMP2-005,Confirmatory,,
70,968,1,2,,17388788,31070,Inactive,,,,Potency,Cell Viability - LYMP2-009,Confirmatory,,
71,969,1,2,,17388788,31070,Inactive,,,,Potency,Cell Viability - LYMP2-011,Confirmatory,,
72,970,1,2,,17388788,31070,Inactive,,,,Potency,Cell Viability - LYMP2-013,Confirmatory,,
73,971,1,2,,17388788,31070,Inactive,,,,Potency,Cell Viability - LYMP2-015,Confirmatory,,
74,972,1,2,,17388788,31070,Inactive,,,,Potency,Cell Viability - LYMP2-017,Confirmatory,,
75,973,1,2,,17388788,31070,Inactive,,,,Potency,Cell Viability - LYMP2-019,Confirmatory,,
76,974,1,2,,17388788,31070,Inactive,,,,Potency,Cell Viability - LYMP2-021,Confirmatory,,
77,975,1,2,,17388788,31070,Inactive,,,,Potency,Cell Viability - LYMP2-023,Confirmatory,,
78,976,1,2,,17388788,31070,Inactive,,,,Potency,Cell Viability - LYMP2-025,Confirmatory,,
79,977,1,2,,17388788,31070,Inactive,,,,Potency,Cell Viability - LYMP2-002,Confirmatory,,
80,978,1,2,,17388788,31070,Inactive,,,,Potency,Cell Viability - LYMP2-006,Confirmatory,,
81,979,1,2,,17388788,31070,Inactive,,,,Potency,Cell Viability - LYMP2-007,Confirmatory,,
82,980,1,2,,17388788,31070,Inactive,,,,Potency,Cell Viability - LYMP2-008,Confirmatory,,
83,981,1,2,,17388788,31070,Inactive,,,,Potency,Cell Viability - LYMP2-010,Confirmatory,,
84,982,1,2,,17388788,31070,Inactive,,,,Potency,Cell Viability - LYMP2-012,Confirmatory,,
85,983,1,2,,17388788,31070,Inactive,,,,Potency,Cell Viability - LYMP2-014,Confirmatory,,
86,984,1,2,,17388788,31070,Inactive,,,,Potency,Cell Viability - LYMP2-016,Confirmatory,,
87,985,1,2,,17388788,31070,Inactive,,,,Potency,Cell Viability - LYMP2-018,Confirmatory,,
88,986,1,2,,17388788,31070,Inactive,,,,Potency,Cell Viability - LYMP2-020,Confirmatory,,
89,987,1,2,,17388788,31070,Inactive,,,,Potency,Cell Viability - LYMP2-022,Confirmatory,,
90,988,1,2,,17388788,31070,Inactive,,,,Potency,Cell Viability - LYMP2-024,Confirmatory,,
91,989,1,2,,17388788,31070,Inactive,,,,Potency,Cell Viability - LYMP2-026,Confirmatory,,
92,993,1,2,,17388788,31070,Inactive,,,,Potency,Cell Viability - LYMP1-002 - Assay at 24 hr,Confirmatory,,
93,994,1,2,,17388788,31070,Inactive,,,,Potency,Cell Viability - LYMP1-002 - Assay at 40 hr,Confirmatory,,
94,995,1,2,,17388788,31070,Inactive,66932916.0,5594.0,,Potency,qHTS Assay for Inhibitors of the ERK Signaling Pathway using a Homogeneous Screening Assay,Confirmatory,,
95,1030,2,1,,17388788,31070,Inconclusive,30582681.0,216.0,28.1838,Potency,qHTS Assay for Inhibitors of Aldehyde Dehydrogenase 1 (ALDH1A1),Confirmatory,,
96,1452,1,1,,17388788,31070,Inactive,154426292.0,239.0,,Potency,qHTS Assay for Inhibitors of 12-hLO (12-human lipoxygenase),Confirmatory,,
97,1457,1,1,,17388788,31070,Inactive,44888968.0,83523.0,,Potency,qHTS Assay for Identifying the Cell-Membrane Permeable IMPase Inhibitors: Potentiation with Lithium,Confirmatory,,
98,1458,1,1,,17388788,31070,Inactive,10937869.0,6607.0,,Potency,qHTS Assay for Enhancers of SMN2 Splice Variant Expression,Confirmatory,,
99,1469,1,1,,17388788,31070,Inactive,189491771.0,7068.0,,Potency,qHTS for Inhibitors of the Interaction of Thyroid Hormone Receptor and Steroid Receptor Coregulator 2,Confirmatory,,
100,1469,1,1,,26753116,31070,Inactive,189491771.0,7068.0,,Potency,qHTS for Inhibitors of the Interaction of Thyroid Hormone Receptor and Steroid Receptor Coregulator 2,Confirmatory,,
101,1471,2,1,,17388788,31070,Inactive,90903231.0,3064.0,,,qHTS Multiplex Assay to Identify Dual Action Probes in a Cell Model of Huntington: Cytoprotection (ATP),Confirmatory,,
102,1476,2,1,,17388788,31070,Inactive,281307097.0,,,Potency,qHTS Assay for Promiscuous and Specific Inhibitors of Cruzain (without detergent),Confirmatory,,
103,1477,1,1,,17388788,31070,Inactive,,,,Potency,qHTS Assay for Compounds Blocking the Interaction Between CBF-beta and RUNX1 for the Treatment of Acute Myeloid Leukemia,Confirmatory,,
104,1478,2,1,,17388788,31070,Inactive,281307097.0,,,Potency,qHTS Assay for Promiscuous and Specific Inhibitors of Cruzain (with detergent),Confirmatory,,
105,1479,1,2,,17388788,31070,Inactive,189491771.0,7068.0,,Potency,Total Fluorescence Counterscreen for Inhibitors of the Interaction of Thyroid Hormone Receptor and Steroid Receptor Coregulator 2,Confirmatory,,
106,1479,1,2,,26753116,31070,Inactive,189491771.0,7068.0,,Potency,Total Fluorescence Counterscreen for Inhibitors of the Interaction of Thyroid Hormone Receptor and Steroid Receptor Coregulator 2,Confirmatory,,
107,1948,1,1,,17388788,31070,Inactive,,,,Potency,qHTS Assay for Compounds that Induce Erasure of Genomic Imprints,Confirmatory,,
108,2101,1,1,,17388788,31070,Inactive,496369.0,2629.0,,Potency,qHTS Assay for Inhibitors and Activators of N370S glucocerebrosidase as a Potential Chaperone Treatment of Gaucher Disease,Confirmatory,,
109,2107,1,1,,17388788,31070,Inactive,757912.0,2717.0,,Potency,qHTS Assay for Inhibitors and Activators of Human alpha-Galactosidase From Spleen Homogenate,Confirmatory,,
110,2112,1,1,,17388788,31070,Inactive,119393891.0,2548.0,,Potency,qHTS Assay for Inhibitors and Activators of Human alpha-Glucosidase From Spleen Homogenate,Confirmatory,,
111,2120,1,1,,17388788,31070,Inactive,32879895.0,3091.0,,Potency,qHTS Assay for Identification of Small Molecule Inducers of Hypoxia Response,Confirmatory,,
112,2517,2,1,,17388788,31070,Inactive,6980812.0,,4.4668,Potency,qHTS Assay for Inhibitors of the Human Apurinic/apyrimidinic Endonuclease 1 (APE1),Confirmatory,,
113,2546,1,1,,17388788,31070,Inactive,188536040.0,19885.0,,Potency,VP16 counterscreen qHTS for inhibitors of ROR gamma transcriptional activity,Confirmatory,,
114,2549,1,1,,17388788,31070,Inactive,282403581.0,,,Potency,qHTS Assay for Inhibitors of RecQ-Like Dna Helicase 1 (RECQ1),Confirmatory,,
115,2551,1,1,,17388788,31070,Inactive,188536040.0,19885.0,,Potency,qHTS for inhibitors of ROR gamma transcriptional activity,Confirmatory,,
116,485290,1,1,,17388788,31070,Inactive,20150581.0,,,Potency,qHTS Assay for Inhibitors of Tyrosyl-DNA Phosphodiesterase (TDP1),Confirmatory,,
117,488839,1,1,,85147165,31070,Inactive,20072248.0,8851.0,,,Development of CDK5 inhibitors   Measured in Biochemical System Using Plate Reader - 2083-01_Inhibitor_SinglePoint_HTS_Activity,Screening,,
118,488839,1,1,,85147165,31070,Inactive,48146199.0,1020.0,,,Development of CDK5 inhibitors   Measured in Biochemical System Using Plate Reader - 2083-01_Inhibitor_SinglePoint_HTS_Activity,Screening,,
119,488862,1,1,,85147165,31070,Inactive,,,,,Inhibitors of Prion Protein 5' UTR mRNA Measured in Cell-Based System Using Plate Reader - 2078-01_Inhibitor_SinglePoint_HTS_Activity,Screening,,
120,488895,1,2,,85147165,31070,Inactive,90111653.0,948321.0,,,High Throughput Screen for Tat Transport Inhibitors Measured in Microorganism System Using Plate Reader - 2093-01_Inhibitor_SinglePoint_HTS_Activity,Screening,,
121,488896,1,1,,85147165,31070,Inactive,14389423.0,20778.0,,,HTS using DiI-HDL to assay lipid transfer in ldlA[SR-BI] cells Measured in Cell-Based System Using Plate Reader - 2085-01_Inhibitor_SinglePoint_HTS_Activity,Screening,,
122,488899,1,1,,85147165,31070,Inactive,40807040.0,4286.0,,,MITF Measured in Cell-Based System Using Plate Reader - 2084-01_Inhibitor_SinglePoint_HTS_Activity,Screening,,
123,488965,1,2,,85147165,31070,Inactive,218891639.0,,,,Fluorescent Biochemical Primary HTS to Identify Inhibitors of P. aeruginosa PvdQ acylase Measured in Biochemical System Using Plate Reader and Imaging Combination - 2091-01_Inhibitor_SinglePoint_HTS_Activity,Screening,,
124,488966,1,1,,85147165,31070,Inactive,,,,IC50,Primary and Confirmatory Screening for Inhibitors of Bacterial Capsule Biogenesis,Confirmatory,,
125,492953,1,1,,85147165,31070,Inactive,296080766.0,5049.0,,,"Fluorescence polarization-based primary biochemical high throughput screening assay to identify inhibitors of human platelet-activating factor acetylhydrolase 1b, catalytic subunit 2 (PAFAH1B2)",Screening,,
126,492956,1,1,,85147165,31070,Inactive,4758878.0,5051.0,,,Fluorescence polarization-based primary biochemical high throughput screening assay to identify inhibitors of human platelet activating factor acetylhydrolase 2 (PAFAH2),Screening,,
127,492972,1,1,,85147165,31070,Inactive,225543099.0,5050.0,,,"Fluorescence polarization-based primary biochemical high throughput screening assay to identify inhibitors of human platelet-activating factor acetylhydrolase 1B, catalytic subunit 3 (PAFAH1B3)",Screening,,
128,493005,1,1,,85147165,31070,Inactive,5454140.0,7251.0,,Potency,qHTS Assay for Iinhibitors of HIV-1 Budding by Blocking the Interaction of PTAP/TSG101,Confirmatory,,
129,493008,1,1,,85147165,31070,Inactive,1927.0,100037999.0,,,Fluorescence-based biochemical primary high throughput screening assay to identify activators of the calcium sensitivity of cardiac Regulated Thin Filaments (RTF),Screening,,
130,493008,1,1,,85147165,31070,Inactive,4507615.0,7134.0,,,Fluorescence-based biochemical primary high throughput screening assay to identify activators of the calcium sensitivity of cardiac Regulated Thin Filaments (RTF),Screening,,
131,493008,1,1,,85147165,31070,Inactive,48255881.0,7139.0,,,Fluorescence-based biochemical primary high throughput screening assay to identify activators of the calcium sensitivity of cardiac Regulated Thin Filaments (RTF),Screening,,
132,493008,1,1,,85147165,31070,Inactive,151101270.0,7137.0,,,Fluorescence-based biochemical primary high throughput screening assay to identify activators of the calcium sensitivity of cardiac Regulated Thin Filaments (RTF),Screening,,
133,493087,1,1,,85147165,31070,Inactive,155969707.0,3416.0,,,Fluorescence polarization-based cell-based primary high throughput screening assay to identify activators of insulin-degrading enzyme (IDE),Screening,,
134,493091,1,1,,85147165,31070,Inactive,10864009.0,58190.0,,,uHTS Colorimetric assay for identification of inhibitors of Scp-1,Screening,,
135,493098,1,1,,85147165,31070,Inactive,37187860.0,1235.0,,,uHTS identification of small molecule antagonists of the CCR6 receptor via a luminescent beta-arrestin assay,Screening,,
136,493131,1,1,,85147165,31070,Inactive,6679827.0,14282.0,,,Activator for delta FosB/delta FosB homodimer Measured in Biochemical System Using Plate Reader - 2072-01_Activator_SinglePoint_HTS_Activity,Screening,,
137,493160,1,1,,85147165,31070,Inactive,156151420.0,80201.0,,,uHTS Fluorescent assay for identification of inhibitors of hexokinase domain containing  I (HKDC1),Screening,,
138,493187,1,2,,85147165,31070,Inactive,156151420.0,80201.0,,,uHTS Fluorescent assay for identification of activators of hexokinase domain containing  I (HKDC1),Screening,,
139,493244,1,1,,85147165,31070,Inactive,1927.0,100037999.0,,,Fluorescence-based biochemical primary high throughput screening assay to identify inhibitors of the calcium sensitivity of cardiac Regulated Thin Filaments (RTF),Screening,,
140,493244,1,1,,85147165,31070,Inactive,4507615.0,7134.0,,,Fluorescence-based biochemical primary high throughput screening assay to identify inhibitors of the calcium sensitivity of cardiac Regulated Thin Filaments (RTF),Screening,,
141,493244,1,1,,85147165,31070,Inactive,48255881.0,7139.0,,,Fluorescence-based biochemical primary high throughput screening assay to identify inhibitors of the calcium sensitivity of cardiac Regulated Thin Filaments (RTF),Screening,,
142,493244,1,1,,85147165,31070,Inactive,151101270.0,7137.0,,,Fluorescence-based biochemical primary high throughput screening assay to identify inhibitors of the calcium sensitivity of cardiac Regulated Thin Filaments (RTF),Screening,,
143,504326,1,2,,85147165,31070,Inactive,63477962.0,4985.0,,,Luminescence-based cell-based primary high throughput screening assay to identify agonists of heterodimerization of the mu 1 (OPRM1) and delta 1 (OPRD1) opioid receptors,Screening,,
144,504326,1,2,,85147165,31070,Inactive,117940060.0,4988.0,,,Luminescence-based cell-based primary high throughput screening assay to identify agonists of heterodimerization of the mu 1 (OPRM1) and delta 1 (OPRD1) opioid receptors,Screening,,
145,504329,1,1,,85147165,31070,Inactive,227977143.0,23308111.0,,IC50,Discovery of Small Molecule Probes for H1N1 Influenza NS1A,Confirmatory,,
146,504339,1,1,,85147165,31070,Inactive,162330054.0,,,Potency,qHTS Assay for Inhibitors of JMJD2A-Tudor Domain,Confirmatory,,
147,504357,1,1,,85147165,31070,Inactive,63477962.0,4985.0,,,Luminescence-based cell-based primary high throughput screening assay to identify inverse agonists of heterodimerization of the mu 1 (OPRM1) and delta 1 (OPRD1) opioid receptors,Screening,,
148,504357,1,1,,85147165,31070,Inactive,117940060.0,4988.0,,,Luminescence-based cell-based primary high throughput screening assay to identify inverse agonists of heterodimerization of the mu 1 (OPRM1) and delta 1 (OPRD1) opioid receptors,Screening,,
149,504411,1,1,,85147165,31070,Inactive,218931251.0,221955.0,,,"Fluorescence-based primary biochemical high throughput screening assay to identify inhibitors of human diacylglycerol lipase, beta (DAGLB)",Screening,,
150,504414,1,1,,85147165,31070,Inactive,9966877.0,57120.0,,,Fluorescence Polarization with Cer CAL-PDZ Measured in Biochemical System Using Plate Reader - 2109-01_Inhibitor_SinglePoint_HTS_Activity,Screening,,
151,504414,1,1,,85147165,31070,Inactive,90421313.0,1080.0,,,Fluorescence Polarization with Cer CAL-PDZ Measured in Biochemical System Using Plate Reader - 2109-01_Inhibitor_SinglePoint_HTS_Activity,Screening,,
152,504423,1,1,,85147165,31070,Inactive,312275222.0,,,,C-LANA FP assay Measured in Biochemical System Using Plate Reader - 2117-01_Inhibitor_SinglePoint_HTS_Activity,Screening,,
153,504441,1,1,,85147165,31070,Inactive,6978787.0,25255.0,,,Dyrk1 A HTS Measured in Biochemical System Using Plate Reader - 2124-01_Inhibitor_SinglePoint_HTS_Activity,Screening,,
154,504444,1,1,,85147165,31070,Inactive,224028257.0,4780.0,,Potency,Nrf2 qHTS screen for inhibitors,Confirmatory,,
155,504454,1,3,,85147165,31070,Inactive,4501969.0,154.0,,,HTS for Beta-2AR agonists via FAP method,Screening,,
156,504462,1,1,,85147165,31070,Inactive,47132611.0,23192.0,,,uHTS fluorescent assay for identification of inhibitors of ATG4B,Screening,,
157,504490,1,2,,85147165,31070,Inactive,13177715.0,408.0,,,Assay for Inhibitors of the beta-Arrestin-Adaptor Protein 2 Interaction That Mediate GPCR Degradation and Recycling,Screening,,
158,504523,1,1,,85147165,31070,Inactive,45269145.0,9817.0,,,Fluorescence polarization to screen for inhibitors that disrupt the protein-protein interaction between Keap1 and Nrf2   Measured in Biochemical System Using Plate Reader - 2119-01_Inhibitor_SinglePoint_HTS_Activity,Screening,,
159,504523,1,1,,85147165,31070,Inactive,224028257.0,4780.0,,,Fluorescence polarization to screen for inhibitors that disrupt the protein-protein interaction between Keap1 and Nrf2   Measured in Biochemical System Using Plate Reader - 2119-01_Inhibitor_SinglePoint_HTS_Activity,Screening,,
160,504558,1,1,,85147165,31070,Inactive,23893668.0,3783750.0,,,Inhibitors of Epstein-Barr LMP1 inducible NF-kappaB luciferase reporter Measured in Cell-Based System Using Plate Reader - 2122-01_Inhibitor_SinglePoint_HTS_Activity,Screening,,
161,504577,2,2,,85147165,31070,Inactive,6325022.0,855842.0,,,HTS of Small Molecules that Regulate V-ATPase Proton Transport in Yeast using pHLuorin,Screening,,
162,504582,2,1,,85147165,31070,Inactive,124809271.0,811941.0,,,In vivo-based yeast HTS to detect compounds rescuing yeast growth/survival of Plasmodium Falciparum HSP40-mediated toxicity Measured in Whole Organism System Using Plate Reader - 2120-01_Inhibitor_SinglePoint_HTS_Activity,Screening,,
163,504621,1,1,,85147165,31070,Inactive,124809506.0,811999.0,,,Anti-Malarial Hsp90 Inhibitors Measured in Microorganism System Using Plate Reader - 2121-01_Inhibitor_SinglePoint_HTS_Activity_Set2,Screening,,
164,504634,1,1,,85147165,31070,Inactive,13236497.0,3361.0,,,Counterscreen for inverse agonists of OPRM1-OPRD1 heterodimerization: luminescence-based cell-based full-deck high throughput screening assay to identify inverse agonists of 5-hydroxytryptamine (serotonin) 5A receptor (HTR5A),Screening,,
165,504648,1,1,,85147165,31070,Inactive,,,,Potency,Nrf2 qHTS screen for inhibitors: counterscreen for cytotoxicity,Confirmatory,,
166,504690,1,3,,85147165,31070,Inactive,12381848.0,,,,uHTS identification of small molecule inhibitors of Plasmodium falciparum Glucose-6-phosphate dehydrogenase via a fluorescence intensity assay,Screening,,
167,504692,2,2,,85147165,31070,Inactive,13236497.0,3361.0,,,Counterscreen for agonists of OPRM1-OPRD1 heterodimerization: luminescence-based cell-based full-deck high throughput screening assay to identify agonists of 5-hydroxytryptamine (serotonin) 5A receptor (HTR5A),Screening,,
168,504700,1,1,,85147165,31070,Inactive,46909587.0,5567.0,,,Fluorescence polarization-based biochemical primary high throughput screening assay to identify activators of the Protein Kinase A-R2B (PKA-R2B) complex,Screening,,
169,504700,1,1,,85147165,31070,Inactive,47132585.0,5577.0,,,Fluorescence polarization-based biochemical primary high throughput screening assay to identify activators of the Protein Kinase A-R2B (PKA-R2B) complex,Screening,,
170,504707,1,1,,85147165,31070,Inactive,6755076.0,18749.0,,,Fluorescence polarization-based biochemical primary high throughput screening assay to identify activators of the Protein Kinase A-R1A (PKA-R1A) complex,Screening,,
171,504707,1,1,,85147165,31070,Inactive,115496662.0,615074.0,,,Fluorescence polarization-based biochemical primary high throughput screening assay to identify activators of the Protein Kinase A-R1A (PKA-R1A) complex,Screening,,
