,AID,AID Version,AID Revision,Panel Member ID,SID,CID,Bioactivity Outcome,Target GI,Target GeneID,Activity Value [uM],Activity Name,Assay Name,Bioassay Type,PubMed ID,RNAi
0,167927,3,3,,103288436,25948,Unspecified,,,,,Carcinogenic activity on all sites after oral administration,Other,7265110.0,
1,167938,3,3,,103288436,25948,Unspecified,,,,,Carcinogenic activity on breast after oral administration,Other,7265110.0,
2,167955,3,3,,103288436,25948,Unspecified,,,,,Carcinogenic activity on ear duct after oral administration,Other,7265110.0,
3,168085,3,3,,103288436,25948,Unspecified,,,,,Carcinogenic activity on liver after oral administration of the compound,Other,7265110.0,
4,168097,3,3,,103288436,25948,Unspecified,,,,,Carcinogenic activity on mixed data after oral administration,Other,7265110.0,
5,168110,3,3,,103288436,25948,Unspecified,,,,,Carcinogenic activity on other sites after oral administration,Other,7265110.0,
6,1259407,1,1,,363898202,25948,Active,,,,,CCRIS mutagenicity studies,Other,,
7,1259408,1,1,,363896814,25948,Active,,,,,GENE-TOX mutagenicity studies,Other,,
8,1259411,1,1,,363898202,25948,Active,,,,,CCRIS carcinogenicity studies,Other,,
