,AID,AID Version,AID Revision,Panel Member ID,SID,CID,Bioactivity Outcome,Target GI,Target GeneID,Activity Value [uM],Activity Name,Assay Name,Bioassay Type,PubMed ID,RNAi
0,1117326,1,1,,225144355,54489997,Inactive,,,,,nuclear beta catenin stimulation in WNT3A conditioned C2C12 cells-screen,Screening,,
1,1117329,1,1,,225144355,54489997,Inactive,,,,,insulin secretion from INS-1E cells in the presence of 5 mM glucose-screen,Screening,,
2,1117336,1,1,,225144355,54489997,Inactive,,,,,GSK3B-pretreated HCT116 viability from Cell TiterGlo-screen,Screening,,
3,1117340,1,1,,225144355,54489997,Inactive,,,,,VEGF stimulated ADSC/ECFC co-culture CD31-stained tube area decrease-screen,Screening,,
4,1117341,1,1,,225144355,54489997,Inactive,,,,,GLP1 secretion from NCI-H716 cells-screen,Screening,,
5,1117342,1,1,,225144355,54489997,Inactive,,,,,HCT116 viability from Cell TiterGlo-screen,Screening,,
6,1117343,1,1,,225144355,54489997,Active,,,,,SW480 viability from Cell TiterGlo-screen,Screening,,
7,1117346,1,1,,225144355,54489997,Inactive,,,,,DLD-1 viability from Cell TiterGlo-screen,Screening,,
8,1259423,1,2,,355011455,54489997,Inactive,,,,,Primary cell-based high-throughput screening assay for identification of small molecule agonists of Aedes aegypti NPYLR7 [Small Molecule Inhibitors of Mosquito Biting Behavior],Screening,,
