,AID,AID Version,AID Revision,Panel Member ID,SID,CID,Bioactivity Outcome,Target GI,Target GeneID,Activity Value [uM],Activity Name,Assay Name,Bioassay Type,PubMed ID,RNAi
0,421,1,3,,17389557,20525,Inactive,,,,,Cell Viability - BJ,Confirmatory,,
1,426,1,2,,17389557,20525,Inactive,,,,,Cell Viability - Jurkat,Confirmatory,,
2,427,1,1,,17389557,20525,Inactive,,,,,Cell Viability - Hek293,Confirmatory,,
3,433,1,1,,17389557,20525,Inactive,,,,,Cell Viability - HepG2,Confirmatory,,
4,434,1,2,,17389557,20525,Inactive,,,,,Cell Viability - MRC5,Confirmatory,,
5,435,1,2,,17389557,20525,Inactive,,,,,Cell Viability - SK-N-SH,Confirmatory,,
6,445,3,1,,17389557,20525,Inactive,10092619.0,4792.0,,,IkB Signaling,Confirmatory,,
7,530,1,1,,17389557,20525,Inconclusive,2499604.0,26414.0,,,JNK3 AlphaScreen Assay,Confirmatory,,
8,540,1,1,,17389557,20525,Inactive,,,,,Cell Viability - N2a,Confirmatory,,
9,541,1,1,,17389557,20525,Inactive,,,,,Cell Viability - NIH 3T3,Confirmatory,,
10,542,1,1,,17389557,20525,Inactive,,,,,Cell Viability - HUV-EC-C,Confirmatory,,
11,543,1,1,,17389557,20525,Inactive,,,,,Cell Viability - H-4-II-E,Confirmatory,,
12,544,2,1,,17389557,20525,Inactive,,,,,Cell Viability - SH-SY5Y,Confirmatory,,
13,545,1,1,,17389557,20525,Inactive,,,,,Cell Viability - Renal Proximal Tubule,Confirmatory,,
14,546,1,1,,17389557,20525,Inactive,,,,,Cell Viability - Mesenchymal,Confirmatory,,
15,584,1,3,,17389557,20525,Inactive,119389684.0,,,,Promiscuous and Specific Inhibitors of AmpC Beta-Lactamase (assay with detergent),Confirmatory,,
16,585,1,4,,17389557,20525,Inactive,119389684.0,,,,Promiscuous and Specific Inhibitors of AmpC Beta-Lactamase (assay without detergent),Confirmatory,,
17,595,1,3,,17389557,20525,Inactive,,,,,qHTS Assay for Disrupters of an Hsp90 Co-Chaperone Interaction,Confirmatory,,
18,596,1,2,,17389557,20525,Inactive,92096784.0,4137.0,,,qHTS Assay for Tau Filament Binding,Confirmatory,,
19,603,1,2,,17389557,20525,Inactive,,,,,qHTS Assay for Inhibitors of DNA Polymerase III Holoenzyme System,Confirmatory,,
20,605,1,2,,17389557,20525,Inactive,84028058.0,,,,qHTS Assay for Inhibitors of YjeE,Confirmatory,,
21,608,1,6,,11537435,20525,Inactive,17149836.0,2280.0,,,NMR Based Screening Assay for FKBP12,Other,,
22,654,1,1,,17389557,20525,Inactive,,,,,Cellular Toxicity (caspase-3) HepG2,Confirmatory,,
23,655,1,1,,17389557,20525,Inactive,,,,,Cellular Toxicity (caspase-3) Jurkat,Confirmatory,,
24,656,1,1,,17389557,20525,Inactive,,,,,Cellular Toxicity (caspase-3) HUV-EC-C,Confirmatory,,
25,657,1,1,,17389557,20525,Inactive,,,,,Cellular Toxicity (caspase-3) SHSY5Y,Confirmatory,,
26,658,1,1,,17389557,20525,Inactive,,,,,Cellular Toxicity (caspase-3) BJ,Confirmatory,,
27,659,1,1,,17389557,20525,Inactive,,,,,Cellular Toxicity (caspase-3) MRC-5,Confirmatory,,
28,660,1,1,,17389557,20525,Inactive,,,,,Cellular Toxicity (caspase-3) Mesangial,Confirmatory,,
29,661,1,1,,17389557,20525,Inactive,,,,,Cellular Toxicity (caspase-3) SK-N-SH,Confirmatory,,
30,662,1,1,,17389557,20525,Inactive,,,,,Cell signaling CRE-BLA (Fsk stim),Confirmatory,,
31,663,1,1,,17389557,20525,Inactive,,,,,Cellular Toxicity (caspase-3) H-4-II-E,Confirmatory,,
32,664,1,1,,17389557,20525,Inactive,,,,,Cellular Toxicity (caspase-3) Hek293,Confirmatory,,
33,665,1,1,,17389557,20525,Inactive,,,,,Cellular Toxicity (caspase-3) N2a,Confirmatory,,
34,666,1,1,,17389557,20525,Inactive,,,,,Cellular Toxicity (caspase-3) NIH 3T3,Confirmatory,,
35,667,1,1,,17389557,20525,Inactive,,,,,Cellular Toxicity (caspase-3) Renal Proximal Tubule,Confirmatory,,
36,875,1,2,,17389557,20525,Inactive,159162802.0,,,Potency,qHTS Assay for Inhibitors of BRCT-Phosphoprotein Interaction (Green Fluorophore),Confirmatory,,
37,880,2,1,,17389557,20525,Inactive,3290016.0,6002.0,,,qHTS Assay for Inhibitors of RGS12 GoLoco Motif Activity (Red Fluorophore),Confirmatory,,
38,880,2,1,,17389557,20525,Inactive,33946324.0,2770.0,,,qHTS Assay for Inhibitors of RGS12 GoLoco Motif Activity (Red Fluorophore),Confirmatory,,
39,880,2,1,,26747327,20525,Inactive,3290016.0,6002.0,,,qHTS Assay for Inhibitors of RGS12 GoLoco Motif Activity (Red Fluorophore),Confirmatory,,
40,880,2,1,,26747327,20525,Inactive,33946324.0,2770.0,,,qHTS Assay for Inhibitors of RGS12 GoLoco Motif Activity (Red Fluorophore),Confirmatory,,
41,881,2,2,,17389557,20525,Inactive,317373425.0,247.0,,Potency,qHTS Assay for Inhibitors of 15-hLO-2 (15-human lipoxygenase 2),Confirmatory,,
42,884,1,2,,17389557,20525,Inactive,13435386.0,1576.0,,Potency,qHTS Assay for Inhibitors and Substrates of Cytochrome P450 3A4,Confirmatory,,
43,885,1,2,,17389557,20525,Inactive,13435386.0,1576.0,,Potency,qHTS Assay for Activators of Cytochrome P450 3A4,Confirmatory,,
44,886,1,2,,17389557,20525,Inactive,122921310.0,,,Potency,"qHTS Assay for Inhibitors of HADH2 (Hydroxyacyl-Coenzyme A Dehydrogenase, Type II)",Confirmatory,,
45,886,1,2,,17389557,20525,Inactive,122921311.0,,,Potency,"qHTS Assay for Inhibitors of HADH2 (Hydroxyacyl-Coenzyme A Dehydrogenase, Type II)",Confirmatory,,
46,887,1,2,,17389557,20525,Inactive,1832253.0,246.0,,Potency,qHTS Assay for Inhibitors of 15-hLO (15-human lipoxygenase),Confirmatory,,
47,889,1,3,,17389557,20525,Inactive,1730092.0,840.0,,Potency,qHTS Assay for Allosteric/Competitive Inhibitors of Caspase-7,Confirmatory,,
48,892,1,2,,17389557,20525,Inactive,159162802.0,,,Potency,qHTS Assay for Inhibitors of BRCT-Phosphoprotein Interaction (Red Fluorophore),Confirmatory,,
49,893,1,2,,17389557,20525,Inactive,122921310.0,,,Potency,"qHTS Assay for Inhibitors of HSD17B4, hydroxysteroid (17-beta) dehydrogenase 4",Confirmatory,,
50,893,1,2,,17389557,20525,Inactive,122921311.0,,,Potency,"qHTS Assay for Inhibitors of HSD17B4, hydroxysteroid (17-beta) dehydrogenase 4",Confirmatory,,
51,894,2,1,,17389557,20525,Inactive,31542939.0,3248.0,,Potency,qHTS Assay for Inhibitors of HPGD (15-Hydroxyprostaglandin Dehydrogenase),Confirmatory,,
52,894,2,1,,26747327,20525,Inactive,31542939.0,3248.0,,Potency,qHTS Assay for Inhibitors of HPGD (15-Hydroxyprostaglandin Dehydrogenase),Confirmatory,,
53,900,1,3,,17389557,20525,Inactive,15431328.0,834.0,,Potency,qHTS Assay for Allosteric/Competitive Inhibitors of Caspase-1,Confirmatory,,
54,902,1,2,,17389557,20525,Inactive,120407068.0,7157.0,,Potency,qHTS Screen for Compounds that Selectively Target Cancer Cells with p53 Mutations: Cytotoxicity of p53ts Cells at the Nonpermissive Temperature,Confirmatory,,
55,910,1,2,,17389557,20525,Inactive,4504349.0,3043.0,,Potency,Confirmation and Secondary Assay for Modulators of Hemoglobin Beta Chain Splicing at IVS2 654 locus,Confirmatory,,
56,912,1,2,,17389557,20525,Inactive,21392848.0,,,Potency,qHTS Assay for Anthrax Lethal Toxin Internalization,Confirmatory,,
57,921,1,2,,17389557,20525,Inactive,,,,Potency,Cell Viability - LYMP2-001,Confirmatory,,
58,923,1,2,,17389557,20525,Inactive,,,,Potency,qHTS Assay for Allosteric/Competitive Inhibitors of Caspase-1: Spectroscopic Profiling in AFC Spectral Region,Confirmatory,,
59,924,1,2,,17389557,20525,Inactive,120407068.0,7157.0,,Potency,qHTS Screen for Compounds that Selectively Target Cancer Cells with p53 Mutations: Cytotoxicity of p53ts Cells at the Permissive Temperature,Confirmatory,,
60,925,1,2,,17389557,20525,Inactive,4504349.0,3043.0,,Potency,qHTS Assay for Modulators of Hemoglobin Beta Chain Splicing,Confirmatory,,
61,926,1,2,,17389557,20525,Inconclusive,38016895.0,7253.0,39.8107,Potency,qHTS Assay for Agonists of the Thyroid Stimulating Hormone Receptor,Confirmatory,,
62,927,1,3,,17389557,20525,Inactive,188528692.0,9099.0,,Potency,qHTS Assay for Inhibitors of Ubiquitin-specific Protease USP2a,Confirmatory,,
63,930,1,2,,17389557,20525,Inactive,4504349.0,3043.0,,Potency,Confirmation and Secondary Assay for Modulators of Hemoglobin Beta Chain Splicing at IVS2 705 locus,Confirmatory,,
64,938,1,2,,17389557,20525,Inconclusive,38016895.0,7253.0,39.8107,Potency,qHTS Assay for Agonists of the Thyroid Stimulating Hormone Receptor: Activators of Intracellular cAMP Concentrations in Parental HEK 293,Confirmatory,,
65,940,1,2,,26613013,20525,Inactive,31881630.0,5732.0,,,Modulators of the EP2 prostaglandin E2 receptor - Primary Screening,Screening,,
66,946,1,2,,17389557,20525,Inactive,,,,Potency,MultiTox-Fluor Cytotoxicity Assay - LYMP1-001 - Dead Cells,Confirmatory,,
67,947,1,2,,17389557,20525,Inconclusive,,,0.3162,Potency,MultiTox-Fluor Cytotoxicity Assay - LYMP1-001 - Live Cells,Confirmatory,,
68,948,1,2,,17389557,20525,Inactive,,,,Potency,Cell Viability - LYMP1-002 - Assay at 16 hr,Confirmatory,,
69,955,1,2,,17389557,20525,Inactive,,,,Potency,MultiTox-Fluor Cytotoxicity Assay - LYMP1-002 - Live Cells,Confirmatory,,
70,960,1,2,,17389557,20525,Inactive,,,,Potency,MultiTox-Fluor Cytotoxicity Assay - LYMP1-002 - Dead Cells,Confirmatory,,
71,961,1,2,,17389557,20525,Inactive,,,,Potency,MultiTox-Fluor Cytotoxicity Assay - LYMP1-003 - Dead Cells,Confirmatory,,
72,962,1,2,,17389557,20525,Inactive,,,,Potency,MultiTox-Fluor Cytotoxicity Assay - LYMP1-003 - Live Cells,Confirmatory,,
73,963,1,2,,17389557,20525,Inactive,,,,Potency,Cell Viability - LYMP1-003 - Assay at 24 hr,Confirmatory,,
74,964,1,2,,17389557,20525,Inactive,,,,Potency,Cell Viability - LYMP1-003 - Assay at 40 hr,Confirmatory,,
75,965,1,2,,17389557,20525,Inactive,,,,Potency,Cell Viability - LYMP2-003,Confirmatory,,
76,966,1,2,,17389557,20525,Inactive,,,,Potency,Cell Viability - LYMP2-004,Confirmatory,,
77,967,1,2,,17389557,20525,Inactive,,,,Potency,Cell Viability - LYMP2-005,Confirmatory,,
78,968,1,2,,17389557,20525,Inactive,,,,Potency,Cell Viability - LYMP2-009,Confirmatory,,
79,969,1,2,,17389557,20525,Inactive,,,,Potency,Cell Viability - LYMP2-011,Confirmatory,,
80,970,1,2,,17389557,20525,Inactive,,,,Potency,Cell Viability - LYMP2-013,Confirmatory,,
81,971,1,2,,17389557,20525,Inactive,,,,Potency,Cell Viability - LYMP2-015,Confirmatory,,
82,972,1,2,,17389557,20525,Inactive,,,,Potency,Cell Viability - LYMP2-017,Confirmatory,,
83,973,1,2,,17389557,20525,Inactive,,,,Potency,Cell Viability - LYMP2-019,Confirmatory,,
84,974,1,2,,17389557,20525,Inactive,,,,Potency,Cell Viability - LYMP2-021,Confirmatory,,
85,975,1,2,,17389557,20525,Inactive,,,,Potency,Cell Viability - LYMP2-023,Confirmatory,,
86,976,1,2,,17389557,20525,Inactive,,,,Potency,Cell Viability - LYMP2-025,Confirmatory,,
87,977,1,2,,17389557,20525,Inactive,,,,Potency,Cell Viability - LYMP2-002,Confirmatory,,
88,978,1,2,,17389557,20525,Inactive,,,,Potency,Cell Viability - LYMP2-006,Confirmatory,,
89,979,1,2,,17389557,20525,Inactive,,,,Potency,Cell Viability - LYMP2-007,Confirmatory,,
90,980,1,2,,17389557,20525,Inactive,,,,Potency,Cell Viability - LYMP2-008,Confirmatory,,
91,981,1,2,,17389557,20525,Inactive,,,,Potency,Cell Viability - LYMP2-010,Confirmatory,,
92,982,1,2,,17389557,20525,Inactive,,,,Potency,Cell Viability - LYMP2-012,Confirmatory,,
93,983,1,2,,17389557,20525,Inactive,,,,Potency,Cell Viability - LYMP2-014,Confirmatory,,
94,984,1,2,,17389557,20525,Inactive,,,,Potency,Cell Viability - LYMP2-016,Confirmatory,,
95,985,1,2,,17389557,20525,Inactive,,,,Potency,Cell Viability - LYMP2-018,Confirmatory,,
96,986,1,2,,17389557,20525,Inactive,,,,Potency,Cell Viability - LYMP2-020,Confirmatory,,
97,987,1,2,,17389557,20525,Inactive,,,,Potency,Cell Viability - LYMP2-022,Confirmatory,,
98,988,1,2,,17389557,20525,Inactive,,,,Potency,Cell Viability - LYMP2-024,Confirmatory,,
99,989,1,2,,17389557,20525,Inactive,,,,Potency,Cell Viability - LYMP2-026,Confirmatory,,
100,993,1,2,,17389557,20525,Inactive,,,,Potency,Cell Viability - LYMP1-002 - Assay at 24 hr,Confirmatory,,
101,994,1,2,,17389557,20525,Inactive,,,,Potency,Cell Viability - LYMP1-002 - Assay at 40 hr,Confirmatory,,
102,995,1,2,,17389557,20525,Inactive,66932916.0,5594.0,,Potency,qHTS Assay for Inhibitors of the ERK Signaling Pathway using a Homogeneous Screening Assay,Confirmatory,,
103,1030,2,1,,17389557,20525,Inactive,30582681.0,216.0,,Potency,qHTS Assay for Inhibitors of Aldehyde Dehydrogenase 1 (ALDH1A1),Confirmatory,,
104,1030,2,1,,26747327,20525,Inconclusive,30582681.0,216.0,39.8107,Potency,qHTS Assay for Inhibitors of Aldehyde Dehydrogenase 1 (ALDH1A1),Confirmatory,,
105,1033,2,2,,11537435,20525,Inactive,216546.0,,,,NMR Based Screening Assay for the substrate binding domain of the chaperone DnaK,Screening,,
106,1188,1,2,,48415409,20525,Active,,,,,DSSTox (EPAFHM) EPA Fathead Minnow Acute Toxicity,Other,,
107,1379,1,2,,26747327,20525,Inactive,1669525.0,,,Potency,Counterscreen for Luciferase (Kinase-Glo TM) Inhibition,Confirmatory,,
108,1422,1,1,,26613013,20525,Inactive,31881630.0,5732.0,,,Inhibitors of the EP2 Prostaglandin E2 Receptor - Primary Screen,Screening,,
109,1452,1,1,,17389557,20525,Inactive,154426292.0,239.0,,Potency,qHTS Assay for Inhibitors of 12-hLO (12-human lipoxygenase),Confirmatory,,
110,1454,1,1,,26747327,20525,Inactive,66932916.0,5594.0,,Potency,qHTS Assay for Inhibitors of the ERK Signaling Pathway using a Homogeneous Screening Assay; Stimulation with EGF,Confirmatory,,
111,1457,1,1,,17389557,20525,Inactive,44888968.0,83523.0,,Potency,qHTS Assay for Identifying the Cell-Membrane Permeable IMPase Inhibitors: Potentiation with Lithium,Confirmatory,,
112,1457,1,1,,26747327,20525,Inactive,44888968.0,83523.0,,Potency,qHTS Assay for Identifying the Cell-Membrane Permeable IMPase Inhibitors: Potentiation with Lithium,Confirmatory,,
113,1458,1,1,,17389557,20525,Inactive,10937869.0,6607.0,,Potency,qHTS Assay for Enhancers of SMN2 Splice Variant Expression,Confirmatory,,
114,1458,1,1,,26747327,20525,Inactive,10937869.0,6607.0,,Potency,qHTS Assay for Enhancers of SMN2 Splice Variant Expression,Confirmatory,,
115,1460,1,3,,26747327,20525,Inactive,92096784.0,4137.0,,Potency,"qHTS for Inhibitors of Tau Fibril Formation, Thioflavin T Binding",Confirmatory,,
116,1463,1,1,,26747327,20525,Inactive,,,,Potency,"Counterscreen qHTS for Inhibitors of Tau Fibril Formation, Fluorescence Polarization",Confirmatory,,
117,1467,1,3,,26747327,20525,Inactive,757912.0,2717.0,,Potency,qHTS Assay for Inhibitors of Human alpha-Galactosidase at pH 4.5.,Confirmatory,,
118,1468,1,1,,26747327,20525,Inactive,92096784.0,4137.0,,Potency,"qHTS for Inhibitors of Tau Fibril Formation, Fluorescence Polarization",Confirmatory,,
119,1469,1,1,,17389557,20525,Inactive,189491771.0,7068.0,,Potency,qHTS for Inhibitors of the Interaction of Thyroid Hormone Receptor and Steroid Receptor Coregulator 2,Confirmatory,,
120,1469,1,1,,26747327,20525,Inactive,189491771.0,7068.0,,Potency,qHTS for Inhibitors of the Interaction of Thyroid Hormone Receptor and Steroid Receptor Coregulator 2,Confirmatory,,
121,1471,2,1,,17389557,20525,Inactive,90903231.0,3064.0,,,qHTS Multiplex Assay to Identify Dual Action Probes in a Cell Model of Huntington: Cytoprotection (ATP),Confirmatory,,
122,1471,2,1,,26747327,20525,Inactive,90903231.0,3064.0,,,qHTS Multiplex Assay to Identify Dual Action Probes in a Cell Model of Huntington: Cytoprotection (ATP),Confirmatory,,
123,1476,2,1,,17389557,20525,Inactive,281307097.0,,,Potency,qHTS Assay for Promiscuous and Specific Inhibitors of Cruzain (without detergent),Confirmatory,,
124,1476,2,1,,26747327,20525,Inactive,281307097.0,,,Potency,qHTS Assay for Promiscuous and Specific Inhibitors of Cruzain (without detergent),Confirmatory,,
125,1477,1,1,,17389557,20525,Inactive,,,,Potency,qHTS Assay for Compounds Blocking the Interaction Between CBF-beta and RUNX1 for the Treatment of Acute Myeloid Leukemia,Confirmatory,,
126,1477,1,1,,26747327,20525,Inactive,,,,Potency,qHTS Assay for Compounds Blocking the Interaction Between CBF-beta and RUNX1 for the Treatment of Acute Myeloid Leukemia,Confirmatory,,
127,1478,2,1,,17389557,20525,Inactive,281307097.0,,,Potency,qHTS Assay for Promiscuous and Specific Inhibitors of Cruzain (with detergent),Confirmatory,,
128,1478,2,1,,26747327,20525,Inactive,281307097.0,,,Potency,qHTS Assay for Promiscuous and Specific Inhibitors of Cruzain (with detergent),Confirmatory,,
129,1479,1,2,,17389557,20525,Inactive,189491771.0,7068.0,,Potency,Total Fluorescence Counterscreen for Inhibitors of the Interaction of Thyroid Hormone Receptor and Steroid Receptor Coregulator 2,Confirmatory,,
130,1479,1,2,,26747327,20525,Inactive,189491771.0,7068.0,,Potency,Total Fluorescence Counterscreen for Inhibitors of the Interaction of Thyroid Hormone Receptor and Steroid Receptor Coregulator 2,Confirmatory,,
131,1490,2,1,,26747327,20525,Inactive,10954339.0,,,Potency,qHTS Assay for Inhibitors of Bacillus subtilis Sfp phosphopantetheinyl transferase (PPTase),Confirmatory,,
132,1519,1,3,,26747327,20525,Inactive,,,,Potency,qHTS Assay for Lipid Storage Modulators,Confirmatory,,
133,1549,1,2,,11537435,20525,Inactive,89033149.0,,,,NMR Based Screening Assay for Novel Chemotypes against influenza A virus,Other,,
134,1552,1,3,,11537435,20525,Inactive,4507793.0,7334.0,,,NMR assay targeting the ubiquitin-proteasome system to modulate protein folding and degradation,Other,,
135,1637,1,2,,11537435,20525,Inactive,,,,,NMR Based Screening Assay for Influenza A RNA Promoter,Other,,
136,1648,1,2,,11537435,20525,Inactive,159164579.0,,,,NMR Based Screening Assay For Novel Chemical Probes Targeting The FRB Domain of mTOR,Other,,
137,1766,1,1,,26747327,20525,Inactive,18860839.0,4221.0,,Potency,qHTS Assay for Inhibitors Targeting the Menin-MLL Interaction in MLL Related Leukemias: Competition With Fluorescein Labeled MLL-derived Peptide,Confirmatory,,
138,1766,1,1,,26747327,20525,Inactive,56550039.0,4297.0,,Potency,qHTS Assay for Inhibitors Targeting the Menin-MLL Interaction in MLL Related Leukemias: Competition With Fluorescein Labeled MLL-derived Peptide,Confirmatory,,
139,1768,1,1,,26747327,20525,Inactive,18860839.0,4221.0,,Potency,qHTS Assay for Inhibitors Targeting the Menin-MLL Interaction in MLL Related Leukemias: Competition With Texas Red Labeled MLL-derived Mutant Peptide,Confirmatory,,
140,1768,1,1,,26747327,20525,Inactive,56550039.0,4297.0,,Potency,qHTS Assay for Inhibitors Targeting the Menin-MLL Interaction in MLL Related Leukemias: Competition With Texas Red Labeled MLL-derived Mutant Peptide,Confirmatory,,
141,1865,1,1,,26747327,20525,Inactive,,,,Potency,Quantitative High-Throughput Screen for Regulators of Epigenetic Control,Confirmatory,,
142,1948,1,1,,17389557,20525,Inactive,,,,Potency,qHTS Assay for Compounds that Induce Erasure of Genomic Imprints,Confirmatory,,
143,1948,1,1,,26747327,20525,Inactive,,,,Potency,qHTS Assay for Compounds that Induce Erasure of Genomic Imprints,Confirmatory,,
144,2016,1,3,,85272410,20525,Inactive,1302091.0,,,,Multiplex HTS Screen of TOR pathway GFP-fusion proteins in Saccharomyes cerevisiae_specifically_ MEP2_MLPCN.,Screening,,
145,2023,1,3,,85272410,20525,Inactive,486173.0,,,,Multiplex HTS Screen of TOR pathway GFP-fusion proteins in Saccharomyes cerevisiae_specifically_ LAP4_MLPCN.,Screening,,
146,2025,1,3,,85272410,20525,Inactive,536029.0,,,,Multiplex HTS Screen of TOR pathway GFP-fusion proteins in Saccharomyes cerevisiae_specifically_ RPL19A_MLPCN.,Screening,,
147,2029,1,3,,85272410,20525,Inactive,171229.0,,,,Multiplex HTS Screen of TOR pathway GFP-fusion proteins in Saccharomyes cerevisiae_specifically_ CIT2_MLPCN.,Screening,,
148,2052,2,1,,85272410,20525,Inactive,124486680.0,16408.0,,,HTS for developing T Cell Immune Modulators,Screening,,
149,2066,1,4,,85272410,20525,Inactive,85666113.0,850333.0,,,Multiplex HTS Screen of TOR pathway GFP-fusion proteins in Saccharomyes cerevisiae_specifically_ AGP1_MLPCN.,Screening,,
150,2101,1,1,,17389557,20525,Inactive,496369.0,2629.0,,Potency,qHTS Assay for Inhibitors and Activators of N370S glucocerebrosidase as a Potential Chaperone Treatment of Gaucher Disease,Confirmatory,,
151,2101,1,1,,26747327,20525,Inactive,496369.0,2629.0,,Potency,qHTS Assay for Inhibitors and Activators of N370S glucocerebrosidase as a Potential Chaperone Treatment of Gaucher Disease,Confirmatory,,
152,2107,1,1,,17389557,20525,Inactive,757912.0,2717.0,,Potency,qHTS Assay for Inhibitors and Activators of Human alpha-Galactosidase From Spleen Homogenate,Confirmatory,,
153,2107,1,1,,26747327,20525,Inactive,757912.0,2717.0,,Potency,qHTS Assay for Inhibitors and Activators of Human alpha-Galactosidase From Spleen Homogenate,Confirmatory,,
154,2112,1,1,,17389557,20525,Inactive,119393891.0,2548.0,,Potency,qHTS Assay for Inhibitors and Activators of Human alpha-Glucosidase From Spleen Homogenate,Confirmatory,,
155,2112,1,1,,26747327,20525,Inactive,119393891.0,2548.0,,Potency,qHTS Assay for Inhibitors and Activators of Human alpha-Glucosidase From Spleen Homogenate,Confirmatory,,
156,2120,1,1,,17389557,20525,Inactive,32879895.0,3091.0,,Potency,qHTS Assay for Identification of Small Molecule Inducers of Hypoxia Response,Confirmatory,,
157,2147,1,1,,26747327,20525,Inconclusive,221046486.0,,39.8107,Potency,qHTS Assay for Inhibitors of  Human Jumonji Domain Containing 2E (JMJD2E),Confirmatory,,
158,2240,1,1,,85789515,20525,Inactive,38156699.0,4286.0,,,Luminescence Cell-Based Primary HTS to Identify Inhibitors of MITF,Screening,,
159,2241,1,1,,85789515,20525,Inactive,167013344.0,,,,Luminescence Cell-Based Primary HTS to Identify Inhibitors of A1,Screening,,
160,2275,1,1,,85789515,20525,Inactive,,,,,Luminescence Cell-Based Primary HTS to Measure Viability of BJeLR cells,Screening,,
161,2280,2,3,,85272410,20525,Inactive,17507875.0,172532.0,,,Fluorescence polarization-based primary biochemical high throughput screening assay to identify inhibitors of GLD-1 protein - TGE RNA interaction.,Screening,,
162,2313,1,1,,85789515,20525,Inactive,,,,,Luminescence Cell-Based Primary HTS to Identify Inhibitors of the Sonic Hedgehog Signaling Pathway,Screening,,
163,2322,1,1,,85789515,20525,Inactive,,,,,Luminescence Homogenous Primary HTS to Identify Inhibitors of STK33 Activity,Screening,,
164,2330,1,1,,85789515,20525,Inactive,12830367.0,65975.0,,,Luminescence Cell-Based Primary HTS to Identify Inhibitors of STK33,Screening,,
165,2380,1,2,,85272410,20525,Inactive,,,,,uHTS identification of small molecules that induce b-cell replication in the MIN-6 cell line,Screening,,
166,2435,1,2,,85272410,20525,Inactive,32307152.0,5021.0,,,Fluorescence-based primary cell-based high throughput screening assay to identify agonists of the Oxytocin Receptor (OXTR).,Screening,,
167,2445,1,2,,85272410,20525,Inactive,32307152.0,5021.0,,,Fluorescence-based primary cell-based high throughput screening assay to identify potentiators of Oxytocin Receptor (OXTR),Screening,,
168,2451,1,2,,26747327,20525,Inactive,122920737.0,,,Potency,"qHTS Assay for Inhibitors of Fructose-1,6-bisphosphate Aldolase from Giardia Lamblia",Confirmatory,,
169,2472,1,2,,26747327,20525,Inactive,7669492.0,2597.0,,,"qHTS Assay for Inhibitors of Fructose-1,6-bisphosphate Aldolase from Giardia Lamblia: Coupling assay counterscreen",Screening,,
170,2517,2,1,,17389557,20525,Inactive,6980812.0,,,Potency,qHTS Assay for Inhibitors of the Human Apurinic/apyrimidinic Endonuclease 1 (APE1),Confirmatory,,
171,2517,2,1,,26747327,20525,Inactive,6980812.0,,,Potency,qHTS Assay for Inhibitors of the Human Apurinic/apyrimidinic Endonuclease 1 (APE1),Confirmatory,,
172,2517,2,1,,85272410,20525,Inactive,6980812.0,,,Potency,qHTS Assay for Inhibitors of the Human Apurinic/apyrimidinic Endonuclease 1 (APE1),Confirmatory,,
173,2520,1,4,,85272410,20525,Inactive,4885057.0,187.0,,,uHTS identification of small molecule agonists of the APJ  receptor  via a luminescent beta-arrestin assay,Screening,,
174,2521,1,3,,85272410,20525,Inactive,4885057.0,187.0,,,uHTS identification of small molecule antagonists of the APJ  receptor  via a luminescent beta-arrestin assay,Screening,,
175,2524,1,2,,85272410,20525,Inactive,124376142.0,248.0,,,uHTS Luminescent assay for identification of activators of human intestinal alkaline phosphatase,Screening,,
176,2528,1,2,,26747327,20525,Inactive,4557365.0,641.0,,Potency,qHTS Assay for Inhibitors of Bloom's syndrome helicase (BLM),Confirmatory,,
177,2540,1,2,,85272410,20525,Inactive,262118306.0,123228.0,,,HTS Luminescent assay for identification of inhibitors of Sentrin-specific protease 8 (SENP8),Screening,,
178,2544,1,2,,85272410,20525,Inactive,124376142.0,248.0,,,uHTS Luminescent assay for identification of inhibitors of human intestinal alkaline phosphatase,Screening,,
179,2546,1,1,,17389557,20525,Inactive,188536040.0,19885.0,,Potency,VP16 counterscreen qHTS for inhibitors of ROR gamma transcriptional activity,Confirmatory,,
180,2546,1,1,,26747327,20525,Inactive,188536040.0,19885.0,,Potency,VP16 counterscreen qHTS for inhibitors of ROR gamma transcriptional activity,Confirmatory,,
181,2549,1,1,,17389557,20525,Inactive,282403581.0,,,Potency,qHTS Assay for Inhibitors of RecQ-Like Dna Helicase 1 (RECQ1),Confirmatory,,
182,2549,1,1,,26747327,20525,Inactive,282403581.0,,,Potency,qHTS Assay for Inhibitors of RecQ-Like Dna Helicase 1 (RECQ1),Confirmatory,,
183,2551,1,1,,17389557,20525,Inactive,188536040.0,19885.0,,Potency,qHTS for inhibitors of ROR gamma transcriptional activity,Confirmatory,,
184,2551,1,1,,26747327,20525,Inactive,188536040.0,19885.0,,Potency,qHTS for inhibitors of ROR gamma transcriptional activity,Confirmatory,,
185,2557,1,3,,85272410,20525,Inactive,67191027.0,3676.0,,,HTS for Identification of VLA-4 Allosteric Modulators from MLPCN library,Screening,,
186,2599,1,2,,85272410,20525,Inactive,6166485.0,26054.0,,,uHTS Luminescent assay for identification of inhibitors of Sentrin-specific protease 6 (SENP6),Screening,,
187,2606,1,2,,85272410,20525,Inactive,15610807.0,885176.0,,,Fluorescence polarization-based primary biochemical high throughput screening assay to identify inhibitors of the membrane-associated serine protease Rv3671c in M.tuberculosis,Screening,,
188,2690,1,2,,85272410,20525,Inactive,,,,,A yeast HTS for caloric restriction mimetics that inhibit age-related superoxide,Screening,,
189,2751,2,2,,85272410,20525,Inactive,153217451.0,9581.0,,,Fluorescence polarization-based primary biochemical high throughput screening assay to identify inhibitors of the prolyl oligopeptidase-like enzyme (PREPL),Screening,,
