,AID,AID Version,AID Revision,Panel Member ID,SID,CID,Bioactivity Outcome,Target GI,Target GeneID,Activity Value [uM],Activity Name,Assay Name,Bioassay Type,PubMed ID,RNAi
0,180,1,1,,68313,1493,Inactive,,,,,NCI In Vivo Anticancer Drug Screen. Data for tumor model  Adenocarcinoma 755 (subcutaneous) in B6D2F1 (BDF1) mice,Other,,
1,228,1,1,,68313,1493,Inactive,,,,,NCI In Vivo Anticancer Drug Screen. Data for tumor model  Friend Virus Leukemia (Solid) (subcutaneous) in B6D2F1 (BDF1) mice,Other,,
2,248,1,1,,68313,1493,Inactive,,,,,NCI In Vivo Anticancer Drug Screen. Data for tumor model  L1210 Leukemia (intraperitoneal) in B6D2F1 (BDF1) mice,Other,,
3,330,1,1,,68313,1493,Inactive,,,,,NCI In Vivo Anticancer Drug Screen. Data for tumor model  P388 Leukemia (intraperitoneal) in CD2F1 (CDF1) mice,Other,,
4,342,1,1,,68313,1493,Inactive,,,,,NCI In Vivo Anticancer Drug Screen. Data for tumor model  Sarcoma 180 (subcutaneous) in Swiss mice,Other,,
5,421,1,3,,17389906,1493,Inactive,,,,,Cell Viability - BJ,Confirmatory,,
6,426,1,2,,17389906,1493,Inactive,,,,,Cell Viability - Jurkat,Confirmatory,,
7,427,1,1,,17389906,1493,Inactive,,,,,Cell Viability - Hek293,Confirmatory,,
8,433,1,1,,17389906,1493,Inactive,,,,,Cell Viability - HepG2,Confirmatory,,
9,434,1,2,,17389906,1493,Inactive,,,,,Cell Viability - MRC5,Confirmatory,,
10,435,1,2,,17389906,1493,Inactive,,,,,Cell Viability - SK-N-SH,Confirmatory,,
11,445,3,1,,17389906,1493,Inactive,10092619.0,4792.0,,,IkB Signaling,Confirmatory,,
12,530,1,1,,17389906,1493,Inactive,2499604.0,26414.0,,,JNK3 AlphaScreen Assay,Confirmatory,,
13,540,1,1,,17389906,1493,Inconclusive,,,,,Cell Viability - N2a,Confirmatory,,
14,541,1,1,,17389906,1493,Inconclusive,,,,,Cell Viability - NIH 3T3,Confirmatory,,
15,542,1,1,,17389906,1493,Inactive,,,,,Cell Viability - HUV-EC-C,Confirmatory,,
16,543,1,1,,17389906,1493,Inconclusive,,,,,Cell Viability - H-4-II-E,Confirmatory,,
17,544,2,1,,17389906,1493,Inactive,,,,,Cell Viability - SH-SY5Y,Confirmatory,,
18,545,1,1,,17389906,1493,Inactive,,,,,Cell Viability - Renal Proximal Tubule,Confirmatory,,
19,546,1,1,,17389906,1493,Inactive,,,,,Cell Viability - Mesenchymal,Confirmatory,,
20,584,1,3,,17389906,1493,Inactive,119389684.0,,,,Promiscuous and Specific Inhibitors of AmpC Beta-Lactamase (assay with detergent),Confirmatory,,
21,585,1,4,,17389906,1493,Inactive,119389684.0,,,,Promiscuous and Specific Inhibitors of AmpC Beta-Lactamase (assay without detergent),Confirmatory,,
22,595,1,3,,17389906,1493,Inactive,,,,,qHTS Assay for Disrupters of an Hsp90 Co-Chaperone Interaction,Confirmatory,,
23,596,1,2,,17389906,1493,Inactive,92096784.0,4137.0,,,qHTS Assay for Tau Filament Binding,Confirmatory,,
24,603,1,2,,17389906,1493,Inactive,,,,,qHTS Assay for Inhibitors of DNA Polymerase III Holoenzyme System,Confirmatory,,
25,605,1,2,,17389906,1493,Inactive,84028058.0,,,,qHTS Assay for Inhibitors of YjeE,Confirmatory,,
26,654,1,1,,17389906,1493,Inactive,,,,,Cellular Toxicity (caspase-3) HepG2,Confirmatory,,
27,655,1,1,,17389906,1493,Inactive,,,,,Cellular Toxicity (caspase-3) Jurkat,Confirmatory,,
28,656,1,1,,17389906,1493,Inactive,,,,,Cellular Toxicity (caspase-3) HUV-EC-C,Confirmatory,,
29,657,1,1,,17389906,1493,Inactive,,,,,Cellular Toxicity (caspase-3) SHSY5Y,Confirmatory,,
30,658,1,1,,17389906,1493,Inactive,,,,,Cellular Toxicity (caspase-3) BJ,Confirmatory,,
31,659,1,1,,17389906,1493,Inactive,,,,,Cellular Toxicity (caspase-3) MRC-5,Confirmatory,,
32,660,1,1,,17389906,1493,Inactive,,,,,Cellular Toxicity (caspase-3) Mesangial,Confirmatory,,
33,661,1,1,,17389906,1493,Inactive,,,,,Cellular Toxicity (caspase-3) SK-N-SH,Confirmatory,,
34,662,1,1,,17389906,1493,Inactive,,,,,Cell signaling CRE-BLA (Fsk stim),Confirmatory,,
35,663,1,1,,17389906,1493,Inactive,,,,,Cellular Toxicity (caspase-3) H-4-II-E,Confirmatory,,
36,664,1,1,,17389906,1493,Inactive,,,,,Cellular Toxicity (caspase-3) Hek293,Confirmatory,,
37,665,1,1,,17389906,1493,Inactive,,,,,Cellular Toxicity (caspase-3) N2a,Confirmatory,,
38,666,1,1,,17389906,1493,Inactive,,,,,Cellular Toxicity (caspase-3) NIH 3T3,Confirmatory,,
39,667,1,1,,17389906,1493,Inactive,,,,,Cellular Toxicity (caspase-3) Renal Proximal Tubule,Confirmatory,,
40,875,1,2,,17389906,1493,Inactive,159162802.0,,,Potency,qHTS Assay for Inhibitors of BRCT-Phosphoprotein Interaction (Green Fluorophore),Confirmatory,,
41,880,2,1,,17389906,1493,Inactive,3290016.0,6002.0,,,qHTS Assay for Inhibitors of RGS12 GoLoco Motif Activity (Red Fluorophore),Confirmatory,,
42,880,2,1,,17389906,1493,Inactive,33946324.0,2770.0,,,qHTS Assay for Inhibitors of RGS12 GoLoco Motif Activity (Red Fluorophore),Confirmatory,,
43,880,2,1,,26747391,1493,Inactive,3290016.0,6002.0,,,qHTS Assay for Inhibitors of RGS12 GoLoco Motif Activity (Red Fluorophore),Confirmatory,,
44,880,2,1,,26747391,1493,Inactive,33946324.0,2770.0,,,qHTS Assay for Inhibitors of RGS12 GoLoco Motif Activity (Red Fluorophore),Confirmatory,,
45,881,2,2,,17389906,1493,Inactive,317373425.0,247.0,,Potency,qHTS Assay for Inhibitors of 15-hLO-2 (15-human lipoxygenase 2),Confirmatory,,
46,884,1,2,,17389906,1493,Inactive,13435386.0,1576.0,,Potency,qHTS Assay for Inhibitors and Substrates of Cytochrome P450 3A4,Confirmatory,,
47,885,1,2,,17389906,1493,Inactive,13435386.0,1576.0,,Potency,qHTS Assay for Activators of Cytochrome P450 3A4,Confirmatory,,
48,886,1,2,,17389906,1493,Inactive,122921310.0,,,Potency,"qHTS Assay for Inhibitors of HADH2 (Hydroxyacyl-Coenzyme A Dehydrogenase, Type II)",Confirmatory,,
49,886,1,2,,17389906,1493,Inactive,122921311.0,,,Potency,"qHTS Assay for Inhibitors of HADH2 (Hydroxyacyl-Coenzyme A Dehydrogenase, Type II)",Confirmatory,,
50,887,1,2,,17389906,1493,Inactive,1832253.0,246.0,,Potency,qHTS Assay for Inhibitors of 15-hLO (15-human lipoxygenase),Confirmatory,,
51,889,1,3,,17389906,1493,Inactive,1730092.0,840.0,,Potency,qHTS Assay for Allosteric/Competitive Inhibitors of Caspase-7,Confirmatory,,
52,892,1,2,,17389906,1493,Inactive,159162802.0,,,Potency,qHTS Assay for Inhibitors of BRCT-Phosphoprotein Interaction (Red Fluorophore),Confirmatory,,
53,893,1,2,,17389906,1493,Inactive,122921310.0,,,Potency,"qHTS Assay for Inhibitors of HSD17B4, hydroxysteroid (17-beta) dehydrogenase 4",Confirmatory,,
54,893,1,2,,17389906,1493,Inactive,122921311.0,,,Potency,"qHTS Assay for Inhibitors of HSD17B4, hydroxysteroid (17-beta) dehydrogenase 4",Confirmatory,,
55,894,2,1,,17389906,1493,Inactive,31542939.0,3248.0,,Potency,qHTS Assay for Inhibitors of HPGD (15-Hydroxyprostaglandin Dehydrogenase),Confirmatory,,
56,894,2,1,,26747391,1493,Inconclusive,31542939.0,3248.0,25.1189,Potency,qHTS Assay for Inhibitors of HPGD (15-Hydroxyprostaglandin Dehydrogenase),Confirmatory,,
57,900,1,3,,17389906,1493,Inactive,15431328.0,834.0,,Potency,qHTS Assay for Allosteric/Competitive Inhibitors of Caspase-1,Confirmatory,,
58,902,1,2,,17389906,1493,Inactive,120407068.0,7157.0,,Potency,qHTS Screen for Compounds that Selectively Target Cancer Cells with p53 Mutations: Cytotoxicity of p53ts Cells at the Nonpermissive Temperature,Confirmatory,,
59,910,1,2,,17389906,1493,Inactive,4504349.0,3043.0,,Potency,Confirmation and Secondary Assay for Modulators of Hemoglobin Beta Chain Splicing at IVS2 654 locus,Confirmatory,,
60,912,1,2,,17389906,1493,Inactive,21392848.0,,,Potency,qHTS Assay for Anthrax Lethal Toxin Internalization,Confirmatory,,
61,921,1,2,,17389906,1493,Inactive,,,,Potency,Cell Viability - LYMP2-001,Confirmatory,,
62,923,1,2,,17389906,1493,Inactive,,,,Potency,qHTS Assay for Allosteric/Competitive Inhibitors of Caspase-1: Spectroscopic Profiling in AFC Spectral Region,Confirmatory,,
63,924,1,2,,17389906,1493,Inactive,120407068.0,7157.0,19.9526,Potency,qHTS Screen for Compounds that Selectively Target Cancer Cells with p53 Mutations: Cytotoxicity of p53ts Cells at the Permissive Temperature,Confirmatory,,
64,925,1,2,,17389906,1493,Inactive,4504349.0,3043.0,,Potency,qHTS Assay for Modulators of Hemoglobin Beta Chain Splicing,Confirmatory,,
65,926,1,2,,17389906,1493,Inconclusive,38016895.0,7253.0,7.9433,Potency,qHTS Assay for Agonists of the Thyroid Stimulating Hormone Receptor,Confirmatory,,
66,927,1,3,,17389906,1493,Inactive,188528692.0,9099.0,,Potency,qHTS Assay for Inhibitors of Ubiquitin-specific Protease USP2a,Confirmatory,,
67,930,1,2,,17389906,1493,Inactive,4504349.0,3043.0,,Potency,Confirmation and Secondary Assay for Modulators of Hemoglobin Beta Chain Splicing at IVS2 705 locus,Confirmatory,,
68,938,1,2,,17389906,1493,Inactive,38016895.0,7253.0,7.9433,Potency,qHTS Assay for Agonists of the Thyroid Stimulating Hormone Receptor: Activators of Intracellular cAMP Concentrations in Parental HEK 293,Confirmatory,,
69,940,1,2,,26613356,1493,Inactive,31881630.0,5732.0,,,Modulators of the EP2 prostaglandin E2 receptor - Primary Screening,Screening,,
70,946,1,2,,17389906,1493,Inactive,,,,Potency,MultiTox-Fluor Cytotoxicity Assay - LYMP1-001 - Dead Cells,Confirmatory,,
71,947,1,2,,17389906,1493,Inactive,,,,Potency,MultiTox-Fluor Cytotoxicity Assay - LYMP1-001 - Live Cells,Confirmatory,,
72,948,1,2,,17389906,1493,Inactive,,,,Potency,Cell Viability - LYMP1-002 - Assay at 16 hr,Confirmatory,,
73,955,1,2,,17389906,1493,Inactive,,,,Potency,MultiTox-Fluor Cytotoxicity Assay - LYMP1-002 - Live Cells,Confirmatory,,
74,960,1,2,,17389906,1493,Inactive,,,,Potency,MultiTox-Fluor Cytotoxicity Assay - LYMP1-002 - Dead Cells,Confirmatory,,
75,961,1,2,,17389906,1493,Inactive,,,,Potency,MultiTox-Fluor Cytotoxicity Assay - LYMP1-003 - Dead Cells,Confirmatory,,
76,962,1,2,,17389906,1493,Inactive,,,,Potency,MultiTox-Fluor Cytotoxicity Assay - LYMP1-003 - Live Cells,Confirmatory,,
77,963,1,2,,17389906,1493,Inactive,,,,Potency,Cell Viability - LYMP1-003 - Assay at 24 hr,Confirmatory,,
78,964,1,2,,17389906,1493,Inactive,,,,Potency,Cell Viability - LYMP1-003 - Assay at 40 hr,Confirmatory,,
79,965,1,2,,17389906,1493,Inactive,,,,Potency,Cell Viability - LYMP2-003,Confirmatory,,
80,966,1,2,,17389906,1493,Inactive,,,,Potency,Cell Viability - LYMP2-004,Confirmatory,,
81,967,1,2,,17389906,1493,Inactive,,,,Potency,Cell Viability - LYMP2-005,Confirmatory,,
82,968,1,2,,17389906,1493,Inactive,,,,Potency,Cell Viability - LYMP2-009,Confirmatory,,
83,969,1,2,,17389906,1493,Inactive,,,,Potency,Cell Viability - LYMP2-011,Confirmatory,,
84,970,1,2,,17389906,1493,Inactive,,,,Potency,Cell Viability - LYMP2-013,Confirmatory,,
85,971,1,2,,17389906,1493,Inactive,,,,Potency,Cell Viability - LYMP2-015,Confirmatory,,
86,972,1,2,,17389906,1493,Inactive,,,,Potency,Cell Viability - LYMP2-017,Confirmatory,,
87,973,1,2,,17389906,1493,Inactive,,,,Potency,Cell Viability - LYMP2-019,Confirmatory,,
88,974,1,2,,17389906,1493,Inactive,,,,Potency,Cell Viability - LYMP2-021,Confirmatory,,
89,975,1,2,,17389906,1493,Inactive,,,,Potency,Cell Viability - LYMP2-023,Confirmatory,,
90,976,1,2,,17389906,1493,Inactive,,,,Potency,Cell Viability - LYMP2-025,Confirmatory,,
91,977,1,2,,17389906,1493,Inactive,,,,Potency,Cell Viability - LYMP2-002,Confirmatory,,
92,978,1,2,,17389906,1493,Inactive,,,,Potency,Cell Viability - LYMP2-006,Confirmatory,,
93,979,1,2,,17389906,1493,Inactive,,,,Potency,Cell Viability - LYMP2-007,Confirmatory,,
94,980,1,2,,17389906,1493,Inactive,,,,Potency,Cell Viability - LYMP2-008,Confirmatory,,
95,981,1,2,,17389906,1493,Inactive,,,,Potency,Cell Viability - LYMP2-010,Confirmatory,,
96,982,1,2,,17389906,1493,Inactive,,,,Potency,Cell Viability - LYMP2-012,Confirmatory,,
97,983,1,2,,17389906,1493,Inactive,,,,Potency,Cell Viability - LYMP2-014,Confirmatory,,
98,984,1,2,,17389906,1493,Inactive,,,,Potency,Cell Viability - LYMP2-016,Confirmatory,,
99,985,1,2,,17389906,1493,Inactive,,,,Potency,Cell Viability - LYMP2-018,Confirmatory,,
100,986,1,2,,17389906,1493,Inactive,,,,Potency,Cell Viability - LYMP2-020,Confirmatory,,
101,987,1,2,,17389906,1493,Inactive,,,,Potency,Cell Viability - LYMP2-022,Confirmatory,,
102,988,1,2,,17389906,1493,Inactive,,,,Potency,Cell Viability - LYMP2-024,Confirmatory,,
103,989,1,2,,17389906,1493,Inactive,,,,Potency,Cell Viability - LYMP2-026,Confirmatory,,
104,993,1,2,,17389906,1493,Inactive,,,,Potency,Cell Viability - LYMP1-002 - Assay at 24 hr,Confirmatory,,
105,994,1,2,,17389906,1493,Inactive,,,,Potency,Cell Viability - LYMP1-002 - Assay at 40 hr,Confirmatory,,
106,995,1,2,,17389906,1493,Inconclusive,66932916.0,5594.0,31.6228,Potency,qHTS Assay for Inhibitors of the ERK Signaling Pathway using a Homogeneous Screening Assay,Confirmatory,,
107,1030,2,1,,17389906,1493,Inconclusive,30582681.0,216.0,31.6228,Potency,qHTS Assay for Inhibitors of Aldehyde Dehydrogenase 1 (ALDH1A1),Confirmatory,,
108,1030,2,1,,26747391,1493,Inconclusive,30582681.0,216.0,25.1189,Potency,qHTS Assay for Inhibitors of Aldehyde Dehydrogenase 1 (ALDH1A1),Confirmatory,,
109,1188,1,2,,48414898,1493,Active,,,,,DSSTox (EPAFHM) EPA Fathead Minnow Acute Toxicity,Other,,
110,1189,1,5,,48413673,1493,Inactive,,,,,DSSTox (CPDBAS) Carcinogenic Potency Database Summary SingleCellCall Results,Other,,
111,1194,1,3,,48413673,1493,Inactive,,,,,DSSTox (CPDBAS) Carcinogenic Potency Database Salmonella Mutagenicity,Other,,
112,1199,1,3,,48413673,1493,Inactive,,,,,DSSTox (CPDBAS) Carcinogenic Potency Database Summary Mouse Bioassay Results,Other,,
113,1376,1,2,,47193722,1493,Inactive,15608158.0,886069.0,,IC50,Inhibitors of Mycobacterial Glucosamine-1-phosphate acetyl transferase (GlmU),Confirmatory,,
114,1379,1,2,,26747391,1493,Inactive,1669525.0,,,Potency,Counterscreen for Luciferase (Kinase-Glo TM) Inhibition,Confirmatory,,
115,1385,2,2,,47193722,1493,Inactive,49168602.0,5888.0,,,Homologous recombination - Rad 51,Screening,,
116,1422,1,1,,26613356,1493,Inactive,31881630.0,5732.0,,,Inhibitors of the EP2 Prostaglandin E2 Receptor - Primary Screen,Screening,,
117,1422,1,1,,47193722,1493,Inactive,31881630.0,5732.0,,,Inhibitors of the EP2 Prostaglandin E2 Receptor - Primary Screen,Screening,,
118,1452,1,1,,17389906,1493,Inactive,154426292.0,239.0,,Potency,qHTS Assay for Inhibitors of 12-hLO (12-human lipoxygenase),Confirmatory,,
119,1454,1,1,,26747391,1493,Inactive,66932916.0,5594.0,,Potency,qHTS Assay for Inhibitors of the ERK Signaling Pathway using a Homogeneous Screening Assay; Stimulation with EGF,Confirmatory,,
120,1457,1,1,,17389906,1493,Inactive,44888968.0,83523.0,,Potency,qHTS Assay for Identifying the Cell-Membrane Permeable IMPase Inhibitors: Potentiation with Lithium,Confirmatory,,
121,1457,1,1,,26747391,1493,Inactive,44888968.0,83523.0,,Potency,qHTS Assay for Identifying the Cell-Membrane Permeable IMPase Inhibitors: Potentiation with Lithium,Confirmatory,,
122,1458,1,1,,17389906,1493,Inactive,10937869.0,6607.0,,Potency,qHTS Assay for Enhancers of SMN2 Splice Variant Expression,Confirmatory,,
123,1458,1,1,,26747391,1493,Inactive,10937869.0,6607.0,11.2202,Potency,qHTS Assay for Enhancers of SMN2 Splice Variant Expression,Confirmatory,,
124,1460,1,3,,26747391,1493,Inactive,92096784.0,4137.0,,Potency,"qHTS for Inhibitors of Tau Fibril Formation, Thioflavin T Binding",Confirmatory,,
125,1463,1,1,,26747391,1493,Inactive,,,,Potency,"Counterscreen qHTS for Inhibitors of Tau Fibril Formation, Fluorescence Polarization",Confirmatory,,
126,1465,1,1,,47193722,1493,Inactive,,,,EC50,"Screen for small molecule probes relevant to Friedreich's ataxia, Single Dose and Dose Response",Confirmatory,,
127,1467,1,3,,26747391,1493,Inactive,757912.0,2717.0,,Potency,qHTS Assay for Inhibitors of Human alpha-Galactosidase at pH 4.5.,Confirmatory,,
128,1468,1,1,,26747391,1493,Inactive,92096784.0,4137.0,,Potency,"qHTS for Inhibitors of Tau Fibril Formation, Fluorescence Polarization",Confirmatory,,
129,1469,1,1,,17389906,1493,Inactive,189491771.0,7068.0,,Potency,qHTS for Inhibitors of the Interaction of Thyroid Hormone Receptor and Steroid Receptor Coregulator 2,Confirmatory,,
130,1469,1,1,,26747391,1493,Inactive,189491771.0,7068.0,,Potency,qHTS for Inhibitors of the Interaction of Thyroid Hormone Receptor and Steroid Receptor Coregulator 2,Confirmatory,,
131,1471,2,1,,17389906,1493,Inactive,90903231.0,3064.0,,,qHTS Multiplex Assay to Identify Dual Action Probes in a Cell Model of Huntington: Cytoprotection (ATP),Confirmatory,,
132,1471,2,1,,26747391,1493,Inactive,90903231.0,3064.0,,,qHTS Multiplex Assay to Identify Dual Action Probes in a Cell Model of Huntington: Cytoprotection (ATP),Confirmatory,,
133,1476,2,1,,17389906,1493,Inactive,281307097.0,,,Potency,qHTS Assay for Promiscuous and Specific Inhibitors of Cruzain (without detergent),Confirmatory,,
134,1476,2,1,,26747391,1493,Inactive,281307097.0,,,Potency,qHTS Assay for Promiscuous and Specific Inhibitors of Cruzain (without detergent),Confirmatory,,
135,1477,1,1,,17389906,1493,Inactive,,,,Potency,qHTS Assay for Compounds Blocking the Interaction Between CBF-beta and RUNX1 for the Treatment of Acute Myeloid Leukemia,Confirmatory,,
136,1477,1,1,,26747391,1493,Inactive,,,,Potency,qHTS Assay for Compounds Blocking the Interaction Between CBF-beta and RUNX1 for the Treatment of Acute Myeloid Leukemia,Confirmatory,,
137,1478,2,1,,17389906,1493,Inactive,281307097.0,,,Potency,qHTS Assay for Promiscuous and Specific Inhibitors of Cruzain (with detergent),Confirmatory,,
138,1478,2,1,,26747391,1493,Inactive,281307097.0,,,Potency,qHTS Assay for Promiscuous and Specific Inhibitors of Cruzain (with detergent),Confirmatory,,
139,1479,1,2,,17389906,1493,Inactive,189491771.0,7068.0,,Potency,Total Fluorescence Counterscreen for Inhibitors of the Interaction of Thyroid Hormone Receptor and Steroid Receptor Coregulator 2,Confirmatory,,
140,1479,1,2,,26747391,1493,Inactive,189491771.0,7068.0,,Potency,Total Fluorescence Counterscreen for Inhibitors of the Interaction of Thyroid Hormone Receptor and Steroid Receptor Coregulator 2,Confirmatory,,
141,1490,2,1,,26747391,1493,Inactive,10954339.0,,,Potency,qHTS Assay for Inhibitors of Bacillus subtilis Sfp phosphopantetheinyl transferase (PPTase),Confirmatory,,
142,1511,1,3,,47193722,1493,Inactive,487738.0,3757.0,,,Primary cell-based high-throughput screening assay for identification of compounds that protect hERG from block by proarrhythmic agents,Screening,,
143,1519,1,3,,26747391,1493,Inconclusive,,,,Potency,qHTS Assay for Lipid Storage Modulators,Confirmatory,,
144,1529,1,1,,47193722,1493,Inactive,42794767.0,4215.0,,,"Multiplex HTS Assay for Inhibitors of MEK Kinase PB1 Domains, specifically MEK5 MEK Kinase3 Wildtype",Screening,,
145,1530,1,1,,47193722,1493,Inactive,22035600.0,5871.0,,,"Multiplex HTS Assay for Inhibitors of MEK Kinase PB1 Domains, specifically MEK5 MEK Kinase 2 mutant",Screening,,
146,1531,1,1,,47193722,1493,Inactive,22035600.0,5871.0,,,"Multiplex HTS Assay for Inhibitors of MEK Kinase PB1 Domains, specifically MEK5 binding to MEK Kinase 2 Wildtype",Screening,,
147,1532,1,1,,47193722,1493,Inactive,,,,,Rml C and D inhibition 384-well mixture HTS,Screening,,
148,1554,1,1,,47193722,1493,Inactive,,,,,MLPCN Ras selective lethality-BJeLR viability,Screening,,
149,1621,1,2,,47193722,1493,Inactive,,,,IC50,A Cell Based Assay for the Identification of Lead Compounds with Anti-Viral Activity Against West Nile Virus,Confirmatory,,
150,1626,1,2,,47193722,1493,Inactive,,,,IC50,High Throughput Screen to Identify Inhibitors of Mycobacterium tuberculosis H37Rv,Confirmatory,,
151,1662,1,2,,47193722,1493,Inactive,15675770.0,901648.0,,,MLPCN Streptokinase Expression Inhibition,Screening,,
152,1663,1,2,,47193722,1493,Inactive,,,,,MLPCN Platelet Activation -Dense Granule Release,Screening,,
153,1672,1,3,,47193722,1493,Inactive,6680530.0,16518.0,,,Primary cell-based high-throughput screening assay for identification of compounds that inhibit/block inward-rectifying potassium ion channel Kir2.1,Screening,,
154,1766,1,1,,26747391,1493,Inactive,18860839.0,4221.0,,Potency,qHTS Assay for Inhibitors Targeting the Menin-MLL Interaction in MLL Related Leukemias: Competition With Fluorescein Labeled MLL-derived Peptide,Confirmatory,,
155,1766,1,1,,26747391,1493,Inactive,56550039.0,4297.0,,Potency,qHTS Assay for Inhibitors Targeting the Menin-MLL Interaction in MLL Related Leukemias: Competition With Fluorescein Labeled MLL-derived Peptide,Confirmatory,,
156,1768,1,1,,26747391,1493,Inactive,18860839.0,4221.0,,Potency,qHTS Assay for Inhibitors Targeting the Menin-MLL Interaction in MLL Related Leukemias: Competition With Texas Red Labeled MLL-derived Mutant Peptide,Confirmatory,,
157,1768,1,1,,26747391,1493,Inactive,56550039.0,4297.0,,Potency,qHTS Assay for Inhibitors Targeting the Menin-MLL Interaction in MLL Related Leukemias: Competition With Texas Red Labeled MLL-derived Mutant Peptide,Confirmatory,,
158,1813,1,2,,47193722,1493,Inactive,,,,,MLPCN Alpha-Synuclein 5'UTR - 5'-UTR binding - inhibitors,Screening,,
159,1814,1,2,,47193722,1493,Inactive,,,,,MLPCN Alpha-Synuclein 5'UTR - 5'-UTR binding - activators,Screening,,
160,1832,2,1,,47193722,1493,Inactive,55976631.0,178296.0,,,MLPCN maternal gene expression-MEX-5 TCR-2 binding assay-Primary Screen,Screening,,
161,1850,2,1,,47193722,1493,Inactive,,,,IC50,A small molecule screen for inhibitors of the PhoP regulon in Salmonella typhi,Confirmatory,,
162,1863,2,1,,47193722,1493,Inactive,,,,IC50,A small molecule screen for inhibitors of the PhoP regulon in Salmonella Typhimurium,Confirmatory,,
163,1865,1,1,,26747391,1493,Inactive,,,,Potency,Quantitative High-Throughput Screen for Regulators of Epigenetic Control,Confirmatory,,
164,1875,2,1,,47193722,1493,Inactive,,,,,Luminescence Cell-Based Primary HTS to Identify Inhibitors of Polyadenylation,Screening,,
165,1885,2,1,,47193722,1493,Inactive,,,,,Luminescence Cell-Based/Microorganism Primary HTS to Identify Inhibitors of T.Cruzi Replication,Screening,,
166,1899,1,3,,47193722,1493,Inactive,83779224.0,,,,TR-FRET-based primary biochemical high-throughput screening assay to identify inhibitors of Hepatitis C Virus (HCV) core protein dimerization,Screening,,
167,1903,2,3,,47193722,1493,Inactive,297591903.0,29031019.0,,IC50,Identification of SV40 T antigen inhibitors: A route to novel anti-viral reagents,Confirmatory,,
168,1906,1,3,,47193722,1493,Inactive,55958172.0,,,,QFRET-based counterscreen for PFM18AAP inhibitors: biochemical high throughput screening assay to identify inhibitors of the Cathepsin L proteinase (CTSL1).,Screening,,
169,1910,1,2,,47193722,1493,Inactive,,,,,Luminescence Cell-Based Primary HTS to Identify Transcriptional Activators of Hypoxia-Inducible Factor Pathway,Screening,,
170,1947,1,2,,47193722,1493,Inactive,21595511.0,226016.0,,,Fluorescence polarization-based counterscreen for RBBP9 inhibitors: primary biochemical high throughput screening assay to identify inhibitors of the serine hydrolase family member Fam108B.,Screening,,
171,1948,1,1,,17389906,1493,Inactive,,,31.6228,Potency,qHTS Assay for Compounds that Induce Erasure of Genomic Imprints,Confirmatory,,
172,1948,1,1,,26747391,1493,Inactive,,,10.0,Potency,qHTS Assay for Compounds that Induce Erasure of Genomic Imprints,Confirmatory,,
173,1950,1,3,,47193722,1493,Inactive,23893623.0,3783709.0,,,Fluorescence polarization-based primary biochemical high throughput screening assay to identify inhibitors of the Epstein-Barr virus nuclear antigen 1 (EBNA-1).,Screening,,
174,1956,1,1,,47193722,1493,Inactive,,,,Conc @ Max Fold Increase,A high-throughput screen to identify small molecule compounds that augment HSV replication,Confirmatory,,
175,1962,1,2,,47193722,1493,Inactive,68476498.0,,,,Fluorescence polarization-based primary biochemical high throughput screening assay to identify inhibitors of tRNA 2'-phosphotransferase (TPT1).,Screening,,
176,1974,1,2,,47193722,1493,Inactive,4758484.0,9446.0,,,Fluorescence polarization-based counterscreen for RBBP9 inhibitors: primary biochemical high throughput screening assay to identify inhibitors of the oxidoreductase glutathione S-transferase omega 1(GSTO1).,Screening,,
177,1987,1,2,,47193722,1493,Inactive,37589898.0,5536.0,,,Fluorescence-based primary biochemical high throughput screening assay to identify inhibitors of Protein Phosphatase 5 (PP5).,Screening,,
178,1996,2,2,,47193722,1493,Active,,,,,Aqueous Solubility from MLSMR Stock Solutions,Other,,
179,2016,1,3,,47193722,1493,Inactive,1302091.0,,,,Multiplex HTS Screen of TOR pathway GFP-fusion proteins in Saccharomyes cerevisiae_specifically_ MEP2_MLPCN.,Screening,,
180,2023,1,3,,47193722,1493,Inactive,486173.0,,,,Multiplex HTS Screen of TOR pathway GFP-fusion proteins in Saccharomyes cerevisiae_specifically_ LAP4_MLPCN.,Screening,,
181,2025,1,3,,47193722,1493,Inactive,536029.0,,,,Multiplex HTS Screen of TOR pathway GFP-fusion proteins in Saccharomyes cerevisiae_specifically_ RPL19A_MLPCN.,Screening,,
182,2029,1,3,,47193722,1493,Inactive,171229.0,,,,Multiplex HTS Screen of TOR pathway GFP-fusion proteins in Saccharomyes cerevisiae_specifically_ CIT2_MLPCN.,Screening,,
183,2052,2,1,,47193722,1493,Inactive,124486680.0,16408.0,,,HTS for developing T Cell Immune Modulators,Screening,,
184,2057,1,2,,47193722,1493,Inactive,78070770.0,4170.0,,,Fluorescence polarization-based primary biochemical high throughput screening assay to identify inhibitors of myeloid cell leukemia sequence 1 (MCL1) interactions with BIM-BH3 peptide.,Screening,,
185,2066,1,4,,47193722,1493,Inactive,85666113.0,850333.0,,,Multiplex HTS Screen of TOR pathway GFP-fusion proteins in Saccharomyes cerevisiae_specifically_ AGP1_MLPCN.,Screening,,
186,2094,1,2,,47193722,1493,Inactive,67463988.0,,,,Plate Read Microorganism-Based Primary HTS to Identify Modulators of the AI-2 Quorum Sensing System,Screening,,
187,2094,1,2,,47193722,1493,Inactive,67463989.0,,,,Plate Read Microorganism-Based Primary HTS to Identify Modulators of the AI-2 Quorum Sensing System,Screening,,
188,2094,1,2,,47193722,1493,Inactive,166202459.0,,,,Plate Read Microorganism-Based Primary HTS to Identify Modulators of the AI-2 Quorum Sensing System,Screening,,
189,2097,1,2,,47193722,1493,Inactive,21361340.0,2932.0,,,Cell-Free Homogeneous Primary HTS to Identify Inhibitors of GSK3beta Activity,Screening,,
