,AID,AID Version,AID Revision,Panel Member ID,SID,CID,Bioactivity Outcome,Target GI,Target GeneID,Activity Value [uM],Activity Name,Assay Name,Bioassay Type,PubMed ID,RNAi
664,434959,1,1,,85788406,3308,Inactive,,,,,Fluorescence Cell-Based Primary HTS to Measure Inhibition of Y box Binding Protein 1 Expression,Screening,,
665,434962,1,2,,56422166,3308,Inactive,155969707.0,3416.0,,,Fluorescence polarization-based cell-based primary high throughput screening assay to identify inhibitors of insulin-degrading enzyme (IDE),Screening,,
666,434973,1,3,,855612,3308,Inactive,120538355.0,57337.0,,,uHTS Luminescent assay for identification of inhibitors of Sentrin-specific protease 7 (SENP7),Screening,,
667,434989,1,1,,56422166,3308,Inactive,222080095.0,3061.0,,,Fluorescence-based cell-based primary high throughput screening assay to identify antagonists of the orexin 1 receptor (OX1R; HCRTR1),Screening,,
668,435003,1,3,,855612,3308,Inactive,,,,,uHTS luminescence assay for the identification of chemical inhibitors of T-cell specific antigen receptor-induced NF-kB activation,Screening,,
669,435005,1,1,,56422166,3308,Inactive,,,,,Luminescence Cell-Based Primary HTS to Identify Inhibitors of Beta Cell Apoptosis.,Screening,,
670,435022,2,2,,855612,3308,Inactive,,,,,uHTS luminescence assay for the identification of chemical inhibitors of B-cell specific antigen receptor-induced NF-kB activation,Screening,,
671,435030,1,2,,56422166,3308,Inactive,15645703.0,899625.0,,,Absorbance-based primary bacterial cell-based high throughput screening assay to identify inhibitors of AddAB recombination protein complex,Screening,,
672,435030,1,2,,56422166,3308,Inactive,15646160.0,899738.0,,,Absorbance-based primary bacterial cell-based high throughput screening assay to identify inhibitors of AddAB recombination protein complex,Screening,,
673,449728,1,2,,56422166,3308,Inactive,,,,,Counterscreen for inhibitors of AddAB: absorbance-based bacterial cell-based high throughput screening assay to identify inhibitors of bacterial viability,Screening,,
674,449739,1,2,,855612,3308,Inactive,53832009.0,8912.0,,,Inhibitors of Cav3 T-type Calcium Channels: Primary Screen,Screening,,
675,449762,1,2,,56422166,3308,Inactive,,,,IC50,High Throughput Screening Assay used to Identify Novel Compounds that Inhibit Mycobacterium Tuberculosis in 7H9 Media,Confirmatory,,
676,449763,1,3,,855612,3308,Inactive,,,,,uHTS identification of small molecule activators of the apoptotic arm of the Unfolded Protein response via a luminescent-based reporter assay,Screening,,
677,449768,1,1,,855612,3308,Inactive,7108463.0,6531.0,,,High Throughput Screening for Cocaine Antagonists: Primary Screen,Screening,,
678,463073,1,2,,855612,3308,Inactive,216548487.0,23569.0,,,Fluorescence polarization-based primary biochemical high throughput screening assay to identify inhibitors of Protein Arginine Deiminase 4 (PAD4),Screening,,
679,463075,1,1,,855612,3308,Inactive,,,,,HTS to identify inhibitors of TNF-alpha Induced Cell Death in Jurkat FADD-/- Cells.,Screening,,
680,463079,1,2,,56422166,3308,Inactive,,,,,Fluorescence-based counterscreen for orexin 1 receptor (OX1R) antagonists: cell-based assay to identify antagonists of the parental CHO cell line,Screening,,
681,463082,1,1,,56422166,3308,Inactive,270133071.0,7941.0,,,Fluorescence polarization-based primary biochemical high throughput screening assay to identify inhibitors of the plasma platelet activating factor acetylhydrolase (pPAFAH),Screening,,
682,463096,1,1,,50105240,3308,Inactive,,,,Potency,Validation screen for inhibitors of Lassa infection,Confirmatory,,
683,463097,1,1,,50105240,3308,Inactive,7705682.0,51053.0,,Potency,Validation screen for small molecules that induce DNA re-replication in MCF 10A normal breast cells,Confirmatory,,
684,463104,1,2,,855612,3308,Inactive,,,,,uHTS identification of small molecule activators of the adaptive arm of the Unfolded Protein response via a luminescent-based reporter assay,Screening,,
685,463106,1,2,,90340662,3308,Inactive,188528692.0,9099.0,,Potency,qHTS Validation Assay for Inhibitors of Ubiquitin-specific Protease USP2a Using CHOP2 as the Reporter,Confirmatory,,
686,463111,1,1,,855612,3308,Inactive,5032039.0,5999.0,,,Primary cell-based high-throughput screening assay for identification of compounds that potentiate/activate regulator of G-protein signaling 4 (RGS4),Screening,,
687,463115,1,1,,855612,3308,Inactive,119622516.0,5045.0,,,High throughput fluorescence intensity-based biochemical assay to screen for small molecule inhibitors of Furin conducted by the Pittsburgh Molecular Library Screening Center.,Screening,,
688,463141,1,2,,56422166,3308,Inactive,14790119.0,836.0,,,Absorbance-based primary biochemical high throughput screening assay to identify activators of procaspase-3,Screening,,
689,463165,1,1,,855612,3308,Inactive,5032039.0,5999.0,,,Primary cell-based high-throughput screening assay for identification of compounds that inhibit regulator of   G-protein signaling 4 (RGS4),Screening,,
690,463187,1,1,,855612,3308,Inactive,,,,,384-well Z-Lyte format Hck-Nef inhibitor HTS run at the PMLSC,Screening,,
691,463189,1,1,,855612,3308,Inactive,,,,,96-well format Chlamydomonas reinhardtii Algae Gravitaxis Assay to measure the difference in the absorbance between the small compact plug of WT swimming algae versus the MUT algae lacking cilia.,Screening,,
692,463189,1,1,,53777585,3308,Inactive,,,,,96-well format Chlamydomonas reinhardtii Algae Gravitaxis Assay to measure the difference in the absorbance between the small compact plug of WT swimming algae versus the MUT algae lacking cilia.,Screening,,
693,463190,1,2,,855612,3308,Inactive,285809906.0,856395.0,,,uHTS identification of small molecule inhibitors of tim10-1 yeast via a luminescent assay,Screening,,
694,463193,1,1,,855612,3308,Inactive,31563518.0,84557.0,,,High-content cell-based screening for modulators of autophagy,Screening,,
695,463195,1,2,,855612,3308,Inactive,285809906.0,856395.0,,,uHTS identification of small molecule inhibitors of tim10 yeast via a luminescent assay,Screening,,
696,463210,1,2,,56422166,3308,Inactive,55960760.0,,,,Counterscreen for procaspase-3 activators: absorbance-based primary biochemical high throughput screening assay to identify activators of procaspase-7,Screening,,
697,463212,1,1,,855612,3308,Inactive,285814664.0,855751.0,,,uHTS identification of small molecule inhibitors of tim23-1 yeast via a luminescent assay,Screening,,
698,463254,1,1,,855612,3308,Inactive,188528692.0,9099.0,,Potency,qHTS Assay for Inhibitors of Ubiquitin-specific Protease USP2a Using CHOP2 as the Reporter,Confirmatory,,
699,475147,3,3,,103188188,3308,Unspecified,,,,,Inhibition of DMBA-induced/TPA-promoted skin carcinogenesis in ICR mouse assessed as reduction in tumor burden at 0.0025% topically applied qd treated one week before DMBA-TPA challenge after 20 weeks relative to control,Other,20299217.0,
700,475151,3,3,,103188188,3308,Unspecified,,,,,"Toxicity in ICR mouse at 0.0025%, po",Other,20299217.0,
701,485270,1,1,,56422166,3308,Inactive,222080095.0,3061.0,,,FRET-based cell-based primary high throughput screening assay to identify antagonists of the orexin 1 receptor (OX1R; HCRTR1),Screening,,
702,485272,1,1,,56422166,3308,Inactive,216548487.0,23569.0,,,Fluorescence polarization-based primary biochemical high throughput screening assay to identify inhibitors of Protein Arginine Deiminase 4 (PAD4) (1536 HTS),Screening,,
703,485273,2,1,,855612,3308,Inactive,4507793.0,7334.0,,,uHTS identification of UBC13 Polyubiquitin Inhibitors via a TR-FRET Assay,Screening,,
704,485275,1,3,,56422166,3308,Inactive,,,,,Phenotypic HTS multiplex for antifungal efflux pump inhibitors,Screening,,
705,485281,1,1,,855612,3308,Inactive,254220970.0,,,Potency,qHTS Assay for Identification of Novel General Anesthetics,Confirmatory,,
706,485290,1,1,,855612,3308,Inactive,20150581.0,,,Potency,qHTS Assay for Inhibitors of Tyrosyl-DNA Phosphodiesterase (TDP1),Confirmatory,,
707,485290,1,1,,26747213,3308,Inactive,20150581.0,,,Potency,qHTS Assay for Inhibitors of Tyrosyl-DNA Phosphodiesterase (TDP1),Confirmatory,,
708,485290,1,1,,50105240,3308,Inactive,20150581.0,,,Potency,qHTS Assay for Inhibitors of Tyrosyl-DNA Phosphodiesterase (TDP1),Confirmatory,,
709,485294,1,1,,855612,3308,Inactive,119389684.0,,,Potency,qHTS Inhibitors of AmpC Beta-Lactamase (assay with detergent),Confirmatory,,
710,485295,1,2,,90340662,3308,Inactive,30027657.0,,,Potency,qHTS Validation Assay for the Inhibitors of DNA Replication in Gram-Positive Bacteria,Confirmatory,,
711,485297,1,1,,855612,3308,Inactive,4759012.0,9367.0,,Potency,qHTS Assay for Rab9 Promoter Activators,Confirmatory,,
712,485297,1,1,,90340662,3308,Inactive,4759012.0,9367.0,,Potency,qHTS Assay for Rab9 Promoter Activators,Confirmatory,,
713,485298,1,1,,855612,3308,Inactive,,,,Potency,qHTS Assay for Small Molecule Inhibitors of Mitochondrial Division or Activators of Mitochondrial Fusion,Confirmatory,,
714,485298,1,1,,90340662,3308,Inactive,,,,Potency,qHTS Assay for Small Molecule Inhibitors of Mitochondrial Division or Activators of Mitochondrial Fusion,Confirmatory,,
715,485313,1,2,,855612,3308,Inactive,255652944.0,4864.0,,Potency,qHTS Assay for NPC1 Promoter Activators,Confirmatory,,
716,485313,1,2,,90340662,3308,Inactive,255652944.0,4864.0,,Potency,qHTS Assay for NPC1 Promoter Activators,Confirmatory,,
717,485314,1,1,,855612,3308,Inactive,4505931.0,5423.0,,Potency,qHTS Assay for Inhibitors of DNA Polymerase Beta,Confirmatory,,
718,485314,1,1,,50105240,3308,Inactive,4505931.0,5423.0,,Potency,qHTS Assay for Inhibitors of DNA Polymerase Beta,Confirmatory,,
719,485341,1,1,,855612,3308,Inactive,119389684.0,,,Potency,qHTS Inhibitors of AmpC Beta-Lactamase (assay without detergent),Confirmatory,,
720,485342,1,2,,90340662,3308,Inactive,5454140.0,7251.0,,Potency,qHTS Validation Assay for Iinhibitors of HIV-1 Budding by Blocking the Interaction of PTAP/TSG101,Confirmatory,,
721,485344,1,1,,855612,3308,Inactive,4503385.0,1813.0,,,HTS Assay for Allosteric Antagonists of the Human D2 Dopamine Receptor: Primary Screen for Antagonists,Screening,,
722,485345,1,2,,90340662,3308,Inactive,,,,Potency,qHTS Validation Assay to Find Inhibitors of Chronic Active B-Cell Receptor Signaling,Confirmatory,,
723,485346,1,1,,855612,3308,Inactive,88702791.0,4194.0,,,uHTS for identification of Inhibitors of Mdm2/MdmX interaction in luminescent format.,Screening,,
724,485346,1,1,,855612,3308,Inactive,89993689.0,4193.0,,,uHTS for identification of Inhibitors of Mdm2/MdmX interaction in luminescent format.,Screening,,
725,485347,1,2,,855612,3308,Inactive,4503385.0,1813.0,,,HTS Assay for Positive Allosteric Modulators of the Human D2 Dopamine Receptor: Primary Screen for Potentiators,Screening,,
726,485349,1,1,,855612,3308,Inactive,71902540.0,472.0,,Potency,qHTS Assay for Identifying a Potential Treatment of Ataxia-Telangiectasia,Confirmatory,,
727,485350,1,2,,92124273,3308,Inactive,126642418.0,,,,A screen for compounds that inhibit the bacterial siderophore biosynthetic enzyme BasE,Screening,,
728,485350,1,2,,92125267,3308,Inactive,126642418.0,,,,A screen for compounds that inhibit the bacterial siderophore biosynthetic enzyme BasE,Screening,,
729,485353,2,1,,855612,3308,Active,30124074.0,1489680.0,,,qHTS of Yeast-based Assay for SARS-CoV PLP,Confirmatory,,
730,485358,1,1,,855612,3308,Inactive,4503385.0,1813.0,,,HTS Assay for Allosteric Agonists of the Human D2 Dopamine Receptor: Primary Screen for Agonists,Screening,,
731,485360,1,1,,855612,3308,Inactive,117938328.0,26013.0,,Potency,qHTS Assay for the Inhibitors of L3MBTL1,Confirmatory,,
732,485364,1,1,,855612,3308,Inconclusive,15149312.0,8345881.0,56.2341,Potency,qHTS Assay for the Inhibitors of Schistosoma Mansoni Peroxiredoxins,Confirmatory,,
733,485366,1,2,,90340662,3308,Inactive,4501969.0,154.0,,Potency,qHTS validation assay of beta-arrestin-biased ligands of beta2-adrenergic receptor,Confirmatory,,
734,485367,1,2,,855612,3308,Inconclusive,72386991.0,3656265.0,0.8492,Potency,qHTS Assay to Find Inhibitors of T. brucei phosphofructokinase,Confirmatory,,
735,485368,1,2,,90340662,3308,Inconclusive,72386991.0,3656265.0,0.7569,Potency,qHTS Validation Assay to Find Inhibitors of T. brucei phosphofructokinase,Confirmatory,,
736,488745,1,4,,85231029,3308,Inactive,,,,Potency,"Quantitative high throughput screen for delayed death inhibitors of the malarial parasite plastid, 96 hour incubation",Confirmatory,,
737,488752,1,4,,85231029,3308,Inactive,,,,Potency,"Quantitative high throughput screen for delayed death inhibitors of the malarial parasite plastid, 48 hour incubation",Confirmatory,,
738,488772,1,1,,90340662,3308,Inactive,8659577.0,58819.0,,Potency,qHTS Assay for Substrates of Mammalian Selenoprotein Thioredoxin Reductase 1 (TrxR1),Confirmatory,,
739,488773,1,2,,90340662,3308,Inactive,8659577.0,58819.0,,Potency,qHTS Assay for Inhibitors of Mammalian Selenoprotein Thioredoxin Reductase 1 (TrxR1),Confirmatory,,
740,488806,1,2,,855612,3308,Inactive,148539876.0,156.0,,,RNA aptamer-based validation for inhibitors of GRK2,Screening,,
741,488816,1,1,,90340662,3308,Inactive,4758356.0,2237.0,,Potency,qHTS Validation Assay for the Inhibitors of Human Flap endonuclease 1 (FEN1),Confirmatory,,
742,488837,1,1,,855612,3308,Inactive,26667227.0,2139.0,,Potency,qHTS Assay for Inhibitors of the Phosphatase Activity of Eya2,Confirmatory,,
743,488837,1,1,,90340662,3308,Inactive,26667227.0,2139.0,,Potency,qHTS Assay for Inhibitors of the Phosphatase Activity of Eya2,Confirmatory,,
744,488839,1,1,,56422166,3308,Inactive,20072248.0,8851.0,,,Development of CDK5 inhibitors   Measured in Biochemical System Using Plate Reader - 2083-01_Inhibitor_SinglePoint_HTS_Activity,Screening,,
745,488839,1,1,,56422166,3308,Inactive,48146199.0,1020.0,,,Development of CDK5 inhibitors   Measured in Biochemical System Using Plate Reader - 2083-01_Inhibitor_SinglePoint_HTS_Activity,Screening,,
746,488847,1,3,,56422166,3308,Inactive,148539876.0,156.0,,,RNA aptamer-based HTS for inhibitors of GRK2,Screening,,
747,488862,1,1,,56422166,3308,Inactive,,,,,Inhibitors of Prion Protein 5' UTR mRNA Measured in Cell-Based System Using Plate Reader - 2078-01_Inhibitor_SinglePoint_HTS_Activity,Screening,,
748,488890,1,2,,56422166,3308,Inactive,,,,IC50,"Elucidation of physiology of non-replicating, drug-tolerant Mycobacterium tuberculosis",Confirmatory,,
749,488895,1,2,,56422166,3308,Inactive,90111653.0,948321.0,,,High Throughput Screen for Tat Transport Inhibitors Measured in Microorganism System Using Plate Reader - 2093-01_Inhibitor_SinglePoint_HTS_Activity,Screening,,
750,488896,1,1,,56422166,3308,Inactive,14389423.0,20778.0,,,HTS using DiI-HDL to assay lipid transfer in ldlA[SR-BI] cells Measured in Cell-Based System Using Plate Reader - 2085-01_Inhibitor_SinglePoint_HTS_Activity,Screening,,
751,488899,1,1,,56422166,3308,Inactive,40807040.0,4286.0,,,MITF Measured in Cell-Based System Using Plate Reader - 2084-01_Inhibitor_SinglePoint_HTS_Activity,Screening,,
752,488922,1,2,,855612,3308,Inactive,7706135.0,,,,Primary cell-based screen for identification of compounds that inhibit the two-pore domain potassium channel KCNK9,Screening,,
753,488949,1,2,,85231029,3308,Inactive,41055989.0,54737.0,,Potency,qHTS Validation Assay for Inhibitors for MPP8 Chromodomain Interactions with Methylated Histone Tails,Confirmatory,,
754,488949,1,2,,90340662,3308,Inactive,41055989.0,54737.0,,Potency,qHTS Validation Assay for Inhibitors for MPP8 Chromodomain Interactions with Methylated Histone Tails,Confirmatory,,
755,488953,1,1,,90340662,3308,Inactive,187960037.0,10951.0,22.3872,Potency,qHTS Validation Assay for Inhibitors of HP1-beta Chromodomain Interactions with Methylated Histone Tails,Confirmatory,,
756,488965,1,2,,56422166,3308,Inactive,218891639.0,,,,Fluorescent Biochemical Primary HTS to Identify Inhibitors of P. aeruginosa PvdQ acylase Measured in Biochemical System Using Plate Reader and Imaging Combination - 2091-01_Inhibitor_SinglePoint_HTS_Activity,Screening,,
757,488966,1,1,,56422166,3308,Inactive,,,,IC50,Primary and Confirmatory Screening for Inhibitors of Bacterial Capsule Biogenesis,Confirmatory,,
758,488975,1,2,,56422166,3308,Inactive,11141885.0,60482.0,,,Primary cell-based screen for identification of compounds that inhibit the Choline Transporter (CHT),Screening,,
759,488977,1,2,,56422166,3308,Inactive,11141885.0,60482.0,,,Primary cell-based screen for identification of compounds that allosterically activate the Choline Transporter (CHT),Screening,,
760,488978,1,1,,90340662,3308,Inactive,45359078.0,,,Potency,High-Throughput Screening for Modulators of Cytosolic Chaperonin Activity: MmCpn Primary Screen,Confirmatory,,
761,488979,1,1,,50105240,3308,Inactive,74315350.0,7442.0,,Potency,HTS Assay for Compounds that Act as Enhancers of the Vanilloid Receptor 1,Confirmatory,,
762,488980,1,1,,85231029,3308,Inactive,38016895.0,7253.0,,Potency,qHTS Assay for Antagonists of the Thyroid Stimulating Hormone Receptor,Confirmatory,,
763,488981,1,1,,90340662,3308,Inactive,4503383.0,1812.0,,Potency,HTS Assay for Allosteric Agonists of the Human D1 Dopamine Receptor: Primary Screen for Agonists,Confirmatory,,
764,488982,1,1,,90340662,3308,Inactive,4503383.0,1812.0,,Potency,HTS Assay for Allosteric Agonists of the Human D1 Dopamine Receptor: Primary Screen for Potentiators,Confirmatory,,
765,488983,1,1,,90340662,3308,Inactive,4503383.0,1812.0,,Potency,HTS Assay for Allosteric Agonists of the Human D1 Dopamine Receptor: Primary Screen for Antagonists,Confirmatory,,
766,489030,2,1,,855612,3308,Inactive,187952397.0,317.0,,,uHTS Fluorescent assay for identification of inhibitors of Apaf-1,Screening,,
767,489031,2,1,,855612,3308,Inactive,187952397.0,317.0,,,uHTS Fluorescent assay for identification of activators of Apaf-1,Screening,,
768,492947,1,1,,855612,3308,Inactive,4501969.0,154.0,,Potency,qHTS assay of beta-arrestin-biased ligands of beta2-adrenergic receptor,Confirmatory,,
769,492953,1,1,,56422166,3308,Inactive,296080766.0,5049.0,,,"Fluorescence polarization-based primary biochemical high throughput screening assay to identify inhibitors of human platelet-activating factor acetylhydrolase 1b, catalytic subunit 2 (PAFAH1B2)",Screening,,
770,492956,1,1,,56422166,3308,Inactive,4758878.0,5051.0,,,Fluorescence polarization-based primary biochemical high throughput screening assay to identify inhibitors of human platelet activating factor acetylhydrolase 2 (PAFAH2),Screening,,
771,492967,1,2,,92125267,3308,Inactive,47566732.0,,,,A screen for compounds that inhibit the CapD enzyme of Bacillus anthracis,Other,,
772,492967,1,2,,99301235,3308,Inactive,47566732.0,,,,A screen for compounds that inhibit the CapD enzyme of Bacillus anthracis,Other,,
773,492972,1,1,,56422166,3308,Inactive,225543099.0,5050.0,,,"Fluorescence polarization-based primary biochemical high throughput screening assay to identify inhibitors of human platelet-activating factor acetylhydrolase 1B, catalytic subunit 3 (PAFAH1B3)",Screening,,
774,493005,1,1,,56422166,3308,Inactive,5454140.0,7251.0,,Potency,qHTS Assay for Iinhibitors of HIV-1 Budding by Blocking the Interaction of PTAP/TSG101,Confirmatory,,
775,493008,1,1,,56422166,3308,Inactive,1927.0,100037999.0,,,Fluorescence-based biochemical primary high throughput screening assay to identify activators of the calcium sensitivity of cardiac Regulated Thin Filaments (RTF),Screening,,
776,493008,1,1,,56422166,3308,Inactive,4507615.0,7134.0,,,Fluorescence-based biochemical primary high throughput screening assay to identify activators of the calcium sensitivity of cardiac Regulated Thin Filaments (RTF),Screening,,
777,493008,1,1,,56422166,3308,Inactive,48255881.0,7139.0,,,Fluorescence-based biochemical primary high throughput screening assay to identify activators of the calcium sensitivity of cardiac Regulated Thin Filaments (RTF),Screening,,
778,493008,1,1,,56422166,3308,Inactive,151101270.0,7137.0,,,Fluorescence-based biochemical primary high throughput screening assay to identify activators of the calcium sensitivity of cardiac Regulated Thin Filaments (RTF),Screening,,
779,493011,1,1,,855612,3308,Inactive,21955158.0,200315.0,,,uHTS identification of APOBEC3A DNA Deaminase Inhibitors via a fluorescence-based single-stranded DNA deaminase assay,Screening,,
780,493012,1,1,,855612,3308,Inactive,13399304.0,60489.0,,,uHTS identification of APOBEC3G DNA Deaminase Inhibitors via a fluorescence-based single-stranded DNA deaminase assay,Screening,,
781,493014,1,1,,855612,3308,Inconclusive,,,0.0058,Potency,qHTS Assay to Find Inhibitors of Chronic Active B-Cell Receptor Signaling,Confirmatory,,
782,493027,1,2,,56422166,3308,Inactive,31542303.0,51099.0,,,"Luminescence-based biochemical high throughput validation assay to identify inhibitors of the interaction of the lipase co-activator protein, abhydrolase domain containing 5 (ABHD5) with perilipin-1 (PLIN1)",Screening,,
783,493027,1,2,,56422166,3308,Inactive,223718203.0,5346.0,,,"Luminescence-based biochemical high throughput validation assay to identify inhibitors of the interaction of the lipase co-activator protein, abhydrolase domain containing 5 (ABHD5) with perilipin-1 (PLIN1)",Screening,,
784,493033,1,2,,92124273,3308,Inactive,614089026.0,,,,A screen for compounds that inhibit the bacterial siderophore biosynthetic enzyme MbtI,Other,,
785,493033,1,2,,92125267,3308,Inactive,614089026.0,,,,A screen for compounds that inhibit the bacterial siderophore biosynthetic enzyme MbtI,Other,,
786,493035,1,2,,56422166,3308,Inactive,31542303.0,51099.0,,,"Luminescence-based biochemical high throughput validation assay to identify inhibitors of the interaction of the lipase co-activator protein, abhydrolase domain containing 5 (ABHD5) with perilipin-5 (MLDP; PLIN5)",Screening,,
787,493035,1,2,,56422166,3308,Inactive,116292172.0,440503.0,,,"Luminescence-based biochemical high throughput validation assay to identify inhibitors of the interaction of the lipase co-activator protein, abhydrolase domain containing 5 (ABHD5) with perilipin-5 (MLDP; PLIN5)",Screening,,
788,493036,1,2,,855612,3308,Inactive,110611243.0,4923.0,,,Image-Based HTS for Selective Agonists for NTR1,Screening,,
789,493056,1,1,,855612,3308,Inactive,4507681.0,7201.0,,,qHTS for Small Molecule Agonists and Allosteric Enhancers of Human TRH Receptor: Primary Screen for Enhancers,Screening,,
790,493084,1,1,,855612,3308,Inactive,4507681.0,7201.0,,,qHTS for Small Molecule Agonists and Allosteric Enhancers of Human TRH Receptor: Primary Screen for Agonists.,Screening,,
791,493087,1,1,,56422166,3308,Inactive,155969707.0,3416.0,,,Fluorescence polarization-based cell-based primary high throughput screening assay to identify activators of insulin-degrading enzyme (IDE),Screening,,
792,493091,1,1,,56422166,3308,Inactive,10864009.0,58190.0,,,uHTS Colorimetric assay for identification of inhibitors of Scp-1,Screening,,
793,493098,1,1,,56422166,3308,Inactive,37187860.0,1235.0,,,uHTS identification of small molecule antagonists of the CCR6 receptor via a luminescent beta-arrestin assay,Screening,,
794,493106,1,1,,90340662,3308,Inactive,116283940.0,79915.0,,Potency,Validation screen for small molecules that induce genotoxicity in human embryonic kidney (HEK293T) cells expressing luciferase-tagged ELG1,Confirmatory,,
795,493107,1,1,,90340662,3308,Inactive,116283940.0,79915.0,,Potency,Validation screen for small molecules that inhibit ELG1-dependent DNA repair in human embryonic kidney (HEK293T) cells expressing luciferase-tagged ELG1,Confirmatory,,
796,493127,1,1,,50105240,3308,Inactive,4507681.0,7201.0,,,qHTS for Small Molecule Agonists and Allosteric Enhancers of Human TRH Receptor: Validation Screen for Agonists,Screening,,
797,493131,1,1,,56422166,3308,Inactive,6679827.0,14282.0,,,Activator for delta FosB/delta FosB homodimer Measured in Biochemical System Using Plate Reader - 2072-01_Activator_SinglePoint_HTS_Activity,Screening,,
798,493140,1,1,,103913789,3308,Inactive,,,,,Screening small molecules to find regulators of human embryonic stem cell survival.,Screening,,
799,493153,1,1,,90340662,3308,Inactive,,4780.0,,Potency,Nrf2 qHTS screen for inhibitors: Validation,Confirmatory,,
800,493153,1,1,,90340662,3308,Inactive,224028257.0,4780.0,,Potency,Nrf2 qHTS screen for inhibitors: Validation,Confirmatory,,
801,493160,1,1,,56422166,3308,Inactive,156151420.0,80201.0,,,uHTS Fluorescent assay for identification of inhibitors of hexokinase domain containing  I (HKDC1),Screening,,
802,493162,1,2,,99301235,3308,Inactive,335756.0,,,,A screen for compounds that inhibit processive DNA synthesis of vaccinia virus,Other,,
803,493164,1,2,,90340662,3308,Inactive,6679377.0,18792.0,,Potency,qHTS for Inhibitors of Cell Surface uPA Generation: Validation Assay,Confirmatory,,
804,493164,1,2,,90340662,3308,Inactive,7242179.0,18793.0,,Potency,qHTS for Inhibitors of Cell Surface uPA Generation: Validation Assay,Confirmatory,,
805,493164,1,2,,90340662,3308,Inactive,257471003.0,18815.0,,Potency,qHTS for Inhibitors of Cell Surface uPA Generation: Validation Assay,Confirmatory,,
806,493187,1,2,,56422166,3308,Inactive,156151420.0,80201.0,,,uHTS Fluorescent assay for identification of activators of hexokinase domain containing  I (HKDC1),Screening,,
807,493189,1,1,,50105240,3308,Inactive,4503895.0,2584.0,,Potency,qHTS Validation Assay for Inhibitors of Human Galactokinase (GALK),Confirmatory,,
808,493244,1,1,,56422166,3308,Inactive,1927.0,100037999.0,,,Fluorescence-based biochemical primary high throughput screening assay to identify inhibitors of the calcium sensitivity of cardiac Regulated Thin Filaments (RTF),Screening,,
809,493244,1,1,,56422166,3308,Inactive,4507615.0,7134.0,,,Fluorescence-based biochemical primary high throughput screening assay to identify inhibitors of the calcium sensitivity of cardiac Regulated Thin Filaments (RTF),Screening,,
