,AID,AID Version,AID Revision,Panel Member ID,SID,CID,Bioactivity Outcome,Target GI,Target GeneID,Activity Value [uM],Activity Name,Assay Name,Bioassay Type,PubMed ID,RNAi
0,1053175,2,1,,178126228,830,Inactive,,,,,A screen for compounds that inhibit growth of Escherichia coli,Other,,
1,1159550,3,1,,252402154,830,Inactive,12653201.0,5226.0,,,Human Phosphogluconate dehydrogenase (6PGD) Inhibitor Screening,Screening,26479318.0,
2,1159580,2,1,,268735365,830,Inactive,,,,,"The chemical genetic matrix (CGM) dataset as reported in Wildenhain et al. (2015) Prediction of Synergism from Chemical-Genetic Interactions by Machine Learning. Cell Systems Volume 1, Issue 6, p383-395",Summary,,
3,1159583,2,1,,178126228,830,Inactive,,,,,High throughput screen for small molecule inhibitors of a hypoxia-regulated fluorescent biosensor in Mycobacterium tuberculosis,Other,,
4,1159607,2,1,,312996476,830,Inactive,,,,,Screen for inhibitors of RMI FANCM (MM2) intereaction,Other,26962873.0,
5,1259309,1,1,,178126228,830,Inactive,,,,,A screen for compounds that are lethal to S. aureus RN4220 with the processive glycosyltransferase UgtP deleted,Other,,
6,1259311,1,1,,178126228,830,Inactive,,,,,A screen for compounds that are lethal to S. aureus RN4220,Other,,
7,1259423,1,2,,354961580,830,Inactive,,,,,Primary cell-based high-throughput screening assay for identification of small molecule agonists of Aedes aegypti NPYLR7 [Small Molecule Inhibitors of Mosquito Biting Behavior],Screening,,
