,AID,AID Version,AID Revision,Panel Member ID,SID,CID,Bioactivity Outcome,Target GI,Target GeneID,Activity Value [uM],Activity Name,Assay Name,Bioassay Type,PubMed ID,RNAi
0,421,1,3,,17389897,8815,Inactive,,,,,Cell Viability - BJ,Confirmatory,,
1,426,1,2,,17389897,8815,Inactive,,,,,Cell Viability - Jurkat,Confirmatory,,
2,427,1,1,,17389897,8815,Inactive,,,,,Cell Viability - Hek293,Confirmatory,,
3,433,1,1,,17389897,8815,Inactive,,,,,Cell Viability - HepG2,Confirmatory,,
4,434,1,2,,17389897,8815,Inactive,,,,,Cell Viability - MRC5,Confirmatory,,
5,435,1,2,,17389897,8815,Inactive,,,,,Cell Viability - SK-N-SH,Confirmatory,,
6,445,3,1,,17389897,8815,Inactive,10092619.0,4792.0,,,IkB Signaling,Confirmatory,,
7,530,1,1,,17389897,8815,Inactive,2499604.0,26414.0,,,JNK3 AlphaScreen Assay,Confirmatory,,
8,540,1,1,,17389897,8815,Inactive,,,,,Cell Viability - N2a,Confirmatory,,
9,541,1,1,,17389897,8815,Inactive,,,,,Cell Viability - NIH 3T3,Confirmatory,,
10,542,1,1,,17389897,8815,Inactive,,,,,Cell Viability - HUV-EC-C,Confirmatory,,
11,543,1,1,,17389897,8815,Inactive,,,,,Cell Viability - H-4-II-E,Confirmatory,,
12,544,2,1,,17389897,8815,Inactive,,,,,Cell Viability - SH-SY5Y,Confirmatory,,
13,545,1,1,,17389897,8815,Inactive,,,,,Cell Viability - Renal Proximal Tubule,Confirmatory,,
14,546,1,1,,17389897,8815,Inactive,,,,,Cell Viability - Mesenchymal,Confirmatory,,
15,584,1,3,,17389897,8815,Inactive,119389684.0,,,,Promiscuous and Specific Inhibitors of AmpC Beta-Lactamase (assay with detergent),Confirmatory,,
16,585,1,4,,17389897,8815,Inactive,119389684.0,,,,Promiscuous and Specific Inhibitors of AmpC Beta-Lactamase (assay without detergent),Confirmatory,,
17,595,1,3,,17389897,8815,Inactive,,,,,qHTS Assay for Disrupters of an Hsp90 Co-Chaperone Interaction,Confirmatory,,
18,596,1,2,,17389897,8815,Inactive,92096784.0,4137.0,,,qHTS Assay for Tau Filament Binding,Confirmatory,,
19,603,1,2,,17389897,8815,Inactive,,,,,qHTS Assay for Inhibitors of DNA Polymerase III Holoenzyme System,Confirmatory,,
20,605,1,2,,17389897,8815,Inactive,84028058.0,,,,qHTS Assay for Inhibitors of YjeE,Confirmatory,,
21,654,1,1,,17389897,8815,Inactive,,,,,Cellular Toxicity (caspase-3) HepG2,Confirmatory,,
22,655,1,1,,17389897,8815,Inactive,,,,,Cellular Toxicity (caspase-3) Jurkat,Confirmatory,,
23,656,1,1,,17389897,8815,Inactive,,,,,Cellular Toxicity (caspase-3) HUV-EC-C,Confirmatory,,
24,657,1,1,,17389897,8815,Inactive,,,,,Cellular Toxicity (caspase-3) SHSY5Y,Confirmatory,,
25,658,1,1,,17389897,8815,Inactive,,,,,Cellular Toxicity (caspase-3) BJ,Confirmatory,,
26,659,1,1,,17389897,8815,Inactive,,,,,Cellular Toxicity (caspase-3) MRC-5,Confirmatory,,
27,660,1,1,,17389897,8815,Inactive,,,,,Cellular Toxicity (caspase-3) Mesangial,Confirmatory,,
28,661,1,1,,17389897,8815,Inactive,,,,,Cellular Toxicity (caspase-3) SK-N-SH,Confirmatory,,
29,662,1,1,,17389897,8815,Inactive,,,,,Cell signaling CRE-BLA (Fsk stim),Confirmatory,,
30,663,1,1,,17389897,8815,Inactive,,,,,Cellular Toxicity (caspase-3) H-4-II-E,Confirmatory,,
31,664,1,1,,17389897,8815,Inactive,,,,,Cellular Toxicity (caspase-3) Hek293,Confirmatory,,
32,665,1,1,,17389897,8815,Inactive,,,,,Cellular Toxicity (caspase-3) N2a,Confirmatory,,
33,666,1,1,,17389897,8815,Inactive,,,,,Cellular Toxicity (caspase-3) NIH 3T3,Confirmatory,,
34,667,1,1,,17389897,8815,Inactive,,,,,Cellular Toxicity (caspase-3) Renal Proximal Tubule,Confirmatory,,
35,875,1,2,,17389897,8815,Inactive,159162802.0,,,Potency,qHTS Assay for Inhibitors of BRCT-Phosphoprotein Interaction (Green Fluorophore),Confirmatory,,
36,880,2,1,,17389897,8815,Inactive,3290016.0,6002.0,,,qHTS Assay for Inhibitors of RGS12 GoLoco Motif Activity (Red Fluorophore),Confirmatory,,
37,880,2,1,,17389897,8815,Inactive,33946324.0,2770.0,,,qHTS Assay for Inhibitors of RGS12 GoLoco Motif Activity (Red Fluorophore),Confirmatory,,
38,880,2,1,,26747358,8815,Inactive,3290016.0,6002.0,,,qHTS Assay for Inhibitors of RGS12 GoLoco Motif Activity (Red Fluorophore),Confirmatory,,
39,880,2,1,,26747358,8815,Inactive,33946324.0,2770.0,,,qHTS Assay for Inhibitors of RGS12 GoLoco Motif Activity (Red Fluorophore),Confirmatory,,
40,881,2,2,,17389897,8815,Inactive,317373425.0,247.0,,Potency,qHTS Assay for Inhibitors of 15-hLO-2 (15-human lipoxygenase 2),Confirmatory,,
41,884,1,2,,17389897,8815,Inconclusive,13435386.0,1576.0,12.5893,Potency,qHTS Assay for Inhibitors and Substrates of Cytochrome P450 3A4,Confirmatory,,
42,885,1,2,,17389897,8815,Inactive,13435386.0,1576.0,12.5893,Potency,qHTS Assay for Activators of Cytochrome P450 3A4,Confirmatory,,
43,886,1,2,,17389897,8815,Inactive,122921310.0,,,Potency,"qHTS Assay for Inhibitors of HADH2 (Hydroxyacyl-Coenzyme A Dehydrogenase, Type II)",Confirmatory,,
44,886,1,2,,17389897,8815,Inactive,122921311.0,,,Potency,"qHTS Assay for Inhibitors of HADH2 (Hydroxyacyl-Coenzyme A Dehydrogenase, Type II)",Confirmatory,,
45,887,1,2,,17389897,8815,Inconclusive,1832253.0,246.0,31.6228,Potency,qHTS Assay for Inhibitors of 15-hLO (15-human lipoxygenase),Confirmatory,,
46,889,1,3,,17389897,8815,Inactive,1730092.0,840.0,,Potency,qHTS Assay for Allosteric/Competitive Inhibitors of Caspase-7,Confirmatory,,
47,892,1,2,,17389897,8815,Inactive,159162802.0,,,Potency,qHTS Assay for Inhibitors of BRCT-Phosphoprotein Interaction (Red Fluorophore),Confirmatory,,
48,893,1,2,,17389897,8815,Inactive,122921310.0,,,Potency,"qHTS Assay for Inhibitors of HSD17B4, hydroxysteroid (17-beta) dehydrogenase 4",Confirmatory,,
49,893,1,2,,17389897,8815,Inactive,122921311.0,,,Potency,"qHTS Assay for Inhibitors of HSD17B4, hydroxysteroid (17-beta) dehydrogenase 4",Confirmatory,,
50,894,2,1,,17389897,8815,Inactive,31542939.0,3248.0,,Potency,qHTS Assay for Inhibitors of HPGD (15-Hydroxyprostaglandin Dehydrogenase),Confirmatory,,
51,894,2,1,,26747358,8815,Inactive,31542939.0,3248.0,,Potency,qHTS Assay for Inhibitors of HPGD (15-Hydroxyprostaglandin Dehydrogenase),Confirmatory,,
52,900,1,3,,17389897,8815,Inactive,15431328.0,834.0,,Potency,qHTS Assay for Allosteric/Competitive Inhibitors of Caspase-1,Confirmatory,,
53,902,1,2,,17389897,8815,Inactive,120407068.0,7157.0,,Potency,qHTS Screen for Compounds that Selectively Target Cancer Cells with p53 Mutations: Cytotoxicity of p53ts Cells at the Nonpermissive Temperature,Confirmatory,,
54,910,1,2,,17389897,8815,Inactive,4504349.0,3043.0,,Potency,Confirmation and Secondary Assay for Modulators of Hemoglobin Beta Chain Splicing at IVS2 654 locus,Confirmatory,,
55,912,1,2,,17389897,8815,Inactive,21392848.0,,,Potency,qHTS Assay for Anthrax Lethal Toxin Internalization,Confirmatory,,
56,921,1,2,,17389897,8815,Inactive,,,,Potency,Cell Viability - LYMP2-001,Confirmatory,,
57,923,1,2,,17389897,8815,Inactive,,,,Potency,qHTS Assay for Allosteric/Competitive Inhibitors of Caspase-1: Spectroscopic Profiling in AFC Spectral Region,Confirmatory,,
58,924,1,2,,17389897,8815,Inconclusive,120407068.0,7157.0,0.631,Potency,qHTS Screen for Compounds that Selectively Target Cancer Cells with p53 Mutations: Cytotoxicity of p53ts Cells at the Permissive Temperature,Confirmatory,,
59,925,1,2,,17389897,8815,Inactive,4504349.0,3043.0,,Potency,qHTS Assay for Modulators of Hemoglobin Beta Chain Splicing,Confirmatory,,
60,926,1,2,,17389897,8815,Inconclusive,38016895.0,7253.0,12.5893,Potency,qHTS Assay for Agonists of the Thyroid Stimulating Hormone Receptor,Confirmatory,,
61,927,1,3,,17389897,8815,Inactive,188528692.0,9099.0,,Potency,qHTS Assay for Inhibitors of Ubiquitin-specific Protease USP2a,Confirmatory,,
62,930,1,2,,17389897,8815,Inactive,4504349.0,3043.0,,Potency,Confirmation and Secondary Assay for Modulators of Hemoglobin Beta Chain Splicing at IVS2 705 locus,Confirmatory,,
63,938,1,2,,17389897,8815,Inactive,38016895.0,7253.0,12.5893,Potency,qHTS Assay for Agonists of the Thyroid Stimulating Hormone Receptor: Activators of Intracellular cAMP Concentrations in Parental HEK 293,Confirmatory,,
64,940,1,2,,26612754,8815,Inactive,31881630.0,5732.0,,,Modulators of the EP2 prostaglandin E2 receptor - Primary Screening,Screening,,
65,946,1,2,,17389897,8815,Inactive,,,,Potency,MultiTox-Fluor Cytotoxicity Assay - LYMP1-001 - Dead Cells,Confirmatory,,
66,947,1,2,,17389897,8815,Inactive,,,,Potency,MultiTox-Fluor Cytotoxicity Assay - LYMP1-001 - Live Cells,Confirmatory,,
67,948,1,2,,17389897,8815,Inactive,,,,Potency,Cell Viability - LYMP1-002 - Assay at 16 hr,Confirmatory,,
68,955,1,2,,17389897,8815,Inactive,,,,Potency,MultiTox-Fluor Cytotoxicity Assay - LYMP1-002 - Live Cells,Confirmatory,,
69,960,1,2,,17389897,8815,Inactive,,,,Potency,MultiTox-Fluor Cytotoxicity Assay - LYMP1-002 - Dead Cells,Confirmatory,,
70,961,1,2,,17389897,8815,Inactive,,,,Potency,MultiTox-Fluor Cytotoxicity Assay - LYMP1-003 - Dead Cells,Confirmatory,,
71,962,1,2,,17389897,8815,Inactive,,,,Potency,MultiTox-Fluor Cytotoxicity Assay - LYMP1-003 - Live Cells,Confirmatory,,
72,963,1,2,,17389897,8815,Inactive,,,,Potency,Cell Viability - LYMP1-003 - Assay at 24 hr,Confirmatory,,
73,964,1,2,,17389897,8815,Inactive,,,,Potency,Cell Viability - LYMP1-003 - Assay at 40 hr,Confirmatory,,
74,965,1,2,,17389897,8815,Inactive,,,,Potency,Cell Viability - LYMP2-003,Confirmatory,,
75,966,1,2,,17389897,8815,Inconclusive,,,0.02,Potency,Cell Viability - LYMP2-004,Confirmatory,,
76,967,1,2,,17389897,8815,Inactive,,,,Potency,Cell Viability - LYMP2-005,Confirmatory,,
77,968,1,2,,17389897,8815,Inactive,,,,Potency,Cell Viability - LYMP2-009,Confirmatory,,
78,969,1,2,,17389897,8815,Inactive,,,,Potency,Cell Viability - LYMP2-011,Confirmatory,,
79,970,1,2,,17389897,8815,Inactive,,,,Potency,Cell Viability - LYMP2-013,Confirmatory,,
80,971,1,2,,17389897,8815,Inactive,,,,Potency,Cell Viability - LYMP2-015,Confirmatory,,
81,972,1,2,,17389897,8815,Inactive,,,,Potency,Cell Viability - LYMP2-017,Confirmatory,,
82,973,1,2,,17389897,8815,Inactive,,,,Potency,Cell Viability - LYMP2-019,Confirmatory,,
83,974,1,2,,17389897,8815,Inactive,,,,Potency,Cell Viability - LYMP2-021,Confirmatory,,
84,975,1,2,,17389897,8815,Inactive,,,,Potency,Cell Viability - LYMP2-023,Confirmatory,,
85,976,1,2,,17389897,8815,Inactive,,,,Potency,Cell Viability - LYMP2-025,Confirmatory,,
86,977,1,2,,17389897,8815,Inactive,,,,Potency,Cell Viability - LYMP2-002,Confirmatory,,
87,978,1,2,,17389897,8815,Inactive,,,,Potency,Cell Viability - LYMP2-006,Confirmatory,,
88,979,1,2,,17389897,8815,Inactive,,,,Potency,Cell Viability - LYMP2-007,Confirmatory,,
89,980,1,2,,17389897,8815,Inactive,,,,Potency,Cell Viability - LYMP2-008,Confirmatory,,
90,981,1,2,,17389897,8815,Inactive,,,,Potency,Cell Viability - LYMP2-010,Confirmatory,,
91,982,1,2,,17389897,8815,Inactive,,,,Potency,Cell Viability - LYMP2-012,Confirmatory,,
92,983,1,2,,17389897,8815,Inactive,,,,Potency,Cell Viability - LYMP2-014,Confirmatory,,
93,984,1,2,,17389897,8815,Inactive,,,,Potency,Cell Viability - LYMP2-016,Confirmatory,,
94,985,1,2,,17389897,8815,Inactive,,,,Potency,Cell Viability - LYMP2-018,Confirmatory,,
95,986,1,2,,17389897,8815,Inactive,,,,Potency,Cell Viability - LYMP2-020,Confirmatory,,
96,987,1,2,,17389897,8815,Inactive,,,,Potency,Cell Viability - LYMP2-022,Confirmatory,,
97,988,1,2,,17389897,8815,Inactive,,,,Potency,Cell Viability - LYMP2-024,Confirmatory,,
98,989,1,2,,17389897,8815,Inactive,,,,Potency,Cell Viability - LYMP2-026,Confirmatory,,
99,993,1,2,,17389897,8815,Inactive,,,,Potency,Cell Viability - LYMP1-002 - Assay at 24 hr,Confirmatory,,
100,994,1,2,,17389897,8815,Inactive,,,,Potency,Cell Viability - LYMP1-002 - Assay at 40 hr,Confirmatory,,
101,995,1,2,,17389897,8815,Inactive,66932916.0,5594.0,,Potency,qHTS Assay for Inhibitors of the ERK Signaling Pathway using a Homogeneous Screening Assay,Confirmatory,,
102,1030,2,1,,17389897,8815,Inconclusive,30582681.0,216.0,35.4813,Potency,qHTS Assay for Inhibitors of Aldehyde Dehydrogenase 1 (ALDH1A1),Confirmatory,,
103,1030,2,1,,26747358,8815,Inactive,30582681.0,216.0,,Potency,qHTS Assay for Inhibitors of Aldehyde Dehydrogenase 1 (ALDH1A1),Confirmatory,,
104,1189,1,5,,48413730,8815,Active,,,,,DSSTox (CPDBAS) Carcinogenic Potency Database Summary SingleCellCall Results,Other,,
105,1194,1,3,,48413730,8815,Inactive,,,,,DSSTox (CPDBAS) Carcinogenic Potency Database Salmonella Mutagenicity,Other,,
106,1199,1,3,,48413730,8815,Active,,,,,DSSTox (CPDBAS) Carcinogenic Potency Database Summary Mouse Bioassay Results,Other,,
107,1379,1,2,,26747358,8815,Inactive,1669525.0,,,Potency,Counterscreen for Luciferase (Kinase-Glo TM) Inhibition,Confirmatory,,
108,1422,1,1,,26612754,8815,Inactive,31881630.0,5732.0,,,Inhibitors of the EP2 Prostaglandin E2 Receptor - Primary Screen,Screening,,
109,1452,1,1,,17389897,8815,Inconclusive,154426292.0,239.0,11.2202,Potency,qHTS Assay for Inhibitors of 12-hLO (12-human lipoxygenase),Confirmatory,,
110,1454,1,1,,26747358,8815,Inactive,66932916.0,5594.0,,Potency,qHTS Assay for Inhibitors of the ERK Signaling Pathway using a Homogeneous Screening Assay; Stimulation with EGF,Confirmatory,,
111,1457,1,1,,17389897,8815,Inactive,44888968.0,83523.0,,Potency,qHTS Assay for Identifying the Cell-Membrane Permeable IMPase Inhibitors: Potentiation with Lithium,Confirmatory,,
112,1457,1,1,,26747358,8815,Inactive,44888968.0,83523.0,,Potency,qHTS Assay for Identifying the Cell-Membrane Permeable IMPase Inhibitors: Potentiation with Lithium,Confirmatory,,
113,1458,1,1,,17389897,8815,Inactive,10937869.0,6607.0,,Potency,qHTS Assay for Enhancers of SMN2 Splice Variant Expression,Confirmatory,,
114,1458,1,1,,26747358,8815,Inactive,10937869.0,6607.0,10.0,Potency,qHTS Assay for Enhancers of SMN2 Splice Variant Expression,Confirmatory,,
115,1460,1,3,,26747358,8815,Inactive,92096784.0,4137.0,,Potency,"qHTS for Inhibitors of Tau Fibril Formation, Thioflavin T Binding",Confirmatory,,
116,1463,1,1,,26747358,8815,Inactive,,,,Potency,"Counterscreen qHTS for Inhibitors of Tau Fibril Formation, Fluorescence Polarization",Confirmatory,,
117,1467,1,3,,26747358,8815,Inactive,757912.0,2717.0,,Potency,qHTS Assay for Inhibitors of Human alpha-Galactosidase at pH 4.5.,Confirmatory,,
118,1468,1,1,,26747358,8815,Inactive,92096784.0,4137.0,,Potency,"qHTS for Inhibitors of Tau Fibril Formation, Fluorescence Polarization",Confirmatory,,
119,1469,1,1,,17389897,8815,Inactive,189491771.0,7068.0,,Potency,qHTS for Inhibitors of the Interaction of Thyroid Hormone Receptor and Steroid Receptor Coregulator 2,Confirmatory,,
120,1469,1,1,,26747358,8815,Inactive,189491771.0,7068.0,,Potency,qHTS for Inhibitors of the Interaction of Thyroid Hormone Receptor and Steroid Receptor Coregulator 2,Confirmatory,,
121,1471,2,1,,17389897,8815,Inactive,90903231.0,3064.0,,,qHTS Multiplex Assay to Identify Dual Action Probes in a Cell Model of Huntington: Cytoprotection (ATP),Confirmatory,,
122,1471,2,1,,26747358,8815,Unspecified,90903231.0,3064.0,,,qHTS Multiplex Assay to Identify Dual Action Probes in a Cell Model of Huntington: Cytoprotection (ATP),Confirmatory,,
123,1476,2,1,,17389897,8815,Inactive,281307097.0,,,Potency,qHTS Assay for Promiscuous and Specific Inhibitors of Cruzain (without detergent),Confirmatory,,
124,1476,2,1,,26747358,8815,Inactive,281307097.0,,,Potency,qHTS Assay for Promiscuous and Specific Inhibitors of Cruzain (without detergent),Confirmatory,,
125,1477,1,1,,17389897,8815,Inactive,,,,Potency,qHTS Assay for Compounds Blocking the Interaction Between CBF-beta and RUNX1 for the Treatment of Acute Myeloid Leukemia,Confirmatory,,
126,1477,1,1,,26747358,8815,Inconclusive,,,0.1,Potency,qHTS Assay for Compounds Blocking the Interaction Between CBF-beta and RUNX1 for the Treatment of Acute Myeloid Leukemia,Confirmatory,,
127,1478,2,1,,17389897,8815,Inactive,281307097.0,,,Potency,qHTS Assay for Promiscuous and Specific Inhibitors of Cruzain (with detergent),Confirmatory,,
128,1478,2,1,,26747358,8815,Inactive,281307097.0,,,Potency,qHTS Assay for Promiscuous and Specific Inhibitors of Cruzain (with detergent),Confirmatory,,
129,1479,1,2,,17389897,8815,Inactive,189491771.0,7068.0,,Potency,Total Fluorescence Counterscreen for Inhibitors of the Interaction of Thyroid Hormone Receptor and Steroid Receptor Coregulator 2,Confirmatory,,
130,1479,1,2,,26747358,8815,Inactive,189491771.0,7068.0,,Potency,Total Fluorescence Counterscreen for Inhibitors of the Interaction of Thyroid Hormone Receptor and Steroid Receptor Coregulator 2,Confirmatory,,
131,1490,2,1,,26747358,8815,Inactive,10954339.0,,,Potency,qHTS Assay for Inhibitors of Bacillus subtilis Sfp phosphopantetheinyl transferase (PPTase),Confirmatory,,
132,1519,1,3,,26747358,8815,Inactive,,,,Potency,qHTS Assay for Lipid Storage Modulators,Confirmatory,,
133,1766,1,1,,26747358,8815,Inactive,18860839.0,4221.0,,Potency,qHTS Assay for Inhibitors Targeting the Menin-MLL Interaction in MLL Related Leukemias: Competition With Fluorescein Labeled MLL-derived Peptide,Confirmatory,,
134,1766,1,1,,26747358,8815,Inactive,56550039.0,4297.0,,Potency,qHTS Assay for Inhibitors Targeting the Menin-MLL Interaction in MLL Related Leukemias: Competition With Fluorescein Labeled MLL-derived Peptide,Confirmatory,,
135,1768,1,1,,26747358,8815,Inactive,18860839.0,4221.0,,Potency,qHTS Assay for Inhibitors Targeting the Menin-MLL Interaction in MLL Related Leukemias: Competition With Texas Red Labeled MLL-derived Mutant Peptide,Confirmatory,,
136,1768,1,1,,26747358,8815,Inactive,56550039.0,4297.0,,Potency,qHTS Assay for Inhibitors Targeting the Menin-MLL Interaction in MLL Related Leukemias: Competition With Texas Red Labeled MLL-derived Mutant Peptide,Confirmatory,,
137,1850,2,1,,49718200,8815,Inactive,,,,IC50,A small molecule screen for inhibitors of the PhoP regulon in Salmonella typhi,Confirmatory,,
138,1865,1,1,,26747358,8815,Inactive,,,,Potency,Quantitative High-Throughput Screen for Regulators of Epigenetic Control,Confirmatory,,
139,1899,1,3,,49718200,8815,Inactive,83779224.0,,,,TR-FRET-based primary biochemical high-throughput screening assay to identify inhibitors of Hepatitis C Virus (HCV) core protein dimerization,Screening,,
140,1906,1,3,,49718200,8815,Inactive,55958172.0,,,,QFRET-based counterscreen for PFM18AAP inhibitors: biochemical high throughput screening assay to identify inhibitors of the Cathepsin L proteinase (CTSL1).,Screening,,
141,1947,1,2,,49718200,8815,Inactive,21595511.0,226016.0,,,Fluorescence polarization-based counterscreen for RBBP9 inhibitors: primary biochemical high throughput screening assay to identify inhibitors of the serine hydrolase family member Fam108B.,Screening,,
142,1948,1,1,,17389897,8815,Inactive,,,,Potency,qHTS Assay for Compounds that Induce Erasure of Genomic Imprints,Confirmatory,,
143,1948,1,1,,26747358,8815,Inactive,,,,Potency,qHTS Assay for Compounds that Induce Erasure of Genomic Imprints,Confirmatory,,
144,1950,1,3,,49718200,8815,Inactive,23893623.0,3783709.0,,,Fluorescence polarization-based primary biochemical high throughput screening assay to identify inhibitors of the Epstein-Barr virus nuclear antigen 1 (EBNA-1).,Screening,,
145,1962,1,2,,49718200,8815,Inactive,68476498.0,,,,Fluorescence polarization-based primary biochemical high throughput screening assay to identify inhibitors of tRNA 2'-phosphotransferase (TPT1).,Screening,,
146,1974,1,2,,49718200,8815,Inactive,4758484.0,9446.0,,,Fluorescence polarization-based counterscreen for RBBP9 inhibitors: primary biochemical high throughput screening assay to identify inhibitors of the oxidoreductase glutathione S-transferase omega 1(GSTO1).,Screening,,
147,1987,1,2,,49718200,8815,Inactive,37589898.0,5536.0,,,Fluorescence-based primary biochemical high throughput screening assay to identify inhibitors of Protein Phosphatase 5 (PP5).,Screening,,
148,2016,1,3,,49718200,8815,Inactive,1302091.0,,,,Multiplex HTS Screen of TOR pathway GFP-fusion proteins in Saccharomyes cerevisiae_specifically_ MEP2_MLPCN.,Screening,,
149,2023,1,3,,49718200,8815,Inactive,486173.0,,,,Multiplex HTS Screen of TOR pathway GFP-fusion proteins in Saccharomyes cerevisiae_specifically_ LAP4_MLPCN.,Screening,,
150,2025,1,3,,49718200,8815,Inactive,536029.0,,,,Multiplex HTS Screen of TOR pathway GFP-fusion proteins in Saccharomyes cerevisiae_specifically_ RPL19A_MLPCN.,Screening,,
151,2029,1,3,,49718200,8815,Inactive,171229.0,,,,Multiplex HTS Screen of TOR pathway GFP-fusion proteins in Saccharomyes cerevisiae_specifically_ CIT2_MLPCN.,Screening,,
152,2052,2,1,,49718200,8815,Inactive,124486680.0,16408.0,,,HTS for developing T Cell Immune Modulators,Screening,,
153,2057,1,2,,49718200,8815,Inactive,78070770.0,4170.0,,,Fluorescence polarization-based primary biochemical high throughput screening assay to identify inhibitors of myeloid cell leukemia sequence 1 (MCL1) interactions with BIM-BH3 peptide.,Screening,,
154,2066,1,4,,49718200,8815,Inactive,85666113.0,850333.0,,,Multiplex HTS Screen of TOR pathway GFP-fusion proteins in Saccharomyes cerevisiae_specifically_ AGP1_MLPCN.,Screening,,
155,2099,1,1,,49718200,8815,Inactive,,,,,Fluorescence Biochemical Primary HTS to Identify Inhibitors of GASC-1 Activity,Screening,,
156,2101,1,1,,17389897,8815,Inactive,496369.0,2629.0,,Potency,qHTS Assay for Inhibitors and Activators of N370S glucocerebrosidase as a Potential Chaperone Treatment of Gaucher Disease,Confirmatory,,
157,2101,1,1,,26747358,8815,Inactive,496369.0,2629.0,,Potency,qHTS Assay for Inhibitors and Activators of N370S glucocerebrosidase as a Potential Chaperone Treatment of Gaucher Disease,Confirmatory,,
158,2101,1,1,,49718200,8815,Inactive,496369.0,2629.0,,Potency,qHTS Assay for Inhibitors and Activators of N370S glucocerebrosidase as a Potential Chaperone Treatment of Gaucher Disease,Confirmatory,,
159,2107,1,1,,17389897,8815,Inactive,757912.0,2717.0,,Potency,qHTS Assay for Inhibitors and Activators of Human alpha-Galactosidase From Spleen Homogenate,Confirmatory,,
160,2107,1,1,,26747358,8815,Inactive,757912.0,2717.0,,Potency,qHTS Assay for Inhibitors and Activators of Human alpha-Galactosidase From Spleen Homogenate,Confirmatory,,
161,2112,1,1,,17389897,8815,Inactive,119393891.0,2548.0,,Potency,qHTS Assay for Inhibitors and Activators of Human alpha-Glucosidase From Spleen Homogenate,Confirmatory,,
162,2112,1,1,,26747358,8815,Inactive,119393891.0,2548.0,,Potency,qHTS Assay for Inhibitors and Activators of Human alpha-Glucosidase From Spleen Homogenate,Confirmatory,,
163,2120,1,1,,17389897,8815,Inactive,32879895.0,3091.0,,Potency,qHTS Assay for Identification of Small Molecule Inducers of Hypoxia Response,Confirmatory,,
164,2129,1,2,,49718200,8815,Inactive,510901.0,598.0,,,"Primary biochemical high throughput screening assay to identify inhibitors of BCL2-related protein, long isoform (BCLXL).",Screening,,
165,2130,1,3,,49718200,8815,Inactive,7706645.0,51400.0,,,Fluorescence polarization-based primary biochemical high throughput screening assay to identify inhibitors of Protein Phosphatase Methylesterase 1 (PME-1).,Screening,,
166,2147,1,1,,26747358,8815,Inactive,221046486.0,,,Potency,qHTS Assay for Inhibitors of  Human Jumonji Domain Containing 2E (JMJD2E),Confirmatory,,
167,2174,1,3,,49718200,8815,Inactive,5453722.0,10434.0,,,Counterscreen for PME1 inhibitors: fluorescence polarization-based primary biochemical high throughput screening assay to identify inhibitors of lysophospholipase 1 (LYPLA1).,Screening,,
168,2177,1,3,,49718200,8815,Inactive,4581413.0,,,,Counterscreen for PME1 inhibitors: fluorescence polarization-based primary biochemical high throughput screening assay to identify inhibitors of lysophospholipase 2 (LYPLA2).,Screening,,
169,2234,1,2,,49718200,8815,Inactive,82503229.0,3783744.0,,,"Counterscreen for inhibitors of EBNA-1: fluorescence polarization-based biochemical high throughput primary assay to identify inhibitors of the Epstein-Barr virus-encoded protein, ZTA.",Screening,,
170,2235,1,2,,49718200,8815,Inactive,56790945.0,5499.0,,,Counterscreen for inhibitors of PP5: fluorescence-based biochemical high throughput primary assay to identify inhibitors of Protein Phosphatase 1 (PP1).,Screening,,
171,2280,2,3,,49718200,8815,Inactive,17507875.0,172532.0,,,Fluorescence polarization-based primary biochemical high throughput screening assay to identify inhibitors of GLD-1 protein - TGE RNA interaction.,Screening,,
172,2300,1,3,,49718200,8815,Inactive,216409728.0,10002.0,,,"TR-FRET-based primary biochemical high throughput screening assay to identify agonists of nuclear receptor subfamily 2, group E, member 3 (NR2E3).",Screening,,
173,2380,1,2,,49718200,8815,Inactive,,,,,uHTS identification of small molecules that induce b-cell replication in the MIN-6 cell line,Screening,,
174,2391,1,1,,49718200,8815,Inactive,,,,IC50,A Cell Based HTS Approach for the Discovery of New Inhibitors of Respiratory syncytial virus (RSV),Confirmatory,,
175,2435,1,2,,49718200,8815,Inactive,32307152.0,5021.0,,,Fluorescence-based primary cell-based high throughput screening assay to identify agonists of the Oxytocin Receptor (OXTR).,Screening,,
176,2445,1,2,,49718200,8815,Inactive,32307152.0,5021.0,,,Fluorescence-based primary cell-based high throughput screening assay to identify potentiators of Oxytocin Receptor (OXTR),Screening,,
177,2451,1,2,,26747358,8815,Inactive,122920737.0,,,Potency,"qHTS Assay for Inhibitors of Fructose-1,6-bisphosphate Aldolase from Giardia Lamblia",Confirmatory,,
178,2462,1,1,,49718200,8815,Inactive,20336315.0,10018.0,,,Luminescence Cell-Based Primary HTS to Identify Inhibitors of A1 Apoptosis.,Screening,,
179,2462,1,1,,49718200,8815,Inactive,167013344.0,,,,Luminescence Cell-Based Primary HTS to Identify Inhibitors of A1 Apoptosis.,Screening,,
180,2472,1,2,,26747358,8815,Inactive,7669492.0,2597.0,,,"qHTS Assay for Inhibitors of Fructose-1,6-bisphosphate Aldolase from Giardia Lamblia: Coupling assay counterscreen",Screening,,
181,2517,2,1,,17389897,8815,Inactive,6980812.0,,,Potency,qHTS Assay for Inhibitors of the Human Apurinic/apyrimidinic Endonuclease 1 (APE1),Confirmatory,,
182,2517,2,1,,26747358,8815,Inactive,6980812.0,,,Potency,qHTS Assay for Inhibitors of the Human Apurinic/apyrimidinic Endonuclease 1 (APE1),Confirmatory,,
