,AID,AID Version,AID Revision,Panel Member ID,SID,CID,Bioactivity Outcome,Target GI,Target GeneID,Activity Value [uM],Activity Name,Assay Name,Bioassay Type,PubMed ID,RNAi
0,377,1,3,,10321395,9415,Inactive,42741659.0,5243.0,,,MDR-1,Other,,
1,608,1,6,,11537696,9415,Inactive,17149836.0,2280.0,,,NMR Based Screening Assay for FKBP12,Other,,
2,940,1,2,,26612358,9415,Inactive,31881630.0,5732.0,,,Modulators of the EP2 prostaglandin E2 receptor - Primary Screening,Screening,,
3,1033,2,2,,11537696,9415,Inactive,216546.0,,,,NMR Based Screening Assay for the substrate binding domain of the chaperone DnaK,Screening,,
4,1189,1,5,,48414072,9415,Active,,,,,DSSTox (CPDBAS) Carcinogenic Potency Database Summary SingleCellCall Results,Other,,
5,1194,1,3,,48414072,9415,Inactive,,,,,DSSTox (CPDBAS) Carcinogenic Potency Database Salmonella Mutagenicity,Other,,
6,1208,1,3,,48414072,9415,Active,,,,,DSSTox (CPDBAS) Carcinogenic Potency Database Summary Rat Bioassay Results,Other,,
7,1332,1,1,,49698578,9415,Inactive,,,,,High Throughput Screen to Identify Inhibitors of Mycobacterium tuberculosis H37Rv,Confirmatory,,
8,1422,1,1,,26612358,9415,Inactive,31881630.0,5732.0,,,Inhibitors of the EP2 Prostaglandin E2 Receptor - Primary Screen,Screening,,
9,1469,1,1,,26757673,9415,Inactive,189491771.0,7068.0,,Potency,qHTS for Inhibitors of the Interaction of Thyroid Hormone Receptor and Steroid Receptor Coregulator 2,Confirmatory,,
10,1471,2,1,,26757673,9415,Inactive,90903231.0,3064.0,,,qHTS Multiplex Assay to Identify Dual Action Probes in a Cell Model of Huntington: Cytoprotection (ATP),Confirmatory,,
11,1479,1,2,,26757673,9415,Inactive,189491771.0,7068.0,,Potency,Total Fluorescence Counterscreen for Inhibitors of the Interaction of Thyroid Hormone Receptor and Steroid Receptor Coregulator 2,Confirmatory,,
12,1490,2,1,,26757673,9415,Inactive,10954339.0,,,Potency,qHTS Assay for Inhibitors of Bacillus subtilis Sfp phosphopantetheinyl transferase (PPTase),Confirmatory,,
13,1549,1,2,,11537696,9415,Inactive,89033149.0,,,,NMR Based Screening Assay for Novel Chemotypes against influenza A virus,Other,,
14,1552,1,3,,11537696,9415,Inactive,4507793.0,7334.0,,,NMR assay targeting the ubiquitin-proteasome system to modulate protein folding and degradation,Other,,
15,1580,1,1,,8149867,9415,Inconclusive,,,,,Screen for compounds that inhibit mitochondrial permeability transition (MitoPT),Other,,
16,1581,1,1,,8149867,9415,Inconclusive,,,,,Screen of Compounds to Block PAR4 - aPKC Interaction for Treatment of Neurodegeneration (Par4_PKC),Other,,
17,1582,1,1,,8149867,9415,Inconclusive,,,,,Yeast cell-based screen for Novel HDAC inhibitors using a PHO84-LacZ reporter gene (PHO84),Other,,
18,1583,1,1,,8149867,9415,Unspecified,,,,,Assay to identify inhibitors of polyglutamine-induced caspase-3 activation (CASP3),Other,,
19,1584,1,1,,8149867,9415,Inconclusive,,,,,Screen for compounds that inhibit in vitro mutant huntingtin aggregation (QA1),Other,,
20,1585,1,1,,8149867,9415,Inconclusive,,,,,"Screen for compounds that inhibit the ability of solid phase synthetic polyglutamine aggregates to elongate by incorporating solution-phase biotin-tagged, monomeric polyglutamine (QA3)",Other,,
21,1586,1,1,,8149867,9415,Inconclusive,,,,,A 2-Hybrid Test for Interactions Between Polyglutamine-Containing Proteins in the Yeast Nucleus  (Qn2Hy),Other,,
22,1587,1,1,,8149867,9415,Inconclusive,,,,,Screen for compounds that increase the expression of EAAT-2 in rat spinal cord organotypic slice cultures (X4_EAAT2),Other,,
23,1588,1,1,,8149867,9415,Inconclusive,,,,,Screen for compounds that reduce polyglutamine aggregation as measured by turbidity (QTHIO),Other,,
24,1589,1,1,,8149867,9415,Inconclusive,,,,,Screen for compounds that reduce polyglutamine (polyQ) inclusions in nerve growth factor (NGF)-treated PC12 cells (SDS),Other,,
25,1590,1,1,,8149867,9415,Inconclusive,,,,,Cellular toxicity caused by inducible expressing of N-terminal huntingtin with expanded ployglutamine repeat (Htt-N63-148Q) in PC12 cells (ROSShtt),Other,,
26,1593,1,1,,8149867,9415,Unspecified,,,,,Yeast cell-based screen for compounds that suppress polyglutamine aggregation in vivo (75Q-TubU),Other,,
27,1594,1,1,,8149867,9415,Inconclusive,,,,,Screen for compounds that decrease glutamate induced motor neuron death measured by TUNEL staining for DNA degradation (MNGlu),Other,,
28,1595,1,1,,8149867,9415,Inconclusive,,,,,Suppression of Polyglutamine Toxicity in Whole Organism Drosophila Model of SCA1 (SCA1FLYe),Other,,
29,1596,1,1,,8149867,9415,Inconclusive,,,,,Protection from expanded polyglutamine huntingtin toxicity in PC12 cells (LDH100),Other,,
30,1597,1,1,,8149867,9415,Inconclusive,,,,,Suppression of Polyglutamine Toxicity in Whole Organism Drosophila Model of SCA1 (SCA1FLYp),Other,,
31,1598,1,1,,8149867,9415,Inconclusive,,,,,Screen for compounds that selectively increase SMN2 splicing relative to SMN1 splicing (SMNLUC),Other,,
32,1599,1,1,,8149867,9415,Unspecified,,,,,"Screen for compounds that correct neuronal dysfunction without cell death as induced by the expression of polyglutamine-expanded, N-terminal huntingtin in C. elegans mechanosensory neurons (HDELENEU)",Other,,
33,1600,1,1,,8149867,9415,Inconclusive,,,,,Yeast Assay for Parkinson&apos;s Disease (YAPD),Other,,
34,1601,1,1,,8149867,9415,Inconclusive,,,,,Screen for compounds that suppress mutant SOD1-mediated cell death (mSODtox),Other,,
35,1602,1,1,,8149867,9415,Inconclusive,,,,,Screen for compounds that attenuate mutant SOD1 toxicity (mSOD1),Other,,
36,1603,1,1,,8149867,9415,Unspecified,,,,,Screen for compounds that selectively inhibit cytochrome c release from purified mitochondria (CytoCRel),Other,,
37,1604,1,1,,8149867,9415,Unspecified,,,,,Screen for compounds that inhibit polyglutamine induced protein aggregation (AGREG),Other,,
38,1605,1,1,,8149867,9415,Unspecified,,,,,Screening of compounds showing protective effect against cell death induced by familial amyotrophic lateral sclerosis (FALS)-linked mutantsuperoxide dismutase 1 (SOD1) (ALSOD1),Other,,
39,1606,1,1,,8149867,9415,Inconclusive,,,,,Protection from expanded polyglutamine huntingtin toxicity in PC12 cells (LDH20),Other,,
40,1607,1,1,,8149867,9415,Inconclusive,,,,,Screen for compounds that promote the turnover of an expanded polyglutamine androgen receptor (AR112GFP),Other,,
41,1608,1,1,,8149867,9415,Inconclusive,,,,,Protection from expanded polyglutamine huntingtin toxicity in PC12 cells (LDH016),Other,,
42,1609,1,1,,8149867,9415,Inconclusive,,,,,Protection from expanded polyglutamine huntingtin toxicity in PC12 cells (LDH08),Other,,
43,1610,1,1,,8149867,9415,Inconclusive,,,,,Protection from expanded polyglutamine huntingtin toxicity in PC12 cells,Other,,
44,1612,1,1,,8149867,9415,Unspecified,,,,,Screen for compounds that increase glutamate transport activity in MN-1 cell line (GluUPTAKE),Other,,
45,1613,1,1,,8149867,9415,Unspecified,,,,,Screen for compounds that inhibit protein aggregation formed by mutant SOD1 (GFPSOD1),Other,,
46,1614,1,1,,8149867,9415,Unspecified,,,,,Screen for compounds that reduce polyglutamine (polyQ) inclusions in nerve growth factor (NGF)-treated PC12 cells (GFPQ80),Other,,
47,1616,1,1,,8149867,9415,Unspecified,,,,,Yeast cell-based screen for compounds that suppress polyglutamine aggregation in vivo (75Q-TubH),Other,,
48,1637,1,2,,11537696,9415,Inactive,,,,,NMR Based Screening Assay for Influenza A RNA Promoter,Other,,
49,1648,1,2,,11537696,9415,Inactive,159164579.0,,,,NMR Based Screening Assay For Novel Chemical Probes Targeting The FRB Domain of mTOR,Other,,
50,1688,1,1,,26757673,9415,Inactive,90903231.0,3064.0,,Potency,qHTS Multiplex Assay to Identify Dual Action Probes in a Cell Model of Huntington: Aggregate Formation (GFP),Confirmatory,,
51,1766,1,1,,26757673,9415,Inactive,18860839.0,4221.0,,Potency,qHTS Assay for Inhibitors Targeting the Menin-MLL Interaction in MLL Related Leukemias: Competition With Fluorescein Labeled MLL-derived Peptide,Confirmatory,,
52,1766,1,1,,26757673,9415,Inactive,56550039.0,4297.0,,Potency,qHTS Assay for Inhibitors Targeting the Menin-MLL Interaction in MLL Related Leukemias: Competition With Fluorescein Labeled MLL-derived Peptide,Confirmatory,,
53,1768,1,1,,26757673,9415,Inactive,18860839.0,4221.0,,Potency,qHTS Assay for Inhibitors Targeting the Menin-MLL Interaction in MLL Related Leukemias: Competition With Texas Red Labeled MLL-derived Mutant Peptide,Confirmatory,,
54,1768,1,1,,26757673,9415,Inactive,56550039.0,4297.0,,Potency,qHTS Assay for Inhibitors Targeting the Menin-MLL Interaction in MLL Related Leukemias: Competition With Texas Red Labeled MLL-derived Mutant Peptide,Confirmatory,,
55,1850,2,1,,56463109,9415,Inactive,,,,IC50,A small molecule screen for inhibitors of the PhoP regulon in Salmonella typhi,Confirmatory,,
56,1863,2,1,,56463109,9415,Inactive,,,,IC50,A small molecule screen for inhibitors of the PhoP regulon in Salmonella Typhimurium,Confirmatory,,
57,1899,1,3,,56463109,9415,Inactive,83779224.0,,,,TR-FRET-based primary biochemical high-throughput screening assay to identify inhibitors of Hepatitis C Virus (HCV) core protein dimerization,Screening,,
58,1903,2,3,,56463109,9415,Inactive,297591903.0,29031019.0,,IC50,Identification of SV40 T antigen inhibitors: A route to novel anti-viral reagents,Confirmatory,,
59,1906,1,3,,56463109,9415,Inactive,55958172.0,,,,QFRET-based counterscreen for PFM18AAP inhibitors: biochemical high throughput screening assay to identify inhibitors of the Cathepsin L proteinase (CTSL1).,Screening,,
60,1947,1,2,,56463109,9415,Inactive,21595511.0,226016.0,,,Fluorescence polarization-based counterscreen for RBBP9 inhibitors: primary biochemical high throughput screening assay to identify inhibitors of the serine hydrolase family member Fam108B.,Screening,,
61,1950,1,3,,56463109,9415,Inactive,23893623.0,3783709.0,,,Fluorescence polarization-based primary biochemical high throughput screening assay to identify inhibitors of the Epstein-Barr virus nuclear antigen 1 (EBNA-1).,Screening,,
62,1962,1,2,,56463109,9415,Inactive,68476498.0,,,,Fluorescence polarization-based primary biochemical high throughput screening assay to identify inhibitors of tRNA 2'-phosphotransferase (TPT1).,Screening,,
63,1974,1,2,,56463109,9415,Inactive,4758484.0,9446.0,,,Fluorescence polarization-based counterscreen for RBBP9 inhibitors: primary biochemical high throughput screening assay to identify inhibitors of the oxidoreductase glutathione S-transferase omega 1(GSTO1).,Screening,,
64,1987,1,2,,56463109,9415,Inactive,37589898.0,5536.0,,,Fluorescence-based primary biochemical high throughput screening assay to identify inhibitors of Protein Phosphatase 5 (PP5).,Screening,,
65,2016,1,3,,56463109,9415,Inactive,1302091.0,,,,Multiplex HTS Screen of TOR pathway GFP-fusion proteins in Saccharomyes cerevisiae_specifically_ MEP2_MLPCN.,Screening,,
66,2023,1,3,,56463109,9415,Inactive,486173.0,,,,Multiplex HTS Screen of TOR pathway GFP-fusion proteins in Saccharomyes cerevisiae_specifically_ LAP4_MLPCN.,Screening,,
67,2025,1,3,,56463109,9415,Inactive,536029.0,,,,Multiplex HTS Screen of TOR pathway GFP-fusion proteins in Saccharomyes cerevisiae_specifically_ RPL19A_MLPCN.,Screening,,
68,2029,1,3,,56463109,9415,Inactive,171229.0,,,,Multiplex HTS Screen of TOR pathway GFP-fusion proteins in Saccharomyes cerevisiae_specifically_ CIT2_MLPCN.,Screening,,
69,2052,2,1,,56463109,9415,Inactive,124486680.0,16408.0,,,HTS for developing T Cell Immune Modulators,Screening,,
70,2057,1,2,,56463109,9415,Inactive,78070770.0,4170.0,,,Fluorescence polarization-based primary biochemical high throughput screening assay to identify inhibitors of myeloid cell leukemia sequence 1 (MCL1) interactions with BIM-BH3 peptide.,Screening,,
71,2066,1,4,,56463109,9415,Inactive,85666113.0,850333.0,,,Multiplex HTS Screen of TOR pathway GFP-fusion proteins in Saccharomyes cerevisiae_specifically_ AGP1_MLPCN.,Screening,,
72,2101,1,1,,56463109,9415,Inactive,496369.0,2629.0,,Potency,qHTS Assay for Inhibitors and Activators of N370S glucocerebrosidase as a Potential Chaperone Treatment of Gaucher Disease,Confirmatory,,
73,2129,1,2,,56463109,9415,Inactive,510901.0,598.0,,,"Primary biochemical high throughput screening assay to identify inhibitors of BCL2-related protein, long isoform (BCLXL).",Screening,,
74,2130,1,3,,56463109,9415,Inactive,7706645.0,51400.0,,,Fluorescence polarization-based primary biochemical high throughput screening assay to identify inhibitors of Protein Phosphatase Methylesterase 1 (PME-1).,Screening,,
75,2174,1,3,,56463109,9415,Inactive,5453722.0,10434.0,,,Counterscreen for PME1 inhibitors: fluorescence polarization-based primary biochemical high throughput screening assay to identify inhibitors of lysophospholipase 1 (LYPLA1).,Screening,,
76,2177,1,3,,56463109,9415,Inactive,4581413.0,,,,Counterscreen for PME1 inhibitors: fluorescence polarization-based primary biochemical high throughput screening assay to identify inhibitors of lysophospholipase 2 (LYPLA2).,Screening,,
77,2234,1,2,,56463109,9415,Inactive,82503229.0,3783744.0,,,"Counterscreen for inhibitors of EBNA-1: fluorescence polarization-based biochemical high throughput primary assay to identify inhibitors of the Epstein-Barr virus-encoded protein, ZTA.",Screening,,
78,2235,1,2,,56463109,9415,Inactive,56790945.0,5499.0,,,Counterscreen for inhibitors of PP5: fluorescence-based biochemical high throughput primary assay to identify inhibitors of Protein Phosphatase 1 (PP1).,Screening,,
79,2240,1,1,,85787878,9415,Inactive,38156699.0,4286.0,,,Luminescence Cell-Based Primary HTS to Identify Inhibitors of MITF,Screening,,
80,2241,1,1,,85787878,9415,Inactive,167013344.0,,,,Luminescence Cell-Based Primary HTS to Identify Inhibitors of A1,Screening,,
81,2275,1,1,,85787878,9415,Inactive,,,,,Luminescence Cell-Based Primary HTS to Measure Viability of BJeLR cells,Screening,,
82,2280,2,3,,56463109,9415,Inactive,17507875.0,172532.0,,,Fluorescence polarization-based primary biochemical high throughput screening assay to identify inhibitors of GLD-1 protein - TGE RNA interaction.,Screening,,
83,2300,1,3,,56463109,9415,Inactive,216409728.0,10002.0,,,"TR-FRET-based primary biochemical high throughput screening assay to identify agonists of nuclear receptor subfamily 2, group E, member 3 (NR2E3).",Screening,,
84,2313,1,1,,85787878,9415,Inactive,,,,,Luminescence Cell-Based Primary HTS to Identify Inhibitors of the Sonic Hedgehog Signaling Pathway,Screening,,
85,2316,1,1,,85787878,9415,Inactive,,,,,Luminescence Cell-Based Primary HTS to Identify Activators of the Reversal of PD-1 Mediated Inhibitors of T-Cell Inhibition,Screening,,
86,2322,1,1,,85787878,9415,Inactive,,,,,Luminescence Homogenous Primary HTS to Identify Inhibitors of STK33 Activity,Screening,,
87,2330,1,1,,85787878,9415,Inactive,12830367.0,65975.0,,,Luminescence Cell-Based Primary HTS to Identify Inhibitors of STK33,Screening,,
88,2380,1,2,,56463109,9415,Inactive,,,,,uHTS identification of small molecules that induce b-cell replication in the MIN-6 cell line,Screening,,
89,2391,1,1,,56463109,9415,Inactive,,,,IC50,A Cell Based HTS Approach for the Discovery of New Inhibitors of Respiratory syncytial virus (RSV),Confirmatory,,
90,2435,1,2,,56463109,9415,Inactive,32307152.0,5021.0,,,Fluorescence-based primary cell-based high throughput screening assay to identify agonists of the Oxytocin Receptor (OXTR).,Screening,,
91,2445,1,2,,56463109,9415,Inactive,32307152.0,5021.0,,,Fluorescence-based primary cell-based high throughput screening assay to identify potentiators of Oxytocin Receptor (OXTR),Screening,,
92,2462,1,1,,56463109,9415,Inactive,20336315.0,10018.0,,,Luminescence Cell-Based Primary HTS to Identify Inhibitors of A1 Apoptosis.,Screening,,
93,2462,1,1,,56463109,9415,Inactive,167013344.0,,,,Luminescence Cell-Based Primary HTS to Identify Inhibitors of A1 Apoptosis.,Screening,,
94,2517,2,1,,56463109,9415,Inactive,6980812.0,,,Potency,qHTS Assay for Inhibitors of the Human Apurinic/apyrimidinic Endonuclease 1 (APE1),Confirmatory,,
95,2520,1,4,,56463109,9415,Inactive,4885057.0,187.0,,,uHTS identification of small molecule agonists of the APJ  receptor  via a luminescent beta-arrestin assay,Screening,,
96,2521,1,3,,56463109,9415,Inactive,4885057.0,187.0,,,uHTS identification of small molecule antagonists of the APJ  receptor  via a luminescent beta-arrestin assay,Screening,,
97,2524,1,2,,56463109,9415,Inactive,124376142.0,248.0,,,uHTS Luminescent assay for identification of activators of human intestinal alkaline phosphatase,Screening,,
98,2528,1,2,,26757673,9415,Inactive,4557365.0,641.0,,Potency,qHTS Assay for Inhibitors of Bloom's syndrome helicase (BLM),Confirmatory,,
99,2540,1,2,,56463109,9415,Inactive,262118306.0,123228.0,,,HTS Luminescent assay for identification of inhibitors of Sentrin-specific protease 8 (SENP8),Screening,,
100,2544,1,2,,56463109,9415,Inactive,124376142.0,248.0,,,uHTS Luminescent assay for identification of inhibitors of human intestinal alkaline phosphatase,Screening,,
101,2546,1,1,,26757673,9415,Inactive,188536040.0,19885.0,,Potency,VP16 counterscreen qHTS for inhibitors of ROR gamma transcriptional activity,Confirmatory,,
102,2551,1,1,,26757673,9415,Inactive,188536040.0,19885.0,,Potency,qHTS for inhibitors of ROR gamma transcriptional activity,Confirmatory,,
103,2557,1,3,,56463109,9415,Inactive,67191027.0,3676.0,,,HTS for Identification of VLA-4 Allosteric Modulators from MLPCN library,Screening,,
104,2599,1,2,,56463109,9415,Inactive,6166485.0,26054.0,,,uHTS Luminescent assay for identification of inhibitors of Sentrin-specific protease 6 (SENP6),Screening,,
105,2606,1,2,,56463109,9415,Inactive,15610807.0,885176.0,,,Fluorescence polarization-based primary biochemical high throughput screening assay to identify inhibitors of the membrane-associated serine protease Rv3671c in M.tuberculosis,Screening,,
106,2629,1,1,,56463109,9415,Inactive,139472804.0,4961527.0,,,Fluorescence Polarization Cell-Free Homogeneous Primary HTS to Identify Inhibitors of the LANA Histone H2A/H2B Interaction,Screening,,
107,2650,2,1,,56463109,9415,Inactive,49574532.0,2931.0,,,Luminescence Cell-Free  Homogenous Primary HTS to Identify Inhibitors of GSK-3 alpha,Screening,,
108,2661,1,1,,56463109,9415,Inactive,23943882.0,65975.0,,,Luminescence Cell-Free  Homogenous Primary HTS to Identify Inhibitors of Serine/Threonine  Kinase 33  Activity,Screening,,
109,2662,2,1,,26757673,9415,Inactive,56550039.0,4297.0,,Potency,qHTS Fluorescence Polarization Assay for Inhibitors of MLL CXXC domain - DNA interaction,Confirmatory,,
110,2676,1,2,,56463109,9415,Inactive,85986601.0,59350.0,,Potency,qHTS Assay for Agonists of the Relaxin Receptor RXFP1,Confirmatory,,
111,2685,1,1,,56463109,9415,Inconclusive,,,0.3663,Potency,qHTS Assay for Lipid Storage Modulators in Drosophila S3 Cells,Confirmatory,,
112,2690,1,2,,56463109,9415,Inactive,,,,,A yeast HTS for caloric restriction mimetics that inhibit age-related superoxide,Screening,,
113,2716,1,1,,56463109,9415,Inactive,,,,,Luminescence  Microorganism Primary HTS to Identify Inhibitors of the SUMOylation Pathway Using a Temperature Sensitive Growth Reversal Mutant Mot1-301,Screening,,
114,2717,1,2,,56463109,9415,Inactive,,,,,Luminescence Cell-Based Primary HTS to Identify Inhibitors of Cancer Stem Cells,Screening,,
115,2718,1,1,,56463109,9415,Inactive,13128862.0,8841.0,,,Fluorescence Cell-Free Homogeneous Primary HTS to Identify Inhibitors of Histone Deacetylase 3,Screening,,
116,2751,2,2,,56463109,9415,Inactive,153217451.0,9581.0,,,Fluorescence polarization-based primary biochemical high throughput screening assay to identify inhibitors of the prolyl oligopeptidase-like enzyme (PREPL),Screening,,
117,2796,1,4,,56463109,9415,Inactive,4502003.0,196.0,,,Luminescence-based primary cell-based high throughput screening assay to identify activators of the Aryl Hydrocarbon Receptor (AHR),Screening,,
118,2797,1,2,,56463109,9415,Inactive,4502331.0,552.0,,,Counterscreen for Oxytocin Receptor (OXTR) agonists: Fluorescence-based primary cell-based high throughput assay to identify agonists of the vasopressin 1 receptor (V1R),Screening,,
119,2805,2,2,,56463109,9415,Inactive,124487323.0,76768.0,,,uHTS Luminescent assay for identification of activators of mouse intestinal alkaline phosphatase,Screening,,
120,2806,2,2,,56463109,9415,Inactive,124487323.0,76768.0,,,uHTS Luminescent assay for identification of inhibitors of mouse intestinal alkaline phosphatase,Screening,,
121,2825,1,2,,56463109,9415,Inactive,219518789.0,114548.0,,,uHTS Luminescent assay for identification of inhibitors of NALP3 in yeast,Screening,,
122,333842,6,1,,103581411,9415,Unspecified,,,,,Cytotoxicity against human KB cells,Other,7130986.0,
123,339034,6,3,,103581411,9415,Unspecified,,,,,Cytotoxicity against human A204 cells after 24 hrs by soft agar colony forming assay,Other,3210016.0,
124,397122,6,3,,103581411,9415,Unspecified,,,,,Inhibition of HIV1 RT,Other,1710653.0,
125,434955,1,2,,56463109,9415,Inactive,,,,IC90,Screen to Identify Novel Compounds That Sensitize Mycobacterium Tuberculosis to Beta-lactam Antibiotics,Confirmatory,,
126,434959,1,1,,85787878,9415,Inactive,,,,,Fluorescence Cell-Based Primary HTS to Measure Inhibition of Y box Binding Protein 1 Expression,Screening,,
127,434962,1,2,,56463109,9415,Inactive,155969707.0,3416.0,,,Fluorescence polarization-based cell-based primary high throughput screening assay to identify inhibitors of insulin-degrading enzyme (IDE),Screening,,
128,434973,1,3,,56463109,9415,Inactive,120538355.0,57337.0,,,uHTS Luminescent assay for identification of inhibitors of Sentrin-specific protease 7 (SENP7),Screening,,
129,434989,1,1,,56463109,9415,Inactive,222080095.0,3061.0,,,Fluorescence-based cell-based primary high throughput screening assay to identify antagonists of the orexin 1 receptor (OX1R; HCRTR1),Screening,,
130,435003,1,3,,56463109,9415,Inactive,,,,,uHTS luminescence assay for the identification of chemical inhibitors of T-cell specific antigen receptor-induced NF-kB activation,Screening,,
131,435005,1,1,,56463109,9415,Inactive,,,,,Luminescence Cell-Based Primary HTS to Identify Inhibitors of Beta Cell Apoptosis.,Screening,,
132,435022,2,2,,56463109,9415,Inactive,,,,,uHTS luminescence assay for the identification of chemical inhibitors of B-cell specific antigen receptor-induced NF-kB activation,Screening,,
133,435030,1,2,,56463109,9415,Inactive,15645703.0,899625.0,,,Absorbance-based primary bacterial cell-based high throughput screening assay to identify inhibitors of AddAB recombination protein complex,Screening,,
134,435030,1,2,,56463109,9415,Inactive,15646160.0,899738.0,,,Absorbance-based primary bacterial cell-based high throughput screening assay to identify inhibitors of AddAB recombination protein complex,Screening,,
135,449728,1,2,,56463109,9415,Inactive,,,,,Counterscreen for inhibitors of AddAB: absorbance-based bacterial cell-based high throughput screening assay to identify inhibitors of bacterial viability,Screening,,
136,449762,1,2,,56463109,9415,Inactive,,,,IC50,High Throughput Screening Assay used to Identify Novel Compounds that Inhibit Mycobacterium Tuberculosis in 7H9 Media,Confirmatory,,
137,449763,1,3,,56463109,9415,Inactive,,,,,uHTS identification of small molecule activators of the apoptotic arm of the Unfolded Protein response via a luminescent-based reporter assay,Screening,,
138,463079,1,2,,56463109,9415,Inactive,,,,,Fluorescence-based counterscreen for orexin 1 receptor (OX1R) antagonists: cell-based assay to identify antagonists of the parental CHO cell line,Screening,,
139,463082,1,1,,56463109,9415,Inactive,270133071.0,7941.0,,,Fluorescence polarization-based primary biochemical high throughput screening assay to identify inhibitors of the plasma platelet activating factor acetylhydrolase (pPAFAH),Screening,,
140,463104,1,2,,56463109,9415,Inactive,,,,,uHTS identification of small molecule activators of the adaptive arm of the Unfolded Protein response via a luminescent-based reporter assay,Screening,,
141,463141,1,2,,56463109,9415,Inactive,14790119.0,836.0,,,Absorbance-based primary biochemical high throughput screening assay to identify activators of procaspase-3,Screening,,
142,463190,1,2,,56463109,9415,Inactive,285809906.0,856395.0,,,uHTS identification of small molecule inhibitors of tim10-1 yeast via a luminescent assay,Screening,,
143,463195,1,2,,56463109,9415,Inactive,285809906.0,856395.0,,,uHTS identification of small molecule inhibitors of tim10 yeast via a luminescent assay,Screening,,
144,463210,1,2,,56463109,9415,Inactive,55960760.0,,,,Counterscreen for procaspase-3 activators: absorbance-based primary biochemical high throughput screening assay to identify activators of procaspase-7,Screening,,
145,463212,1,1,,56463109,9415,Inactive,285814664.0,855751.0,,,uHTS identification of small molecule inhibitors of tim23-1 yeast via a luminescent assay,Screening,,
146,463254,1,1,,56463109,9415,Inactive,188528692.0,9099.0,,Potency,qHTS Assay for Inhibitors of Ubiquitin-specific Protease USP2a Using CHOP2 as the Reporter,Confirmatory,,
147,485270,1,1,,56463109,9415,Inactive,222080095.0,3061.0,,,FRET-based cell-based primary high throughput screening assay to identify antagonists of the orexin 1 receptor (OX1R; HCRTR1),Screening,,
148,485272,1,1,,56463109,9415,Inactive,216548487.0,23569.0,,,Fluorescence polarization-based primary biochemical high throughput screening assay to identify inhibitors of Protein Arginine Deiminase 4 (PAD4) (1536 HTS),Screening,,
149,485273,2,1,,56463109,9415,Inactive,4507793.0,7334.0,,,uHTS identification of UBC13 Polyubiquitin Inhibitors via a TR-FRET Assay,Screening,,
150,485275,1,3,,56463109,9415,Inactive,,,,,Phenotypic HTS multiplex for antifungal efflux pump inhibitors,Screening,,
151,485290,1,1,,26757673,9415,Inactive,20150581.0,,,Potency,qHTS Assay for Inhibitors of Tyrosyl-DNA Phosphodiesterase (TDP1),Confirmatory,,
