,AID,AID Version,AID Revision,Panel Member ID,SID,CID,Bioactivity Outcome,Target GI,Target GeneID,Activity Value [uM],Activity Name,Assay Name,Bioassay Type,PubMed ID,RNAi
0,421,1,3,,17389686,6366,Inactive,,,,,Cell Viability - BJ,Confirmatory,,
1,426,1,2,,17389686,6366,Inactive,,,,,Cell Viability - Jurkat,Confirmatory,,
2,427,1,1,,17389686,6366,Inactive,,,,,Cell Viability - Hek293,Confirmatory,,
3,433,1,1,,17389686,6366,Inactive,,,,,Cell Viability - HepG2,Confirmatory,,
4,434,1,2,,17389686,6366,Inactive,,,,,Cell Viability - MRC5,Confirmatory,,
5,435,1,2,,17389686,6366,Inactive,,,,,Cell Viability - SK-N-SH,Confirmatory,,
6,445,3,1,,17389686,6366,Inactive,10092619.0,4792.0,,,IkB Signaling,Confirmatory,,
7,530,1,1,,17389686,6366,Inactive,2499604.0,26414.0,,,JNK3 AlphaScreen Assay,Confirmatory,,
8,540,1,1,,17389686,6366,Inactive,,,,,Cell Viability - N2a,Confirmatory,,
9,541,1,1,,17389686,6366,Inactive,,,,,Cell Viability - NIH 3T3,Confirmatory,,
10,542,1,1,,17389686,6366,Inactive,,,,,Cell Viability - HUV-EC-C,Confirmatory,,
11,543,1,1,,17389686,6366,Inactive,,,,,Cell Viability - H-4-II-E,Confirmatory,,
12,544,2,1,,17389686,6366,Inactive,,,,,Cell Viability - SH-SY5Y,Confirmatory,,
13,545,1,1,,17389686,6366,Inactive,,,,,Cell Viability - Renal Proximal Tubule,Confirmatory,,
14,546,1,1,,17389686,6366,Inactive,,,,,Cell Viability - Mesenchymal,Confirmatory,,
15,584,1,3,,17389686,6366,Inactive,119389684.0,,,,Promiscuous and Specific Inhibitors of AmpC Beta-Lactamase (assay with detergent),Confirmatory,,
16,585,1,4,,17389686,6366,Inactive,119389684.0,,,,Promiscuous and Specific Inhibitors of AmpC Beta-Lactamase (assay without detergent),Confirmatory,,
17,595,1,3,,17389686,6366,Inactive,,,,,qHTS Assay for Disrupters of an Hsp90 Co-Chaperone Interaction,Confirmatory,,
18,596,1,2,,17389686,6366,Inactive,92096784.0,4137.0,,,qHTS Assay for Tau Filament Binding,Confirmatory,,
19,603,1,2,,17389686,6366,Inactive,,,,,qHTS Assay for Inhibitors of DNA Polymerase III Holoenzyme System,Confirmatory,,
20,605,1,2,,17389686,6366,Inactive,84028058.0,,,,qHTS Assay for Inhibitors of YjeE,Confirmatory,,
21,654,1,1,,17389686,6366,Inactive,,,,,Cellular Toxicity (caspase-3) HepG2,Confirmatory,,
22,655,1,1,,17389686,6366,Inactive,,,,,Cellular Toxicity (caspase-3) Jurkat,Confirmatory,,
23,656,1,1,,17389686,6366,Inactive,,,,,Cellular Toxicity (caspase-3) HUV-EC-C,Confirmatory,,
24,657,1,1,,17389686,6366,Inactive,,,,,Cellular Toxicity (caspase-3) SHSY5Y,Confirmatory,,
25,658,1,1,,17389686,6366,Inactive,,,,,Cellular Toxicity (caspase-3) BJ,Confirmatory,,
26,659,1,1,,17389686,6366,Inactive,,,,,Cellular Toxicity (caspase-3) MRC-5,Confirmatory,,
27,660,1,1,,17389686,6366,Inactive,,,,,Cellular Toxicity (caspase-3) Mesangial,Confirmatory,,
28,661,1,1,,17389686,6366,Inactive,,,,,Cellular Toxicity (caspase-3) SK-N-SH,Confirmatory,,
29,662,1,1,,17389686,6366,Inactive,,,,,Cell signaling CRE-BLA (Fsk stim),Confirmatory,,
30,663,1,1,,17389686,6366,Inactive,,,,,Cellular Toxicity (caspase-3) H-4-II-E,Confirmatory,,
31,664,1,1,,17389686,6366,Inactive,,,,,Cellular Toxicity (caspase-3) Hek293,Confirmatory,,
32,665,1,1,,17389686,6366,Inactive,,,,,Cellular Toxicity (caspase-3) N2a,Confirmatory,,
33,666,1,1,,17389686,6366,Inactive,,,,,Cellular Toxicity (caspase-3) NIH 3T3,Confirmatory,,
34,667,1,1,,17389686,6366,Inactive,,,,,Cellular Toxicity (caspase-3) Renal Proximal Tubule,Confirmatory,,
35,875,1,2,,17389686,6366,Inactive,159162802.0,,,Potency,qHTS Assay for Inhibitors of BRCT-Phosphoprotein Interaction (Green Fluorophore),Confirmatory,,
36,880,2,1,,17389686,6366,Inactive,3290016.0,6002.0,,,qHTS Assay for Inhibitors of RGS12 GoLoco Motif Activity (Red Fluorophore),Confirmatory,,
37,880,2,1,,17389686,6366,Inactive,33946324.0,2770.0,,,qHTS Assay for Inhibitors of RGS12 GoLoco Motif Activity (Red Fluorophore),Confirmatory,,
38,881,2,2,,17389686,6366,Inactive,317373425.0,247.0,,Potency,qHTS Assay for Inhibitors of 15-hLO-2 (15-human lipoxygenase 2),Confirmatory,,
39,884,1,2,,17389686,6366,Inactive,13435386.0,1576.0,,Potency,qHTS Assay for Inhibitors and Substrates of Cytochrome P450 3A4,Confirmatory,,
40,885,1,2,,17389686,6366,Inactive,13435386.0,1576.0,,Potency,qHTS Assay for Activators of Cytochrome P450 3A4,Confirmatory,,
41,886,1,2,,17389686,6366,Inactive,122921310.0,,,Potency,"qHTS Assay for Inhibitors of HADH2 (Hydroxyacyl-Coenzyme A Dehydrogenase, Type II)",Confirmatory,,
42,886,1,2,,17389686,6366,Inactive,122921311.0,,,Potency,"qHTS Assay for Inhibitors of HADH2 (Hydroxyacyl-Coenzyme A Dehydrogenase, Type II)",Confirmatory,,
43,887,1,2,,17389686,6366,Inactive,1832253.0,246.0,,Potency,qHTS Assay for Inhibitors of 15-hLO (15-human lipoxygenase),Confirmatory,,
44,889,1,3,,17389686,6366,Inactive,1730092.0,840.0,,Potency,qHTS Assay for Allosteric/Competitive Inhibitors of Caspase-7,Confirmatory,,
45,892,1,2,,17389686,6366,Inactive,159162802.0,,,Potency,qHTS Assay for Inhibitors of BRCT-Phosphoprotein Interaction (Red Fluorophore),Confirmatory,,
46,893,1,2,,17389686,6366,Inactive,122921310.0,,,Potency,"qHTS Assay for Inhibitors of HSD17B4, hydroxysteroid (17-beta) dehydrogenase 4",Confirmatory,,
47,893,1,2,,17389686,6366,Inactive,122921311.0,,,Potency,"qHTS Assay for Inhibitors of HSD17B4, hydroxysteroid (17-beta) dehydrogenase 4",Confirmatory,,
48,894,2,1,,17389686,6366,Inactive,31542939.0,3248.0,,Potency,qHTS Assay for Inhibitors of HPGD (15-Hydroxyprostaglandin Dehydrogenase),Confirmatory,,
49,900,1,3,,17389686,6366,Inactive,15431328.0,834.0,,Potency,qHTS Assay for Allosteric/Competitive Inhibitors of Caspase-1,Confirmatory,,
50,902,1,2,,17389686,6366,Inactive,120407068.0,7157.0,,Potency,qHTS Screen for Compounds that Selectively Target Cancer Cells with p53 Mutations: Cytotoxicity of p53ts Cells at the Nonpermissive Temperature,Confirmatory,,
51,912,1,2,,17389686,6366,Inactive,21392848.0,,,Potency,qHTS Assay for Anthrax Lethal Toxin Internalization,Confirmatory,,
52,921,1,2,,17389686,6366,Inactive,,,,Potency,Cell Viability - LYMP2-001,Confirmatory,,
53,923,1,2,,17389686,6366,Inactive,,,,Potency,qHTS Assay for Allosteric/Competitive Inhibitors of Caspase-1: Spectroscopic Profiling in AFC Spectral Region,Confirmatory,,
54,924,1,2,,17389686,6366,Inactive,120407068.0,7157.0,,Potency,qHTS Screen for Compounds that Selectively Target Cancer Cells with p53 Mutations: Cytotoxicity of p53ts Cells at the Permissive Temperature,Confirmatory,,
55,925,1,2,,17389686,6366,Inactive,4504349.0,3043.0,,Potency,qHTS Assay for Modulators of Hemoglobin Beta Chain Splicing,Confirmatory,,
56,926,1,2,,17389686,6366,Inactive,38016895.0,7253.0,,Potency,qHTS Assay for Agonists of the Thyroid Stimulating Hormone Receptor,Confirmatory,,
57,938,1,2,,17389686,6366,Inactive,38016895.0,7253.0,,Potency,qHTS Assay for Agonists of the Thyroid Stimulating Hormone Receptor: Activators of Intracellular cAMP Concentrations in Parental HEK 293,Confirmatory,,
58,946,1,2,,17389686,6366,Inactive,,,,Potency,MultiTox-Fluor Cytotoxicity Assay - LYMP1-001 - Dead Cells,Confirmatory,,
59,947,1,2,,17389686,6366,Inactive,,,,Potency,MultiTox-Fluor Cytotoxicity Assay - LYMP1-001 - Live Cells,Confirmatory,,
60,948,1,2,,17389686,6366,Inactive,,,,Potency,Cell Viability - LYMP1-002 - Assay at 16 hr,Confirmatory,,
61,955,1,2,,17389686,6366,Inactive,,,,Potency,MultiTox-Fluor Cytotoxicity Assay - LYMP1-002 - Live Cells,Confirmatory,,
62,960,1,2,,17389686,6366,Inactive,,,,Potency,MultiTox-Fluor Cytotoxicity Assay - LYMP1-002 - Dead Cells,Confirmatory,,
63,961,1,2,,17389686,6366,Inactive,,,,Potency,MultiTox-Fluor Cytotoxicity Assay - LYMP1-003 - Dead Cells,Confirmatory,,
64,962,1,2,,17389686,6366,Inactive,,,,Potency,MultiTox-Fluor Cytotoxicity Assay - LYMP1-003 - Live Cells,Confirmatory,,
65,963,1,2,,17389686,6366,Inactive,,,,Potency,Cell Viability - LYMP1-003 - Assay at 24 hr,Confirmatory,,
66,964,1,2,,17389686,6366,Inactive,,,,Potency,Cell Viability - LYMP1-003 - Assay at 40 hr,Confirmatory,,
67,965,1,2,,17389686,6366,Inactive,,,,Potency,Cell Viability - LYMP2-003,Confirmatory,,
68,966,1,2,,17389686,6366,Inactive,,,,Potency,Cell Viability - LYMP2-004,Confirmatory,,
69,967,1,2,,17389686,6366,Inactive,,,,Potency,Cell Viability - LYMP2-005,Confirmatory,,
70,968,1,2,,17389686,6366,Inactive,,,,Potency,Cell Viability - LYMP2-009,Confirmatory,,
71,969,1,2,,17389686,6366,Inactive,,,,Potency,Cell Viability - LYMP2-011,Confirmatory,,
72,970,1,2,,17389686,6366,Inactive,,,,Potency,Cell Viability - LYMP2-013,Confirmatory,,
73,971,1,2,,17389686,6366,Inactive,,,,Potency,Cell Viability - LYMP2-015,Confirmatory,,
74,972,1,2,,17389686,6366,Inactive,,,,Potency,Cell Viability - LYMP2-017,Confirmatory,,
75,973,1,2,,17389686,6366,Inactive,,,,Potency,Cell Viability - LYMP2-019,Confirmatory,,
76,974,1,2,,17389686,6366,Inactive,,,,Potency,Cell Viability - LYMP2-021,Confirmatory,,
77,975,1,2,,17389686,6366,Inactive,,,,Potency,Cell Viability - LYMP2-023,Confirmatory,,
78,976,1,2,,17389686,6366,Inactive,,,,Potency,Cell Viability - LYMP2-025,Confirmatory,,
79,977,1,2,,17389686,6366,Inactive,,,,Potency,Cell Viability - LYMP2-002,Confirmatory,,
80,978,1,2,,17389686,6366,Inactive,,,,Potency,Cell Viability - LYMP2-006,Confirmatory,,
81,979,1,2,,17389686,6366,Inactive,,,,Potency,Cell Viability - LYMP2-007,Confirmatory,,
82,980,1,2,,17389686,6366,Inactive,,,,Potency,Cell Viability - LYMP2-008,Confirmatory,,
83,981,1,2,,17389686,6366,Inactive,,,,Potency,Cell Viability - LYMP2-010,Confirmatory,,
84,982,1,2,,17389686,6366,Inactive,,,,Potency,Cell Viability - LYMP2-012,Confirmatory,,
85,983,1,2,,17389686,6366,Inactive,,,,Potency,Cell Viability - LYMP2-014,Confirmatory,,
86,984,1,2,,17389686,6366,Inactive,,,,Potency,Cell Viability - LYMP2-016,Confirmatory,,
87,985,1,2,,17389686,6366,Inactive,,,,Potency,Cell Viability - LYMP2-018,Confirmatory,,
88,986,1,2,,17389686,6366,Inactive,,,,Potency,Cell Viability - LYMP2-020,Confirmatory,,
89,987,1,2,,17389686,6366,Inactive,,,,Potency,Cell Viability - LYMP2-022,Confirmatory,,
90,988,1,2,,17389686,6366,Inactive,,,,Potency,Cell Viability - LYMP2-024,Confirmatory,,
91,989,1,2,,17389686,6366,Inactive,,,,Potency,Cell Viability - LYMP2-026,Confirmatory,,
92,993,1,2,,17389686,6366,Inactive,,,,Potency,Cell Viability - LYMP1-002 - Assay at 24 hr,Confirmatory,,
93,994,1,2,,17389686,6366,Inactive,,,,Potency,Cell Viability - LYMP1-002 - Assay at 40 hr,Confirmatory,,
94,995,1,2,,17389686,6366,Inactive,66932916.0,5594.0,,Potency,qHTS Assay for Inhibitors of the ERK Signaling Pathway using a Homogeneous Screening Assay,Confirmatory,,
95,1030,2,1,,17389686,6366,Inactive,30582681.0,216.0,,Potency,qHTS Assay for Inhibitors of Aldehyde Dehydrogenase 1 (ALDH1A1),Confirmatory,,
96,1189,1,5,,48414630,6366,Active,,,,,DSSTox (CPDBAS) Carcinogenic Potency Database Summary SingleCellCall Results,Other,,
97,1194,1,3,,48414630,6366,Active,,,,,DSSTox (CPDBAS) Carcinogenic Potency Database Salmonella Mutagenicity,Other,,
98,1199,1,3,,48414630,6366,Active,,,,,DSSTox (CPDBAS) Carcinogenic Potency Database Summary Mouse Bioassay Results,Other,,
99,1205,1,4,,48414630,6366,Active,,,,,DSSTox (CPDBAS) Carcinogenic Potency Database Summary MultiCellCall Results,Other,,
100,1208,1,3,,48414630,6366,Inactive,,,,,DSSTox (CPDBAS) Carcinogenic Potency Database Summary Rat Bioassay Results,Other,,
101,1452,1,1,,17389686,6366,Inactive,154426292.0,239.0,,Potency,qHTS Assay for Inhibitors of 12-hLO (12-human lipoxygenase),Confirmatory,,
102,1457,1,1,,17389686,6366,Inactive,44888968.0,83523.0,,Potency,qHTS Assay for Identifying the Cell-Membrane Permeable IMPase Inhibitors: Potentiation with Lithium,Confirmatory,,
103,1458,1,1,,17389686,6366,Inactive,10937869.0,6607.0,,Potency,qHTS Assay for Enhancers of SMN2 Splice Variant Expression,Confirmatory,,
104,1469,1,1,,17389686,6366,Inactive,189491771.0,7068.0,,Potency,qHTS for Inhibitors of the Interaction of Thyroid Hormone Receptor and Steroid Receptor Coregulator 2,Confirmatory,,
105,1471,2,1,,17389686,6366,Inactive,90903231.0,3064.0,,,qHTS Multiplex Assay to Identify Dual Action Probes in a Cell Model of Huntington: Cytoprotection (ATP),Confirmatory,,
106,1476,2,1,,17389686,6366,Inactive,281307097.0,,,Potency,qHTS Assay for Promiscuous and Specific Inhibitors of Cruzain (without detergent),Confirmatory,,
107,1477,1,1,,17389686,6366,Inactive,,,,Potency,qHTS Assay for Compounds Blocking the Interaction Between CBF-beta and RUNX1 for the Treatment of Acute Myeloid Leukemia,Confirmatory,,
108,1478,2,1,,17389686,6366,Inactive,281307097.0,,,Potency,qHTS Assay for Promiscuous and Specific Inhibitors of Cruzain (with detergent),Confirmatory,,
109,1479,1,2,,17389686,6366,Inactive,189491771.0,7068.0,,Potency,Total Fluorescence Counterscreen for Inhibitors of the Interaction of Thyroid Hormone Receptor and Steroid Receptor Coregulator 2,Confirmatory,,
110,1948,1,1,,17389686,6366,Inactive,,,,Potency,qHTS Assay for Compounds that Induce Erasure of Genomic Imprints,Confirmatory,,
111,2101,1,1,,17389686,6366,Inactive,496369.0,2629.0,,Potency,qHTS Assay for Inhibitors and Activators of N370S glucocerebrosidase as a Potential Chaperone Treatment of Gaucher Disease,Confirmatory,,
112,2107,1,1,,17389686,6366,Inactive,757912.0,2717.0,,Potency,qHTS Assay for Inhibitors and Activators of Human alpha-Galactosidase From Spleen Homogenate,Confirmatory,,
113,2112,1,1,,17389686,6366,Inactive,119393891.0,2548.0,,Potency,qHTS Assay for Inhibitors and Activators of Human alpha-Glucosidase From Spleen Homogenate,Confirmatory,,
114,2120,1,1,,17389686,6366,Inactive,32879895.0,3091.0,,Potency,qHTS Assay for Identification of Small Molecule Inducers of Hypoxia Response,Confirmatory,,
115,2517,2,1,,17389686,6366,Inactive,6980812.0,,,Potency,qHTS Assay for Inhibitors of the Human Apurinic/apyrimidinic Endonuclease 1 (APE1),Confirmatory,,
116,2546,1,1,,17389686,6366,Inactive,188536040.0,19885.0,,Potency,VP16 counterscreen qHTS for inhibitors of ROR gamma transcriptional activity,Confirmatory,,
117,2549,1,1,,17389686,6366,Inactive,282403581.0,,,Potency,qHTS Assay for Inhibitors of RecQ-Like Dna Helicase 1 (RECQ1),Confirmatory,,
118,2551,1,1,,17389686,6366,Inactive,188536040.0,19885.0,,Potency,qHTS for inhibitors of ROR gamma transcriptional activity,Confirmatory,,
119,19825,3,3,,103407502,6366,Unspecified,,,,,Partition coefficient (logP),Other,7861411.0,
120,37562,4,2,,103407502,6366,Unspecified,,,,,Induction of aneuploidy in Aspergillus nidulans.,Other,7861411.0,
121,485290,1,1,,17389686,6366,Inactive,20150581.0,,,Potency,qHTS Assay for Inhibitors of Tyrosyl-DNA Phosphodiesterase (TDP1),Confirmatory,,
122,588513,1,1,,17389686,6366,Inactive,348019627.0,2099.0,,Potency,qHTS assay for small molecule antagonists of estrogen receptor alpha signaling,Confirmatory,,
123,588514,1,1,,17389686,6366,Inactive,348019627.0,2099.0,,Potency,qHTS assay for small molecule agonists of estrogen receptor alpha signaling,Confirmatory,,
124,588515,1,1,,17389686,6366,Inactive,124375976.0,367.0,,Potency,qHTS assay for small molecule agonists of androgen receptor signaling,Confirmatory,,
125,588516,1,1,,17389686,6366,Inactive,124375976.0,367.0,,Potency,qHTS assay for small molecule antagonists of androgen receptor signaling,Confirmatory,,
126,588526,1,1,,17389686,6366,Inactive,325495553.0,9971.0,,Potency,qHTS assay for small molecule antagonists of farnesoid X receptor signaling,Confirmatory,,
127,588527,1,1,,17389686,6366,Inactive,325495553.0,9971.0,,Potency,qHTS assay for small molecule agonists of farnesoid X receptor signaling,Confirmatory,,
128,588532,1,1,,17389686,6366,Inactive,311348376.0,2908.0,,Potency,qHTS assay for small molecule agonists of glucocorticoid receptor signaling,Confirmatory,,
129,588533,1,1,,17389686,6366,Inconclusive,311348376.0,2908.0,,Potency,qHTS assay for small molecule antagonists of glucocorticoid receptor signaling,Confirmatory,,
130,588534,1,1,,17389686,6366,Inactive,216409690.0,5467.0,,Potency,qHTS assay for small molecule agonists of peroxisome proliferator-activated receptor delta signaling,Confirmatory,,
131,588535,1,1,,17389686,6366,Inactive,216409690.0,5467.0,,Potency,qHTS assay for small molecule antagonists of peroxisome proliferator-activated receptor delta signaling,Confirmatory,,
132,588536,1,1,,17389686,6366,Inactive,216409692.0,5468.0,,Potency,qHTS assay for small molecule agonists of peroxisome proliferator-activated receptor gamma signaling,Confirmatory,,
133,588537,1,1,,17389686,6366,Inactive,216409692.0,5468.0,,Potency,qHTS assay for small molecule antagonists of peroxisome proliferator-activated receptor gamma signaling,Confirmatory,,
134,588541,1,1,,17389686,6366,Inactive,216409708.0,7421.0,,Potency,qHTS assay for small molecule antagonists of vitamin D receptor signaling,Confirmatory,,
135,588543,1,1,,17389686,6366,Inactive,216409708.0,7421.0,,Potency,qHTS assay for small molecule agonists of vitamin D receptor signaling,Confirmatory,,
136,588544,1,1,,17389686,6366,Inactive,325495497.0,6256.0,,Potency,qHTS assay for small molecule agonists of retinoid X receptor alpha signaling,Confirmatory,,
137,588545,1,1,,17389686,6366,Inactive,189491771.0,7068.0,,Potency,qHTS assay for small molecule agonists of thyroid hormone receptor beta signaling,Confirmatory,,
138,588546,1,1,,17389686,6366,Inactive,325495497.0,6256.0,,Potency,qHTS assay for small molecule antagonists of retinoid X receptor alpha signaling,Confirmatory,,
139,588547,1,1,,17389686,6366,Inactive,189491771.0,7068.0,,Potency,qHTS assay for small molecule antagonists of thyroid hormone receptor beta signaling,Confirmatory,,
140,588834,2,1,,17389686,6366,Inactive,325651834.0,3757.0,,Potency,qHTS Assay for Small Molecule Inhibitors of the Human hERG Channel Activity,Confirmatory,,
141,625144,5,5,,103407502,6366,Unspecified,239977155.0,,,IC50,DRUGMATRIX: Leukotriene LTC4 Synthase enzyme inhibition (substrate: LTA4),Confirmatory,,
142,625145,4,7,,103407502,6366,Unspecified,20138087.0,10800.0,,IC50,DRUGMATRIX: Cysteinyl leukotriene receptor 1 radioligand binding (ligand: [3H]LTD4),Confirmatory,,
143,625146,5,5,,103407502,6366,Unspecified,126397.0,100009114.0,,IC50,DRUGMATRIX: Lipoxygenase 15-LO enzyme inhibition (substrate: Linoleic acid),Confirmatory,,
144,625147,4,7,,103407502,6366,Unspecified,395398606.0,4159.0,,IC50,DRUGMATRIX: Melanocortin MC3 radioligand binding (ligand: [125I] NDP-alpha-MSH),Confirmatory,,
145,625148,4,7,,103407502,6366,Unspecified,60392672.0,4160.0,,IC50,DRUGMATRIX: Melanocortin MC4 radioligand binding (ligand: [125I] NDP-alpha-MSH),Confirmatory,,
146,625149,4,7,,103407502,6366,Unspecified,729996.0,4161.0,,IC50,DRUGMATRIX: Melanocortin MC5 radioligand binding (ligand: [125I] NDP-alpha-MSH),Confirmatory,,
147,625150,5,5,,103407502,6366,Unspecified,113978.0,4128.0,,IC50,DRUGMATRIX: Monoamine Oxidase MAO-A enzyme inhibition (substrate: Kynuramine),Confirmatory,,
148,625151,4,7,,103407502,6366,Unspecified,113118.0,1128.0,,IC50,DRUGMATRIX: Muscarinic M1 radioligand binding (ligand: [3H] N-Methylscopolamine),Confirmatory,,
149,625152,4,7,,103407502,6366,Unspecified,113122.0,1129.0,,IC50,DRUGMATRIX: Muscarinic M2 radioligand binding (ligand: [3H] N-Methylscopolamine),Confirmatory,,
150,625153,4,7,,103407502,6366,Unspecified,113125.0,1131.0,,IC50,DRUGMATRIX: Muscarinic M3 radioligand binding (ligand: [3H] N-Methylscopolamine),Confirmatory,,
151,625154,4,7,,103407502,6366,Unspecified,23503039.0,1132.0,,IC50,DRUGMATRIX: Muscarinic M4 radioligand binding (ligand: [3H] N-Methylscopolamine),Confirmatory,,
152,625155,4,7,,103407502,6366,Unspecified,543761.0,1133.0,,IC50,DRUGMATRIX: Muscarinic M5 radioligand binding (ligand: [3H] N-Methylscopolamine),Confirmatory,,
153,625156,1,9,,103407502,6366,Unspecified,128997.0,4886.0,,,DRUGMATRIX: Neuropeptide Y Y1 radioligand binding (ligand: [125I] Peptide YY),Other,,
154,625157,6,2,,103407502,6366,Unspecified,1352610.0,4887.0,,IC50,DRUGMATRIX: Neuropeptide Y Y2 radioligand binding (ligand: [125I] Peptide YY),Confirmatory,,
155,625158,3,4,,103407502,6366,Unspecified,,,,IC50,DRUGMATRIX: Nicotinic Acetylcholine radioligand binding (ligand: [125I] Epibatidine),Confirmatory,,
156,625159,5,5,,103407502,6366,Unspecified,266646.0,24598.0,,IC50,"DRUGMATRIX: Nitric Oxide Synthase, Neuronal (nNOS) radioligand binding (ligand: [3H]L-Arginine)",Confirmatory,,
157,625160,1,9,,103407502,6366,Unspecified,266649.0,18126.0,,,"DRUGMATRIX: Nitric Oxide Synthase, Inducible (iNOS) enzyme inhibition (substrate: L-Arginine)",Other,,
158,625161,4,7,,103407502,6366,Unspecified,311033488.0,4985.0,,IC50,"DRUGMATRIX: Opiate delta1 (OP1, DOP) radioligand binding (ligand: [3H] Naltrindole)",Confirmatory,,
159,625162,4,7,,103407502,6366,Unspecified,116242691.0,4986.0,,IC50,"DRUGMATRIX: Opiate kappa (OP2, KOP) radioligand binding (ligand: [3H] Diprenorphine)",Confirmatory,,
160,625163,4,7,,103407502,6366,Unspecified,2851402.0,4988.0,,IC50,"DRUGMATRIX: Opiate mu (OP3, MOP) radioligand binding (ligand: [3H] Diprenorphine)",Confirmatory,,
161,625164,1,6,,103407502,6366,Unspecified,,,,,DRUGMATRIX: Phorbol Ester radioligand binding (ligand: [3H] PDBu),Other,,
162,625165,3,4,,103407502,6366,Unspecified,,,,IC50,DRUGMATRIX: Phosphodiesterase PDE3 enzyme inhibition (substrate: [3H]cAMP + cAMP),Confirmatory,,
163,625166,3,4,,103407502,6366,Unspecified,,,,IC50,DRUGMATRIX: Phosphodiesterase PDE4 enzyme inhibition (substrate: [3H]cAMP + cAMP),Confirmatory,,
164,625167,5,5,,103407502,6366,Unspecified,317373261.0,8654.0,,IC50,DRUGMATRIX: Phosphodiesterase PDE5 enzyme inhibition (substrate: [3H]cGMP + cGMP),Confirmatory,,
165,625168,4,7,,103407502,6366,Unspecified,129557.0,5724.0,,IC50,DRUGMATRIX: Platelet Activating Factor (PAF) radioligand binding (ligand: [3H] PAF),Confirmatory,,
166,625169,1,6,,103407502,6366,Unspecified,,,,,DRUGMATRIX: Platelet-Derived Growth Factor (PDGF) radioligand binding (ligand: [125I] PDGF),Other,,
167,625170,3,4,,103407502,6366,Unspecified,,,,IC50,DRUGMATRIX: Potassium Channel [KATP] radioligand binding (ligand: [3H] Glyburide),Confirmatory,,
168,625171,4,7,,103407502,6366,Unspecified,7531135.0,3757.0,,IC50,DRUGMATRIX: Potassium Channel HERG radioligand binding (ligand: [3H] Astemizole),Confirmatory,,
169,625172,4,7,,103407502,6366,Unspecified,75071465.0,,,IC50,DRUGMATRIX: Progesterone radioligand binding (ligand: [3H] R-5020),Confirmatory,,
170,625173,5,5,,103407502,6366,Unspecified,2822103.0,100009274.0,,IC50,"DRUGMATRIX: Peptidase, Angiotensin Converting Enzyme enzyme inhibition (substrate: FAPGG)",Confirmatory,,
171,625174,5,5,,103407502,6366,Unspecified,266321.0,834.0,,IC50,"DRUGMATRIX: Protease, Caspase 1 enzyme inhibition (substrate: Ac-YVAD-AMC)",Confirmatory,,
172,625175,5,5,,103407502,6366,Unspecified,115725.0,1511.0,,IC50,"DRUGMATRIX: Protease, Cathepsin G enzyme inhibition (substrate: Suc-Ala-Ala-Pro-Phe-AMC)",Confirmatory,,
173,625176,1,9,,103407502,6366,Unspecified,119292.0,1991.0,,,"DRUGMATRIX: Peptidase, ELA2 (Neutrophil Elastase 2) enzyme inhibition (substrate: N-MeOSuc-Ala-Ala-Pro-Val-pNA)",Other,,
174,625177,5,5,,103407502,6366,Unspecified,116852.0,4312.0,,IC50,"DRUGMATRIX: Peptidase, Matrix Metalloprotease-1 (MMP-1) enzyme inhibition (substrate: Mca-Pro-Leu-Gly-Leu-Dpa-Ala-Arg-NH2)",Confirmatory,,
175,625178,5,5,,103407502,6366,Unspecified,269849668.0,4318.0,,IC50,"DRUGMATRIX: Protease, Matrix Metalloprotease-9 (MMP-9) enzyme inhibition (substrate: Mca-Pro-Leu-Gly-Leu-Dpa-Ala-Arg-NH2)",Confirmatory,,
176,625179,1,9,,103407502,6366,Unspecified,317373571.0,5578.0,,,DRUGMATRIX: Protein Serine/Threonine Kinase PKCalpha enzyme inhibition (substrate: Histone),Other,,
177,625180,5,5,,103407502,6366,Unspecified,232066.0,5595.0,,IC50,"DRUGMATRIX: Protein Serine/Threonine Kinase, ERK1 enzyme inhibition (substrate: Myelin Basic Protein)",Confirmatory,,
178,625181,5,5,,103407502,6366,Unspecified,119554.0,5594.0,,IC50,"DRUGMATRIX: Protein Serine/Threonine Kinase, ERK2 enzyme inhibition (substrate: Myelin Basic Protein)",Confirmatory,,
179,625182,5,5,,103407502,6366,Unspecified,2499600.0,1432.0,,IC50,"DRUGMATRIX: Protein Serine/Threonine Kinase, p38alpha enzyme inhibition (substrate: Myelin Basic Protein)",Confirmatory,,
180,625183,5,5,,103407502,6366,Unspecified,1352673.0,5530.0,,IC50,"DRUGMATRIX: Protein Serine/Threonine Phosphatase, PPP3CA (Calcineurin, PP2B) enzyme inhibition (substrate: DiFMUP)",Confirmatory,,
181,625184,5,5,,103407502,6366,Unspecified,2811086.0,1956.0,,IC50,"DRUGMATRIX: Protein Tyrosine Kinase, EGF Receptor enzyme inhibition (substrate: Poly(Glu:Tyr))",Confirmatory,,
182,625185,5,5,,103407502,6366,Unspecified,125370.0,2534.0,,IC50,"DRUGMATRIX: Protein Tyrosine Kinase, Fyn enzyme inhibition (substrate: Poly(Glu:Tyr))",Confirmatory,,
183,625186,5,5,,103407502,6366,Unspecified,119533.0,2064.0,,IC50,"DRUGMATRIX: Protein Tyrosine Kinase, ERBB2 (HER2) enzyme inhibition (substrate: Poly(Glu:Tyr))",Confirmatory,,
184,625187,5,5,,103407502,6366,Unspecified,125474.0,3932.0,,IC50,"DRUGMATRIX: Protein Tyrosine Kinase, LCK enzyme inhibition (substrate: Poly(Glu:Tyr))",Confirmatory,,
185,625188,1,9,,103407502,6366,Unspecified,33112650.0,5788.0,,,"DRUGMATRIX: Protein Tyrosine Phosphatase, PTPRC (CD45) enzyme inhibition (substrate: DiFMUP)",Other,,
186,625189,1,7,,103407502,6366,Unspecified,,,,,"DRUGMATRIX: Purinergic P2X radioligand binding (ligand: [3H] alpha, beta-Methylene-ATP)",Other,,
187,625190,4,5,,103407502,6366,Unspecified,,,,IC50,DRUGMATRIX: Serotonin (5-Hydroxytryptamine) 5-HT1A radioligand binding (ligand: [3H] 8-OH-DPAT),Confirmatory,,
188,625191,4,7,,103407502,6366,Unspecified,112815.0,25075.0,,IC50,DRUGMATRIX: Serotonin (5-Hydroxytryptamine) 5-HT1B radioligand binding (ligand: [125I] Cyanopindolol),Confirmatory,,
189,625192,4,7,,103407502,6366,Unspecified,543727.0,3356.0,,IC50,DRUGMATRIX: Serotonin (5-Hydroxytryptamine) 5-HT2A radioligand binding (ligand: [3H] Ketanserin),Confirmatory,,
190,625193,5,5,,103407502,6366,Unspecified,113037.0,43.0,,IC50,DRUGMATRIX: Acetylcholinesterase enzyme inhibition (substrate: acetylthiocholine),Confirmatory,,
