,AID,AID Version,AID Revision,Panel Member ID,SID,CID,Bioactivity Outcome,Target GI,Target GeneID,Activity Value [uM],Activity Name,Assay Name,Bioassay Type,PubMed ID,RNAi
191,625194,4,7,,103407502,6366,Unspecified,231473.0,134.0,,IC50,DRUGMATRIX: Adenosine A1 radioligand binding (ligand: DPCPX),Confirmatory,,
192,625195,4,7,,103407502,6366,Unspecified,543740.0,135.0,,IC50,DRUGMATRIX: Adenosine A2A radioligand binding (ligand: AB-MECA),Confirmatory,,
193,625196,5,6,,103407502,6366,Unspecified,803374855.0,140.0,,IC50,DRUGMATRIX: Adenosine A3 radioligand binding (ligand: AB-MECA),Confirmatory,,
194,625197,3,4,,103407502,6366,Unspecified,,,,IC50,DRUGMATRIX: Sodium/nucleoside co-transporter radioligand binding (ligand: nitrobenzylthioinosine),Confirmatory,,
195,625198,4,7,,103407502,6366,Unspecified,1168247.0,29412.0,,IC50,DRUGMATRIX: Alpha-1A adrenergic receptor radioligand binding (ligand: prazosin),Confirmatory,,
196,625199,4,7,,103407502,6366,Unspecified,543734.0,24173.0,,IC50,DRUGMATRIX: Alpha-1B adrenergic receptor radioligand binding (ligand: prazosin),Confirmatory,,
197,625200,4,7,,103407502,6366,Unspecified,1168243.0,146.0,,IC50,DRUGMATRIX: Alpha-1D adrenergic receptor radioligand binding (ligand: prazosin),Confirmatory,,
198,625201,4,7,,103407502,6366,Unspecified,1351829.0,150.0,,IC50,DRUGMATRIX: Alpha-2A adrenergic receptor radioligand binding (ligand: MK-912),Confirmatory,,
199,625202,4,7,,103407502,6366,Unspecified,613504690.0,151.0,,IC50,DRUGMATRIX: Alpha-2B adrenergic receptor radioligand binding (ligand: Rauwolscine),Confirmatory,,
200,625203,4,7,,103407502,6366,Unspecified,20141211.0,152.0,,IC50,DRUGMATRIX: Adrenergic Alpha-2C radioligand binding (ligand: [3H] MK-912),Confirmatory,,
201,625204,4,7,,103407502,6366,Unspecified,48429211.0,153.0,,IC50,DRUGMATRIX: Adrenergic beta1 radioligand binding (ligand: [125I] Cyanopindolol),Confirmatory,,
202,625205,4,7,,103407502,6366,Unspecified,296439450.0,154.0,,IC50,DRUGMATRIX: Adrenergic beta2 radioligand binding (ligand: [3H] CGP-12177),Confirmatory,,
203,625206,4,7,,103407502,6366,Unspecified,461604.0,155.0,,IC50,DRUGMATRIX: Adrenergic beta3 radioligand binding (ligand: [125I] Cyanopindolol),Confirmatory,,
204,625207,4,7,,103407502,6366,Unspecified,128616.0,6530.0,,IC50,DRUGMATRIX: Norepinephrine Transporter radioligand binding (ligand: [125I] RTI-55),Confirmatory,,
205,625208,5,5,,103407502,6366,Unspecified,1168407.0,24192.0,,IC50,DRUGMATRIX: Aldose Reductase enzyme inhibition (substrate: DL-Glyceraldehyde),Confirmatory,,
206,625209,4,7,,103407502,6366,Unspecified,1703214.0,186.0,,IC50,DRUGMATRIX: Angiotensin AT2 radioligand binding (ligand: [125I] CGP-42112A),Confirmatory,,
207,625210,3,4,,103407502,6366,Unspecified,,,,IC50,"DRUGMATRIX: ATPase, Na+/K+ enzyme inhibition (substrate: ATP)",Confirmatory,,
208,625211,1,6,,103407502,6366,Unspecified,,,,,DRUGMATRIX: Atrial Natriuretic Factor (ANF) radioligand binding (ligand: [125I] ANF (rat)),Other,,
209,625212,3,4,,103407502,6366,Unspecified,,,,IC50,DRUGMATRIX: beta-Lactamase enzyme inhibition (substrate: Nitrocefin),Confirmatory,,
210,625213,4,7,,103407502,6366,Unspecified,2506481.0,624.0,,IC50,DRUGMATRIX: Bradykinin B2 radioligand binding (ligand: [3H] Bradykinin),Confirmatory,,
211,625214,1,9,,103407502,6366,Unspecified,550544247.0,799.0,,,DRUGMATRIX: Calcitonin radioligand binding (ligand: [125I] Calcitonin (salmon)),Other,,
212,625215,3,4,,103407502,6366,Unspecified,,,,IC50,"DRUGMATRIX: Calcium Channel Type L, Benzothiazepine radioligand binding (ligand: [3H] Diltiazem)",Confirmatory,,
213,625216,3,4,,103407502,6366,Unspecified,,,,IC50,"DRUGMATRIX: Calcium Channel Type L, Dihydropyridine radioligand binding (ligand: [3H] Nitrendipine)",Confirmatory,,
214,625217,4,7,,103407502,6366,Unspecified,1168220.0,3357.0,,IC50,DRUGMATRIX: Serotonin (5-Hydroxytryptamine) 5-HT2B radioligand binding (ligand: [3H] Lysergic acid diethylamide),Confirmatory,,
215,625218,4,7,,103407502,6366,Unspecified,112816.0,3358.0,,IC50,DRUGMATRIX: Serotonin (5-Hydroxytryptamine) 5-HT2C radioligand binding (ligand: [3H] Mesulergine),Confirmatory,,
216,625219,3,4,,103407502,6366,Unspecified,,,,IC50,DRUGMATRIX: Serotonin (5-Hydroxytryptamine) 5-HT3 radioligand binding (ligand: [3H] GR-65630),Confirmatory,,
217,625220,4,7,,103407502,6366,Unspecified,6224984.0,100135548.0,,IC50,DRUGMATRIX: Serotonin (5-Hydroxytryptamine) 5-HT4 radioligand binding (ligand: [3H] GR-113808),Confirmatory,,
218,625221,4,7,,103407502,6366,Unspecified,1703010.0,3362.0,,IC50,DRUGMATRIX: Serotonin (5-Hydroxytryptamine) 5-HT6 radioligand binding (ligand: [3H] Lysergic acid diethylamide),Confirmatory,,
219,625222,4,7,,103407502,6366,Unspecified,400630.0,6532.0,,IC50,"DRUGMATRIX: Transporter, Serotonin (5-Hydroxytryptamine) (SERT) radioligand binding (ligand: [3H] Paroxetine)",Confirmatory,,
220,625223,4,7,,103407502,6366,Unspecified,74752153.0,10280.0,,IC50,DRUGMATRIX: Sigma1 radioligand binding (ligand: [3H] Haloperidol),Confirmatory,,
221,625224,3,4,,103407502,6366,Unspecified,,,,IC50,DRUGMATRIX: Sigma2 radioligand binding (ligand: [3H] Ifenprodil),Confirmatory,,
222,625225,3,4,,103407502,6366,Unspecified,,,,IC50,"DRUGMATRIX: Sodium Channel, Site 2 radioligand binding (ligand: [3H] Batrachotoxin)",Confirmatory,,
223,625226,4,7,,103407502,6366,Unspecified,128359.0,6869.0,,IC50,DRUGMATRIX: Tachykinin NK1 radioligand binding (ligand: [3H] Substance P),Confirmatory,,
224,625227,4,7,,103407502,6366,Unspecified,229462950.0,6865.0,,IC50,DRUGMATRIX: Tachykinin NK2 radioligand binding (ligand: [3H] SR-48968),Confirmatory,,
225,625228,4,7,,103407502,6366,Unspecified,113832.0,24208.0,,IC50,DRUGMATRIX: Androgen (Testosterone) AR radioligand binding (ligand: [3H] Mibolerone),Confirmatory,,
226,625229,5,5,,103407502,6366,Unspecified,254763392.0,6916.0,,IC50,DRUGMATRIX: Thromboxane Synthetase enzyme inhibition (substrate: PGH2),Confirmatory,,
227,625230,1,6,,103407502,6366,Unspecified,,,,,"DRUGMATRIX: Tumor Necrosis Factor (TNF), Non-Selective radioligand binding (ligand: [125I] TNF-alpha)",Other,,
228,625231,4,7,,103407502,6366,Unspecified,143811474.0,2321.0,,IC50,DRUGMATRIX: Vascular Endothelial Growth Factor (VEGF) radioligand binding (ligand: [125I] VEGF),Confirmatory,,
229,625232,1,9,,103407502,6366,Unspecified,418253.0,7433.0,,,DRUGMATRIX: Vasoactive Intestinal Peptide VIP1 radioligand binding (ligand: [125I] VIP),Other,,
230,625233,4,7,,103407502,6366,Unspecified,586197.0,552.0,,IC50,DRUGMATRIX: Vasopressin V1A radioligand binding (ligand: [125I] PhenylacetylTyr(Me)PheGlnAsnArgProArgTyr),Confirmatory,,
231,625234,3,4,,103407502,6366,Unspecified,,,,IC50,"DRUGMATRIX: Calcium Channel Type L, Phenylalkylamine radioligand binding (ligand: [3H] (-)-Desmethoxyverapamil (D-888))",Confirmatory,,
232,625235,4,7,,103407502,6366,Unspecified,115562.0,1268.0,,IC50,DRUGMATRIX: Cannabinoid CB1 radioligand binding (ligand: [3H] SR141716A),Confirmatory,,
233,625236,5,5,,103407502,6366,Unspecified,115456.0,760.0,,IC50,DRUGMATRIX: Carbonic Anhydrase II enzyme inhibition (substrate: 4-Nitrophenyl acetate (4-NPA)),Confirmatory,,
234,625237,4,7,,103407502,6366,Unspecified,1168965.0,729230.0,,IC50,DRUGMATRIX: Chemokine CCR2B radioligand binding (ligand: [125I] MCP-1),Confirmatory,,
235,625238,4,7,,103407502,6366,Unspecified,1705894.0,1233.0,,IC50,DRUGMATRIX: Chemokine CCR4 radioligand binding (ligand: [125I] TARC),Confirmatory,,
236,625239,4,7,,103407502,6366,Unspecified,1705896.0,1234.0,,IC50,DRUGMATRIX: Chemokine CCR5 radioligand binding (ligand: [125I] MIP-1alpha),Confirmatory,,
237,625240,1,9,,103407502,6366,Unspecified,108936015.0,3577.0,,,DRUGMATRIX: Chemokine CXCR1 (IL-8A),Other,,
238,625241,4,7,,103407502,6366,Unspecified,1352454.0,3579.0,,IC50,DRUGMATRIX: Chemokine CXCR2 (IL-8B) radioligand binding (ligand: [125I] IL-8),Confirmatory,,
239,625242,4,7,,103407502,6366,Unspecified,416772.0,886.0,,IC50,"DRUGMATRIX: Cholecystokinin CCKA radioligand binding (ligand: [3H] L-364,718)",Confirmatory,,
240,625243,5,5,,103407502,6366,Unspecified,317373262.0,5742.0,,IC50,DRUGMATRIX: Cyclooxygenase COX-1 enzyme inhibition (substrate: Arachidonic acid),Confirmatory,,
241,625244,5,5,,103407502,6366,Unspecified,3915797.0,5743.0,,IC50,DRUGMATRIX: Cyclooxygenase COX-2 enzyme inhibition (substrate: Arachidonic acid),Confirmatory,,
242,625245,5,5,,103407502,6366,Unspecified,117144.0,1544.0,,IC50,"DRUGMATRIX: CYP450, 1A2 enzyme inhibition (substrate: 3-Cyano-7-ethoxycoumarin)",Confirmatory,,
243,625246,1,9,,103407502,6366,Unspecified,308153612.0,1548.0,,,"DRUGMATRIX: CYP450, 2A6 enzyme inhibition (substrate: 3-Cyano-7-ethoxycoumarin)",Other,,
244,625247,5,5,,103407502,6366,Unspecified,60416369.0,1557.0,,IC50,"DRUGMATRIX: CYP450, 2C19 enzyme inhibition (substrate: 3-Cyano-7-ethoxycoumarin)",Confirmatory,,
245,625248,5,5,,103407502,6366,Unspecified,6686268.0,1559.0,,IC50,"DRUGMATRIX: CYP450, 2C9 enzyme inhibition (substrate: 3-Cyano-7-ethoxycoumarin)",Confirmatory,,
246,625249,5,5,,103407502,6366,Unspecified,84028191.0,1565.0,,IC50,"DRUGMATRIX: CYP450, 2D6 enzyme inhibition (substrate: 3-Cyano-7-ethoxycoumarin)",Confirmatory,,
247,625250,5,5,,103407502,6366,Unspecified,117250.0,1571.0,,IC50,"DRUGMATRIX: CYP450, 2E1 enzyme inhibition (substrate: 3-Cyano-7-ethoxycoumarin)",Confirmatory,,
248,625251,5,5,,103407502,6366,Unspecified,116241312.0,1576.0,,IC50,"DRUGMATRIX: CYP450, 3A4 enzyme inhibition (substrate: 7-Benzyloxy-4-(trifluoromethyl)-coumarin)",Confirmatory,,
249,625252,4,7,,103407502,6366,Unspecified,118228.0,1812.0,,IC50,DRUGMATRIX: Dopamine D1 radioligand binding (ligand: [3H] SCH-23390),Confirmatory,,
250,625253,4,7,,103407502,6366,Unspecified,118206.0,1813.0,,IC50,DRUGMATRIX: Dopamine D2L radioligand binding (ligand: [3H] Spiperone),Confirmatory,,
251,625254,4,7,,103407502,6366,Unspecified,1169206.0,1814.0,,IC50,DRUGMATRIX: Dopamine D3 radioligand binding (ligand: [3H] Spiperone),Confirmatory,,
252,625255,4,7,,103407502,6366,Unspecified,1345939.0,1815.0,,IC50,DRUGMATRIX: Dopamine D4.2 radioligand binding (ligand: [3H] Spiperone),Confirmatory,,
253,625256,4,7,,103407502,6366,Unspecified,266667.0,6531.0,,IC50,DRUGMATRIX: Dopamine Transporter radioligand binding (ligand: [125I] RTI-55),Confirmatory,,
254,625257,4,7,,103407502,6366,Unspecified,119606.0,1909.0,,IC50,DRUGMATRIX: Endothelin ETA radioligand binding (ligand: [125I] Endothelin-1),Confirmatory,,
255,625258,4,7,,103407502,6366,Unspecified,544257.0,2099.0,,IC50,DRUGMATRIX: Estrogen ERalpha radioligand binding (ligand: [3H] Estradiol),Confirmatory,,
256,625259,4,7,,103407502,6366,Unspecified,6166154.0,2100.0,,IC50,DRUGMATRIX: Estrogen ERbeta radioligand binding (ligand: [3H] Estradiol),Confirmatory,,
257,625260,3,4,,103407502,6366,Unspecified,,,,IC50,"DRUGMATRIX: GABAA, Muscimol, Central radioligand binding (ligand: [3H] Muscimol)",Confirmatory,,
258,625261,3,4,,103407502,6366,Unspecified,,,,IC50,"DRUGMATRIX: GABAA, Flunitrazepam, Central radioligand binding (ligand: [3H] Flunitrazepam)",Confirmatory,,
259,625262,3,4,,103407502,6366,Unspecified,,,,IC50,"DRUGMATRIX: GABAA, Chloride Channel, TBOB radioligand binding (ligand: [3H] TBOB)",Confirmatory,,
260,625263,4,7,,103407502,6366,Unspecified,121069.0,2908.0,,IC50,DRUGMATRIX: Glucocorticoid radioligand binding (ligand: [3H] Dexamethasone),Confirmatory,,
261,625264,3,4,,103407502,6366,Unspecified,,,,IC50,"DRUGMATRIX: Glutamate, AMPA radioligand binding (ligand: [3H] AMPA)",Confirmatory,,
262,625265,1,6,,103407502,6366,Unspecified,,,,,"DRUGMATRIX: Glutamate, Kainate radioligand binding (ligand: [3H] Kainic acid)",Other,,
263,625266,3,4,,103407502,6366,Unspecified,,,,IC50,"DRUGMATRIX: Glutamate, NMDA, Agonism radioligand binding (ligand: [3H] CGP-39653)",Confirmatory,,
264,625267,3,4,,103407502,6366,Unspecified,,,,IC50,"DRUGMATRIX: Glutamate, NMDA, Phencyclidine radioligand binding (ligand: [3H] TCP)",Confirmatory,,
265,625268,4,2,,103407502,6366,Unspecified,121579.0,24397.0,,IC50,"DRUGMATRIX: Glycine, Strychnine-Sensitive radioligand binding (ligand: [3H] Strychnine)",Confirmatory,,
266,625268,4,2,,103407502,6366,Unspecified,121580.0,114516.0,,IC50,"DRUGMATRIX: Glycine, Strychnine-Sensitive radioligand binding (ligand: [3H] Strychnine)",Confirmatory,,
267,625268,4,2,,103407502,6366,Unspecified,121604.0,25456.0,,IC50,"DRUGMATRIX: Glycine, Strychnine-Sensitive radioligand binding (ligand: [3H] Strychnine)",Confirmatory,,
268,625268,4,2,,103407502,6366,Unspecified,12230887.0,25674.0,,IC50,"DRUGMATRIX: Glycine, Strychnine-Sensitive radioligand binding (ligand: [3H] Strychnine)",Confirmatory,,
269,625269,4,7,,103407502,6366,Unspecified,547645.0,3269.0,,IC50,"DRUGMATRIX: Histamine H1, Central radioligand binding (ligand: [3H] Pyrilamine)",Confirmatory,,
270,625270,4,7,,103407502,6366,Unspecified,123120.0,3274.0,,IC50,DRUGMATRIX: Histamine H2 radioligand binding (ligand: [125I] Aminopotentidine),Confirmatory,,
271,625271,5,5,,103407502,6366,Unspecified,123343.0,3156.0,,IC50,DRUGMATRIX: HMG-CoA Reductase enzyme inhibition (substrate: [14C]HMG-CoA),Confirmatory,,
272,625272,3,4,,103407502,6366,Unspecified,,,,IC50,"DRUGMATRIX: Imidazoline I2, Central radioligand binding (ligand: [3H] Idazoxan)",Confirmatory,,
273,625273,4,6,,103407502,6366,Unspecified,124531.0,24954.0,,IC50,DRUGMATRIX: Insulin radioligand binding (ligand: [125I] Insulin),Confirmatory,,
274,625274,1,6,,103407502,6366,Unspecified,,,,,DRUGMATRIX: Interleukin IL-1 radioligand binding (ligand: [125I] interleukin 1beta),Other,,
275,625275,3,4,,103407502,6366,Unspecified,,,,IC50,"DRUGMATRIX: Leukotriene, BLT (LTB4) radioligand binding (ligand: [3H]LTB4)",Confirmatory,,
276,651631,4,1,,144207555,6366,Inactive,269849759.0,7157.0,,Potency-Replicate_1,qHTS assay for small molecule agonists of the p53 signaling pathway,Confirmatory,,
277,651632,4,1,,144207555,6366,Inactive,296439460.0,79915.0,,Potency-Replicate_1,qHTS assay for small molecules that induce genotoxicity in human embryonic kidney cells expressing luciferase-tagged ATAD5,Confirmatory,,
278,651633,4,1,,144207555,6366,Inactive,,,,Potency-Replicate_1,qHTS assay for small molecule agonists of the p53 signaling pathway - cell viability,Confirmatory,,
279,651634,4,1,,144207555,6366,Inactive,,,,Potency-Replicate_1,qHTS assay for small molecules that induce genotoxicity in human embryonic kidney cells expressing luciferase-tagged ATAD5 - cell viability,Confirmatory,,
280,651741,1,1,,17389686,6366,Inactive,20149576.0,4780.0,,Potency,qHTS assay for small molecule agonists of the antioxidant response element (ARE) signaling pathway,Confirmatory,,
281,651743,1,1,,17389686,6366,Inactive,269849759.0,7157.0,,Potency,qHTS assay for small molecule activators of the p53 signaling pathway,Confirmatory,,
282,651749,1,1,,17389686,6366,Inactive,34577122.0,4790.0,,Potency,qHTS assay for small molecule activators of the nuclear factor-kappa B (NF-kB) signaling pathway,Confirmatory,,
283,651751,1,1,,17389686,6366,Inactive,5702233.0,84385.0,,Potency,qHTS assay for small molecule activators of the rat pregnane X receptor (rPXR) signaling pathway,Confirmatory,,
284,651754,1,1,,17389686,6366,Inactive,,,,Potency,qHTS assay for small molecule disruptors of the mitochondrial membrane potential - 1 hr assay,Confirmatory,,
285,651755,1,1,,17389686,6366,Inactive,,,,Potency,qHTS assay for small molecule disruptors of the mitochondrial membrane potential - 5 hr assay,Confirmatory,,
286,651757,1,1,,17389686,6366,Inactive,25952111.0,7124.0,,Potency,qHTS assay to identify small molecules that stimulate Tumor Necrosis Factor-alpha (TNF-alpha) secretion,Confirmatory,,
287,651758,1,1,,17389686,6366,Inactive,186368.0,3576.0,,Potency,qHTS assay to identify small molecules that stimulate interleukin-8 (IL-8) secretion,Confirmatory,,
288,651777,1,1,,17389686,6366,Inactive,51095037.0,196.0,,Potency,qHTS assay for environmental chemicals that activate the Aryl hydrocarbon Receptor (AhR) signaling pathway,Confirmatory,,
289,651778,1,1,,17389686,6366,Inactive,3041727.0,5465.0,,Potency,qHTS assay for small molecule agonists of the peroxisome proliferator-activated receptor alpha (PPARalpha) signaling pathway,Confirmatory,,
290,651802,1,1,,17389686,6366,Inactive,49066040.0,6097.0,0.9439,Potency,qHTS assay for small molecule antagonists of the retinoid-related orphan receptor gamma (ROR-gamma) signaling pathway,Confirmatory,,
291,651838,1,1,,17389686,6366,Unspecified,,,,,qHTS assay for identifying genotoxic compounds that show differential cytotoxicity against a panel of isogenic chicken DT40 cell lines with known DNA damage response pathways,Other,,
292,651838,1,1,1.0,17389686,6366,Inactive,,,,,qHTS assay for identifying genotoxic compounds that show differential cytotoxicity against a panel of isogenic chicken DT40 cell lines with known DNA damage response pathways,Other,,
293,651838,1,1,2.0,17389686,6366,Inactive,,,,,qHTS assay for identifying genotoxic compounds that show differential cytotoxicity against a panel of isogenic chicken DT40 cell lines with known DNA damage response pathways,Other,,
294,651838,1,1,3.0,17389686,6366,Inactive,,,,,qHTS assay for identifying genotoxic compounds that show differential cytotoxicity against a panel of isogenic chicken DT40 cell lines with known DNA damage response pathways,Other,,
295,651838,1,1,4.0,17389686,6366,Inactive,,,,,qHTS assay for identifying genotoxic compounds that show differential cytotoxicity against a panel of isogenic chicken DT40 cell lines with known DNA damage response pathways,Other,,
296,651838,1,1,5.0,17389686,6366,Inactive,,,,,qHTS assay for identifying genotoxic compounds that show differential cytotoxicity against a panel of isogenic chicken DT40 cell lines with known DNA damage response pathways,Other,,
297,651838,1,1,6.0,17389686,6366,Inactive,,,,,qHTS assay for identifying genotoxic compounds that show differential cytotoxicity against a panel of isogenic chicken DT40 cell lines with known DNA damage response pathways,Other,,
298,651838,1,1,7.0,17389686,6366,Inactive,,,,,qHTS assay for identifying genotoxic compounds that show differential cytotoxicity against a panel of isogenic chicken DT40 cell lines with known DNA damage response pathways,Other,,
299,651838,1,1,8.0,17389686,6366,Inactive,,,,,qHTS assay for identifying genotoxic compounds that show differential cytotoxicity against a panel of isogenic chicken DT40 cell lines with known DNA damage response pathways,Other,,
300,720516,2,1,,144207555,6366,Inactive,296439460.0,79915.0,,ATAD5 Potency (uM),qHTS assay for small molecules that induce genotoxicity in human embryonic kidney cells expressing luciferase-tagged ATAD5: Summary,Summary,,
301,720552,2,1,,144207555,6366,Inactive,269849759.0,7157.0,,Ratio Potency (uM),qHTS assay for small molecule agonists of the p53 signaling pathway: Summary,Summary,,
302,720634,2,1,,144207555,6366,Inactive,,,,Potency-Replicate_1,qHTS assay for small molecule disruptors of the mitochondrial membrane potential - cell viability,Confirmatory,,
303,720635,2,1,,144207555,6366,Inactive,,,,Potency-Replicate_1,qHTS assay for small molecule disruptors of the mitochondrial membrane potential,Confirmatory,,
304,720636,1,1,,17389686,6366,Inactive,20149576.0,4780.0,,Potency-Replicate_1,qHTS assay for small molecule agonists of the antioxidant response element (ARE) signaling pathway measured by Nrf2-dependant transcriptional activity,Confirmatory,,
305,720637,2,1,,144207555,6366,Inactive,,,,Ratio Potency (uM),qHTS assay for small molecule disruptors of the mitochondrial membrane potential: Summary,Summary,,
306,720652,1,1,,17389686,6366,Inactive,,,,Potency-Replicate_1,qHTS assay for small molecule antagonists of the retinoid-related orphan receptor gamma (ROR-gamma) signaling pathway - cell viability counter screen,Confirmatory,,
307,720653,1,1,,17389686,6366,Inactive,,,,Potency-Replicate_1,qHTS assay for small molecule agonists of the antioxidant response element (ARE) signaling pathway measured by Nrf2-dependant transcriptional activity - cell viability counter screen,Confirmatory,,
308,720659,1,1,,17389686,6366,Inactive,325495557.0,8856.0,,Potency-Replicate_1,qHTS assay for small molecule activators of the human pregnane X receptor (PXR) signaling pathway,Confirmatory,,
309,720674,2,2,,144207555,6366,Inactive,,,,Potency-Replicate_1,qHTS assay to test for compound auto fluorescence at 590 nm (red) in HepG2 cells,Confirmatory,,
310,720675,2,2,,144207555,6366,Inactive,,,,Potency-Replicate_1,qHTS assay to test for compound auto fluorescence at 535 nm (green) in HepG2 cells,Confirmatory,,
311,720678,2,1,,144207555,6366,Inactive,,,,Potency-Replicate_1,qHTS assay to test for compound auto fluorescence at 460 nm (blue) in HEK293 cells,Confirmatory,,
312,720679,2,1,,144207555,6366,Inactive,,,,Potency-Replicate_1,qHTS assay to test for compound auto fluorescence at 590 nm (red) in HEK293 cells,Confirmatory,,
313,720680,2,1,,144207555,6366,Inactive,,,,Potency-Replicate_1,qHTS assay to test for compound auto fluorescence at 535 nm (green) in HEK293 cells,Confirmatory,,
314,720681,2,1,,144207555,6366,Inactive,,,,Potency-Replicate_1,qHTS assay to test for compound auto fluorescence at 460 nm (blue) in HEK293 cell free culture,Confirmatory,,
315,720682,2,1,,144207555,6366,Inactive,,,,Potency-Replicate_1,qHTS assay to test for compound auto fluorescence at 535 nm (green) in HEK293 cell free culture,Confirmatory,,
316,720683,2,1,,144207555,6366,Inactive,,,,Potency-Replicate_1,qHTS assay to test for compound auto fluorescence at 590 nm (red) in HEK293 cell free culture,Confirmatory,,
317,720684,2,1,,144207555,6366,Inactive,,,,Potency-Replicate_1,qHTS assay to test for compound auto fluorescence at 590 nm (red) in HepG2 cell free culture,Confirmatory,,
318,720685,2,1,,144207555,6366,Inactive,,,,Potency-Replicate_1,qHTS assay to test for compound auto fluorescence at 460 nm (blue) in HepG2 cell free culture,Confirmatory,,
319,720686,2,1,,144207555,6366,Inactive,,,,Potency-Replicate_1,qHTS assay to test for compound auto fluorescence at 535 nm (green) in HepG2 cell free culture,Confirmatory,,
320,720687,2,2,,144207555,6366,Inactive,,,,Potency-Replicate_1,qHTS assay to test for compound auto fluorescence at 460 nm (blue) in HepG2 cells,Confirmatory,,
321,720691,4,1,,144207555,6366,Inactive,311348376.0,2908.0,,Potency-Replicate_1,qHTS assay to identify small molecule agonists of the glucocorticoid receptor (GR) signaling pathway,Confirmatory,,
322,720692,3,1,,144207555,6366,Inactive,311348376.0,2908.0,,Potency-Replicate_1,qHTS assay to identify small molecule antagonists of the glucocorticoid receptor (GR) signaling pathway,Confirmatory,,
323,720693,3,1,,144207555,6366,Inactive,,,,Potency-Replicate_1,qHTS assay to identify small molecule antagonists of the glucocorticoid receptor (GR) signaling pathway - cell viability counter screen,Confirmatory,,
324,720719,2,1,,144207555,6366,Inactive,311348376.0,2908.0,,Ratio Potency (uM),qHTS assay to identify small molecule agonists of the glucocorticoid receptor (GR) signaling pathway: Summary,Summary,,
325,720725,2,1,,144207555,6366,Inactive,311348376.0,2908.0,,,qHTS assay to identify small molecule antagonists of the glucocorticoid receptor (GR) signaling pathway: Summary,Summary,,
326,743012,3,1,,144207555,6366,Inactive,,,,Potency-Replicate_1,qHTS assay for identifying genotoxic compounds that show differential cytotoxicity against isogenic chicken DT40 cell lines with known DNA damage response pathways - wild type cell line,Confirmatory,,
327,743014,3,1,,144207555,6366,Inactive,,,,Potency-Replicate_1,qHTS assay for identifying genotoxic compounds that show differential cytotoxicity against isogenic chicken DT40 cell lines with known DNA damage response pathways - Rev3 mutant cell line,Confirmatory,,
328,743015,3,1,,144207555,6366,Inactive,,,,Potency-Replicate_1,qHTS assay for identifying genotoxic compounds that show differential cytotoxicity against isogenic chicken DT40 cell lines with known DNA damage response pathways - Rad54/Ku70 mutant cell line,Confirmatory,,
329,743033,3,1,,144207555,6366,Inactive,,,,Potency-Replicate_1,qHTS assay to identify small molecule antagonists of the androgen  receptor (AR) signaling pathway - cell viability counter screen,Confirmatory,,
330,743035,2,1,,144207555,6366,Inactive,124375976.0,367.0,,Potency-Replicate_1,qHTS assay to identify small molecule antagonists of the androgen receptor (AR) signaling pathway,Confirmatory,,
331,743036,2,1,,144207555,6366,Inactive,124375976.0,367.0,,Potency-Replicate_1,qHTS assay to identify small molecule agonists of the androgen receptor (AR) signaling pathway,Confirmatory,,
332,743040,3,1,,144207555,6366,Inactive,124375976.0,367.0,,Potency-Replicate_1,qHTS assay to identify small molecule agonists of the androgen  receptor (AR) signaling pathway using the MDA cell line,Confirmatory,,
333,743041,3,1,,144207555,6366,Inactive,,,,Potency-Replicate_1,qHTS assay to identify small molecule antagonists of the androgen  receptor (AR) signaling pathway using the MDA cell line - cell viability counter screen,Confirmatory,,
334,743042,3,1,,144207555,6366,Inactive,124375976.0,367.0,,Potency-Replicate_1,qHTS assay to identify small molecule antagonists of the androgen  receptor (AR) signaling pathway using the MDA cell line,Confirmatory,,
335,743053,2,1,,144207555,6366,Inactive,124375976.0,367.0,,Ratio Potency (uM),qHTS assay to identify small molecule agonists of the androgen receptor (AR) signaling pathway: Summary,Summary,,
336,743054,2,1,,144207555,6366,Inactive,124375976.0,367.0,,AR Potency (uM),qHTS assay to identify small molecule antagonists of the androgen receptor (AR) signaling pathway using the MDA cell line: Summary,Summary,,
337,743063,2,1,,144207555,6366,Inactive,124375976.0,367.0,,Ratio Potency (uM),qHTS assay to identify small molecule antagonists of the androgen receptor (AR) signaling pathway: Summary,Summary,,
