,AID,AID Version,AID Revision,Panel Member ID,SID,CID,Bioactivity Outcome,Target GI,Target GeneID,Activity Value [uM],Activity Name,Assay Name,Bioassay Type,PubMed ID,RNAi
297,504884,1,2,,56463184,4410,Inactive,115347926.0,1175052.0,,,Inhibitors of Y. pestis Topo-I using cleavage product accumulation Measured in Biochemical System Using Plate Reader - 2123-01_Inhibitor_SinglePoint_HTS_Activity,Screening,,
298,504891,1,1,,56463184,4410,Inactive,5453898.0,5300.0,,Potency,qHTS Assay to Find Inhibitors of Pin1,Confirmatory,,
299,504894,1,1,,56463184,4410,Inactive,553160.0,,,Potency,Activators of T cell receptors: qHTS campaign,Confirmatory,,
300,504937,1,2,,56463184,4410,Inactive,179095.0,6609.0,,Potency,Inhibitors of Secretory Acid Sphingomyelinase (S-ASM): qHTS,Confirmatory,,
301,504941,1,1,,56463184,4410,Inactive,90111653.0,948321.0,,AC50_uM,High Throughput Screen for Tat Transport Inhibitors Measured in Microorganism System Using Plate Reader - 2093-01_Inhibitor_Dose_CherryPick_Activity_Set2,Confirmatory,,
302,540253,1,1,,56463184,4410,Inactive,5031833.0,10073.0,,Potency,qHTS Assay for Inhibitors of RanGTP induced Rango (Ran-regulated importin-beta cargo) - Importin beta complex dissociation,Confirmatory,,
303,540253,1,1,,56463184,4410,Inactive,5453555.0,5901.0,,Potency,qHTS Assay for Inhibitors of RanGTP induced Rango (Ran-regulated importin-beta cargo) - Importin beta complex dissociation,Confirmatory,,
304,540253,1,1,,56463184,4410,Inactive,19923142.0,3837.0,,Potency,qHTS Assay for Inhibitors of RanGTP induced Rango (Ran-regulated importin-beta cargo) - Importin beta complex dissociation,Confirmatory,,
305,540263,1,1,,56463184,4410,Inactive,5031833.0,10073.0,,Potency,qHTS Assay for Inhibitors of Rango (Ran-regulated importin-beta cargo) - Importin beta complex formation,Confirmatory,,
306,540263,1,1,,56463184,4410,Inactive,19923142.0,3837.0,,Potency,qHTS Assay for Inhibitors of Rango (Ran-regulated importin-beta cargo) - Importin beta complex formation,Confirmatory,,
307,540267,1,1,,56463184,4410,Inactive,,,,,Small Molecules that selectively kill Giardia lamblia: qHTS,Screening,,
308,540275,1,1,,56463184,4410,Inactive,74315350.0,7442.0,,,HTS Assay for Compounds that Act as Agonists of the Vanilloid Receptor 1,Screening,,
309,540277,1,1,,56463184,4410,Inactive,74315350.0,7442.0,,,HTS Assay for Compounds that Act as Potentiators of the Vanilloid Receptor 1,Screening,,
310,540295,1,1,,56463184,4410,Inactive,119508433.0,4160.0,,,TRFRET-based cell-based primary high throughput screening assay to identify biased ligands of the melanocortin 4 receptor (MC4R): antagonists of MC4R,Screening,,
311,540303,1,1,,56463184,4410,Inactive,6679377.0,18792.0,,Potency,qHTS for Inhibitors of Cell Surface uPA Generation,Confirmatory,,
312,540303,1,1,,56463184,4410,Inactive,7242179.0,18793.0,,Potency,qHTS for Inhibitors of Cell Surface uPA Generation,Confirmatory,,
313,540303,1,1,,56463184,4410,Inactive,257471003.0,18815.0,,Potency,qHTS for Inhibitors of Cell Surface uPA Generation,Confirmatory,,
314,540308,1,1,,56463184,4410,Inactive,119508433.0,4160.0,,,Luminescence-based cell-based primary high throughput screening assay to identify biased ligands of the melanocortin 4 receptor (MC4R): agonists of MC4R,Screening,,
315,540317,1,1,,56463184,4410,Inactive,187960037.0,10951.0,,Potency,HTS for Inhibitors of HP1-beta Chromodomain Interactions with Methylated Histone Tails,Confirmatory,,
316,540336,1,1,,56463184,4410,Inactive,68474550.0,3639678.0,,,Rtt109/Vps75 Measured in Biochemical System Using Plate Reader - 2106-01_Inhibitor_SinglePoint_HTS_Activity,Screening,,
317,540336,1,1,,56463184,4410,Inactive,68488893.0,3646682.0,,,Rtt109/Vps75 Measured in Biochemical System Using Plate Reader - 2106-01_Inhibitor_SinglePoint_HTS_Activity,Screening,,
318,540364,1,2,,56463184,4410,Inactive,,2395.0,,,Luminescence-based cell-based primary high throughput screening assay to identify activators of the GAA850 frataxin (FXN) promoter,Screening,,
319,588334,1,1,,56463184,4410,Inactive,,,,,MITF Measured in Cell-Based System Using Plate Reader - 2084-01_Activator_SinglePoint_HTS_Activity,Screening,,
320,588335,1,1,,56463184,4410,Inactive,,,,,Counterscreen for inhibitors of the fructose-bisphosphate aldolase (FBA) of M. tuberculosis: Absorbance-based biochemical high throughput Glycerophosphate Dehydrogenase-Triosephosphate Isomerase (GDH-TPI) full deck assay to identify assay artifacts,Screening,,
321,588342,1,1,,56463184,4410,Inactive,160794.0,,,Potency,qHTS profiling assay for firefly luciferase inhibitor/activator using purifed enzyme and Km concentrations of substrates (counterscreen for miR-21 project),Confirmatory,,
322,588352,1,2,,56463184,4410,Inactive,32307126.0,8202.0,,,Luminescence-based cell-based primary high throughput screening assay to identify inhibitors of the Steroid Receptor Coactivator 3 (SRC3; NCOA3),Screening,,
323,588354,1,1,,56463184,4410,Inactive,22538455.0,8648.0,,,Luminescence-based cell-based primary high throughput screening assay to identify inhibitors of the Steroid Receptor Coactivator 1 (SRC1; NCOA1),Screening,,
324,588391,1,1,,56463184,4410,Inactive,14790033.0,5034.0,,,Turbidometric Biochemical  Primary HTS  to identify inhibitors of Protein Disulfide Isomerase Measured in Biochemical System Using Plate Reader - 2137-01_Inhibitor_SinglePoint_HTS_Activity,Screening,,
325,588405,1,1,,56463184,4410,Inactive,78486550.0,171071.0,,,HTS Assay for Peg3 Promoter Inhibitors,Screening,,
326,588413,1,2,,56463184,4410,Inactive,6009644.0,14632.0,,,uHTS identification of Gli-Sufu Antagonists in a luminescence reporter assay,Screening,,
327,588436,1,1,,56463184,4410,Inactive,,,,,"Cholera Quorum: HTS for inducers of light production in the absence ofautoinducers using BH1578 (luxS deficient, cqsA deficient) Measured in Microorganism System Using Plate Reader - 2132-01_Agonist_SinglePoint_HTS_Activity",Screening,,
328,588453,1,1,,56463184,4410,Inactive,8659577.0,58819.0,,Potency,qHTS Assay for Inhibitors of Mammalian Selenoprotein Thioredoxin Reductase 1 (TrxR1): qHTS,Confirmatory,,
329,588456,1,1,,56463184,4410,Inactive,8659577.0,58819.0,,Potency,qHTS Assay for Substrates of Mammalian Selenoprotein Thioredoxin Reductase 1 (TrxR1): qHTS,Confirmatory,,
330,588458,1,1,,56463184,4410,Inactive,4503351.0,1786.0,,,uHTS identification of DNMT1 inhibitors in a Fluorescent Molecular Beacon assay,Screening,,
331,588473,1,1,,56463184,4410,Inactive,30219.0,1393.0,,,uHTS identification of agonists of the CRF-binding protein and CRF-R2 receptor complex,Screening,,
332,588473,1,1,,56463184,4410,Inactive,38349113.0,1395.0,,,uHTS identification of agonists of the CRF-binding protein and CRF-R2 receptor complex,Screening,,
333,588475,1,2,,56463184,4410,Inactive,30219.0,1393.0,,,uHTS identification of antagonists of the CRF-binding protein and CRF-R2 receptor complex,Screening,,
334,588475,1,2,,56463184,4410,Inactive,38349113.0,1395.0,,,uHTS identification of antagonists of the CRF-binding protein and CRF-R2 receptor complex,Screening,,
335,588478,1,2,,124800426,4410,Inactive,4877999.0,51377.0,,,"A screen for small molecule inhibitors of the human deubiquitinating enzyme, UCH37",Other,,
336,588489,1,1,,56463184,4410,Inactive,46367787.0,26986.0,,,uHTS identification of microRNA-mediated mRNA deadenylation inhibitors by fluoresence polarization assay,Screening,,
337,588492,1,1,,56463184,4410,Inactive,,,,,uHTS identification of small molecule modulators of myocardial damage,Screening,,
338,588493,1,2,,56463184,4410,Inactive,16306916.0,10213.0,,,uHTS identification of inhibitors of Rpn11 in a Fluorescent Polarization assay,Screening,,
339,588497,1,2,,56463184,4410,Inactive,168184763.0,,,,"High-throughput multiplex microsphere screening for inhibitors of toxin protease, specifically Botulinum neurotoxin light chain F protease, MLPCN compound set",Screening,16604538.0,
340,588497,1,2,,56463184,4410,Inactive,168184763.0,,,,"High-throughput multiplex microsphere screening for inhibitors of toxin protease, specifically Botulinum neurotoxin light chain F protease, MLPCN compound set",Screening,20035615.0,
341,588497,1,2,,56463184,4410,Inactive,168184763.0,,,,"High-throughput multiplex microsphere screening for inhibitors of toxin protease, specifically Botulinum neurotoxin light chain F protease, MLPCN compound set",Screening,20938917.0,
342,588499,1,3,,56463184,4410,Inactive,148378801.0,5185061.0,,,"High-throughput multiplex microsphere screening for inhibitors of toxin protease, specifically Botulinum neurotoxin light chain A protease, MLPCN compound set",Screening,16604538.0,
343,588499,1,3,,56463184,4410,Inactive,148378801.0,5185061.0,,,"High-throughput multiplex microsphere screening for inhibitors of toxin protease, specifically Botulinum neurotoxin light chain A protease, MLPCN compound set",Screening,20035615.0,
344,588499,1,3,,56463184,4410,Inactive,148378801.0,5185061.0,,,"High-throughput multiplex microsphere screening for inhibitors of toxin protease, specifically Botulinum neurotoxin light chain A protease, MLPCN compound set",Screening,20938917.0,
345,588501,1,2,,56463184,4410,Inactive,21392848.0,,,,"High-throughput multiplex microsphere screening for inhibitors of toxin protease, specifically Lethal Factor Protease, MLPCN compound set",Screening,16604538.0,
346,588501,1,2,,56463184,4410,Inactive,21392848.0,,,,"High-throughput multiplex microsphere screening for inhibitors of toxin protease, specifically Lethal Factor Protease, MLPCN compound set",Screening,20035615.0,
347,588501,1,2,,56463184,4410,Inactive,21392848.0,,,,"High-throughput multiplex microsphere screening for inhibitors of toxin protease, specifically Lethal Factor Protease, MLPCN compound set",Screening,20938917.0,
348,588511,1,2,,56463184,4410,Inactive,334278898.0,101772.0,,,Primary cell-based high-throughput screening for identification of compounds that inhibit/block calcium-activated chloride channels (TMEM16A),Screening,,
349,588549,1,1,,56463184,4410,Inactive,1781172.0,,,,Fluorescence polarization to screen for inhibitor that competite the binding of FadD28 to bisubstrate Measured in Biochemical System Using Plate Reader - 2147-01_Inhibitor_SinglePoint_HTS_Activity,Screening,,
350,588579,1,1,,26758042,4410,Inactive,7705344.0,51426.0,,Potency,qHTS for Inhibitors of Polymerase Kappa,Confirmatory,,
351,588579,1,1,,56463184,4410,Inactive,7705344.0,51426.0,,Potency,qHTS for Inhibitors of Polymerase Kappa,Confirmatory,,
352,588590,1,1,,56463184,4410,Inactive,154350220.0,11201.0,,Potency,qHTS for Inhibitors of Polymerase Iota,Confirmatory,,
353,588591,1,1,,56463184,4410,Inactive,5729982.0,5429.0,,Potency,qHTS for Inhibitors of Polymerase Eta,Confirmatory,,
354,588621,1,1,,56463184,4410,Inactive,90652859.0,84867.0,,,uHTS identification of small molecule inhibitors of Striatal-Enriched Phosphatase via a fluorescence intensity assay,Screening,,
355,588627,1,1,,56463184,4410,Inactive,195969650.0,259249.0,,,Primary cell-based high-throughput screening for identification of compounds that activate MrgX1 receptor signaling,Screening,,
356,588664,1,2,,56463184,4410,Inactive,62362414.0,25.0,,,"TRFRET-based biochemical primary high throughput screening assay to identify inhibitors of the interaction of the Ras and Rab interactor 1 protein (Rin1) and the c-abl oncogene 1, non-receptor tyrosine kinase (Abl)",Screening,,
357,588664,1,2,,56463184,4410,Inactive,68989256.0,9610.0,,,"TRFRET-based biochemical primary high throughput screening assay to identify inhibitors of the interaction of the Ras and Rab interactor 1 protein (Rin1) and the c-abl oncogene 1, non-receptor tyrosine kinase (Abl)",Screening,,
358,588674,1,2,,56463184,4410,Inactive,,,,,Schnurri-3 Inhibitors: specific inducers of adult bone formation Measured in Cell-Based System Using Plate Reader - 2134-01_Inhibitor_SinglePoint_HTS_Activity_Set2,Screening,,
359,588675,1,1,,56463184,4410,Inactive,195969650.0,259249.0,,,Primary cell-based high-throughput screening for identification of compounds that allosterically activate MrgX1 receptor signaling,Screening,,
360,588676,1,1,,56463184,4410,Inactive,195969650.0,259249.0,,,Primary cell-based high-throughput screening for identification of compounds that antagonize MrgX1 receptor signaling,Screening,,
361,588689,1,1,,56463184,4410,Inactive,219689243.0,,,IC50,Primary and Confirmatory Screening for Flavivirus Genomic Capping Enzyme Inhibition,Confirmatory,,
362,588692,2,1,,56463184,4410,Inactive,,,,,Luciferase Reporter Cell Based HTS to identify inhibitors of N-linked Glycosylation Measured in Cell-Based System Using Plate Reader - 2146-01_Inhibitor_SinglePoint_HTS_Activity_Set2,Screening,,
363,588726,1,2,,56463184,4410,Inactive,15607504.0,886474.0,,,Fluorescence-based biochemical primary high throughput screening assay to identify inhibitors of the fructose-bisphosphate aldolase (FBA) of M. tuberculosis,Screening,,
364,588727,1,1,,56463184,4410,Inactive,,,,IC50,"A Cell-Based Confirmatory Screen for Compounds that Inhibit VEEV, TC-83",Confirmatory,,
365,588795,1,1,,56463184,4410,Inactive,4758356.0,2237.0,,Potency,qHTS Assay for the Inhibitors of Human Flap endonuclease 1 (FEN1).,Confirmatory,,
366,588814,1,3,,56463184,4410,Inactive,37622910.0,1128.0,,,"Fluorescence-based cell-based primary high throughput screening assay to identify agonists of the human cholinergic receptor, muscarinic 1 (CHRM1)",Screening,,
367,588819,1,4,,56463184,4410,Inactive,37622910.0,1128.0,,,Fluorescence-based cell-based primary high throughput screening assay to identify positive allosteric modulators (PAMs) of the human M1 muscarinic receptor (CHRM1).,Screening,,
368,588834,2,1,,144205792,4410,Inactive,325651834.0,3757.0,,Potency,qHTS Assay for Small Molecule Inhibitors of the Human hERG Channel Activity,Confirmatory,,
369,588850,1,1,,56463184,4410,Inactive,90421313.0,1080.0,,,uHTS identification of cystic fibrosis induced NFkb Inhibitors in a fluoresence assay,Screening,,
370,588852,1,3,,56463184,4410,Inactive,37622910.0,1128.0,,,Fluorescence-based cell-based primary high throughput screening assay to identify antagonists of the human M1 muscarinic receptor (CHRM1),Screening,,
371,588855,1,1,,56463184,4410,Inactive,18418623.0,4088.0,,Potency,qHTS for Inhibitors of TGF-b,Confirmatory,,
372,588856,1,1,,56463184,4410,Inactive,,,,Potency,qHTS for Inhibitors of TGF-b: Cytotox Counterscreen,Confirmatory,,
373,602123,1,1,,56463184,4410,Inactive,16128424.0,945085.0,,,Fluorescence polarization-based primary biochemical high throughput screening assay to identify inhibitors of Escherichia coli DNA-binding ATP-dependent protease La (eLon),Screening,,
374,602141,1,1,,56463184,4410,Inactive,,,,,uHTS determination of small molecule cytotoxicity in a fluorescence assay to identify cystic fibrosis induced NFkb Inhibitors,Screening,,
375,602162,1,1,,56463184,4410,Inactive,9955963.0,10058.0,,,Flow Cytometric HTS Screen for inhibitors of the ABC transporter ABCB6 for MLPCN Compound Set,Screening,,
376,602163,1,1,,56463184,4410,Inactive,73586699.0,281312.0,,,Absorbance-based biochemical primary high throughput screening assay to identify activators of Methionine sulfoxide reductase A (MsrA),Screening,,
377,602179,1,2,,56463184,4410,Inactive,89573979.0,3417.0,,Potency,qHTS for Inhibitors of mutant isocitrate dehydrogenase 1 (IDH1): qHTS,Confirmatory,,
378,602229,1,1,,56463184,4410,Inactive,216409728.0,10002.0,,,"Luminescence-based cell-based high throughput primary screening assay to identify agonists of nuclear receptor subfamily 2, group E, member 3 (NR2E3)",Screening,,
379,602233,1,1,,56463184,4410,Inactive,115503961.0,4357161.0,,Potency,qHTS Assay to Find Inhibitors of Phosphoglycerate Kinase,Confirmatory,,
380,602244,1,2,,56463184,4410,Inactive,5730106.0,10663.0,,,uHTS identification of CXCR6 Inhibitors in a B-arrestin luminescence assay,Screening,,
381,602247,1,2,,56463184,4410,Inactive,,,,,Full deck counterscreen for positive allosteric modulators (PAMs) of the human M1 muscarinic receptor (CHRM1): Fluorescence-based cell-based high throughput screening assay to identify nonselective activators and assay artifacts using the parental CHOK1 cell line,Screening,,
382,602248,1,2,,56463184,4410,Inactive,,,,,Full deck counterscreen for agonists of the human M1 muscarinic receptor (CHRM1): Fluorescence-based cell-based high throughput screening assay to identify nonselective activators and assay artifacts using the parental CHOK1 cell line,Screening,,
383,602250,1,2,,56463184,4410,Inactive,,,,,Full deck counterscreen for antagonists of the human M1 muscarinic receptor (CHRM1): Fluorescence-based cell-based high throughput screening assay to identify nonselective inhibitors and assay artifacts using the parental CHOK1 cell line,Screening,,
384,602252,1,1,,56463184,4410,Inactive,62868213.0,57120.0,,,Fluorescence Polarization with CAL-PDZ Measured in Biochemical System Using Plate Reader - 2109-02_Inhibitor_SinglePoint_HTS_Activity,Screening,,
385,602252,1,1,,56463184,4410,Inactive,90421313.0,1080.0,,,Fluorescence Polarization with CAL-PDZ Measured in Biochemical System Using Plate Reader - 2109-02_Inhibitor_SinglePoint_HTS_Activity,Screening,,
386,602261,1,1,,56463184,4410,Inactive,41872631.0,2194.0,,,uHTS identification of small molecule inhibitors of  the thioesterase domain of fatty acid synthase via a fluorescence intensity assay,Screening,,
387,602274,1,2,,56463184,4410,Inactive,,,,,uHTS luminescent assay for identification of compounds that enhance the survival of human induced pluripotent stem cells when cultured as single cells,Screening,,
388,602281,1,1,,56463184,4410,Inactive,31542303.0,51099.0,,,"Luminescence-based biochemical primary high throughput screening assay to identify inhibitors of the interaction of the lipase co-activator protein, abhydrolase domain containing 5 (ABHD5) with perilipin-5 (MLDP; PLIN5)",Screening,,
389,602281,1,1,,56463184,4410,Inactive,116292172.0,440503.0,,,"Luminescence-based biochemical primary high throughput screening assay to identify inhibitors of the interaction of the lipase co-activator protein, abhydrolase domain containing 5 (ABHD5) with perilipin-5 (MLDP; PLIN5)",Screening,,
390,602310,1,2,,56463184,4410,Inactive,13399304.0,60489.0,,Potency,qHTS for Inhibitors of Vif-A3G Interactions: qHTS,Confirmatory,,
391,602313,1,1,,56463184,4410,Inactive,22907044.0,200316.0,,Potency,qHTS for Inhibitors of Vif-A3F Interactions: qHTS,Confirmatory,,
392,602329,1,1,,56463184,4410,Inactive,216548193.0,8438.0,,,Identification of inhibitors of RAD54 Measured in Biochemical System Using Plate Reader - 2159-01_Inhibitor_SinglePoint_HTS_Activity,Screening,,
393,602332,1,1,,26758042,4410,Inactive,168984549.0,,,Potency,qHTS for Inducers of the Endoplasmic Reticulum Stress Response (ERSR) in Human Glioma: qHTS,Confirmatory,,
394,602332,1,1,,56463184,4410,Inactive,168984549.0,,,Potency,qHTS for Inducers of the Endoplasmic Reticulum Stress Response (ERSR) in Human Glioma: qHTS,Confirmatory,,
395,602340,1,2,,56463184,4410,Inactive,,,,,HTS for suppressors of simvastatin-induced mytoxicity in differentiated C2C12 cells Measured in Cell-Based System Using Plate Reader - 2112-01_Suppressor_SinglePoint_HTS_Activity,Screening,,
396,602342,2,1,,56463184,4410,Inactive,,,,,Small molecule inhibitors of miR122  Measured in Cell-Based System Using Plate Reader - 2144-01_Inhibitor_SinglePoint_HTS_Activity,Screening,,
397,602346,1,1,,56463184,4410,Inactive,9629361.0,155459.0,,,Identification of VIF Inhibitors Measured in Cell-Based System Using Imaging - 2108-01_Inhibitor_SinglePoint_HTS_Activity,Screening,,
398,602363,1,1,,56463184,4410,Inactive,,,,,Whole cell Yeast HTS to identify compounds modulating the fidelity of the start codon recognition in eukaryotes. Measured in Whole Organism System Using Plate Reader - 2155-01_Other_SinglePoint_HTS_Activity,Screening,,
399,602393,1,1,,56463184,4410,Inactive,291463269.0,20586.0,,,Screen for inhibitors of the SWI/SNF chromatin remodeling complex (esBAF) in mouse embryonic stem cells with Luciferase reporter assay Measured in Cell-Based System Using Plate Reader - 2141-01_Inhibitor_SinglePoint_HTS_Activity,Screening,,
400,602396,1,2,,56463184,4410,Inactive,4504343.0,2494.0,,,Luminescence-based cell-based primary high throughput screening assay to identify inverse agonists of the liver receptor homolog-1 (LRH-1; NR5A2),Screening,,
401,602399,1,2,,56463184,4410,Inactive,15927174.0,,,,uHTS identification of inhibitors of NadD in a Colorimetric assay,Screening,,
402,602405,1,1,,56463184,4410,Inactive,75495260.0,,,,PgID: DNTB colorimetric HTS to detect inhibitor of PgID Measured in Biochemical System Using Plate Reader - 2164-01_Inhibitor_SinglePoint_HTS_Activity,Screening,,
403,602410,1,1,,56463184,4410,Inactive,11093520.0,3777.0,,,Primary cell-based screen for identification of compounds that inhibit the two-pore domain potassium channel KCNK3,Screening,,
404,602429,1,1,,56463184,4410,Inactive,1762973.0,7341.0,,,uHTS identification of SUMO1-mediated protein-protein interactions,Screening,,
405,602438,1,1,,56463184,4410,Inactive,160877737.0,,,,uHTS identification of modulators of interaction between CendR and NRP-1 using Fluorescence Polarization assay,Screening,,
406,602440,1,1,,56463184,4410,Inactive,262118306.0,123228.0,,,uHTS Fluorescent Assay Using Nedd8 Protein Substrate for Identification of Inhibitors of Sentrin-Specific Protease 8 (SENP8),Screening,,
407,602449,1,2,,56463184,4410,Inactive,,,,,uHTS identification of small molecule inhibitors of the mitochondrial permeability transition pore via an absorbance assay,Screening,,
408,602481,1,1,,56463184,4410,Inactive,378544807.0,,,,Mycobacterium tuberculosis BioA enzyme inhibitor Measured in Biochemical System Using Plate Reader - 2163-01_Inhibitor_SinglePoint_HTS_Activity,Screening,,
409,623870,1,1,,56463184,4410,Inactive,2702319.0,405.0,,,ARNT-TAC3: AlphaScreen HTS to detect disruption of ARNT/TAC3 interactions Measured in Biochemical System Using Plate Reader - 2158-01_Inhibitor_SinglePoint_HTS_Activity,Screening,,
410,623870,1,1,,56463184,4410,Inactive,5454102.0,10460.0,,,ARNT-TAC3: AlphaScreen HTS to detect disruption of ARNT/TAC3 interactions Measured in Biochemical System Using Plate Reader - 2158-01_Inhibitor_SinglePoint_HTS_Activity,Screening,,
411,623877,1,1,,56463184,4410,Inactive,334278898.0,101772.0,,,Primary cell-based high-throughput screening for identification of compounds that activate/potentiate calcium-activated chloride channels (TMEM16A),Screening,,
412,623901,1,1,,56463184,4410,Inactive,,,,,Small molecule inhibitors of miR122  Measured in Cell-Based System Using Plate Reader - 2144-01_Activator_SinglePoint_HTS_Activity,Screening,,
413,624030,1,2,,26758042,4410,Inactive,160794.0,,,Potency,Biochemical firefly luciferase enzyme assay for NPC,Confirmatory,,
414,624031,1,2,,26758042,4410,Inactive,,,,Potency,S16 Schwann cell viability assay (CellTiter-Glo assay),Confirmatory,,
415,624032,1,2,,26758042,4410,Inactive,8393992.0,24660.0,,Potency,S16 Schwann cell PMP22 intronic element firefly luciferase assay,Confirmatory,,
416,624037,1,3,,56463184,4410,Inactive,7108336.0,1133.0,,,"Fluorescence-based cell-based primary high throughput screening assay to identify agonists of the human cholinergic receptor, muscarinic 5 (CHRM5)",Screening,,
417,624038,1,3,,56463184,4410,Inactive,7108336.0,1133.0,,,"Fluorescence-based cell-based primary high throughput screening assay to identify positive allosteric modulators (PAMs) of the human cholinergic receptor, muscarinic 5 (CHRM5)",Screening,,
418,624040,1,3,,56463184,4410,Inactive,7108336.0,1133.0,,,"Fluorescence-based cell-based primary high throughput screening assay to identify antagonists of the human cholinergic receptor, muscarinic 5 (CHRM5)",Screening,,
419,624044,1,2,,26758042,4410,Inactive,8393992.0,24660.0,,Potency,S16 Schwann cell PMP22 intronic element beta-lactamase assay,Confirmatory,,
420,624125,1,4,,56463184,4410,Inactive,52426748.0,1132.0,,,"Fluorescence-based cell-based primary high throughput screening assay to identify antagonists of the human cholinergic receptor, muscarinic 4 (CHRM4)",Screening,,
421,624126,1,3,,56463184,4410,Inactive,52426748.0,1132.0,,,"Fluorescence-based cell-based primary high throughput screening assay to identify positive allosteric modulators (PAMs) of the human cholinergic receptor, muscarinic 4 (CHRM4)",Screening,,
422,624127,1,2,,56463184,4410,Inactive,52426748.0,1132.0,,,"Fluorescence-based cell-based primary high throughput screening assay to identify agonists of the human cholinergic receptor, muscarinic 4 (CHRM4)",Screening,,
423,624168,1,1,,56463184,4410,Inactive,47678551.0,9215.0,,,uHTS identification of small molecule activators of alpha dystroglycan glycosylation,Screening,,
424,624169,1,1,,56463184,4410,Inactive,27753985.0,15558.0,,,Luminescence-based cell-based primary high throughput screening assay to identify agonists of the mouse 5-hydroxytryptamine (serotonin) receptor 2A (HTR2A),Screening,,
425,624170,1,1,,26758042,4410,Inactive,71051501.0,2744.0,,Potency,qHTS for Inhibitors of Glutaminase (GLS),Confirmatory,,
426,624170,1,1,,56463184,4410,Inactive,71051501.0,2744.0,,Potency,qHTS for Inhibitors of Glutaminase (GLS),Confirmatory,,
427,624171,1,1,,56463184,4410,Inactive,693842.0,4780.0,,Potency,qHTS of Nrf2 Activators,Confirmatory,,
428,624172,1,1,,26758042,4410,Inactive,1724069.0,2740.0,,Potency,qHTS of GLP-1 Receptor Agonists,Confirmatory,,
429,624172,1,1,,56463184,4410,Inactive,1724069.0,2740.0,,Potency,qHTS of GLP-1 Receptor Agonists,Confirmatory,,
430,624173,1,3,,26758042,4410,Inactive,62359610.0,,,Potency,qHTS of Trypanosoma Brucei Inhibitors,Confirmatory,,
431,624173,1,3,,56463184,4410,Inactive,62359610.0,,,Potency,qHTS of Trypanosoma Brucei Inhibitors,Confirmatory,,
432,624178,1,1,,56463184,4410,Unspecified,179095.0,6609.0,,Potency,qHTS for Inhibitors of Human Acid Sphingomyelinase Assay: Native Substrate,Confirmatory,,
