,AID,AID Version,AID Revision,Panel Member ID,SID,CID,Bioactivity Outcome,Target GI,Target GeneID,Activity Value [uM],Activity Name,Assay Name,Bioassay Type,PubMed ID,RNAi
0,372,1,3,,8042925,15546,Inactive,28949057.0,,,,HIV-1 RNase H Inhibition,Screening,,
1,1469,1,1,,26757712,15546,Inactive,189491771.0,7068.0,,Potency,qHTS for Inhibitors of the Interaction of Thyroid Hormone Receptor and Steroid Receptor Coregulator 2,Confirmatory,,
2,1479,1,2,,26757712,15546,Inactive,189491771.0,7068.0,,Potency,Total Fluorescence Counterscreen for Inhibitors of the Interaction of Thyroid Hormone Receptor and Steroid Receptor Coregulator 2,Confirmatory,,
3,1490,2,1,,47202885,15546,Inactive,10954339.0,,,Potency,qHTS Assay for Inhibitors of Bacillus subtilis Sfp phosphopantetheinyl transferase (PPTase),Confirmatory,,
4,1511,1,3,,47202885,15546,Inactive,487738.0,3757.0,,,Primary cell-based high-throughput screening assay for identification of compounds that protect hERG from block by proarrhythmic agents,Screening,,
5,1527,1,3,,47202885,15546,Inactive,7381449.0,14678525.0,,,Primary biochemical high throughput screening assay to identify inhibitors of VIM-2 metallo-beta-lactamase,Screening,,
6,1529,1,1,,47202885,15546,Inactive,42794767.0,4215.0,,,"Multiplex HTS Assay for Inhibitors of MEK Kinase PB1 Domains, specifically MEK5 MEK Kinase3 Wildtype",Screening,,
7,1530,1,1,,47202885,15546,Inactive,22035600.0,5871.0,,,"Multiplex HTS Assay for Inhibitors of MEK Kinase PB1 Domains, specifically MEK5 MEK Kinase 2 mutant",Screening,,
8,1531,1,1,,47202885,15546,Inactive,22035600.0,5871.0,,,"Multiplex HTS Assay for Inhibitors of MEK Kinase PB1 Domains, specifically MEK5 binding to MEK Kinase 2 Wildtype",Screening,,
9,1554,1,1,,47202885,15546,Inactive,,,,,MLPCN Ras selective lethality-BJeLR viability,Screening,,
10,1556,1,4,,47202885,15546,Inactive,27368096.0,,,,Epi-absorbance primary biochemical high throughput screening assay to identify inhibitors of IMP-1 metallo-beta-lactamase,Screening,,
11,1565,2,2,,47202885,15546,Inactive,219689097.0,162466.0,,IC50,uHTS absorbance assay for the identification of compounds that inhibit PHOSPHO1,Confirmatory,,
12,1566,2,3,,47202885,15546,Inactive,11545912.0,64127.0,,EC50,uHTS luminescence assay for the identification of compounds that inhibit NOD2,Confirmatory,,
13,1578,3,2,,47202885,15546,Inactive,5174617.0,10392.0,,EC50,uHTS luminescence assay for the identification of compounds that inhibit NOD1,Confirmatory,,
14,1621,1,2,,47202885,15546,Inactive,,,,IC50,A Cell Based Assay for the Identification of Lead Compounds with Anti-Viral Activity Against West Nile Virus,Confirmatory,,
15,1631,3,1,,47202885,15546,Inactive,33286418.0,5315.0,,Potency,qHTS Assay for Activators of Human Muscle isoform 2 Pyruvate Kinase,Confirmatory,,
16,1634,3,1,,47202885,15546,Inactive,33286418.0,5315.0,,Potency,qHTS Assay for Inhibitors of Human Muscle isoform 2 Pyruvate Kinase,Confirmatory,,
17,1654,2,2,,47202885,15546,Inactive,4758208.0,1845.0,,IC50,uHTS absorbance assay for the identification of compounds that inhibit VHR1.,Confirmatory,,
18,1656,2,2,,47202885,15546,Inactive,,,,,High Throughput Imaging Assay for Hepatic Lipid Droplet Formation,Screening,,
19,1662,1,2,,47202885,15546,Inactive,15675770.0,901648.0,,,MLPCN Streptokinase Expression Inhibition,Screening,,
20,1663,1,2,,47202885,15546,Inactive,,,,,MLPCN Platelet Activation -Dense Granule Release,Screening,,
21,1672,1,3,,47202885,15546,Inactive,6680530.0,16518.0,,,Primary cell-based high-throughput screening assay for identification of compounds that inhibit/block inward-rectifying potassium ion channel Kir2.1,Screening,,
22,1700,1,2,,47202885,15546,Inactive,124263658.0,688.0,,,Primary cell-based high throughput screening assay to identify inhibitors of kruppel-like factor 5 (KLF5),Screening,,
23,1706,1,2,,47202885,15546,Inactive,73745819.0,,,,QFRET-based primary biochemical high throughput screening assay to identify inhibitors of the SARS coronavirus 3C-like Protease (3CLPro),Screening,,
24,1721,1,2,,47202885,15546,Inactive,290753097.0,,,Potency,qHTS Assay for Inhibitors of Leishmania Mexicana Pyruvate Kinase (LmPK),Confirmatory,,
25,1722,1,2,,47202885,15546,Inactive,290753097.0,,,Potency,qHTS Assay for Activators of Leishmania Mexicana Pyruvate Kinase (LmPK),Confirmatory,,
26,1766,1,1,,47202885,15546,Inactive,18860839.0,4221.0,,Potency,qHTS Assay for Inhibitors Targeting the Menin-MLL Interaction in MLL Related Leukemias: Competition With Fluorescein Labeled MLL-derived Peptide,Confirmatory,,
27,1766,1,1,,47202885,15546,Inactive,56550039.0,4297.0,,Potency,qHTS Assay for Inhibitors Targeting the Menin-MLL Interaction in MLL Related Leukemias: Competition With Fluorescein Labeled MLL-derived Peptide,Confirmatory,,
28,1768,1,1,,47202885,15546,Inactive,18860839.0,4221.0,,Potency,qHTS Assay for Inhibitors Targeting the Menin-MLL Interaction in MLL Related Leukemias: Competition With Texas Red Labeled MLL-derived Mutant Peptide,Confirmatory,,
29,1768,1,1,,47202885,15546,Inactive,56550039.0,4297.0,,Potency,qHTS Assay for Inhibitors Targeting the Menin-MLL Interaction in MLL Related Leukemias: Competition With Texas Red Labeled MLL-derived Mutant Peptide,Confirmatory,,
30,1777,3,2,,47202885,15546,Inactive,39725940.0,4986.0,,EC50,uHTS identification of small molecule agonists of the kappa opioid receptor via a luminescent beta-arrestin assay,Confirmatory,,
31,1778,3,3,,47202885,15546,Inactive,39725940.0,4986.0,,IC50,uHTS identification of small molecule antagonists of the kappa opioid receptor via a luminescent beta-arrestin assay,Confirmatory,,
32,1779,2,2,,47202885,15546,Inactive,224586929.0,26191.0,,IC50,uHTS identification of small molecule inhibitors of LYP via a fluorescence intensity assay,Confirmatory,,
33,1789,1,2,,47202885,15546,Inactive,83318444.0,3320.0,,,Luminescence-based primary biochemical high throughput screening assay to identify inhibitors of the Heat Shock Protein 90 (HSP90),Screening,,
34,1800,1,2,,47202885,15546,Inactive,125541954.0,,,,Fluorescence-based primary biochemical high throughput screening assay to identify inhibitors of the Hepatitis C Virus non-structural protein 3 helicase (NS3),Screening,,
35,1813,1,2,,47202885,15546,Inactive,,,,,MLPCN Alpha-Synuclein 5'UTR - 5'-UTR binding - inhibitors,Screening,,
36,1814,1,2,,47202885,15546,Inactive,,,,,MLPCN Alpha-Synuclein 5'UTR - 5'-UTR binding - activators,Screening,,
37,1817,2,2,,47202885,15546,Inactive,40849930.0,5339.0,,IC50,uHTS identification of small molecule antagonists of the binding of Siah-1 and a peptide ligand via a fluorescence polarization assay.,Confirmatory,,
38,1822,1,3,,47202885,15546,Inactive,23505220.0,813594.0,,,QFRET-based primary biochemical high throughput screening assay to identify inhibitors of the Plasmodium falciparum M18 Aspartyl Aminopeptidase (PFM18AAP).,Screening,,
39,1825,1,1,,47202885,15546,Inactive,,,,,Luminescence-based counterscreen assay for KLF5 inhibitors: cell-based high throughput screening assay to identify cytotoxic compounds using the IEC-6 intestinal epithelial cell line.,Screening,,
40,1832,2,1,,47202885,15546,Inactive,55976631.0,178296.0,,,MLPCN maternal gene expression-MEX-5 TCR-2 binding assay-Primary Screen,Screening,,
41,1845,1,2,,47202885,15546,Inactive,125541954.0,,,,Fluorescence-based counterscreen assay for HCV NS3 helicase inhibitors: biochemical high-throughput screening assay to identify compounds that cause fluorescent intercalator displacement (FID),Screening,,
42,1850,2,1,,47202885,15546,Inactive,,,,IC50,A small molecule screen for inhibitors of the PhoP regulon in Salmonella typhi,Confirmatory,,
43,1861,2,1,,47202885,15546,Inactive,119607128.0,2831.0,,,Fluorescence-based primary cell-based high throughput screening assay to identify antagonists of the G-protein coupled receptor 7 (GPR7).,Screening,,
44,1863,2,1,,47202885,15546,Inactive,,,,IC50,A small molecule screen for inhibitors of the PhoP regulon in Salmonella Typhimurium,Confirmatory,,
45,1868,1,4,,47202885,15546,Inactive,4503895.0,2584.0,,Potency,qHTS Assay for Inhibitors of Human Galactokinase (GALK),Confirmatory,,
46,1875,2,1,,47202885,15546,Inactive,,,,,Luminescence Cell-Based Primary HTS to Identify Inhibitors of Polyadenylation,Screening,,
47,1885,2,1,,47202885,15546,Inactive,,,,,Luminescence Cell-Based/Microorganism Primary HTS to Identify Inhibitors of T.Cruzi Replication,Screening,,
48,1899,1,3,,47202885,15546,Inactive,83779224.0,,,,TR-FRET-based primary biochemical high-throughput screening assay to identify inhibitors of Hepatitis C Virus (HCV) core protein dimerization,Screening,,
49,1903,2,3,,47202885,15546,Inactive,297591903.0,29031019.0,,IC50,Identification of SV40 T antigen inhibitors: A route to novel anti-viral reagents,Confirmatory,,
50,1906,1,3,,47202885,15546,Inactive,55958172.0,,,,QFRET-based counterscreen for PFM18AAP inhibitors: biochemical high throughput screening assay to identify inhibitors of the Cathepsin L proteinase (CTSL1).,Screening,,
51,1910,1,2,,47202885,15546,Inactive,,,,,Luminescence Cell-Based Primary HTS to Identify Transcriptional Activators of Hypoxia-Inducible Factor Pathway,Screening,,
52,1947,1,2,,47202885,15546,Inactive,21595511.0,226016.0,,,Fluorescence polarization-based counterscreen for RBBP9 inhibitors: primary biochemical high throughput screening assay to identify inhibitors of the serine hydrolase family member Fam108B.,Screening,,
53,1950,1,3,,47202885,15546,Inactive,23893623.0,3783709.0,,,Fluorescence polarization-based primary biochemical high throughput screening assay to identify inhibitors of the Epstein-Barr virus nuclear antigen 1 (EBNA-1).,Screening,,
54,1961,2,2,,47202885,15546,Inactive,33695107.0,9290.0,,EC50,Image-based HTS for Selective Agonists of GPR55,Confirmatory,,
55,1962,1,2,,47202885,15546,Inactive,68476498.0,,,,Fluorescence polarization-based primary biochemical high throughput screening assay to identify inhibitors of tRNA 2'-phosphotransferase (TPT1).,Screening,,
56,1974,1,2,,47202885,15546,Inactive,4758484.0,9446.0,,,Fluorescence polarization-based counterscreen for RBBP9 inhibitors: primary biochemical high throughput screening assay to identify inhibitors of the oxidoreductase glutathione S-transferase omega 1(GSTO1).,Screening,,
57,1979,1,1,,47202885,15546,Inactive,994798.0,,,,Fluorescence Cell-Based Primary HTS of C.albicans growth in the presence of Fluconazole and compound,Screening,,
58,1984,1,3,,47202885,15546,Inactive,118026946.0,17979.0,,IC50,Fluorescence for the identification of compounds that decrease p/CIP protein stability,Confirmatory,,
59,1986,1,2,,47202885,15546,Inactive,45357394.0,,,IC50,uHTS fluorescence assay for the identification of Human Immunodeficiency Virus Fusion Inhibitors.,Confirmatory,,
60,1987,1,2,,47202885,15546,Inactive,37589898.0,5536.0,,,Fluorescence-based primary biochemical high throughput screening assay to identify inhibitors of Protein Phosphatase 5 (PP5).,Screening,,
61,1996,2,2,,47202885,15546,Active,,,,,Aqueous Solubility from MLSMR Stock Solutions,Other,,
62,2006,3,2,,47202885,15546,Inactive,4507785.0,7329.0,,IC50,uHTS HTRF assay for identification of inhibitors of SUMOylation,Confirmatory,,
63,2006,3,2,,47202885,15546,Inactive,13111961.0,10054.0,,IC50,uHTS HTRF assay for identification of inhibitors of SUMOylation,Confirmatory,,
64,2006,3,2,,47202885,15546,Inactive,17390638.0,10055.0,,IC50,uHTS HTRF assay for identification of inhibitors of SUMOylation,Confirmatory,,
65,2012,3,2,,47202885,15546,Inactive,45219878.0,7458.0,,IC50,uHTS fluorescence polarization assay for the identification of translation initiation inhibitors (eIF4H),Confirmatory,,
66,2013,2,2,,47202885,15546,Inactive,33695107.0,9290.0,,IC50,Image-Based HTS for Selective Antagonists for GPR55,Confirmatory,,
67,2014,3,2,,47202885,15546,Inactive,46367787.0,26986.0,,IC50,uHTS fluorescence polarization assay for the identification of translation initiation inhibitors (PABP),Confirmatory,,
68,2016,1,3,,47202885,15546,Inactive,1302091.0,,,,Multiplex HTS Screen of TOR pathway GFP-fusion proteins in Saccharomyes cerevisiae_specifically_ MEP2_MLPCN.,Screening,,
69,2023,1,3,,47202885,15546,Inactive,486173.0,,,,Multiplex HTS Screen of TOR pathway GFP-fusion proteins in Saccharomyes cerevisiae_specifically_ LAP4_MLPCN.,Screening,,
70,2025,1,3,,47202885,15546,Inactive,536029.0,,,,Multiplex HTS Screen of TOR pathway GFP-fusion proteins in Saccharomyes cerevisiae_specifically_ RPL19A_MLPCN.,Screening,,
71,2029,1,3,,47202885,15546,Inactive,171229.0,,,,Multiplex HTS Screen of TOR pathway GFP-fusion proteins in Saccharomyes cerevisiae_specifically_ CIT2_MLPCN.,Screening,,
72,2052,2,1,,47202885,15546,Inactive,124486680.0,16408.0,,,HTS for developing T Cell Immune Modulators,Screening,,
73,2057,1,2,,47202885,15546,Inactive,78070770.0,4170.0,,,Fluorescence polarization-based primary biochemical high throughput screening assay to identify inhibitors of myeloid cell leukemia sequence 1 (MCL1) interactions with BIM-BH3 peptide.,Screening,,
74,2058,3,2,,47202885,15546,Inactive,33695097.0,2859.0,,IC50,Image-Based HTS for Selective Antagonists of GPR35,Confirmatory,,
75,2066,1,4,,47202885,15546,Inactive,85666113.0,850333.0,,,Multiplex HTS Screen of TOR pathway GFP-fusion proteins in Saccharomyes cerevisiae_specifically_ AGP1_MLPCN.,Screening,,
76,2071,2,2,,47202885,15546,Inactive,14719829.0,22861.0,,,Colorimetric  Assay for Inhibitors for NALP1,Screening,,
77,2073,2,3,,47202885,15546,Inactive,2625023.0,83589.0,,IC50,Homogeneous Time-Resolved Fluorescence Resonance Energy Transfer (HTRF) Assay,Confirmatory,,
78,2073,2,3,,47202885,15546,Inactive,4502523.0,774.0,,IC50,Homogeneous Time-Resolved Fluorescence Resonance Energy Transfer (HTRF) Assay,Confirmatory,,
79,2094,1,2,,47202885,15546,Inactive,67463988.0,,,,Plate Read Microorganism-Based Primary HTS to Identify Modulators of the AI-2 Quorum Sensing System,Screening,,
80,2094,1,2,,47202885,15546,Inactive,67463989.0,,,,Plate Read Microorganism-Based Primary HTS to Identify Modulators of the AI-2 Quorum Sensing System,Screening,,
81,2094,1,2,,47202885,15546,Inactive,166202459.0,,,,Plate Read Microorganism-Based Primary HTS to Identify Modulators of the AI-2 Quorum Sensing System,Screening,,
82,2097,1,2,,47202885,15546,Inactive,21361340.0,2932.0,,,Cell-Free Homogeneous Primary HTS to Identify Inhibitors of GSK3beta Activity,Screening,,
83,2098,1,1,,47202885,15546,Inactive,62740231.0,15499.0,,,Luminescence Cell-Based Primary HTS to Identify Inhibitors of Heat Shock Factor 1 (HSF1).,Screening,,
84,2099,1,1,,47202885,15546,Inactive,,,,,Fluorescence Biochemical Primary HTS to Identify Inhibitors of GASC-1 Activity,Screening,,
85,2100,1,1,,47202885,15546,Inactive,119393891.0,2548.0,,Potency,qHTS Assay for Inhibitors and Activators of Human alpha-Glucosidase Cleavage of Glycogen,Confirmatory,,
86,2101,1,1,,47202885,15546,Inactive,496369.0,2629.0,,Potency,qHTS Assay for Inhibitors and Activators of N370S glucocerebrosidase as a Potential Chaperone Treatment of Gaucher Disease,Confirmatory,,
87,2129,1,2,,47202885,15546,Inactive,510901.0,598.0,,,"Primary biochemical high throughput screening assay to identify inhibitors of BCL2-related protein, long isoform (BCLXL).",Screening,,
88,2130,1,3,,47202885,15546,Inactive,7706645.0,51400.0,,,Fluorescence polarization-based primary biochemical high throughput screening assay to identify inhibitors of Protein Phosphatase Methylesterase 1 (PME-1).,Screening,,
89,2156,2,2,,47202885,15546,Inactive,18959272.0,170848.0,,,Primary cell-based high-throughput screening assay for identification of compounds that inhibit KCNQ2 potassium channels,Screening,,
90,2174,1,3,,47202885,15546,Inactive,5453722.0,10434.0,,,Counterscreen for PME1 inhibitors: fluorescence polarization-based primary biochemical high throughput screening assay to identify inhibitors of lysophospholipase 1 (LYPLA1).,Screening,,
91,2177,1,3,,47202885,15546,Inactive,4581413.0,,,,Counterscreen for PME1 inhibitors: fluorescence polarization-based primary biochemical high throughput screening assay to identify inhibitors of lysophospholipase 2 (LYPLA2).,Screening,,
92,2216,1,3,,47202885,15546,Inactive,,,,,Fluorescence Cell-Free Homogeneous Primary HTS to Identify Inhibitors of the RanGTP-Importin-beta complex,Screening,,
93,2221,1,2,,47202885,15546,Inactive,15609874.0,888371.0,,,Fluorescence Cell-Free Homogenous Primary HTS to Identify Inhibitors of RecA Intein Splicing Activity,Screening,,
94,2227,1,2,,47202885,15546,Inactive,2935630.0,22066.0,,,Primary cell-based high-throughput screening assay for identification of compounds that allosterically potentiate transient receptor potential cation channel C4 (TRPC4),Screening,,
95,2234,1,2,,47202885,15546,Inactive,82503229.0,3783744.0,,,"Counterscreen for inhibitors of EBNA-1: fluorescence polarization-based biochemical high throughput primary assay to identify inhibitors of the Epstein-Barr virus-encoded protein, ZTA.",Screening,,
96,2235,1,2,,47202885,15546,Inactive,56790945.0,5499.0,,,Counterscreen for inhibitors of PP5: fluorescence-based biochemical high throughput primary assay to identify inhibitors of Protein Phosphatase 1 (PP1).,Screening,,
97,2237,1,2,,47202885,15546,Inactive,2935630.0,22066.0,,,Primary cell-based screen for identification of compounds that activate transient receptor potential cation channel C4 (TRPC4).,Screening,,
98,2239,1,2,,47202885,15546,Inactive,18959272.0,170848.0,,,Primary cell-based high-throughput screening assay for identification of compounds that potentiate KCNQ2 potassium channels,Screening,,
99,2247,1,2,,47202885,15546,Inactive,2935630.0,22066.0,,,Primary cell-based screen for identification of compounds that inhibit transient receptor potential cation channel C4 (TRPC4).,Screening,,
100,2280,2,3,,47202885,15546,Inactive,17507875.0,172532.0,,,Fluorescence polarization-based primary biochemical high throughput screening assay to identify inhibitors of GLD-1 protein - TGE RNA interaction.,Screening,,
101,2288,1,1,,47202885,15546,Inactive,,,,Potency,qHTS Assay for Modulators of miRNAs and/orActivators of miR-21,Confirmatory,,
102,2289,1,1,,47202885,15546,Inactive,,,,Potency,qHTS Assay for Modulators of miRNAs and/or Inhibitors of miR-21,Confirmatory,,
103,2300,1,3,,47202885,15546,Inactive,216409728.0,10002.0,,,"TR-FRET-based primary biochemical high throughput screening assay to identify agonists of nuclear receptor subfamily 2, group E, member 3 (NR2E3).",Screening,,
104,2314,1,2,,47202885,15546,Inactive,32400299.0,,,,Cycloheximide Counterscreen for Small Molecule Inhibitors of Shiga Toxin,Screening,,
105,2314,1,2,,47202885,15546,Inactive,32400300.0,,,,Cycloheximide Counterscreen for Small Molecule Inhibitors of Shiga Toxin,Screening,,
106,2326,1,1,,47202885,15546,Inactive,194352380.0,,,Potency,qHTS Assay for Inhibitors of Influenza NS1 Protein Function,Confirmatory,,
107,2380,1,2,,47202885,15546,Inactive,,,,,uHTS identification of small molecules that induce b-cell replication in the MIN-6 cell line,Screening,,
108,2391,1,1,,47202885,15546,Inactive,,,,IC50,A Cell Based HTS Approach for the Discovery of New Inhibitors of Respiratory syncytial virus (RSV),Confirmatory,,
109,2435,1,2,,47202885,15546,Inactive,32307152.0,5021.0,,,Fluorescence-based primary cell-based high throughput screening assay to identify agonists of the Oxytocin Receptor (OXTR).,Screening,,
110,2445,1,2,,47202885,15546,Inactive,32307152.0,5021.0,,,Fluorescence-based primary cell-based high throughput screening assay to identify potentiators of Oxytocin Receptor (OXTR),Screening,,
111,2451,1,2,,47202885,15546,Inactive,122920737.0,,,Potency,"qHTS Assay for Inhibitors of Fructose-1,6-bisphosphate Aldolase from Giardia Lamblia",Confirmatory,,
112,2462,1,1,,47202885,15546,Inactive,20336315.0,10018.0,,,Luminescence Cell-Based Primary HTS to Identify Inhibitors of A1 Apoptosis.,Screening,,
113,2462,1,1,,47202885,15546,Inactive,167013344.0,,,,Luminescence Cell-Based Primary HTS to Identify Inhibitors of A1 Apoptosis.,Screening,,
114,2472,1,2,,47202885,15546,Inactive,7669492.0,2597.0,,,"qHTS Assay for Inhibitors of Fructose-1,6-bisphosphate Aldolase from Giardia Lamblia: Coupling assay counterscreen",Screening,,
115,2517,2,1,,47202885,15546,Inactive,6980812.0,,,Potency,qHTS Assay for Inhibitors of the Human Apurinic/apyrimidinic Endonuclease 1 (APE1),Confirmatory,,
116,2520,1,4,,47202885,15546,Inactive,4885057.0,187.0,,,uHTS identification of small molecule agonists of the APJ  receptor  via a luminescent beta-arrestin assay,Screening,,
117,2521,1,3,,47202885,15546,Inactive,4885057.0,187.0,,,uHTS identification of small molecule antagonists of the APJ  receptor  via a luminescent beta-arrestin assay,Screening,,
118,2524,1,2,,47202885,15546,Inactive,124376142.0,248.0,,,uHTS Luminescent assay for identification of activators of human intestinal alkaline phosphatase,Screening,,
119,2528,1,2,,47202885,15546,Inactive,4557365.0,641.0,,Potency,qHTS Assay for Inhibitors of Bloom's syndrome helicase (BLM),Confirmatory,,
120,2540,1,2,,47202885,15546,Inactive,262118306.0,123228.0,,,HTS Luminescent assay for identification of inhibitors of Sentrin-specific protease 8 (SENP8),Screening,,
121,2544,1,2,,47202885,15546,Inactive,124376142.0,248.0,,,uHTS Luminescent assay for identification of inhibitors of human intestinal alkaline phosphatase,Screening,,
122,2546,1,1,,47202885,15546,Inactive,188536040.0,19885.0,,Potency,VP16 counterscreen qHTS for inhibitors of ROR gamma transcriptional activity,Confirmatory,,
123,2550,1,3,,47202885,15546,Inactive,160333370.0,22068.0,,,High throughput screening of activators of transient receptor potential cation channel C6 (TRPC6),Screening,,
124,2551,1,1,,47202885,15546,Inactive,188536040.0,19885.0,,Potency,qHTS for inhibitors of ROR gamma transcriptional activity,Confirmatory,,
125,2553,1,2,,47202885,15546,Inactive,160333370.0,22068.0,,,High throughput screening of inhibitors of transient receptor potential cation channel C6 (TRPC6),Screening,,
126,2557,1,3,,47202885,15546,Inactive,67191027.0,3676.0,,,HTS for Identification of VLA-4 Allosteric Modulators from MLPCN library,Screening,,
127,2563,1,1,,47202885,15546,Inactive,6323930.0,855317.0,,,Fluorescence Cell-Free Homogenous Primary HTS  to Identify Inhibitors of the Ras-converting Enzyme,Screening,,
128,2599,1,2,,47202885,15546,Inactive,6166485.0,26054.0,,,uHTS Luminescent assay for identification of inhibitors of Sentrin-specific protease 6 (SENP6),Screening,,
129,2606,1,2,,47202885,15546,Inactive,15610807.0,885176.0,,,Fluorescence polarization-based primary biochemical high throughput screening assay to identify inhibitors of the membrane-associated serine protease Rv3671c in M.tuberculosis,Screening,,
130,2629,1,1,,47202885,15546,Inactive,139472804.0,4961527.0,,,Fluorescence Polarization Cell-Free Homogeneous Primary HTS to Identify Inhibitors of the LANA Histone H2A/H2B Interaction,Screening,,
131,2642,1,2,,47202885,15546,Inactive,32479527.0,3784.0,,,Primary cell-based high-throughput screening assay for identification of compounds that inhibit KCNQ1 potassium channels,Screening,,
132,2648,1,2,,47202885,15546,Inactive,32479527.0,3784.0,,,Primary cell-based high-throughput screening assay for identification of compounds that potentiate/activate KCNQ1 potassium channels,Screening,,
133,2650,2,1,,47202885,15546,Inactive,49574532.0,2931.0,,,Luminescence Cell-Free  Homogenous Primary HTS to Identify Inhibitors of GSK-3 alpha,Screening,,
134,2661,1,1,,47202885,15546,Inactive,23943882.0,65975.0,,,Luminescence Cell-Free  Homogenous Primary HTS to Identify Inhibitors of Serine/Threonine  Kinase 33  Activity,Screening,,
135,2662,2,1,,47202885,15546,Inactive,56550039.0,4297.0,,Potency,qHTS Fluorescence Polarization Assay for Inhibitors of MLL CXXC domain - DNA interaction,Confirmatory,,
136,2675,1,1,,47202885,15546,Inactive,41281591.0,4154.0,,Potency,qHTS Assay for Inhibitors of MBNL1-poly(CUG) RNA binding,Confirmatory,,
137,2676,1,2,,47202885,15546,Inactive,85986601.0,59350.0,,Potency,qHTS Assay for Agonists of the Relaxin Receptor RXFP1,Confirmatory,,
138,2685,1,1,,47202885,15546,Inconclusive,,,,Potency,qHTS Assay for Lipid Storage Modulators in Drosophila S3 Cells,Confirmatory,,
139,2690,1,2,,47202885,15546,Inactive,,,,,A yeast HTS for caloric restriction mimetics that inhibit age-related superoxide,Screening,,
140,2716,1,1,,47202885,15546,Inactive,,,,,Luminescence  Microorganism Primary HTS to Identify Inhibitors of the SUMOylation Pathway Using a Temperature Sensitive Growth Reversal Mutant Mot1-301,Screening,,
141,2717,1,2,,47202885,15546,Inactive,,,,,Luminescence Cell-Based Primary HTS to Identify Inhibitors of Cancer Stem Cells,Screening,,
142,2718,1,1,,47202885,15546,Inactive,13128862.0,8841.0,,,Fluorescence Cell-Free Homogeneous Primary HTS to Identify Inhibitors of Histone Deacetylase 3,Screening,,
143,2751,2,2,,47202885,15546,Inactive,153217451.0,9581.0,,,Fluorescence polarization-based primary biochemical high throughput screening assay to identify inhibitors of the prolyl oligopeptidase-like enzyme (PREPL),Screening,,
144,2796,1,4,,47202885,15546,Inactive,4502003.0,196.0,,,Luminescence-based primary cell-based high throughput screening assay to identify activators of the Aryl Hydrocarbon Receptor (AHR),Screening,,
145,2797,1,2,,47202885,15546,Inactive,4502331.0,552.0,,,Counterscreen for Oxytocin Receptor (OXTR) agonists: Fluorescence-based primary cell-based high throughput assay to identify agonists of the vasopressin 1 receptor (V1R),Screening,,
146,2805,2,2,,47202885,15546,Inactive,124487323.0,76768.0,,,uHTS Luminescent assay for identification of activators of mouse intestinal alkaline phosphatase,Screening,,
147,2806,2,2,,47202885,15546,Inactive,124487323.0,76768.0,,,uHTS Luminescent assay for identification of inhibitors of mouse intestinal alkaline phosphatase,Screening,,
148,2825,1,2,,47202885,15546,Inactive,219518789.0,114548.0,,,uHTS Luminescent assay for identification of inhibitors of NALP3 in yeast,Screening,,
