,AID,AID Version,AID Revision,Panel Member ID,SID,CID,Bioactivity Outcome,Target GI,Target GeneID,Activity Value [uM],Activity Name,Assay Name,Bioassay Type,PubMed ID,RNAi
149,434955,1,2,,47202885,15546,Inactive,,,,IC90,Screen to Identify Novel Compounds That Sensitize Mycobacterium Tuberculosis to Beta-lactam Antibiotics,Confirmatory,,
150,434962,1,2,,47202885,15546,Inactive,155969707.0,3416.0,,,Fluorescence polarization-based cell-based primary high throughput screening assay to identify inhibitors of insulin-degrading enzyme (IDE),Screening,,
151,434973,1,3,,47202885,15546,Inactive,120538355.0,57337.0,,,uHTS Luminescent assay for identification of inhibitors of Sentrin-specific protease 7 (SENP7),Screening,,
152,434989,1,1,,47202885,15546,Inactive,222080095.0,3061.0,,,Fluorescence-based cell-based primary high throughput screening assay to identify antagonists of the orexin 1 receptor (OX1R; HCRTR1),Screening,,
153,435003,1,3,,47202885,15546,Inactive,,,,,uHTS luminescence assay for the identification of chemical inhibitors of T-cell specific antigen receptor-induced NF-kB activation,Screening,,
154,435005,1,1,,47202885,15546,Inactive,,,,,Luminescence Cell-Based Primary HTS to Identify Inhibitors of Beta Cell Apoptosis.,Screening,,
155,435022,2,2,,47202885,15546,Inactive,,,,,uHTS luminescence assay for the identification of chemical inhibitors of B-cell specific antigen receptor-induced NF-kB activation,Screening,,
156,435030,1,2,,47202885,15546,Inactive,15645703.0,899625.0,,,Absorbance-based primary bacterial cell-based high throughput screening assay to identify inhibitors of AddAB recombination protein complex,Screening,,
157,435030,1,2,,47202885,15546,Inactive,15646160.0,899738.0,,,Absorbance-based primary bacterial cell-based high throughput screening assay to identify inhibitors of AddAB recombination protein complex,Screening,,
158,449728,1,2,,47202885,15546,Inactive,,,,,Counterscreen for inhibitors of AddAB: absorbance-based bacterial cell-based high throughput screening assay to identify inhibitors of bacterial viability,Screening,,
159,449762,1,2,,47202885,15546,Inactive,,,,IC50,High Throughput Screening Assay used to Identify Novel Compounds that Inhibit Mycobacterium Tuberculosis in 7H9 Media,Confirmatory,,
160,449763,1,3,,47202885,15546,Inactive,,,,,uHTS identification of small molecule activators of the apoptotic arm of the Unfolded Protein response via a luminescent-based reporter assay,Screening,,
161,463079,1,2,,47202885,15546,Inactive,,,,,Fluorescence-based counterscreen for orexin 1 receptor (OX1R) antagonists: cell-based assay to identify antagonists of the parental CHO cell line,Screening,,
162,463082,1,1,,47202885,15546,Inactive,270133071.0,7941.0,,,Fluorescence polarization-based primary biochemical high throughput screening assay to identify inhibitors of the plasma platelet activating factor acetylhydrolase (pPAFAH),Screening,,
163,463104,1,2,,47202885,15546,Inactive,,,,,uHTS identification of small molecule activators of the adaptive arm of the Unfolded Protein response via a luminescent-based reporter assay,Screening,,
164,463111,1,1,,47202885,15546,Inactive,5032039.0,5999.0,,,Primary cell-based high-throughput screening assay for identification of compounds that potentiate/activate regulator of G-protein signaling 4 (RGS4),Screening,,
165,463141,1,2,,47202885,15546,Inactive,14790119.0,836.0,,,Absorbance-based primary biochemical high throughput screening assay to identify activators of procaspase-3,Screening,,
166,463165,1,1,,47202885,15546,Inactive,5032039.0,5999.0,,,Primary cell-based high-throughput screening assay for identification of compounds that inhibit regulator of   G-protein signaling 4 (RGS4),Screening,,
167,463190,1,2,,47202885,15546,Inactive,285809906.0,856395.0,,,uHTS identification of small molecule inhibitors of tim10-1 yeast via a luminescent assay,Screening,,
168,463195,1,2,,47202885,15546,Inactive,285809906.0,856395.0,,,uHTS identification of small molecule inhibitors of tim10 yeast via a luminescent assay,Screening,,
169,463210,1,2,,47202885,15546,Inactive,55960760.0,,,,Counterscreen for procaspase-3 activators: absorbance-based primary biochemical high throughput screening assay to identify activators of procaspase-7,Screening,,
170,463212,1,1,,47202885,15546,Inactive,285814664.0,855751.0,,,uHTS identification of small molecule inhibitors of tim23-1 yeast via a luminescent assay,Screening,,
171,463254,1,1,,47202885,15546,Inactive,188528692.0,9099.0,,Potency,qHTS Assay for Inhibitors of Ubiquitin-specific Protease USP2a Using CHOP2 as the Reporter,Confirmatory,,
172,485270,1,1,,47202885,15546,Inactive,222080095.0,3061.0,,,FRET-based cell-based primary high throughput screening assay to identify antagonists of the orexin 1 receptor (OX1R; HCRTR1),Screening,,
173,485272,1,1,,47202885,15546,Inactive,216548487.0,23569.0,,,Fluorescence polarization-based primary biochemical high throughput screening assay to identify inhibitors of Protein Arginine Deiminase 4 (PAD4) (1536 HTS),Screening,,
174,485273,2,1,,47202885,15546,Inactive,4507793.0,7334.0,,,uHTS identification of UBC13 Polyubiquitin Inhibitors via a TR-FRET Assay,Screening,,
175,485275,1,3,,47202885,15546,Inactive,,,,,Phenotypic HTS multiplex for antifungal efflux pump inhibitors,Screening,,
176,485281,1,1,,47202885,15546,Inactive,254220970.0,,,Potency,qHTS Assay for Identification of Novel General Anesthetics,Confirmatory,,
177,485294,1,1,,47202885,15546,Inconclusive,119389684.0,,2.8184,Potency,qHTS Inhibitors of AmpC Beta-Lactamase (assay with detergent),Confirmatory,,
178,485297,1,1,,47202885,15546,Inactive,4759012.0,9367.0,,Potency,qHTS Assay for Rab9 Promoter Activators,Confirmatory,,
179,485298,1,1,,47202885,15546,Inactive,,,,Potency,qHTS Assay for Small Molecule Inhibitors of Mitochondrial Division or Activators of Mitochondrial Fusion,Confirmatory,,
180,485313,1,2,,47202885,15546,Inactive,255652944.0,4864.0,,Potency,qHTS Assay for NPC1 Promoter Activators,Confirmatory,,
181,485314,1,1,,47202885,15546,Inactive,4505931.0,5423.0,,Potency,qHTS Assay for Inhibitors of DNA Polymerase Beta,Confirmatory,,
182,485317,1,2,,47202885,15546,Inactive,54112432.0,2671.0,,,HTS-Luminescent assay for inhibitors of ALR by detection of hydrogen peroxide production Measured in Biochemical System Using Plate Reader - 2036-02_Inhibitor_SinglePoint_HTS,Screening,,
183,485341,1,1,,47202885,15546,Inactive,119389684.0,,,Potency,qHTS Inhibitors of AmpC Beta-Lactamase (assay without detergent),Confirmatory,,
184,485344,1,1,,47202885,15546,Inactive,4503385.0,1813.0,,,HTS Assay for Allosteric Antagonists of the Human D2 Dopamine Receptor: Primary Screen for Antagonists,Screening,,
185,485346,1,1,,47202885,15546,Inactive,88702791.0,4194.0,,,uHTS for identification of Inhibitors of Mdm2/MdmX interaction in luminescent format.,Screening,,
186,485346,1,1,,47202885,15546,Inactive,89993689.0,4193.0,,,uHTS for identification of Inhibitors of Mdm2/MdmX interaction in luminescent format.,Screening,,
187,485347,1,2,,47202885,15546,Inactive,4503385.0,1813.0,,,HTS Assay for Positive Allosteric Modulators of the Human D2 Dopamine Receptor: Primary Screen for Potentiators,Screening,,
188,485349,1,1,,47202885,15546,Inactive,71902540.0,472.0,,Potency,qHTS Assay for Identifying a Potential Treatment of Ataxia-Telangiectasia,Confirmatory,,
189,485353,2,1,,47202885,15546,Inactive,30124074.0,1489680.0,,,qHTS of Yeast-based Assay for SARS-CoV PLP,Confirmatory,,
190,485358,1,1,,47202885,15546,Inactive,4503385.0,1813.0,,,HTS Assay for Allosteric Agonists of the Human D2 Dopamine Receptor: Primary Screen for Agonists,Screening,,
191,485360,1,1,,47202885,15546,Inactive,117938328.0,26013.0,,Potency,qHTS Assay for the Inhibitors of L3MBTL1,Confirmatory,,
192,485364,1,1,,47202885,15546,Inactive,15149312.0,8345881.0,,Potency,qHTS Assay for the Inhibitors of Schistosoma Mansoni Peroxiredoxins,Confirmatory,,
193,485367,1,2,,47202885,15546,Inactive,72386991.0,3656265.0,,Potency,qHTS Assay to Find Inhibitors of T. brucei phosphofructokinase,Confirmatory,,
194,485395,1,2,,92238180,15546,Inactive,150392496.0,,,,A screen for compounds that inhibit the activity of Staphylococcus aureus DNA helicase,Other,,
195,488837,1,1,,47202885,15546,Inactive,26667227.0,2139.0,,Potency,qHTS Assay for Inhibitors of the Phosphatase Activity of Eya2,Confirmatory,,
196,488839,1,1,,47202885,15546,Inactive,20072248.0,8851.0,,,Development of CDK5 inhibitors   Measured in Biochemical System Using Plate Reader - 2083-01_Inhibitor_SinglePoint_HTS_Activity,Screening,,
197,488839,1,1,,47202885,15546,Inactive,48146199.0,1020.0,,,Development of CDK5 inhibitors   Measured in Biochemical System Using Plate Reader - 2083-01_Inhibitor_SinglePoint_HTS_Activity,Screening,,
198,488847,1,3,,47202885,15546,Inactive,148539876.0,156.0,,,RNA aptamer-based HTS for inhibitors of GRK2,Screening,,
199,488862,1,1,,47202885,15546,Inactive,,,,,Inhibitors of Prion Protein 5' UTR mRNA Measured in Cell-Based System Using Plate Reader - 2078-01_Inhibitor_SinglePoint_HTS_Activity,Screening,,
200,488890,1,2,,47202885,15546,Inactive,,,,IC50,"Elucidation of physiology of non-replicating, drug-tolerant Mycobacterium tuberculosis",Confirmatory,,
201,488895,1,2,,47202885,15546,Inactive,90111653.0,948321.0,,,High Throughput Screen for Tat Transport Inhibitors Measured in Microorganism System Using Plate Reader - 2093-01_Inhibitor_SinglePoint_HTS_Activity,Screening,,
202,488896,1,1,,47202885,15546,Inactive,14389423.0,20778.0,,,HTS using DiI-HDL to assay lipid transfer in ldlA[SR-BI] cells Measured in Cell-Based System Using Plate Reader - 2085-01_Inhibitor_SinglePoint_HTS_Activity,Screening,,
203,488899,1,1,,47202885,15546,Inactive,40807040.0,4286.0,,,MITF Measured in Cell-Based System Using Plate Reader - 2084-01_Inhibitor_SinglePoint_HTS_Activity,Screening,,
204,488922,1,2,,47202885,15546,Inactive,7706135.0,,,,Primary cell-based screen for identification of compounds that inhibit the two-pore domain potassium channel KCNK9,Screening,,
205,488965,1,2,,47202885,15546,Inactive,218891639.0,,,,Fluorescent Biochemical Primary HTS to Identify Inhibitors of P. aeruginosa PvdQ acylase Measured in Biochemical System Using Plate Reader and Imaging Combination - 2091-01_Inhibitor_SinglePoint_HTS_Activity,Screening,,
206,488966,1,1,,47202885,15546,Inactive,,,,IC50,Primary and Confirmatory Screening for Inhibitors of Bacterial Capsule Biogenesis,Confirmatory,,
207,488975,1,2,,47202885,15546,Inactive,11141885.0,60482.0,,,Primary cell-based screen for identification of compounds that inhibit the Choline Transporter (CHT),Screening,,
208,488977,1,2,,47202885,15546,Inactive,11141885.0,60482.0,,,Primary cell-based screen for identification of compounds that allosterically activate the Choline Transporter (CHT),Screening,,
209,489030,2,1,,47202885,15546,Inactive,187952397.0,317.0,,,uHTS Fluorescent assay for identification of inhibitors of Apaf-1,Screening,,
210,489031,2,1,,47202885,15546,Inactive,187952397.0,317.0,,,uHTS Fluorescent assay for identification of activators of Apaf-1,Screening,,
211,492947,1,1,,47202885,15546,Inactive,4501969.0,154.0,,Potency,qHTS assay of beta-arrestin-biased ligands of beta2-adrenergic receptor,Confirmatory,,
212,492953,1,1,,47202885,15546,Inactive,296080766.0,5049.0,,,"Fluorescence polarization-based primary biochemical high throughput screening assay to identify inhibitors of human platelet-activating factor acetylhydrolase 1b, catalytic subunit 2 (PAFAH1B2)",Screening,,
213,492956,1,1,,47202885,15546,Inactive,4758878.0,5051.0,,,Fluorescence polarization-based primary biochemical high throughput screening assay to identify inhibitors of human platelet activating factor acetylhydrolase 2 (PAFAH2),Screening,,
214,492967,1,2,,92238180,15546,Inactive,47566732.0,,,,A screen for compounds that inhibit the CapD enzyme of Bacillus anthracis,Other,,
215,492972,1,1,,47202885,15546,Inactive,225543099.0,5050.0,,,"Fluorescence polarization-based primary biochemical high throughput screening assay to identify inhibitors of human platelet-activating factor acetylhydrolase 1B, catalytic subunit 3 (PAFAH1B3)",Screening,,
216,493005,1,1,,47202885,15546,Inactive,5454140.0,7251.0,,Potency,qHTS Assay for Iinhibitors of HIV-1 Budding by Blocking the Interaction of PTAP/TSG101,Confirmatory,,
217,493008,1,1,,47202885,15546,Inactive,1927.0,100037999.0,,,Fluorescence-based biochemical primary high throughput screening assay to identify activators of the calcium sensitivity of cardiac Regulated Thin Filaments (RTF),Screening,,
218,493008,1,1,,47202885,15546,Inactive,4507615.0,7134.0,,,Fluorescence-based biochemical primary high throughput screening assay to identify activators of the calcium sensitivity of cardiac Regulated Thin Filaments (RTF),Screening,,
219,493008,1,1,,47202885,15546,Inactive,48255881.0,7139.0,,,Fluorescence-based biochemical primary high throughput screening assay to identify activators of the calcium sensitivity of cardiac Regulated Thin Filaments (RTF),Screening,,
220,493008,1,1,,47202885,15546,Inactive,151101270.0,7137.0,,,Fluorescence-based biochemical primary high throughput screening assay to identify activators of the calcium sensitivity of cardiac Regulated Thin Filaments (RTF),Screening,,
221,493011,1,1,,47202885,15546,Inactive,21955158.0,200315.0,,,uHTS identification of APOBEC3A DNA Deaminase Inhibitors via a fluorescence-based single-stranded DNA deaminase assay,Screening,,
222,493012,1,1,,47202885,15546,Inactive,13399304.0,60489.0,,,uHTS identification of APOBEC3G DNA Deaminase Inhibitors via a fluorescence-based single-stranded DNA deaminase assay,Screening,,
223,493014,1,1,,47202885,15546,Inactive,,,,Potency,qHTS Assay to Find Inhibitors of Chronic Active B-Cell Receptor Signaling,Confirmatory,,
224,493033,1,2,,92238180,15546,Inactive,614089026.0,,,,A screen for compounds that inhibit the bacterial siderophore biosynthetic enzyme MbtI,Other,,
225,493036,1,2,,47202885,15546,Inactive,110611243.0,4923.0,,,Image-Based HTS for Selective Agonists for NTR1,Screening,,
226,493056,1,1,,47202885,15546,Inactive,4507681.0,7201.0,,,qHTS for Small Molecule Agonists and Allosteric Enhancers of Human TRH Receptor: Primary Screen for Enhancers,Screening,,
227,493084,1,1,,47202885,15546,Inactive,4507681.0,7201.0,,,qHTS for Small Molecule Agonists and Allosteric Enhancers of Human TRH Receptor: Primary Screen for Agonists.,Screening,,
228,493087,1,1,,47202885,15546,Inactive,155969707.0,3416.0,,,Fluorescence polarization-based cell-based primary high throughput screening assay to identify activators of insulin-degrading enzyme (IDE),Screening,,
229,493091,1,1,,47202885,15546,Inactive,10864009.0,58190.0,,,uHTS Colorimetric assay for identification of inhibitors of Scp-1,Screening,,
230,493098,1,1,,47202885,15546,Inactive,37187860.0,1235.0,,,uHTS identification of small molecule antagonists of the CCR6 receptor via a luminescent beta-arrestin assay,Screening,,
231,493131,1,1,,47202885,15546,Inactive,6679827.0,14282.0,,,Activator for delta FosB/delta FosB homodimer Measured in Biochemical System Using Plate Reader - 2072-01_Activator_SinglePoint_HTS_Activity,Screening,,
232,493160,1,1,,47202885,15546,Active,156151420.0,80201.0,,,uHTS Fluorescent assay for identification of inhibitors of hexokinase domain containing  I (HKDC1),Screening,,
233,493187,1,2,,47202885,15546,Inactive,156151420.0,80201.0,,,uHTS Fluorescent assay for identification of activators of hexokinase domain containing  I (HKDC1),Screening,,
234,493244,1,1,,47202885,15546,Inactive,1927.0,100037999.0,,,Fluorescence-based biochemical primary high throughput screening assay to identify inhibitors of the calcium sensitivity of cardiac Regulated Thin Filaments (RTF),Screening,,
235,493244,1,1,,47202885,15546,Inactive,4507615.0,7134.0,,,Fluorescence-based biochemical primary high throughput screening assay to identify inhibitors of the calcium sensitivity of cardiac Regulated Thin Filaments (RTF),Screening,,
236,493244,1,1,,47202885,15546,Inactive,48255881.0,7139.0,,,Fluorescence-based biochemical primary high throughput screening assay to identify inhibitors of the calcium sensitivity of cardiac Regulated Thin Filaments (RTF),Screening,,
237,493244,1,1,,47202885,15546,Inactive,151101270.0,7137.0,,,Fluorescence-based biochemical primary high throughput screening assay to identify inhibitors of the calcium sensitivity of cardiac Regulated Thin Filaments (RTF),Screening,,
238,504326,1,2,,47202885,15546,Inactive,63477962.0,4985.0,,,Luminescence-based cell-based primary high throughput screening assay to identify agonists of heterodimerization of the mu 1 (OPRM1) and delta 1 (OPRD1) opioid receptors,Screening,,
239,504326,1,2,,47202885,15546,Inactive,117940060.0,4988.0,,,Luminescence-based cell-based primary high throughput screening assay to identify agonists of heterodimerization of the mu 1 (OPRM1) and delta 1 (OPRD1) opioid receptors,Screening,,
240,504327,1,1,,47202885,15546,Inactive,153791535.0,2648.0,,Potency,qHTS Assay for Inhibitors of GCN5L2,Confirmatory,,
241,504329,1,1,,47202885,15546,Inactive,227977143.0,23308111.0,,IC50,Discovery of Small Molecule Probes for H1N1 Influenza NS1A,Confirmatory,,
242,504332,1,1,,47202885,15546,Inactive,168985070.0,,,Potency,qHTS Assay for Inhibitors of Histone Lysine Methyltransferase G9a,Confirmatory,,
243,504333,1,1,,47202885,15546,Inactive,6683500.0,29994.0,,Potency,qHTS Assay for Inhibitors of BAZ2B,Confirmatory,,
244,504339,1,1,,47202885,15546,Inactive,162330054.0,,,Potency,qHTS Assay for Inhibitors of JMJD2A-Tudor Domain,Confirmatory,,
245,504357,1,1,,47202885,15546,Inactive,63477962.0,4985.0,,,Luminescence-based cell-based primary high throughput screening assay to identify inverse agonists of heterodimerization of the mu 1 (OPRM1) and delta 1 (OPRD1) opioid receptors,Screening,,
246,504357,1,1,,47202885,15546,Inactive,117940060.0,4988.0,,,Luminescence-based cell-based primary high throughput screening assay to identify inverse agonists of heterodimerization of the mu 1 (OPRM1) and delta 1 (OPRD1) opioid receptors,Screening,,
247,504406,1,1,,47202885,15546,Inactive,15610945.0,886142.0,,,Inhibitors of Mycobacterium tuberculosis UDP-galactopyranose mutase (UGM) enzyme - High throughput screening using Fluorescent polarization assay Measured in Biochemical System Using Plate Reader - 2105-01_Inhibitor_SinglePoint_HTS_Activity_Set6,Screening,,
248,504408,2,1,,47202885,15546,Inactive,,,,,Heat Shock Factor-1 (HSF-1) Measured in Cell-Based System Using Plate Reader - 2038-01_Activator_SinglePoint_HTS_Activity,Screening,,
249,504411,1,1,,47202885,15546,Inactive,218931251.0,221955.0,,,"Fluorescence-based primary biochemical high throughput screening assay to identify inhibitors of human diacylglycerol lipase, beta (DAGLB)",Screening,,
250,504414,1,1,,47202885,15546,Inactive,9966877.0,57120.0,,,Fluorescence Polarization with Cer CAL-PDZ Measured in Biochemical System Using Plate Reader - 2109-01_Inhibitor_SinglePoint_HTS_Activity,Screening,,
251,504414,1,1,,47202885,15546,Inactive,90421313.0,1080.0,,,Fluorescence Polarization with Cer CAL-PDZ Measured in Biochemical System Using Plate Reader - 2109-01_Inhibitor_SinglePoint_HTS_Activity,Screening,,
252,504423,1,1,,47202885,15546,Inactive,312275222.0,,,,C-LANA FP assay Measured in Biochemical System Using Plate Reader - 2117-01_Inhibitor_SinglePoint_HTS_Activity,Screening,,
253,504441,1,1,,47202885,15546,Inactive,6978787.0,25255.0,,,Dyrk1 A HTS Measured in Biochemical System Using Plate Reader - 2124-01_Inhibitor_SinglePoint_HTS_Activity,Screening,,
254,504444,1,1,,47202885,15546,Inactive,224028257.0,4780.0,,Potency,Nrf2 qHTS screen for inhibitors,Confirmatory,,
255,504454,1,3,,47202885,15546,Inactive,4501969.0,154.0,,,HTS for Beta-2AR agonists via FAP method,Screening,,
256,504462,1,1,,47202885,15546,Inactive,47132611.0,23192.0,,,uHTS fluorescent assay for identification of inhibitors of ATG4B,Screening,,
257,504466,1,1,,47202885,15546,Inactive,116283940.0,79915.0,,Potency,qHTS screen for small molecules that induce genotoxicity in human embryonic kidney (HEK293T) cells expressing luciferase-tagged ELG1,Confirmatory,,
258,504467,1,1,,47202885,15546,Inactive,116283940.0,79915.0,,Potency,qHTS screen for small molecules that inhibit ELG1-dependent DNA repair in human embryonic kidney (HEK293T) cells expressing luciferase-tagged ELG1,Confirmatory,,
259,504490,1,2,,47202885,15546,Inactive,13177715.0,408.0,,,Assay for Inhibitors of the beta-Arrestin-Adaptor Protein 2 Interaction That Mediate GPCR Degradation and Recycling,Screening,,
260,504523,1,1,,47202885,15546,Inactive,45269145.0,9817.0,,,Fluorescence polarization to screen for inhibitors that disrupt the protein-protein interaction between Keap1 and Nrf2   Measured in Biochemical System Using Plate Reader - 2119-01_Inhibitor_SinglePoint_HTS_Activity,Screening,,
261,504523,1,1,,47202885,15546,Inactive,224028257.0,4780.0,,,Fluorescence polarization to screen for inhibitors that disrupt the protein-protein interaction between Keap1 and Nrf2   Measured in Biochemical System Using Plate Reader - 2119-01_Inhibitor_SinglePoint_HTS_Activity,Screening,,
262,504558,1,1,,47202885,15546,Inactive,23893668.0,3783750.0,,,Inhibitors of Epstein-Barr LMP1 inducible NF-kappaB luciferase reporter Measured in Cell-Based System Using Plate Reader - 2122-01_Inhibitor_SinglePoint_HTS_Activity,Screening,,
263,504577,2,2,,47202885,15546,Inactive,6325022.0,855842.0,,,HTS of Small Molecules that Regulate V-ATPase Proton Transport in Yeast using pHLuorin,Screening,,
264,504582,2,1,,47202885,15546,Inactive,124809271.0,811941.0,,,In vivo-based yeast HTS to detect compounds rescuing yeast growth/survival of Plasmodium Falciparum HSP40-mediated toxicity Measured in Whole Organism System Using Plate Reader - 2120-01_Inhibitor_SinglePoint_HTS_Activity,Screening,,
265,504621,1,1,,47202885,15546,Inactive,124809506.0,811999.0,,,Anti-Malarial Hsp90 Inhibitors Measured in Microorganism System Using Plate Reader - 2121-01_Inhibitor_SinglePoint_HTS_Activity_Set2,Screening,,
266,504634,1,1,,47202885,15546,Inactive,13236497.0,3361.0,,,Counterscreen for inverse agonists of OPRM1-OPRD1 heterodimerization: luminescence-based cell-based full-deck high throughput screening assay to identify inverse agonists of 5-hydroxytryptamine (serotonin) 5A receptor (HTR5A),Screening,,
267,504648,1,1,,47202885,15546,Inactive,,,,Potency,Nrf2 qHTS screen for inhibitors: counterscreen for cytotoxicity,Confirmatory,,
268,504651,1,1,,47202885,15546,Inactive,4503383.0,1812.0,,,Potentiators of Human D1 Dopamine Receptor: qHTS,Screening,,
269,504652,1,1,,47202885,15546,Inactive,4503383.0,1812.0,,,Antagonist of Human D 1 Dopamine Receptor: qHTS,Screening,,
270,504660,1,1,,47202885,15546,Inactive,4503383.0,1812.0,,,Allosteric Agonists of the Human D1 Dopamine Receptor: qHTS,Screening,,
271,504690,1,3,,47202885,15546,Inactive,12381848.0,,,,uHTS identification of small molecule inhibitors of Plasmodium falciparum Glucose-6-phosphate dehydrogenase via a fluorescence intensity assay,Screening,,
272,504692,2,2,,47202885,15546,Inactive,13236497.0,3361.0,,,Counterscreen for agonists of OPRM1-OPRD1 heterodimerization: luminescence-based cell-based full-deck high throughput screening assay to identify agonists of 5-hydroxytryptamine (serotonin) 5A receptor (HTR5A),Screening,,
273,504700,1,1,,47202885,15546,Inactive,46909587.0,5567.0,,,Fluorescence polarization-based biochemical primary high throughput screening assay to identify activators of the Protein Kinase A-R2B (PKA-R2B) complex,Screening,,
274,504700,1,1,,47202885,15546,Inactive,47132585.0,5577.0,,,Fluorescence polarization-based biochemical primary high throughput screening assay to identify activators of the Protein Kinase A-R2B (PKA-R2B) complex,Screening,,
275,504707,1,1,,47202885,15546,Inactive,6755076.0,18749.0,,,Fluorescence polarization-based biochemical primary high throughput screening assay to identify activators of the Protein Kinase A-R1A (PKA-R1A) complex,Screening,,
276,504707,1,1,,47202885,15546,Inactive,115496662.0,615074.0,,,Fluorescence polarization-based biochemical primary high throughput screening assay to identify activators of the Protein Kinase A-R1A (PKA-R1A) complex,Screening,,
277,504708,1,1,,47202885,15546,Inactive,156151420.0,80201.0,,,Single concentration confirmation of activators of hexokinase domain containing  I (HKDC1),Screening,,
278,504710,1,1,,47202885,15546,Inactive,156151420.0,80201.0,,,Single concentration confirmation of inhibitors of hexokinase domain containing  I (HKDC1),Screening,,
279,504720,1,1,,47202885,15546,Inactive,16130689.0,947252.0,,,uHTS identification of MazEF TA System activators  via a fluorescence-based single-stranded RNase assay,Screening,,
280,504734,1,1,,47202885,15546,Inactive,194068499.0,54106.0,,,Fluorescence-based cell-based primary high throughput screening assay to identify inhibitors of TLR9-MyD88 binding.,Screening,,
281,504766,2,1,,47202885,15546,Inactive,5016090.0,190.0,,,"Luminescence-based primary cell-based high throughput screening assay to identify inhibitors of the orphan nuclear receptor subfamily 0, group B, member 1 (DAX1; NR0B1)",Screening,,
282,504770,1,2,,92238180,15546,Inactive,9657380.0,2612528.0,,,A screen for compounds that inhibit replication of Vibrio cholerae chromosome II,Other,,
283,504775,1,1,,47202885,15546,Inactive,14389423.0,20778.0,,,HTS using DiI-HDL to assay lipid transfer in ldlA[SR-BI] cells Measured in Cell-Based System Using Plate Reader - 2085-01_Activator_SinglePoint_HTS_Activity,Screening,,
284,504803,1,1,,47202885,15546,Inactive,121945198.0,,,,Fluorescence polarization-based primary biochemical high throughput screening assay to identify inhibitors of the HTRA serine peptidase 1 (HTRA1),Screening,,
285,504810,1,2,,47202885,15546,Inactive,118341367.0,7253.0,,,Antagonists of the Thyroid Stimulating Hormone Receptor: HTS campaign,Screening,20427476.0,
