,AID,AID Version,AID Revision,Panel Member ID,SID,CID,Bioactivity Outcome,Target GI,Target GeneID,Activity Value [uM],Activity Name,Assay Name,Bioassay Type,PubMed ID,RNAi
644,624297,1,1,,85148657,904,Inactive,7705682.0,51053.0,,Potency,A quantitative high throughput screen for small molecules that induce DNA re-replication in SW480 colon adenocarcinoma cells.,Confirmatory,,
645,624304,1,2,,85148657,904,Inactive,25148072.0,177343.0,,,uHTS identification of SKN-1 Inhibitors in a fluoresence assay,Screening,,
646,624330,1,2,,85148657,904,Inactive,21361397.0,29127.0,,IC50,Discovery of small molecule inhibitors of the oncogenic and cytokinetic protein MgcRacGAP -  Primary and Confirmatory Screens,Confirmatory,,
647,624349,1,2,,92124511,904,Inactive,,,,,A screen for compounds that inhibit liver stage malaria,Other,,
648,624349,1,2,,92307701,904,Inactive,,,,,A screen for compounds that inhibit liver stage malaria,Other,,
649,624352,1,1,,85148657,904,Inactive,40254439.0,2034.0,,,uHTS identification of HIF-2a Inhibitors in a luminesence assay,Screening,,
650,624354,1,1,,85148657,904,Inactive,224494019.0,8795.0,,,uHTS identification of Caspase-8 TRAIL sensitizers in a luminesence assay,Screening,,
651,624377,1,1,,85148657,904,Inactive,351542238.0,50807.0,,,"Fluorescence polarization-based biochemical primary high throughput screening assay to identify inhibitors of ArfGAP with SH3 domain, ankyrin repeat and PH domain 1 (ASAP1)",Screening,,
652,624414,1,1,,85148657,904,Inactive,10092597.0,57192.0,,,qHTS for Agonists of the Human Mucolipin Transient Receptor Potential 1 (TRPML1),Screening,,
653,624415,1,2,,85148657,904,Inactive,10092597.0,57192.0,,,qHTS for Inhibitors of the Human Mucolipin Transient Receptor Potential 1 (TRPML1),Screening,,
654,624416,1,1,,85148657,904,Inactive,9629363.0,155971.0,,,"TRFRET-based biochemical primary high throughput screening assay to identify small molecules that bind to the HIV-1-gp120 binding antibody, PG9",Screening,,
655,624417,1,1,,85148657,904,Inactive,1724069.0,2740.0,,Potency,qHTS of GLP-1 Receptor Inverse Agonists (Inhibition Mode),Confirmatory,,
656,624418,1,1,,85148657,904,Inactive,,,,Potency,qHTS of GLP-1 Receptor Inverse Agonists: Cytotox Screen,Confirmatory,,
657,624463,1,1,,85148657,904,Inactive,4503385.0,1813.0,,,Beta-Arrestin HTS for Positive Allosteric Modulators of the Human D2 Dopamine Receptor: Antagonists,Other,,
658,624464,1,1,,85148657,904,Inactive,4503385.0,1813.0,,,Beta-Arrestin HTS for Positive Allosteric Modulators of the Human D2 Dopamine Receptor: Potentiators,Other,,
659,624465,1,1,,85148657,904,Inactive,4503385.0,1813.0,,,Beta-Arrestin HTS for Positive Allosteric Modulators of the Human D2 Dopamine Receptor: Agonists,Other,,
660,624466,1,3,,85148657,904,Inactive,21264324.0,134864.0,,,Fluorescence-based cell-based primary high throughput screening assay to identify antagonists of the human trace amine associated receptor 1 (TAAR1),Screening,,
661,624467,1,1,,85148657,904,Inactive,21264324.0,134864.0,,,Fluorescence-based cell-based primary high throughput screening assay to identify agonists of the human trace amine associated receptor 1 (TAAR1),Screening,,
662,624483,1,1,,85148657,904,Inactive,,,,,Counterscreen of compound fluorescence effects on High-throughput multiplex microsphere screening for inhibitors of toxin protease,Screening,,
663,651550,1,1,,85148657,904,Inactive,60391226.0,207.0,,,HTS Assay for Inhibitors of Akt Phophorylation: Primary Screen,Screening,,
664,651560,1,1,,85148657,904,Inactive,1709543.0,52.0,,,"uHTS identification of small molecule inhibitors of Low Molecular Weight Protein Tyrosine Phosphatase, LMPTP, via a fluorescence intensity assay",Screening,,
665,651572,1,2,,85148657,904,Inactive,21489979.0,246310.0,,,Fluorescence polarization-based biochemical primary high throughput screening assay to identify inhibitors of ADP-ribosylation factor GTPase activating protein 1 (ARFGAP1),Screening,,
666,651582,1,1,,85148657,904,Inactive,,,,,uHTS identification of small molecule Triacylglycerol inhbitors in a fluoresence assay,Screening,,
667,651602,1,1,,85148657,904,Inactive,16130723.0,947287.0,,,Absorbance-based primary bacterial cell-based high throughput screening assay to identify inhibitors of RecBCD (with phage),Screening,,
668,651602,1,1,,85148657,904,Inactive,16130724.0,947286.0,,,Absorbance-based primary bacterial cell-based high throughput screening assay to identify inhibitors of RecBCD (with phage),Screening,,
669,651602,1,1,,85148657,904,Inactive,16130726.0,947294.0,,,Absorbance-based primary bacterial cell-based high throughput screening assay to identify inhibitors of RecBCD (with phage),Screening,,
670,651610,2,1,,85148657,904,Inactive,,,,,HIV entry: Env-mediated Cell Fusion Measured in Cell-Based System Using Plate Reader - 7013-01_Inhibitor_SinglePoint_HTS_Activity,Screening,,
671,651631,4,1,,144204664,904,Inactive,269849759.0,7157.0,,Potency-Replicate_1,qHTS assay for small molecule agonists of the p53 signaling pathway,Confirmatory,,
672,651631,4,1,,144208123,904,Inactive,269849759.0,7157.0,,Potency-Replicate_1,qHTS assay for small molecule agonists of the p53 signaling pathway,Confirmatory,,
673,651632,4,1,,144204664,904,Inactive,296439460.0,79915.0,,Potency-Replicate_1,qHTS assay for small molecules that induce genotoxicity in human embryonic kidney cells expressing luciferase-tagged ATAD5,Confirmatory,,
674,651632,4,1,,144208123,904,Inactive,296439460.0,79915.0,,Potency-Replicate_1,qHTS assay for small molecules that induce genotoxicity in human embryonic kidney cells expressing luciferase-tagged ATAD5,Confirmatory,,
675,651633,4,1,,144204664,904,Inactive,,,,Potency-Replicate_1,qHTS assay for small molecule agonists of the p53 signaling pathway - cell viability,Confirmatory,,
676,651633,4,1,,144208123,904,Inactive,,,,Potency-Replicate_1,qHTS assay for small molecule agonists of the p53 signaling pathway - cell viability,Confirmatory,,
677,651634,4,1,,144204664,904,Inactive,,,,Potency-Replicate_1,qHTS assay for small molecules that induce genotoxicity in human embryonic kidney cells expressing luciferase-tagged ATAD5 - cell viability,Confirmatory,,
678,651634,4,1,,144208123,904,Inactive,,,68.9385,Potency-Replicate_1,qHTS assay for small molecules that induce genotoxicity in human embryonic kidney cells expressing luciferase-tagged ATAD5 - cell viability,Confirmatory,,
679,651635,1,3,,85148657,904,Inactive,171543895.0,6311.0,,Potency,qHTS for Inhibitors of ATXN expression,Confirmatory,,
680,651636,1,1,,85148657,904,Inactive,4826706.0,1880.0,,,uHTS identification of small molecule antagonists of the EBI2 receptor via a luminescent beta-arrestin assay,Screening,,
681,651640,1,1,,85148657,904,Inactive,,,,,DENV2 CPE-Based HTS Measured in Cell-Based and Microorganism Combination System Using Plate Reader - 2149-01_Other_SinglePoint_HTS_Activity,Screening,,
682,651644,1,1,,85148657,904,Inactive,28872817.0,155807.0,,Potency,qHTS Assay for Inhibitors of the HIV-1 protein Vpr,Confirmatory,,
683,651647,1,1,,85148657,904,Inactive,4826834.0,4323.0,,,uHTS identification of inhibitors of MT1-MMP activation in a fluoresence assay,Screening,,
684,651654,1,1,,85148657,904,Inactive,,,,,HTS for the detection of C. neoformans cell lysis via adenylate kinase (AK) release Measured in Microorganism System Using Plate Reader - 2162-01_Inhibitor_SinglePoint_HTS_Activity,Screening,,
685,651658,1,1,,85148657,904,Inactive,10190672.0,27006.0,,,Small Molecule Inhibitors of FGF22-Mediated Excitatory Synaptogenesis & Epilepsy Measured in Biochemical System Using RT-PCR - 7012-01_Inhibitor_SinglePoint_HTS_Activity,Screening,,
686,651661,2,1,,85148657,904,Inactive,,,,,Luminescence Cell-Based Primary HTS to identify inhibitors of the oncoprotein EWS/Fli transcriptional activity Measured in Cell-Based System Using Plate Reader - 7014-01_Inhibitor_SinglePoint_HTS_Activity,Screening,,
687,651687,1,1,,85148657,904,Inactive,,,,,MLPCN PGC1a Modulators Measured in Cell-Based System Using Plate Reader - 2139-01_Inhibitor_SinglePoint_HTS_Activity,Screening,,
688,651699,1,1,,85148657,904,Inactive,4502169.0,8883.0,,,uHTS identification of inhibitors of cullin neddylation in a TR-FRET assay,Screening,,
689,651699,1,1,,85148657,904,Inactive,4507791.0,9040.0,,,uHTS identification of inhibitors of cullin neddylation in a TR-FRET assay,Screening,,
690,651702,1,2,,85148657,904,Inactive,,,,,Flow Cytometric HTS Screening for Inhibitors of Lytic Granule Exocytosis with MLPCN Compound Library,Screening,,
691,651704,2,1,,85148657,904,Inactive,156104889.0,4300.0,,,Inhibition of the MLL-AF4-AF9 Interaction in Pediatric Leukemia Measured in Biochemical System Using Plate Reader - 2160-01_Inhibitor_SinglePoint_HTS_Activity,Screening,,
692,651710,1,1,,85148657,904,Inactive,109637798.0,5893.0,,,FRET-based HTS for detection of RAD52 Inhibitors Measured in Biochemical System Using Plate Reader - 7018-01_Inhibitor_SinglePoint_HTS_Activity_Set2,Screening,,
693,651711,2,1,,85148657,904,Inactive,2501205.0,10130.0,,,Turbidometric Biochemical  Primary HTS  to identify inhibitors of ERp5 Measured in Biochemical System Using Plate Reader - 7002-01_Inhibitor_SinglePoint_HTS_Activity,Screening,,
694,651718,1,2,,85148657,904,Inactive,73586699.0,281312.0,,,Absorbance-based biochemical primary high throughput screening assay to identify inhibitors of Methionine sulfoxide reductase A (MsrA),Screening,,
695,651719,1,2,,85148657,904,Inactive,4503907.0,8484.0,,,Fluorescence-based cell-based primary high throughput screening assay to identify antagonists of the Galanin Receptor 3 (GalR3),Screening,,
696,651723,1,1,,85148657,904,Inactive,,,,,MLPCN PGC1a Modulators Measured in Cell-Based System Using Plate Reader - 2139-01_Activator_SinglePoint_HTS_Activity,Screening,,
697,651724,1,1,,85148657,904,Inactive,1730321.0,5932.0,,,qHTS Assay for Inhibitors of the CtBP/E1A Interaction,Screening,,
698,651725,1,1,,85148657,904,Inactive,1246761.0,6495.0,,,qHTS Assay for Inhibitors of the Six1/Eya2 Interaction,Screening,,
699,651741,1,1,,17389551,904,Inconclusive,20149576.0,4780.0,,Potency,qHTS assay for small molecule agonists of the antioxidant response element (ARE) signaling pathway,Confirmatory,,
700,651743,1,1,,17389551,904,Inactive,269849759.0,7157.0,,Potency,qHTS assay for small molecule activators of the p53 signaling pathway,Confirmatory,,
701,651749,1,1,,17389551,904,Inactive,34577122.0,4790.0,,Potency,qHTS assay for small molecule activators of the nuclear factor-kappa B (NF-kB) signaling pathway,Confirmatory,,
702,651751,1,1,,17389551,904,Inactive,5702233.0,84385.0,,Potency,qHTS assay for small molecule activators of the rat pregnane X receptor (rPXR) signaling pathway,Confirmatory,,
703,651754,1,1,,17389551,904,Inactive,,,,Potency,qHTS assay for small molecule disruptors of the mitochondrial membrane potential - 1 hr assay,Confirmatory,,
704,651755,1,1,,17389551,904,Inactive,,,,Potency,qHTS assay for small molecule disruptors of the mitochondrial membrane potential - 5 hr assay,Confirmatory,,
705,651757,1,1,,17389551,904,Inactive,25952111.0,7124.0,,Potency,qHTS assay to identify small molecules that stimulate Tumor Necrosis Factor-alpha (TNF-alpha) secretion,Confirmatory,,
706,651758,1,1,,17389551,904,Inconclusive,186368.0,3576.0,,Potency,qHTS assay to identify small molecules that stimulate interleukin-8 (IL-8) secretion,Confirmatory,,
707,651768,1,2,,85148657,904,Inactive,3719421.0,7486.0,,Potency,qHTS for Inhibitors of WRN Helicase,Confirmatory,,
708,651777,1,1,,17389551,904,Inactive,51095037.0,196.0,,Potency,qHTS assay for environmental chemicals that activate the Aryl hydrocarbon Receptor (AhR) signaling pathway,Confirmatory,,
709,651778,1,1,,17389551,904,Inactive,3041727.0,5465.0,,Potency,qHTS assay for small molecule agonists of the peroxisome proliferator-activated receptor alpha (PPARalpha) signaling pathway,Confirmatory,,
710,651800,1,1,,85148657,904,Inactive,2358024.0,6955.0,,,Fluorescence-based biochemical primary high throughput assay to identify inhibitors of T-cell receptor (TCR)-CD3 interaction using a TAMRA-labeled TCR probe,Screening,,
711,651802,1,1,,17389551,904,Inactive,49066040.0,6097.0,,Potency,qHTS assay for small molecule antagonists of the retinoid-related orphan receptor gamma (ROR-gamma) signaling pathway,Confirmatory,,
712,651819,1,1,,85148657,904,Inactive,83758679.0,153562.0,,,High-Throughput Screening for Modulators of Cytosolic Chaperonin Activity,Screening,,
713,651820,1,1,,85148657,904,Inactive,,,,Potency,qHTS Assay for Inhibitors of Hepatitis C Virus (HCV),Confirmatory,,
714,651821,2,4,,85148657,904,Inactive,,,,,Fluorescence-based biochemical primary high throughput screening assay to identify molecules that bind r(CAG) RNA repeats,Screening,,
715,651838,1,1,,17389551,904,Unspecified,,,,,qHTS assay for identifying genotoxic compounds that show differential cytotoxicity against a panel of isogenic chicken DT40 cell lines with known DNA damage response pathways,Other,,
716,651838,1,1,1.0,17389551,904,Inconclusive,,,,,qHTS assay for identifying genotoxic compounds that show differential cytotoxicity against a panel of isogenic chicken DT40 cell lines with known DNA damage response pathways,Other,,
717,651838,1,1,2.0,17389551,904,Inconclusive,,,,,qHTS assay for identifying genotoxic compounds that show differential cytotoxicity against a panel of isogenic chicken DT40 cell lines with known DNA damage response pathways,Other,,
718,651838,1,1,3.0,17389551,904,Inactive,,,,,qHTS assay for identifying genotoxic compounds that show differential cytotoxicity against a panel of isogenic chicken DT40 cell lines with known DNA damage response pathways,Other,,
719,651838,1,1,4.0,17389551,904,Inactive,,,,,qHTS assay for identifying genotoxic compounds that show differential cytotoxicity against a panel of isogenic chicken DT40 cell lines with known DNA damage response pathways,Other,,
720,651838,1,1,5.0,17389551,904,Inactive,,,,,qHTS assay for identifying genotoxic compounds that show differential cytotoxicity against a panel of isogenic chicken DT40 cell lines with known DNA damage response pathways,Other,,
721,651838,1,1,6.0,17389551,904,Inconclusive,,,,,qHTS assay for identifying genotoxic compounds that show differential cytotoxicity against a panel of isogenic chicken DT40 cell lines with known DNA damage response pathways,Other,,
722,651838,1,1,7.0,17389551,904,Inactive,,,,,qHTS assay for identifying genotoxic compounds that show differential cytotoxicity against a panel of isogenic chicken DT40 cell lines with known DNA damage response pathways,Other,,
723,651838,1,1,8.0,17389551,904,Inactive,,,,,qHTS assay for identifying genotoxic compounds that show differential cytotoxicity against a panel of isogenic chicken DT40 cell lines with known DNA damage response pathways,Other,,
724,651957,1,1,,85148657,904,Inactive,5729858.0,10499.0,,,Luminescence-based cell-based primary high throughput screening assay to identify inhibitors of the Steroid Receptor Coactivator 2 (SRC2; NCOA2),Screening,,
725,651958,1,1,,85148657,904,Inactive,76364066.0,2943075.0,,,Fluorescence-based biochemical high throughput screening primary assay to identify inhibitors of Crimean-Congo Hemorrhagic Fever (CCHF) viral ovarian tumor domain protease (vOTU): Pep-AMC substrate,Screening,,
726,651965,1,1,,85148657,904,Inactive,2668494.0,,,Potency,qHTS Assay for Activators of ClpP,Confirmatory,,
727,651999,1,1,,85148657,904,Inactive,38027923.0,10987.0,,,"uHTS identification of small molecule inhibitors of Csn-mediated Deneddylation of Cullin-Ring Ligases, vis a fluorescence polarization assay",Screening,,
728,652010,1,1,,85148657,904,Inactive,5016090.0,190.0,,,"Luminescence-based cell-based primary high throughput screening assay for inhibitors of the orphan nuclear receptor subfamily 0, group B, member 1 (DAX1; NR0B1): repression of SF-1 (NR5A1) activated StAR promoter by full-length DAX-1",Screening,,
729,652017,1,1,,85148657,904,Inactive,119579215.0,6595.0,,,"Luminescence-based cell-based primary high throughput screening assay to identify activators of the function of SWI/SNF related, matrix associated, actin dependent regulator of chromatin, subfamily a, member 2 (SMARCA2, BRM)",Screening,,
730,652025,1,1,,85148657,904,Inactive,7110653.0,16183.0,,Potency,qHTS of IL-2 Activators,Confirmatory,,
731,652039,1,1,,85148657,904,Inactive,21327705.0,5650.0,,,Fluorescence Intensity-based biochemical primary high throughput screening assay to identify activators of kallikrein-7 (K7) zymogen,Screening,,
732,652048,1,2,,85148657,904,Inactive,89191863.0,1814.0,,,qHTS of D3 Dopamine Receptor Agonist: qHTS,Screening,,
733,652048,1,2,,144204664,904,Inactive,89191863.0,1814.0,,,qHTS of D3 Dopamine Receptor Agonist: qHTS,Screening,,
734,652051,1,1,,85148657,904,Inactive,89191863.0,1814.0,,,qHTS of D3 Dopamine Receptor Potentiators: qHTS,Screening,,
735,652051,1,1,,144204664,904,Inactive,89191863.0,1814.0,,,qHTS of D3 Dopamine Receptor Potentiators: qHTS,Screening,,
736,652054,1,1,,85148657,904,Inactive,89191863.0,1814.0,,,qHTS of D3 Dopamine Receptor Antagonist: qHTS,Screening,,
737,652067,1,4,,85148657,904,Inactive,71987181.0,181263.0,,,Luminescence-based cell-based primary high throughput screening assay to identify activators of the DAF-12 from the parasite H. contortus (hcDAF-12),Screening,,
738,652104,1,1,,85148657,904,Inactive,20140568.0,23435.0,,Potency,qHTS of TDP-43 Inhibitors,Confirmatory,,
739,652105,1,1,,85148657,904,Inactive,18266879.0,5305.0,,Potency,qHTS for Inhibitors of phosphatidylinositol 5-phosphate 4-kinase (PI5P4K),Confirmatory,,
740,652106,1,1,,85148657,904,Inactive,586067.0,6622.0,,Potency,qHTS of alpha-syn Inhibitors,Confirmatory,,
741,652115,1,1,,85148657,904,Inactive,38258652.0,23408.0,,,MLPCN SirT-5 Measured in Biochemical System Using Imaging - 7044-01_Inhibitor_SinglePoint_HTS_Activity_Set5,Screening,,
742,652126,1,3,,85148657,904,Inactive,71987181.0,181263.0,,,Luminescence-based cell-based primary high throughput screening assay to identify activators of the DAF-12 from the parasite S. stercoralis (ssDAF-12),Screening,,
743,652154,1,1,,85148657,904,Inactive,998701.0,7849.0,,,HTS for PAX8 inhibitors using PAX8 luciferase reporter gene assay in RMG-I cells Measured in Cell-Based System Using Plate Reader - 7054-01_Inhibitor_SinglePoint_HTS_Activity,Screening,,
744,652162,2,1,,85148657,904,Inactive,126698238.0,4914074.0,,,C. difficile toxins: HTS for inhibitors of TcdB glycohydrolase activity Measured in Biochemical System Using Plate Reader - 7074-01_Inhibitor_SinglePoint_HTS_Activity,Screening,,
745,652163,1,1,,85148657,904,Inactive,47496637.0,6275.0,,,S100A4: HTS Measured in Biochemical System Using Plate Reader - 7045-01_Inhibitor_SinglePoint_HTS_Activity,Screening,,
746,652197,1,1,,85148657,904,Inactive,21315078.0,51752.0,,,MLPCN ERAP1 Measured in Biochemical System Using Plate Reader - 7016-01_Inhibitor_SinglePoint_HTS_Activity,Screening,,
747,652257,1,1,,85148657,904,Inactive,32425330.0,3276.0,,,Primary biochemical fluorescence polarization-based high throughput screening assay to identify inhibitors of protein arginine methyltransferase 1 (PRMT1),Screening,,
748,686940,1,1,,85148657,904,Inactive,14149746.0,7026.0,,,Luminescence-based cell-based primary high throughput screening assay to identify inhibitors of COUP-TFII (NR2F2),Screening,,
749,686964,1,1,,85148657,904,Inactive,21595776.0,8932.0,,,TRFRET-based biochemical primary high throughput screening assay to identify inhibitors of 5-meCpG-binding domain protein 2 (MBD2)-DBD binding to methylated oligonucleotide,Screening,,
750,686970,1,2,,85148657,904,Inactive,49168486.0,3417.0,,Potency,qHTS for induction of synthetic lethality in tumor cells producing 2HG: qHTS for the HT-1080-NT fibrosarcoma cell line,Confirmatory,,
751,686971,1,2,,85148657,904,Inactive,,,,Potency,qHTS for induction of synthetic lethality in tumor cells producing 2HG: qHTS for the HT-1080-IDH1KD cell line,Confirmatory,,
752,686978,1,1,,26747334,904,Inactive,79154014.0,55775.0,,Potency,qHTS for Inhibitors of human tyrosyl-DNA phosphodiesterase 1 (TDP1): qHTS in cells in absence of CPT,Confirmatory,,
753,686978,1,1,,85148657,904,Inactive,79154014.0,55775.0,,Potency,qHTS for Inhibitors of human tyrosyl-DNA phosphodiesterase 1 (TDP1): qHTS in cells in absence of CPT,Confirmatory,,
754,686978,1,1,,144204664,904,Inactive,79154014.0,55775.0,,Potency,qHTS for Inhibitors of human tyrosyl-DNA phosphodiesterase 1 (TDP1): qHTS in cells in absence of CPT,Confirmatory,,
755,686979,1,1,,26747334,904,Inactive,79154014.0,55775.0,,Potency,qHTS for Inhibitors of human tyrosyl-DNA phosphodiesterase 1 (TDP1): qHTS in cells in presence of CPT,Confirmatory,,
756,686979,1,1,,85148657,904,Inactive,79154014.0,55775.0,,Potency,qHTS for Inhibitors of human tyrosyl-DNA phosphodiesterase 1 (TDP1): qHTS in cells in presence of CPT,Confirmatory,,
757,686979,1,1,,144204664,904,Inactive,79154014.0,55775.0,,Potency,qHTS for Inhibitors of human tyrosyl-DNA phosphodiesterase 1 (TDP1): qHTS in cells in presence of CPT,Confirmatory,,
758,686992,2,1,,85148657,904,Inactive,187960042.0,6401.0,,,Identification of agents that induce E-selectin on human endothelial cells Measured in Cell-Based System Using Imaging - 2152-01_Activator_SinglePoint_HTS_Activity,Screening,,
759,687014,1,1,,85148657,904,Inactive,71987181.0,181263.0,,,Luminescence-based cell-based primary high throughput screening assay to identify agonists of the DAF-12 from the parasite H. glycines (hgDAF-12).,Screening,,
760,687016,1,1,,85148657,904,Inactive,115430235.0,29128.0,,,Counterscreen for inhibitors of 5-meCpG-binding domain protein 2 (MBD2): TRFRET-based biochemical primary high throughput screening assay to identify inhibitors of binding of ubiquitin-like with PHD and ring finger domains 1 (UHRF1) to methylated oligonucleotide,Screening,,
761,720504,1,1,,85148657,904,Inactive,21359873.0,5347.0,,Potency,qHTS for Inhibitors of PLK1-PDB (polo-like kinase 1 - polo-box domain): Primary Screen,Confirmatory,,
762,720508,1,1,,85148657,904,Inactive,28373962.0,,,,Fluorescence polarization-based biochemical primary high throughput screening assay to identify inhibitors that disrupt the binding of a cyclic peptide (Tn7) to the fibrin proteolytic product D-Dimer and fragment E complex [DD(E )],Screening,,
763,720509,1,1,,85148657,904,Inactive,28373962.0,,,,Fluorescence polarization-based biochemical primary high throughput screening assay to identify inhibitors that disrupt the binding of a cyclic peptide (Tn6) to the fibrin proteolytic product D-Dimer and fragment E complex [DD(E )],Screening,,
764,720511,1,1,,85148657,904,Inactive,89348172.0,1080.0,,,Identification of Small Molecule Correctors of the Cystic Fibrosis Transmembrane Conductance Regulator (CFTR) Delta508 Mutation Function in Human Bronchial Epithelial Cells. Measured in Cell-Based System Using Plate Reader - 7017-01_Other_SinglePoint_HTS_Activity,Screening,,
765,720516,2,1,,144204664,904,Inactive,296439460.0,79915.0,,ATAD5 Potency (uM),qHTS assay for small molecules that induce genotoxicity in human embryonic kidney cells expressing luciferase-tagged ATAD5: Summary,Summary,,
766,720516,2,1,,144208123,904,Inactive,296439460.0,79915.0,,ATAD5 Potency (uM),qHTS assay for small molecules that induce genotoxicity in human embryonic kidney cells expressing luciferase-tagged ATAD5: Summary,Summary,,
767,720532,1,1,,26747334,904,Inactive,420597.0,,,Potency,qHTS for Inhibitors of binding or entry into cells for Marburg Virus,Confirmatory,,
768,720532,1,1,,144204664,904,Inactive,420597.0,,,Potency,qHTS for Inhibitors of binding or entry into cells for Marburg Virus,Confirmatory,,
769,720533,1,1,,26747334,904,Inactive,,,,Potency,qHTS for Inhibitors of binding or entry into cells for Lassa Virus,Confirmatory,,
770,720533,1,1,,144204664,904,Inactive,,,,Potency,qHTS for Inhibitors of binding or entry into cells for Lassa Virus,Confirmatory,,
771,720542,1,2,,85148657,904,Inactive,23496270.0,810891.0,,Potency,qHTS for Inhibitors of AMA1-RON; Towards Development of Antimalarial Drug Lead: Primary Screen,Confirmatory,,
772,720543,1,1,,85148657,904,Inactive,326937491.0,105501.0,,,Fluorescence polarization-based biochemical high throughput primary assay to identify inhibitors of alpha/beta hydrolase domain containing 4 (ABHD4).,Screening,,
773,720551,1,2,,85148657,904,Inactive,342840031.0,3757.0,,Potency,qHTS for Inhibitors of KCHN2 3.1: Wildtype qHTS,Confirmatory,,
774,720552,2,1,,144204664,904,Inactive,269849759.0,7157.0,,Ratio Potency (uM),qHTS assay for small molecule agonists of the p53 signaling pathway: Summary,Summary,,
775,720552,2,1,,144208123,904,Inactive,269849759.0,7157.0,,Ratio Potency (uM),qHTS assay for small molecule agonists of the p53 signaling pathway: Summary,Summary,,
776,720553,1,2,,85148657,904,Inactive,342840031.0,3757.0,,Potency,qHTS for Inhibitors of KCHN2 3.1: Mutant qHTS,Confirmatory,,
777,720579,2,1,,26747334,904,Inactive,222762.0,3707576.0,,Potency,qHTS for Stage-Specific Inhibitors of Vaccinia Orthopoxvirus: mCherry Reporter Primary qHTS,Confirmatory,,
778,720579,2,1,,85148657,904,Inactive,222762.0,3707576.0,,Potency,qHTS for Stage-Specific Inhibitors of Vaccinia Orthopoxvirus: mCherry Reporter Primary qHTS,Confirmatory,,
779,720580,1,1,,26747334,904,Inactive,222762.0,3707576.0,,Potency,qHTS for Stage-Specific Inhibitors of Vaccinia Orthopoxvirus: Venus Reporter Primary qHTS,Confirmatory,,
780,720580,1,1,,85148657,904,Inactive,222762.0,3707576.0,,Potency,qHTS for Stage-Specific Inhibitors of Vaccinia Orthopoxvirus: Venus Reporter Primary qHTS,Confirmatory,,
781,720582,1,1,,85148657,904,Inactive,2393947.0,102.0,,,QFRET-based biochemical primary high throughput screening assay to identify exosite inhibitors of ADAM10.,Screening,,
782,720596,1,1,,85148657,904,Inactive,4506113.0,5621.0,,,TRFRET-based cell-based primary high throughput screening assay to identify inhibitors of cell surface Prion Protein (PRPC),Screening,,
