,AID,AID Version,AID Revision,Panel Member ID,SID,CID,Bioactivity Outcome,Target GI,Target GeneID,Activity Value [uM],Activity Name,Assay Name,Bioassay Type,PubMed ID,RNAi
0,155,1,1,,73469,904,Inactive,,,,,NCI Yeast Anticancer Drug Screen. Data for the rad50 strain,Other,,
1,157,1,1,,73469,904,Inactive,,,,,NCI Yeast Anticancer Drug Screen. Data for the mec2-1 strain,Other,,
2,161,1,1,,73469,904,Inactive,,,,,NCI Yeast Anticancer Drug Screen. Data for the sgs1 mgt1 strain,Other,,
3,165,1,1,,73469,904,Inactive,,,,,NCI Yeast Anticancer Drug Screen. Data for the cln2 rad14 strain,Other,,
4,167,1,1,,73469,904,Inactive,,,,,NCI Yeast Anticancer Drug Screen. Data for the bub3 strain,Other,,
5,175,1,1,,73469,904,Inactive,,,,,NCI Yeast Anticancer Drug Screen. Data for the mlh1 rad18 strain,Other,,
6,179,1,1,,73469,904,Inactive,,,,,NCI AIDS Antiviral Assay,Confirmatory,,
7,421,1,3,,17389551,904,Inactive,,,,,Cell Viability - BJ,Confirmatory,,
8,426,1,2,,17389551,904,Inactive,,,,,Cell Viability - Jurkat,Confirmatory,,
9,427,1,1,,17389551,904,Inactive,,,,,Cell Viability - Hek293,Confirmatory,,
10,433,1,1,,17389551,904,Inactive,,,,,Cell Viability - HepG2,Confirmatory,,
11,434,1,2,,17389551,904,Inactive,,,,,Cell Viability - MRC5,Confirmatory,,
12,435,1,2,,17389551,904,Inactive,,,,,Cell Viability - SK-N-SH,Confirmatory,,
13,445,3,1,,17389551,904,Inactive,10092619.0,4792.0,,,IkB Signaling,Confirmatory,,
14,530,1,1,,17389551,904,Inactive,2499604.0,26414.0,,,JNK3 AlphaScreen Assay,Confirmatory,,
15,540,1,1,,17389551,904,Inactive,,,,,Cell Viability - N2a,Confirmatory,,
16,541,1,1,,17389551,904,Inactive,,,,,Cell Viability - NIH 3T3,Confirmatory,,
17,542,1,1,,17389551,904,Inactive,,,,,Cell Viability - HUV-EC-C,Confirmatory,,
18,543,1,1,,17389551,904,Inactive,,,,,Cell Viability - H-4-II-E,Confirmatory,,
19,544,2,1,,17389551,904,Inactive,,,,,Cell Viability - SH-SY5Y,Confirmatory,,
20,545,1,1,,17389551,904,Inactive,,,,,Cell Viability - Renal Proximal Tubule,Confirmatory,,
21,546,1,1,,17389551,904,Inactive,,,,,Cell Viability - Mesenchymal,Confirmatory,,
22,584,1,3,,17389551,904,Inactive,119389684.0,,,,Promiscuous and Specific Inhibitors of AmpC Beta-Lactamase (assay with detergent),Confirmatory,,
23,585,1,4,,17389551,904,Inactive,119389684.0,,,,Promiscuous and Specific Inhibitors of AmpC Beta-Lactamase (assay without detergent),Confirmatory,,
24,595,1,3,,17389551,904,Inactive,,,,,qHTS Assay for Disrupters of an Hsp90 Co-Chaperone Interaction,Confirmatory,,
25,596,1,2,,17389551,904,Inactive,92096784.0,4137.0,,,qHTS Assay for Tau Filament Binding,Confirmatory,,
26,603,1,2,,17389551,904,Inactive,,,,,qHTS Assay for Inhibitors of DNA Polymerase III Holoenzyme System,Confirmatory,,
27,605,1,2,,17389551,904,Inactive,84028058.0,,,,qHTS Assay for Inhibitors of YjeE,Confirmatory,,
28,654,1,1,,17389551,904,Inactive,,,,,Cellular Toxicity (caspase-3) HepG2,Confirmatory,,
29,655,1,1,,17389551,904,Inactive,,,,,Cellular Toxicity (caspase-3) Jurkat,Confirmatory,,
30,656,1,1,,17389551,904,Inactive,,,,,Cellular Toxicity (caspase-3) HUV-EC-C,Confirmatory,,
31,657,1,1,,17389551,904,Inactive,,,,,Cellular Toxicity (caspase-3) SHSY5Y,Confirmatory,,
32,658,1,1,,17389551,904,Inactive,,,,,Cellular Toxicity (caspase-3) BJ,Confirmatory,,
33,659,1,1,,17389551,904,Inactive,,,,,Cellular Toxicity (caspase-3) MRC-5,Confirmatory,,
34,660,1,1,,17389551,904,Inactive,,,,,Cellular Toxicity (caspase-3) Mesangial,Confirmatory,,
35,661,1,1,,17389551,904,Inactive,,,,,Cellular Toxicity (caspase-3) SK-N-SH,Confirmatory,,
36,662,1,1,,17389551,904,Inactive,,,,,Cell signaling CRE-BLA (Fsk stim),Confirmatory,,
37,663,1,1,,17389551,904,Inactive,,,,,Cellular Toxicity (caspase-3) H-4-II-E,Confirmatory,,
38,664,1,1,,17389551,904,Inactive,,,,,Cellular Toxicity (caspase-3) Hek293,Confirmatory,,
39,665,1,1,,17389551,904,Inactive,,,,,Cellular Toxicity (caspase-3) N2a,Confirmatory,,
40,666,1,1,,17389551,904,Inactive,,,,,Cellular Toxicity (caspase-3) NIH 3T3,Confirmatory,,
41,667,1,1,,17389551,904,Inactive,,,,,Cellular Toxicity (caspase-3) Renal Proximal Tubule,Confirmatory,,
42,875,1,2,,17389551,904,Inactive,159162802.0,,,Potency,qHTS Assay for Inhibitors of BRCT-Phosphoprotein Interaction (Green Fluorophore),Confirmatory,,
43,880,2,1,,17389551,904,Inactive,3290016.0,6002.0,,,qHTS Assay for Inhibitors of RGS12 GoLoco Motif Activity (Red Fluorophore),Confirmatory,,
44,880,2,1,,17389551,904,Inactive,33946324.0,2770.0,,,qHTS Assay for Inhibitors of RGS12 GoLoco Motif Activity (Red Fluorophore),Confirmatory,,
45,880,2,1,,26747334,904,Inactive,3290016.0,6002.0,,,qHTS Assay for Inhibitors of RGS12 GoLoco Motif Activity (Red Fluorophore),Confirmatory,,
46,880,2,1,,26747334,904,Inactive,33946324.0,2770.0,,,qHTS Assay for Inhibitors of RGS12 GoLoco Motif Activity (Red Fluorophore),Confirmatory,,
47,881,2,2,,17389551,904,Inactive,317373425.0,247.0,,Potency,qHTS Assay for Inhibitors of 15-hLO-2 (15-human lipoxygenase 2),Confirmatory,,
48,884,1,2,,17389551,904,Inactive,13435386.0,1576.0,,Potency,qHTS Assay for Inhibitors and Substrates of Cytochrome P450 3A4,Confirmatory,,
49,885,1,2,,17389551,904,Inactive,13435386.0,1576.0,,Potency,qHTS Assay for Activators of Cytochrome P450 3A4,Confirmatory,,
50,886,1,2,,17389551,904,Active,122921310.0,,31.6228,Potency,"qHTS Assay for Inhibitors of HADH2 (Hydroxyacyl-Coenzyme A Dehydrogenase, Type II)",Confirmatory,,
51,886,1,2,,17389551,904,Active,122921311.0,,31.6228,Potency,"qHTS Assay for Inhibitors of HADH2 (Hydroxyacyl-Coenzyme A Dehydrogenase, Type II)",Confirmatory,,
52,887,1,2,,17389551,904,Inactive,1832253.0,246.0,,Potency,qHTS Assay for Inhibitors of 15-hLO (15-human lipoxygenase),Confirmatory,,
53,889,1,3,,17389551,904,Inactive,1730092.0,840.0,,Potency,qHTS Assay for Allosteric/Competitive Inhibitors of Caspase-7,Confirmatory,,
54,892,1,2,,17389551,904,Inactive,159162802.0,,,Potency,qHTS Assay for Inhibitors of BRCT-Phosphoprotein Interaction (Red Fluorophore),Confirmatory,,
55,893,1,2,,17389551,904,Inactive,122921310.0,,,Potency,"qHTS Assay for Inhibitors of HSD17B4, hydroxysteroid (17-beta) dehydrogenase 4",Confirmatory,,
56,893,1,2,,17389551,904,Inactive,122921311.0,,,Potency,"qHTS Assay for Inhibitors of HSD17B4, hydroxysteroid (17-beta) dehydrogenase 4",Confirmatory,,
57,894,2,1,,17389551,904,Inactive,31542939.0,3248.0,,Potency,qHTS Assay for Inhibitors of HPGD (15-Hydroxyprostaglandin Dehydrogenase),Confirmatory,,
58,894,2,1,,26747334,904,Inactive,31542939.0,3248.0,,Potency,qHTS Assay for Inhibitors of HPGD (15-Hydroxyprostaglandin Dehydrogenase),Confirmatory,,
59,900,1,3,,17389551,904,Inactive,15431328.0,834.0,,Potency,qHTS Assay for Allosteric/Competitive Inhibitors of Caspase-1,Confirmatory,,
60,902,1,2,,17389551,904,Inactive,120407068.0,7157.0,,Potency,qHTS Screen for Compounds that Selectively Target Cancer Cells with p53 Mutations: Cytotoxicity of p53ts Cells at the Nonpermissive Temperature,Confirmatory,,
61,910,1,2,,17389551,904,Inactive,4504349.0,3043.0,,Potency,Confirmation and Secondary Assay for Modulators of Hemoglobin Beta Chain Splicing at IVS2 654 locus,Confirmatory,,
62,912,1,2,,17389551,904,Inactive,21392848.0,,,Potency,qHTS Assay for Anthrax Lethal Toxin Internalization,Confirmatory,,
63,921,1,2,,17389551,904,Inactive,,,,Potency,Cell Viability - LYMP2-001,Confirmatory,,
64,923,1,2,,17389551,904,Inactive,,,,Potency,qHTS Assay for Allosteric/Competitive Inhibitors of Caspase-1: Spectroscopic Profiling in AFC Spectral Region,Confirmatory,,
65,924,1,2,,17389551,904,Inactive,120407068.0,7157.0,,Potency,qHTS Screen for Compounds that Selectively Target Cancer Cells with p53 Mutations: Cytotoxicity of p53ts Cells at the Permissive Temperature,Confirmatory,,
66,925,1,2,,17389551,904,Inactive,4504349.0,3043.0,,Potency,qHTS Assay for Modulators of Hemoglobin Beta Chain Splicing,Confirmatory,,
67,926,1,2,,17389551,904,Inactive,38016895.0,7253.0,,Potency,qHTS Assay for Agonists of the Thyroid Stimulating Hormone Receptor,Confirmatory,,
68,927,1,3,,17389551,904,Inactive,188528692.0,9099.0,,Potency,qHTS Assay for Inhibitors of Ubiquitin-specific Protease USP2a,Confirmatory,,
69,930,1,2,,17389551,904,Inactive,4504349.0,3043.0,,Potency,Confirmation and Secondary Assay for Modulators of Hemoglobin Beta Chain Splicing at IVS2 705 locus,Confirmatory,,
70,938,1,2,,17389551,904,Inactive,38016895.0,7253.0,,Potency,qHTS Assay for Agonists of the Thyroid Stimulating Hormone Receptor: Activators of Intracellular cAMP Concentrations in Parental HEK 293,Confirmatory,,
71,940,1,2,,26612214,904,Inactive,31881630.0,5732.0,,,Modulators of the EP2 prostaglandin E2 receptor - Primary Screening,Screening,,
72,946,1,2,,17389551,904,Inactive,,,,Potency,MultiTox-Fluor Cytotoxicity Assay - LYMP1-001 - Dead Cells,Confirmatory,,
73,947,1,2,,17389551,904,Inactive,,,,Potency,MultiTox-Fluor Cytotoxicity Assay - LYMP1-001 - Live Cells,Confirmatory,,
74,948,1,2,,17389551,904,Inactive,,,,Potency,Cell Viability - LYMP1-002 - Assay at 16 hr,Confirmatory,,
75,955,1,2,,17389551,904,Inactive,,,,Potency,MultiTox-Fluor Cytotoxicity Assay - LYMP1-002 - Live Cells,Confirmatory,,
76,960,1,2,,17389551,904,Inactive,,,,Potency,MultiTox-Fluor Cytotoxicity Assay - LYMP1-002 - Dead Cells,Confirmatory,,
77,961,1,2,,17389551,904,Inactive,,,,Potency,MultiTox-Fluor Cytotoxicity Assay - LYMP1-003 - Dead Cells,Confirmatory,,
78,962,1,2,,17389551,904,Inactive,,,,Potency,MultiTox-Fluor Cytotoxicity Assay - LYMP1-003 - Live Cells,Confirmatory,,
79,963,1,2,,17389551,904,Inactive,,,,Potency,Cell Viability - LYMP1-003 - Assay at 24 hr,Confirmatory,,
80,964,1,2,,17389551,904,Inactive,,,,Potency,Cell Viability - LYMP1-003 - Assay at 40 hr,Confirmatory,,
81,965,1,2,,17389551,904,Inactive,,,,Potency,Cell Viability - LYMP2-003,Confirmatory,,
82,966,1,2,,17389551,904,Inactive,,,,Potency,Cell Viability - LYMP2-004,Confirmatory,,
83,967,1,2,,17389551,904,Inactive,,,,Potency,Cell Viability - LYMP2-005,Confirmatory,,
84,968,1,2,,17389551,904,Inactive,,,,Potency,Cell Viability - LYMP2-009,Confirmatory,,
85,969,1,2,,17389551,904,Inactive,,,,Potency,Cell Viability - LYMP2-011,Confirmatory,,
86,970,1,2,,17389551,904,Inactive,,,,Potency,Cell Viability - LYMP2-013,Confirmatory,,
87,971,1,2,,17389551,904,Inactive,,,,Potency,Cell Viability - LYMP2-015,Confirmatory,,
88,972,1,2,,17389551,904,Inactive,,,,Potency,Cell Viability - LYMP2-017,Confirmatory,,
89,973,1,2,,17389551,904,Inactive,,,,Potency,Cell Viability - LYMP2-019,Confirmatory,,
90,974,1,2,,17389551,904,Inactive,,,,Potency,Cell Viability - LYMP2-021,Confirmatory,,
91,975,1,2,,17389551,904,Inactive,,,,Potency,Cell Viability - LYMP2-023,Confirmatory,,
92,976,1,2,,17389551,904,Inactive,,,,Potency,Cell Viability - LYMP2-025,Confirmatory,,
93,977,1,2,,17389551,904,Inactive,,,,Potency,Cell Viability - LYMP2-002,Confirmatory,,
94,978,1,2,,17389551,904,Inactive,,,,Potency,Cell Viability - LYMP2-006,Confirmatory,,
95,979,1,2,,17389551,904,Inactive,,,,Potency,Cell Viability - LYMP2-007,Confirmatory,,
96,980,1,2,,17389551,904,Inactive,,,,Potency,Cell Viability - LYMP2-008,Confirmatory,,
97,981,1,2,,17389551,904,Inactive,,,,Potency,Cell Viability - LYMP2-010,Confirmatory,,
98,982,1,2,,17389551,904,Inactive,,,,Potency,Cell Viability - LYMP2-012,Confirmatory,,
99,983,1,2,,17389551,904,Inactive,,,,Potency,Cell Viability - LYMP2-014,Confirmatory,,
100,984,1,2,,17389551,904,Inactive,,,,Potency,Cell Viability - LYMP2-016,Confirmatory,,
101,985,1,2,,17389551,904,Inactive,,,,Potency,Cell Viability - LYMP2-018,Confirmatory,,
102,986,1,2,,17389551,904,Inactive,,,,Potency,Cell Viability - LYMP2-020,Confirmatory,,
103,987,1,2,,17389551,904,Inactive,,,,Potency,Cell Viability - LYMP2-022,Confirmatory,,
104,988,1,2,,17389551,904,Inactive,,,,Potency,Cell Viability - LYMP2-024,Confirmatory,,
105,989,1,2,,17389551,904,Inactive,,,,Potency,Cell Viability - LYMP2-026,Confirmatory,,
106,993,1,2,,17389551,904,Inactive,,,,Potency,Cell Viability - LYMP1-002 - Assay at 24 hr,Confirmatory,,
107,994,1,2,,17389551,904,Inactive,,,,Potency,Cell Viability - LYMP1-002 - Assay at 40 hr,Confirmatory,,
108,995,1,2,,17389551,904,Inactive,66932916.0,5594.0,,Potency,qHTS Assay for Inhibitors of the ERK Signaling Pathway using a Homogeneous Screening Assay,Confirmatory,,
109,1030,2,1,,17389551,904,Inactive,30582681.0,216.0,,Potency,qHTS Assay for Inhibitors of Aldehyde Dehydrogenase 1 (ALDH1A1),Confirmatory,,
110,1030,2,1,,26747334,904,Inactive,30582681.0,216.0,,Potency,qHTS Assay for Inhibitors of Aldehyde Dehydrogenase 1 (ALDH1A1),Confirmatory,,
111,1195,1,2,,48415503,904,Active,,,,,DSSTox (FDAMDD) FDA Maximum (Recommended) Daily Dose Database,Other,,
112,1379,1,2,,26747334,904,Inactive,1669525.0,,,Potency,Counterscreen for Luciferase (Kinase-Glo TM) Inhibition,Confirmatory,,
113,1422,1,1,,26612214,904,Inactive,31881630.0,5732.0,,,Inhibitors of the EP2 Prostaglandin E2 Receptor - Primary Screen,Screening,,
114,1452,1,1,,17389551,904,Inactive,154426292.0,239.0,,Potency,qHTS Assay for Inhibitors of 12-hLO (12-human lipoxygenase),Confirmatory,,
115,1454,1,1,,26747334,904,Inactive,66932916.0,5594.0,,Potency,qHTS Assay for Inhibitors of the ERK Signaling Pathway using a Homogeneous Screening Assay; Stimulation with EGF,Confirmatory,,
116,1457,1,1,,17389551,904,Inactive,44888968.0,83523.0,,Potency,qHTS Assay for Identifying the Cell-Membrane Permeable IMPase Inhibitors: Potentiation with Lithium,Confirmatory,,
117,1457,1,1,,26747334,904,Inactive,44888968.0,83523.0,,Potency,qHTS Assay for Identifying the Cell-Membrane Permeable IMPase Inhibitors: Potentiation with Lithium,Confirmatory,,
118,1458,1,1,,17389551,904,Inactive,10937869.0,6607.0,,Potency,qHTS Assay for Enhancers of SMN2 Splice Variant Expression,Confirmatory,,
119,1458,1,1,,26747334,904,Inactive,10937869.0,6607.0,,Potency,qHTS Assay for Enhancers of SMN2 Splice Variant Expression,Confirmatory,,
120,1460,1,3,,26747334,904,Inactive,92096784.0,4137.0,,Potency,"qHTS for Inhibitors of Tau Fibril Formation, Thioflavin T Binding",Confirmatory,,
121,1463,1,1,,26747334,904,Inactive,,,,Potency,"Counterscreen qHTS for Inhibitors of Tau Fibril Formation, Fluorescence Polarization",Confirmatory,,
122,1467,1,3,,26747334,904,Inactive,757912.0,2717.0,,Potency,qHTS Assay for Inhibitors of Human alpha-Galactosidase at pH 4.5.,Confirmatory,,
123,1468,1,1,,26747334,904,Inactive,92096784.0,4137.0,,Potency,"qHTS for Inhibitors of Tau Fibril Formation, Fluorescence Polarization",Confirmatory,,
124,1469,1,1,,17389551,904,Inactive,189491771.0,7068.0,,Potency,qHTS for Inhibitors of the Interaction of Thyroid Hormone Receptor and Steroid Receptor Coregulator 2,Confirmatory,,
125,1469,1,1,,26747334,904,Inactive,189491771.0,7068.0,,Potency,qHTS for Inhibitors of the Interaction of Thyroid Hormone Receptor and Steroid Receptor Coregulator 2,Confirmatory,,
126,1471,2,1,,17389551,904,Inactive,90903231.0,3064.0,,,qHTS Multiplex Assay to Identify Dual Action Probes in a Cell Model of Huntington: Cytoprotection (ATP),Confirmatory,,
127,1471,2,1,,26747334,904,Inactive,90903231.0,3064.0,,,qHTS Multiplex Assay to Identify Dual Action Probes in a Cell Model of Huntington: Cytoprotection (ATP),Confirmatory,,
128,1476,2,1,,17389551,904,Inactive,281307097.0,,,Potency,qHTS Assay for Promiscuous and Specific Inhibitors of Cruzain (without detergent),Confirmatory,,
129,1476,2,1,,26747334,904,Inactive,281307097.0,,,Potency,qHTS Assay for Promiscuous and Specific Inhibitors of Cruzain (without detergent),Confirmatory,,
130,1477,1,1,,17389551,904,Inactive,,,,Potency,qHTS Assay for Compounds Blocking the Interaction Between CBF-beta and RUNX1 for the Treatment of Acute Myeloid Leukemia,Confirmatory,,
131,1477,1,1,,26747334,904,Inactive,,,,Potency,qHTS Assay for Compounds Blocking the Interaction Between CBF-beta and RUNX1 for the Treatment of Acute Myeloid Leukemia,Confirmatory,,
132,1478,2,1,,17389551,904,Inactive,281307097.0,,,Potency,qHTS Assay for Promiscuous and Specific Inhibitors of Cruzain (with detergent),Confirmatory,,
133,1478,2,1,,26747334,904,Inactive,281307097.0,,,Potency,qHTS Assay for Promiscuous and Specific Inhibitors of Cruzain (with detergent),Confirmatory,,
134,1479,1,2,,17389551,904,Inactive,189491771.0,7068.0,,Potency,Total Fluorescence Counterscreen for Inhibitors of the Interaction of Thyroid Hormone Receptor and Steroid Receptor Coregulator 2,Confirmatory,,
135,1479,1,2,,26747334,904,Inactive,189491771.0,7068.0,,Potency,Total Fluorescence Counterscreen for Inhibitors of the Interaction of Thyroid Hormone Receptor and Steroid Receptor Coregulator 2,Confirmatory,,
136,1487,1,1,,17389551,904,Inactive,27436948.0,4000.0,,Potency,qHTS Assay for Modulators of Lamin A Splicing,Confirmatory,,
137,1490,2,1,,17389551,904,Inactive,10954339.0,,,Potency,qHTS Assay for Inhibitors of Bacillus subtilis Sfp phosphopantetheinyl transferase (PPTase),Confirmatory,,
138,1490,2,1,,26747334,904,Inactive,10954339.0,,,Potency,qHTS Assay for Inhibitors of Bacillus subtilis Sfp phosphopantetheinyl transferase (PPTase),Confirmatory,,
139,1519,1,3,,26747334,904,Inactive,,,,Potency,qHTS Assay for Lipid Storage Modulators,Confirmatory,,
140,1580,1,1,,8149759,904,Inconclusive,,,,,Screen for compounds that inhibit mitochondrial permeability transition (MitoPT),Other,,
141,1580,1,1,,8149760,904,Inconclusive,,,,,Screen for compounds that inhibit mitochondrial permeability transition (MitoPT),Other,,
142,1581,1,1,,8149759,904,Inconclusive,,,,,Screen of Compounds to Block PAR4 - aPKC Interaction for Treatment of Neurodegeneration (Par4_PKC),Other,,
143,1581,1,1,,8149760,904,Inconclusive,,,,,Screen of Compounds to Block PAR4 - aPKC Interaction for Treatment of Neurodegeneration (Par4_PKC),Other,,
144,1582,1,1,,8149759,904,Inconclusive,,,,,Yeast cell-based screen for Novel HDAC inhibitors using a PHO84-LacZ reporter gene (PHO84),Other,,
145,1582,1,1,,8149760,904,Inconclusive,,,,,Yeast cell-based screen for Novel HDAC inhibitors using a PHO84-LacZ reporter gene (PHO84),Other,,
146,1583,1,1,,8149759,904,Unspecified,,,,,Assay to identify inhibitors of polyglutamine-induced caspase-3 activation (CASP3),Other,,
147,1583,1,1,,8149760,904,Unspecified,,,,,Assay to identify inhibitors of polyglutamine-induced caspase-3 activation (CASP3),Other,,
148,1584,1,1,,8149759,904,Inconclusive,,,,,Screen for compounds that inhibit in vitro mutant huntingtin aggregation (QA1),Other,,
149,1584,1,1,,8149760,904,Inconclusive,,,,,Screen for compounds that inhibit in vitro mutant huntingtin aggregation (QA1),Other,,
150,1585,1,1,,8149759,904,Inconclusive,,,,,"Screen for compounds that inhibit the ability of solid phase synthetic polyglutamine aggregates to elongate by incorporating solution-phase biotin-tagged, monomeric polyglutamine (QA3)",Other,,
151,1585,1,1,,8149760,904,Inconclusive,,,,,"Screen for compounds that inhibit the ability of solid phase synthetic polyglutamine aggregates to elongate by incorporating solution-phase biotin-tagged, monomeric polyglutamine (QA3)",Other,,
152,1586,1,1,,8149759,904,Inconclusive,,,,,A 2-Hybrid Test for Interactions Between Polyglutamine-Containing Proteins in the Yeast Nucleus  (Qn2Hy),Other,,
153,1586,1,1,,8149760,904,Inconclusive,,,,,A 2-Hybrid Test for Interactions Between Polyglutamine-Containing Proteins in the Yeast Nucleus  (Qn2Hy),Other,,
154,1587,1,1,,8149759,904,Inconclusive,,,,,Screen for compounds that increase the expression of EAAT-2 in rat spinal cord organotypic slice cultures (X4_EAAT2),Other,,
155,1587,1,1,,8149760,904,Inconclusive,,,,,Screen for compounds that increase the expression of EAAT-2 in rat spinal cord organotypic slice cultures (X4_EAAT2),Other,,
156,1588,1,1,,8149759,904,Inconclusive,,,,,Screen for compounds that reduce polyglutamine aggregation as measured by turbidity (QTHIO),Other,,
157,1588,1,1,,8149760,904,Inconclusive,,,,,Screen for compounds that reduce polyglutamine aggregation as measured by turbidity (QTHIO),Other,,
158,1589,1,1,,8149759,904,Inconclusive,,,,,Screen for compounds that reduce polyglutamine (polyQ) inclusions in nerve growth factor (NGF)-treated PC12 cells (SDS),Other,,
159,1589,1,1,,8149760,904,Inconclusive,,,,,Screen for compounds that reduce polyglutamine (polyQ) inclusions in nerve growth factor (NGF)-treated PC12 cells (SDS),Other,,
160,1590,1,1,,8149759,904,Inconclusive,,,,,Cellular toxicity caused by inducible expressing of N-terminal huntingtin with expanded ployglutamine repeat (Htt-N63-148Q) in PC12 cells (ROSShtt),Other,,
161,1590,1,1,,8149760,904,Inconclusive,,,,,Cellular toxicity caused by inducible expressing of N-terminal huntingtin with expanded ployglutamine repeat (Htt-N63-148Q) in PC12 cells (ROSShtt),Other,,
162,1593,1,1,,8149759,904,Unspecified,,,,,Yeast cell-based screen for compounds that suppress polyglutamine aggregation in vivo (75Q-TubU),Other,,
163,1593,1,1,,8149760,904,Unspecified,,,,,Yeast cell-based screen for compounds that suppress polyglutamine aggregation in vivo (75Q-TubU),Other,,
164,1594,1,1,,8149759,904,Inconclusive,,,,,Screen for compounds that decrease glutamate induced motor neuron death measured by TUNEL staining for DNA degradation (MNGlu),Other,,
165,1594,1,1,,8149760,904,Inconclusive,,,,,Screen for compounds that decrease glutamate induced motor neuron death measured by TUNEL staining for DNA degradation (MNGlu),Other,,
166,1595,1,1,,8149759,904,Inconclusive,,,,,Suppression of Polyglutamine Toxicity in Whole Organism Drosophila Model of SCA1 (SCA1FLYe),Other,,
167,1595,1,1,,8149760,904,Inconclusive,,,,,Suppression of Polyglutamine Toxicity in Whole Organism Drosophila Model of SCA1 (SCA1FLYe),Other,,
168,1596,1,1,,8149759,904,Inconclusive,,,,,Protection from expanded polyglutamine huntingtin toxicity in PC12 cells (LDH100),Other,,
169,1596,1,1,,8149760,904,Inconclusive,,,,,Protection from expanded polyglutamine huntingtin toxicity in PC12 cells (LDH100),Other,,
170,1597,1,1,,8149759,904,Inconclusive,,,,,Suppression of Polyglutamine Toxicity in Whole Organism Drosophila Model of SCA1 (SCA1FLYp),Other,,
171,1597,1,1,,8149760,904,Inconclusive,,,,,Suppression of Polyglutamine Toxicity in Whole Organism Drosophila Model of SCA1 (SCA1FLYp),Other,,
172,1598,1,1,,8149759,904,Inconclusive,,,,,Screen for compounds that selectively increase SMN2 splicing relative to SMN1 splicing (SMNLUC),Other,,
173,1598,1,1,,8149760,904,Inconclusive,,,,,Screen for compounds that selectively increase SMN2 splicing relative to SMN1 splicing (SMNLUC),Other,,
174,1599,1,1,,8149759,904,Unspecified,,,,,"Screen for compounds that correct neuronal dysfunction without cell death as induced by the expression of polyglutamine-expanded, N-terminal huntingtin in C. elegans mechanosensory neurons (HDELENEU)",Other,,
175,1599,1,1,,8149760,904,Unspecified,,,,,"Screen for compounds that correct neuronal dysfunction without cell death as induced by the expression of polyglutamine-expanded, N-terminal huntingtin in C. elegans mechanosensory neurons (HDELENEU)",Other,,
176,1600,1,1,,8149759,904,Inconclusive,,,,,Yeast Assay for Parkinson&apos;s Disease (YAPD),Other,,
177,1600,1,1,,8149760,904,Inconclusive,,,,,Yeast Assay for Parkinson&apos;s Disease (YAPD),Other,,
178,1601,1,1,,8149759,904,Inconclusive,,,,,Screen for compounds that suppress mutant SOD1-mediated cell death (mSODtox),Other,,
179,1601,1,1,,8149760,904,Inconclusive,,,,,Screen for compounds that suppress mutant SOD1-mediated cell death (mSODtox),Other,,
180,1602,1,1,,8149759,904,Inconclusive,,,,,Screen for compounds that attenuate mutant SOD1 toxicity (mSOD1),Other,,
181,1602,1,1,,8149760,904,Inconclusive,,,,,Screen for compounds that attenuate mutant SOD1 toxicity (mSOD1),Other,,
182,1603,1,1,,8149759,904,Unspecified,,,,,Screen for compounds that selectively inhibit cytochrome c release from purified mitochondria (CytoCRel),Other,,
183,1603,1,1,,8149760,904,Unspecified,,,,,Screen for compounds that selectively inhibit cytochrome c release from purified mitochondria (CytoCRel),Other,,
184,1604,1,1,,8149759,904,Unspecified,,,,,Screen for compounds that inhibit polyglutamine induced protein aggregation (AGREG),Other,,
185,1604,1,1,,8149760,904,Unspecified,,,,,Screen for compounds that inhibit polyglutamine induced protein aggregation (AGREG),Other,,
186,1605,1,1,,8149759,904,Unspecified,,,,,Screening of compounds showing protective effect against cell death induced by familial amyotrophic lateral sclerosis (FALS)-linked mutantsuperoxide dismutase 1 (SOD1) (ALSOD1),Other,,
187,1605,1,1,,8149760,904,Unspecified,,,,,Screening of compounds showing protective effect against cell death induced by familial amyotrophic lateral sclerosis (FALS)-linked mutantsuperoxide dismutase 1 (SOD1) (ALSOD1),Other,,
188,1606,1,1,,8149759,904,Inconclusive,,,,,Protection from expanded polyglutamine huntingtin toxicity in PC12 cells (LDH20),Other,,
189,1606,1,1,,8149760,904,Inconclusive,,,,,Protection from expanded polyglutamine huntingtin toxicity in PC12 cells (LDH20),Other,,
190,1607,1,1,,8149759,904,Inconclusive,,,,,Screen for compounds that promote the turnover of an expanded polyglutamine androgen receptor (AR112GFP),Other,,
191,1607,1,1,,8149760,904,Inconclusive,,,,,Screen for compounds that promote the turnover of an expanded polyglutamine androgen receptor (AR112GFP),Other,,
192,1608,1,1,,8149759,904,Inconclusive,,,,,Protection from expanded polyglutamine huntingtin toxicity in PC12 cells (LDH016),Other,,
193,1608,1,1,,8149760,904,Inconclusive,,,,,Protection from expanded polyglutamine huntingtin toxicity in PC12 cells (LDH016),Other,,
194,1609,1,1,,8149759,904,Inconclusive,,,,,Protection from expanded polyglutamine huntingtin toxicity in PC12 cells (LDH08),Other,,
195,1609,1,1,,8149760,904,Inconclusive,,,,,Protection from expanded polyglutamine huntingtin toxicity in PC12 cells (LDH08),Other,,
196,1610,1,1,,8149759,904,Inconclusive,,,,,Protection from expanded polyglutamine huntingtin toxicity in PC12 cells,Other,,
197,1610,1,1,,8149760,904,Inconclusive,,,,,Protection from expanded polyglutamine huntingtin toxicity in PC12 cells,Other,,
